ID,Name,Price,URL
38799,Aveeno Active Naturals Stress Relief Body Wash,$10.00,https://www.igashop.com.au/product/aveeno-active-naturals-stress-relief-body-wash-38799
878982,Aveeno Daily Moisturising Wash,$8.00,https://www.igashop.com.au/product/aveeno-daily-moisturising-wash-878982
388440,Bexters Soda Crystals,$10.00,https://www.igashop.com.au/product/bexters-soda-crystals-388440
751224,Bosistos Body Wash Kakadu Plum Lemon Myrtle,$8.00,https://www.igashop.com.au/product/bosistos-body-wash-kakadu-plum-lemon-myrtle-751224
751185,Bosistos Body Wash Mint Mandarin,$8.00,https://www.igashop.com.au/product/bosistos-body-wash-mint-mandarin-751185
750972,Bosistos Hand Wash Banksia Flower Lavender,$6.00,https://www.igashop.com.au/product/bosistos-hand-wash-banksia-flower-lavender-750972
737830,Bosistos Hand Wash Banksia Flower Lavender Refill,$7.50,https://www.igashop.com.au/product/bosistos-hand-wash-banksia-flower-lavender-refill-737830
737576,Bosistos Hand Wash Desert Lime Eucalyptus,$7.50,https://www.igashop.com.au/product/bosistos-hand-wash-desert-lime-eucalyptus-737576
751012,Bosistos Hand Wash Desert Lime Eucalyptus,$6.00,https://www.igashop.com.au/product/bosistos-hand-wash-desert-lime-eucalyptus-751012
311922,Cashmere Bouquet Bar Soap Lavender,$4.50,https://www.igashop.com.au/product/cashmere-bouquet-bar-soap-lavender-311922
905195,Community Co Antibacterial Wipes,$1.70,https://www.igashop.com.au/product/community-co-antibacterial-wipes-905195
847287,Community Co Coconut Coffee Soap,$3.40,https://www.igashop.com.au/product/community-co-coconut-coffee-soap-847287
847193,Community Co Goat Milk Lemon Myrtle Soap,$3.40,https://www.igashop.com.au/product/community-co-goat-milk-lemon-myrtle-soap-847193
847211,Community Co Pomegranate Poppy Seed Soap,$3.40,https://www.igashop.com.au/product/community-co-pomegranate-poppy-seed-soap-847211
407011,Country Life Soap Bar Fresh Linen And White Clay,$4.50,https://www.igashop.com.au/product/country-life-soap-bar-fresh-linen-and-white-clay-407011
406531,Country Life Soap Golden Lemon,$4.50,https://www.igashop.com.au/product/country-life-soap-golden-lemon-406531
351561,Cussons Oatmeal Soap,$5.00,https://www.igashop.com.au/product/cussons-oatmeal-soap-351561
796732,Dermaveen Soap Free Body Wash Oatmeal,$20.00,https://www.igashop.com.au/product/dermaveen-soap-free-body-wash-oatmeal-796732
876825,Dettol 2 In 1 Hands And Surfaces Antibacterial Wipes,$3.00,https://www.igashop.com.au/product/dettol-2-in-1-hands-and-surfaces-antibacterial-wipes-876825
91569,Dettol Antibacterial Hand Wash Refill Aloe Vera Vitamin E,$5.00,https://www.igashop.com.au/product/dettol-antibacterial-hand-wash-refill-aloe-vera-vitamin-e-91569
82248,Dettol Antibacterial Liquid Hand Wash Aloe Vera And Vitamin E Refill,$10.00,https://www.igashop.com.au/product/dettol-antibacterial-liquid-hand-wash-aloe-vera-and-vitamin-e-refill-82248
436934,Dettol Antibacterial Liquid Hand Wash Pump Aloe Vera And Vitamin E,$2.80,https://www.igashop.com.au/product/dettol-antibacterial-liquid-hand-wash-pump-aloe-vera-and-vitamin-e-436934
389027,Dettol Antibacterial Liquid Hand Wash Pump Raspberry,$2.80,https://www.igashop.com.au/product/dettol-antibacterial-liquid-hand-wash-pump-raspberry-389027
336003,Dettol Antibacterial Liquid Hand Wash Pump Refresh,$2.80,https://www.igashop.com.au/product/dettol-antibacterial-liquid-hand-wash-pump-refresh-336003
847826,Dettol Antibacterial Liquid Hand Wash Pump Vanilla And Orchid,$2.80,https://www.igashop.com.au/product/dettol-antibacterial-liquid-hand-wash-pump-vanilla-and-orchid-847826
82159,Dettol Antibacterial Liquid Hand Wash Refresh Refill,$10.00,https://www.igashop.com.au/product/dettol-antibacterial-liquid-hand-wash-refresh-refill-82159
175444,Dettol Australian Heartland Collection Daintree Rains Grapefruit Citrus Handwash,$10.00,https://www.igashop.com.au/product/dettol-australian-heartland-collection-daintree-rains-grapefruit-citrus-handwash-175444
175402,Dettol Australian Heartland Collection Nullarbor Moon Wild Rosella Handwash,$10.00,https://www.igashop.com.au/product/dettol-australian-heartland-collection-nullarbor-moon-wild-rosella-handwash-175402
351692,Dettol Foam Hand Wash Rose And Cherry In Bloom,$3.50,https://www.igashop.com.au/product/dettol-foam-hand-wash-rose-and-cherry-in-bloom-351692
779798,Dettol Handwash Lime And Orange Blossom Pump,$3.50,https://www.igashop.com.au/product/dettol-handwash-lime-and-orange-blossom-pump-779798
170000003459,Dettol Healthy Touch Liquid Antibacterial Instant Hand Sanitiser,$2.80,https://www.igashop.com.au/product/dettol-healthy-touch-liquid-antibacterial-instant-hand-sanitiser-170000003459
610978,Dettol Healthy Touch Liquid Antibacterial Instant Hand Sanitiser,$2.80,https://www.igashop.com.au/product/dettol-healthy-touch-liquid-antibacterial-instant-hand-sanitiser-610978
62256,Dettol Sapoderm Hygienic Soap For Acne Oily Skin,$5.50,https://www.igashop.com.au/product/dettol-sapoderm-hygienic-soap-for-acne-oily-skin-62256
608890,Dove Beauty Soap Bar Original,$4.20,https://www.igashop.com.au/product/dove-beauty-soap-bar-original-608890
395515,Dove Body Wash Pomegranate And Lemon Verbena,$17.00,https://www.igashop.com.au/product/dove-body-wash-pomegranate-and-lemon-verbena-395515
351456,Dove Body Wash Sensitive,$17.00,https://www.igashop.com.au/product/dove-body-wash-sensitive-351456
170000003760,Dove Body Wash Triple Moisturising,$7.00,https://www.igashop.com.au/product/dove-body-wash-triple-moisturising-170000003760
356430,Dove Body Wash Triple Moisturising,$17.00,https://www.igashop.com.au/product/dove-body-wash-triple-moisturising-356430
351464,Dove Go Fresh Body Wash Fresh Touch,$17.00,https://www.igashop.com.au/product/dove-go-fresh-body-wash-fresh-touch-351464
81988,Dove Men Body Wash Deep Clean,$2.00,https://www.igashop.com.au/product/dove-men-body-wash-deep-clean-81988
887892,Dove Nourishing Secrets Body Wash Restoring Coconut Almond Oil,$17.00,https://www.igashop.com.au/product/dove-nourishing-secrets-body-wash-restoring-coconut-almond-oil-887892
891558,Femfresh Deodorising Wash,$7.50,https://www.igashop.com.au/product/femfresh-deodorising-wash-891558
972760,Funtime Kids Bubble Bath Space Bubbles,$2.50,https://www.igashop.com.au/product/funtime-kids-bubble-bath-space-bubbles-972760
796059,Ice Salts Magnesium Muscle Recovery,$14.40,https://www.igashop.com.au/product/ice-salts-magnesium-muscle-recovery-796059
6064,Imperial Leather Soap Original,$5.30,https://www.igashop.com.au/product/imperial-leather-soap-original-6064
396430,Johnsons Body Care Dreamy Skin Body Wash,$9.00,https://www.igashop.com.au/product/johnsons-body-care-dreamy-skin-body-wash-396430
396692,Johnsons Body Care Extra Rich Moisturising Cream Body Wash,$9.00,https://www.igashop.com.au/product/johnsons-body-care-extra-rich-moisturising-cream-body-wash-396692
396707,Johnsons Body Care Moisturising Body Wash,$9.00,https://www.igashop.com.au/product/johnsons-body-care-moisturising-body-wash-396707
624024,Love Beauty And Planet Body Lotion Argan Oil Lavender,$14.00,https://www.igashop.com.au/product/love-beauty-and-planet-body-lotion-argan-oil-lavender-624024
624008,Love Beauty And Planet Body Lotion Murmuru Butter Rose,$14.00,https://www.igashop.com.au/product/love-beauty-and-planet-body-lotion-murmuru-butter-rose-624008
84999,Lux Body Wash Magical Spell,$5.80,https://www.igashop.com.au/product/lux-body-wash-magical-spell-84999
85173,Lux Body Wash Petal Touch,$5.80,https://www.igashop.com.au/product/lux-body-wash-petal-touch-85173
292644,Lynx Body Wash Black,$6.50,https://www.igashop.com.au/product/lynx-body-wash-black-292644
160000002517,Lynx Body Wash Collision Leather Cookies,$6.50,https://www.igashop.com.au/product/lynx-body-wash-collision-leather-cookies-160000002517
688777,Lynx Bodywash Xbox,$6.50,https://www.igashop.com.au/product/lynx-bodywash-xbox-688777
80788,Lynx Men Body Wash Excite,$6.50,https://www.igashop.com.au/product/lynx-men-body-wash-excite-80788
692941,Method Gel Hand Wash Pump Pink Grapefruit,$5.00,https://www.igashop.com.au/product/method-gel-hand-wash-pump-pink-grapefruit-692941
692975,Method Gel Hand Wash Pump Sweet Water,$5.00,https://www.igashop.com.au/product/method-gel-hand-wash-pump-sweet-water-692975
51695,Natures Organics Spa Fruit Sensations Shower Gel,$2.90,https://www.igashop.com.au/product/natures-organics-spa-fruit-sensations-shower-gel-51695
51899,Natures Organics Spa Vanilla Berry Shower Milk With Shea Butter,$2.90,https://www.igashop.com.au/product/natures-organics-spa-vanilla-berry-shower-milk-with-shea-butter-51899
339174,Organic Care Body Wash Moisturising,$4.90,https://www.igashop.com.au/product/organic-care-body-wash-moisturising-339174
740016,Organic Care Coconut Crme Hydrating Body Wash,$7.00,https://www.igashop.com.au/product/organic-care-coconut-crme-hydrating-body-wash-740016
366833,Organic Care Kids Bubble Bath,$4.00,https://www.igashop.com.au/product/organic-care-kids-bubble-bath-366833
887122,Organic Care Naturals Antibacterial Hand Wash Lemongrass Ginger,$4.63,https://www.igashop.com.au/product/organic-care-naturals-antibacterial-hand-wash-lemongrass-ginger-887122
887033,Organic Care Pump Handwash Vanilla Shea,$4.63,https://www.igashop.com.au/product/organic-care-pump-handwash-vanilla-shea-887033
391618,Original Source Body Wash Vanilla Milk Raspberry,$5.00,https://www.igashop.com.au/product/original-source-body-wash-vanilla-milk-raspberry-391618
190000002238,Original Source Lime Shower Gel,$5.00,https://www.igashop.com.au/product/original-source-lime-shower-gel-190000002238
190000002239,Original Source Tingly Mint Tea Tree Shower Gel,$5.00,https://www.igashop.com.au/product/original-source-tingly-mint-tea-tree-shower-gel-190000002239
160000012316,Ozcare Instant Hand Sanitiser Spray,$16.00,https://www.igashop.com.au/product/ozcare-instant-hand-sanitiser-spray-160000012316
91218,Palmolive Antibacterial Defence Pump,$2.50,https://www.igashop.com.au/product/palmolive-antibacterial-defence-pump-91218
389996,Palmolive Antibacterial Foaming Hand Wash Soap Lime Refill,$4.00,https://www.igashop.com.au/product/palmolive-antibacterial-foaming-hand-wash-soap-lime-refill-389996
347538,Palmolive Antibacterial Foaming Liquid Hand Wash Lime Mint,$2.50,https://www.igashop.com.au/product/palmolive-antibacterial-foaming-liquid-hand-wash-lime-mint-347538
903428,Palmolive Antibacterial Foaming Liquid Hand Wash Soap Aqua Lily,$2.50,https://www.igashop.com.au/product/palmolive-antibacterial-foaming-liquid-hand-wash-soap-aqua-lily-903428
341977,Palmolive Antibacterial Gentle Clean Liquid Hand Wash Refill,$2.75,https://www.igashop.com.au/product/palmolive-antibacterial-gentle-clean-liquid-hand-wash-refill-341977
835515,Palmolive Antibacterial Hand Sanitiser Japanese Cherry Blossom,$6.70,https://www.igashop.com.au/product/palmolive-antibacterial-hand-sanitiser-japanese-cherry-blossom-835515
342033,Palmolive Antibacterial Liquid Hand Wash Soap Lime Odour Neutralising Refill Save,$5.50,https://www.igashop.com.au/product/palmolive-antibacterial-liquid-hand-wash-soap-lime-odour-neutralising-refill-save-342033
91072,Palmolive Antibacterial Liquid Hand Wash Soap Lime Refill,$7.50,https://www.igashop.com.au/product/palmolive-antibacterial-liquid-hand-wash-soap-lime-refill-91072
5110,Palmolive Antibacterial Liquid Hand Wash Soap Odour Neutralising,$2.50,https://www.igashop.com.au/product/palmolive-antibacterial-liquid-hand-wash-soap-odour-neutralising-5110
91056,Palmolive Antibacterial Liquid Hand Wash Soap Orange 2 Hour Defence Refill Save,$7.50,https://www.igashop.com.au/product/palmolive-antibacterial-liquid-hand-wash-soap-orange-2-hour-defence-refill-save-91056
98419,Palmolive Antibacterial Liquid Hand Wash Soap Sea Minerals Deep Cleansing Pump 0 Parabens Recyclable,$2.50,https://www.igashop.com.au/product/palmolive-antibacterial-liquid-hand-wash-soap-sea-minerals-deep-cleansing-pump-0-parabens-recyclable-98419
321595,Palmolive Antibacterial Liquid Hand Wash Soap Sea Minerals Refill Save,$7.50,https://www.igashop.com.au/product/palmolive-antibacterial-liquid-hand-wash-soap-sea-minerals-refill-save-321595
372300,Palmolive Antibacterial Liquid Hand Wash Soap White Tea Pump 0 Parabens Recyclable,$2.50,https://www.igashop.com.au/product/palmolive-antibacterial-liquid-hand-wash-soap-white-tea-pump-0-parabens-recyclable-372300
91098,Palmolive Antibacterial Liquid Hand Wash Soap White Tea Refill Save,$7.50,https://www.igashop.com.au/product/palmolive-antibacterial-liquid-hand-wash-soap-white-tea-refill-save-91098
635070,Palmolive Antibacterial Travel Hand Sanitiser Cherry Blossom,$3.00,https://www.igashop.com.au/product/palmolive-antibacterial-travel-hand-sanitiser-cherry-blossom-635070
334394,Palmolive Aromatherapy Anti Stress Body Wash Ylang Ylang Iris,$4.50,https://www.igashop.com.au/product/palmolive-aromatherapy-anti-stress-body-wash-ylang-ylang-iris-334394
5186,Palmolive Body Butter Coconut Jojoba Body Wash Exfoliating Scrub With Real Fruit Seeds,$4.50,https://www.igashop.com.au/product/palmolive-body-butter-coconut-jojoba-body-wash-exfoliating-scrub-with-real-fruit-seeds-5186
91103,Palmolive Body Butter Heavenly Vanilla Moisturising Body Wash Recyclable Bottle,$4.50,https://www.igashop.com.au/product/palmolive-body-butter-heavenly-vanilla-moisturising-body-wash-recyclable-bottle-91103
728357,Palmolive Elements Liquid Hand Wash Soap Micellar 100 Natural Rose Oil Pump Recyclable,$7.50,https://www.igashop.com.au/product/palmolive-elements-liquid-hand-wash-soap-micellar-100-natural-rose-oil-pump-recyclable-728357
880612,Palmolive Foaming Antibacterial Hand Wash Soap Lime Mint Refill Save,$7.50,https://www.igashop.com.au/product/palmolive-foaming-antibacterial-hand-wash-soap-lime-mint-refill-save-880612
882928,Palmolive Foaming Hand Wash Soap New Zealand Manuka Honey Lavender Recyclable,$7.00,https://www.igashop.com.au/product/palmolive-foaming-hand-wash-soap-new-zealand-manuka-honey-lavender-recyclable-882928
347570,Palmolive Foaming Hand Wash Soap Raspberry Pump,$2.50,https://www.igashop.com.au/product/palmolive-foaming-hand-wash-soap-raspberry-pump-347570
632381,Palmolive Foaming Liquid Hand Wash Soap Japanese Cherry Blossom,$2.50,https://www.igashop.com.au/product/palmolive-foaming-liquid-hand-wash-soap-japanese-cherry-blossom-632381
632404,Palmolive Foaming Liquid Hand Wash Soap Japanese Cherry Blossom,$4.00,https://www.igashop.com.au/product/palmolive-foaming-liquid-hand-wash-soap-japanese-cherry-blossom-632404
762720,Palmolive Foaming Liquid Hand Wash Soap Vanilla Sweet Almond,$5.00,https://www.igashop.com.au/product/palmolive-foaming-liquid-hand-wash-soap-vanilla-sweet-almond-762720
350094,Palmolive Gold Bar Soap Daily Deodorant Protection,$4.00,https://www.igashop.com.au/product/palmolive-gold-bar-soap-daily-deodorant-protection-350094
930467,Palmolive Handwash Milk Honey Refill,$5.50,https://www.igashop.com.au/product/palmolive-handwash-milk-honey-refill-930467
328372,Palmolive Kids 3 In 1 Bodywash Shampoo Conditioner Strawberry,$7.00,https://www.igashop.com.au/product/palmolive-kids-3-in-1-bodywash-shampoo-conditioner-strawberry-328372
831299,Palmolive Luminous Oils Coconut Oil Frangipani Enriching Body Wash,$4.50,https://www.igashop.com.au/product/palmolive-luminous-oils-coconut-oil-frangipani-enriching-body-wash-831299
67329,Palmolive Luminous Oils Invigorating Body Wash Macadamia Oil With Peony Recyclable,$4.50,https://www.igashop.com.au/product/palmolive-luminous-oils-invigorating-body-wash-macadamia-oil-with-peony-recyclable-67329
223776,Palmolive Luminous Oils Liquid Hand Wash Soap Macadamia Peony,$4.50,https://www.igashop.com.au/product/palmolive-luminous-oils-liquid-hand-wash-soap-macadamia-peony-223776
321299,Palmolive Men Active Body Wash With Sea Minerals 0 Parabens Recyclable,$12.00,https://www.igashop.com.au/product/palmolive-men-active-body-wash-with-sea-minerals-0-parabens-recyclable-321299
727937,Palmolive Micellar Rose Body Wash No Parabens No Phthalates No Alcohol Recyclable,$7.00,https://www.igashop.com.au/product/palmolive-micellar-rose-body-wash-no-parabens-no-phthalates-no-alcohol-recyclable-727937
321388,Palmolive Naturals Anti Stress Body Wash With Ylang Ylang Iris,$12.00,https://www.igashop.com.au/product/palmolive-naturals-anti-stress-body-wash-with-ylang-ylang-iris-321388
350078,Palmolive Naturals Bar Soap Balanced Mild Chamomile Extracts,$4.00,https://www.igashop.com.au/product/palmolive-naturals-bar-soap-balanced-mild-chamomile-extracts-350078
350086,Palmolive Naturals Bar Soap Replenishing Milk Honey,$4.00,https://www.igashop.com.au/product/palmolive-naturals-bar-soap-replenishing-milk-honey-350086
44062,Palmolive Naturals Hydrating Soap Free Body Wash Sea Minerals,$4.50,https://www.igashop.com.au/product/palmolive-naturals-hydrating-soap-free-body-wash-sea-minerals-44062
436845,Palmolive Naturals Liquid Hand Wash Soap Aloe Vera Chamomile,$2.50,https://www.igashop.com.au/product/palmolive-naturals-liquid-hand-wash-soap-aloe-vera-chamomile-436845
317826,Palmolive Naturals Liquid Hand Wash Soap Aloe Vera Chamomile With Moisturising Milk Refill Save Recyclable,$7.50,https://www.igashop.com.au/product/palmolive-naturals-liquid-hand-wash-soap-aloe-vera-chamomile-with-moisturising-milk-refill-save-recyclable-317826
358233,Palmolive Naturals Liquid Hand Wash Soap Aloe Vera Chamomile With Moisturising Milk Refill Save Recyclable,$2.75,https://www.igashop.com.au/product/palmolive-naturals-liquid-hand-wash-soap-aloe-vera-chamomile-with-moisturising-milk-refill-save-recyclable-358233
321590,Palmolive Naturals Liquid Hand Wash Soap Milk Honey With Moisturising Milk Refill Save 0 Parabens Recyclable,$7.50,https://www.igashop.com.au/product/palmolive-naturals-liquid-hand-wash-soap-milk-honey-with-moisturising-milk-refill-save-0-parabens-recyclable-321590
929597,Palmolive Naturals Liquid Hand Wash Soap Pump Milk Honey,$2.50,https://www.igashop.com.au/product/palmolive-naturals-liquid-hand-wash-soap-pump-milk-honey-929597
223726,Palmolive Naturals Mild Sensitive Hypoallergenic Milk Body Wash,$12.00,https://www.igashop.com.au/product/palmolive-naturals-mild-sensitive-hypoallergenic-milk-body-wash-223726
321118,Palmolive Naturals Milk Cherry Blossom Body Wash With Moisturising Milk 0 Parabens Recyclable,$12.00,https://www.igashop.com.au/product/palmolive-naturals-milk-cherry-blossom-body-wash-with-moisturising-milk-0-parabens-recyclable-321118
90204,Palmolive Naturals Milk Honey Body Wash With Moisturising Milk 0 Parabens Recyclable,$12.00,https://www.igashop.com.au/product/palmolive-naturals-milk-honey-body-wash-with-moisturising-milk-0-parabens-recyclable-90204
67230,Palmolive Naturals Milk Orchid Body Wash With Moisturising Milk,$4.50,https://www.igashop.com.au/product/palmolive-naturals-milk-orchid-body-wash-with-moisturising-milk-67230
350007,Palmolive Naturals Moisture Care Aloe Olive Extracts Bar Soap,$4.00,https://www.igashop.com.au/product/palmolive-naturals-moisture-care-aloe-olive-extracts-bar-soap-350007
80916,Palmolive Naturals Orchid Body Wash With Moisturising Milk,$12.00,https://www.igashop.com.au/product/palmolive-naturals-orchid-body-wash-with-moisturising-milk-80916
90929,Palmolive Naturals Pomegranate With Mango Body Wash 0 Parabens Recyclable,$12.00,https://www.igashop.com.au/product/palmolive-naturals-pomegranate-with-mango-body-wash-0-parabens-recyclable-90929
494576,Palmolive Naturals Rich Moisture Soap Free Body Wash Milk Honey,$4.50,https://www.igashop.com.au/product/palmolive-naturals-rich-moisture-soap-free-body-wash-milk-honey-494576
321231,Palmolive Naturals Sea Minerals Body Wash With Seaweed Sea Salt,$12.00,https://www.igashop.com.au/product/palmolive-naturals-sea-minerals-body-wash-with-seaweed-sea-salt-321231
321312,Palmolive Naturals Shea Butter Body Wash With Moisturising Milk,$12.00,https://www.igashop.com.au/product/palmolive-naturals-shea-butter-body-wash-with-moisturising-milk-321312
345662,Palmolive Naturals Travel Body Wash Milk Honey With Moisturising Milk Recyclable Carry On Friendly,$2.50,https://www.igashop.com.au/product/palmolive-naturals-travel-body-wash-milk-honey-with-moisturising-milk-recyclable-carry-on-friendly-345662
466450,Palmolive Naturals Ultra Moisture Body Wash Milk Shea Butter,$4.50,https://www.igashop.com.au/product/palmolive-naturals-ultra-moisture-body-wash-milk-shea-butter-466450
340743,Palmolive Naturals White Citrus Body Wash With Lemongrass,$6.50,https://www.igashop.com.au/product/palmolive-naturals-white-citrus-body-wash-with-lemongrass-340743
426154,Pears Liquid Hand Wash Pure Gentle,$4.50,https://www.igashop.com.au/product/pears-liquid-hand-wash-pure-gentle-426154
636990,Pears Pure Gentle With Natural Oils Transparent Soap,$5.64,https://www.igashop.com.au/product/pears-pure-gentle-with-natural-oils-transparent-soap-636990
60880,Pears Transparent Soap,$3.00,https://www.igashop.com.au/product/pears-transparent-soap-60880
656160,Priya Natures Sandalwood Soap,$2.10,https://www.igashop.com.au/product/priya-natures-sandalwood-soap-656160
656144,Priya Soap Bar Olive Oil,$2.10,https://www.igashop.com.au/product/priya-soap-bar-olive-oil-656144
389420,Radox Bath Gel Muscle Soak,$7.20,https://www.igashop.com.au/product/radox-bath-gel-muscle-soak-389420
965878,Radox Bath Salts Muscle Soothe,$7.95,https://www.igashop.com.au/product/radox-bath-salts-muscle-soothe-965878
395256,Radox Body Wash Feel Energised,$12.00,https://www.igashop.com.au/product/radox-body-wash-feel-energised-395256
349077,Radox Body Wash Feel Extreme,$12.00,https://www.igashop.com.au/product/radox-body-wash-feel-extreme-349077
349069,Radox Body Wash Feel Heavenly With Coconut Extract,$9.00,https://www.igashop.com.au/product/radox-body-wash-feel-heavenly-with-coconut-extract-349069
349051,Radox Body Wash Feel Oxygenated,$9.00,https://www.igashop.com.au/product/radox-body-wash-feel-oxygenated-349051
347046,Radox Body Wash Feel Uplifted,$12.00,https://www.igashop.com.au/product/radox-body-wash-feel-uplifted-347046
742903,Redberry Body Bath Cleaner,$2.20,https://www.igashop.com.au/product/redberry-body-bath-cleaner-742903
247796,Redberry Soap Case,$1.70,https://www.igashop.com.au/product/redberry-soap-case-247796
160000012500,Sukin Art Series Anna Cole Hand Wash,$9.90,https://www.igashop.com.au/product/sukin-art-series-anna-cole-hand-wash-160000012500
160000012504,Sukin Botanical Body Wash Bergamot Patchouli,$9.90,https://www.igashop.com.au/product/sukin-botanical-body-wash-bergamot-patchouli-160000012504
160000012505,Sukin Botanical Body Wash Lime Coconut,$9.90,https://www.igashop.com.au/product/sukin-botanical-body-wash-lime-coconut-160000012505
160000012523,Sukin Botanical Body Wash Lime And Coconut,$16.00,https://www.igashop.com.au/product/sukin-botanical-body-wash-lime-and-coconut-160000012523
160000012503,Sukin Cleansing Hand Wash Bergamot Patchouli Pump,$9.90,https://www.igashop.com.au/product/sukin-cleansing-hand-wash-bergamot-patchouli-pump-160000012503
160000012495,Sukin For Men 3 In 1 Body Wash Sport,$13.95,https://www.igashop.com.au/product/sukin-for-men-3-in-1-body-wash-sport-160000012495
160000012496,Sukin Men 3 In 1 Wash Energising,$13.95,https://www.igashop.com.au/product/sukin-men-3-in-1-wash-energising-160000012496
160000012512,Sukin Signature Cleansing Hand Wash,$9.90,https://www.igashop.com.au/product/sukin-signature-cleansing-hand-wash-160000012512
141961,Veet Shower Wash Naturals Grape Seed Oil,$12.00,https://www.igashop.com.au/product/veet-shower-wash-naturals-grape-seed-oil-141961
464791,Velvet Bar Soap Pure,$4.18,https://www.igashop.com.au/product/velvet-bar-soap-pure-464791
