ID,Name,Price,URL
658065,Veet Hair Removal Cream For Sensitive Skin,$7.00,https://www.igashop.com.au/product/veet-hair-removal-cream-for-sensitive-skin-658065
605826,Veet Hair Removal Wax Warm,$14.00,https://www.igashop.com.au/product/veet-hair-removal-wax-warm-605826
20173,Veet Sensitive Hair Removal Wax Cold Strips,$9.00,https://www.igashop.com.au/product/veet-sensitive-hair-removal-wax-cold-strips-20173
672268,Veet Sensitive Precision Beauty Styler Hair Trimmer,$50.00,https://www.igashop.com.au/product/veet-sensitive-precision-beauty-styler-hair-trimmer-672268
347745,Veet Silky Fresh Hair Removal Cream,$21.00,https://www.igashop.com.au/product/veet-silky-fresh-hair-removal-cream-347745
14224,Veet Spray On Hair Removal Cream,$15.00,https://www.igashop.com.au/product/veet-spray-on-hair-removal-cream-14224
