ID,Name,Price,URL
862258,Always Discreet Liners Normal,$7.50,https://www.igashop.com.au/product/always-discreet-liners-normal-862258
862224,Always Discreet Pads Long,$9.00,https://www.igashop.com.au/product/always-discreet-pads-long-862224
862397,Always Discreet Pads Night Maxi,$9.00,https://www.igashop.com.au/product/always-discreet-pads-night-maxi-862397
862216,Always Discreet Pads Normal,$9.00,https://www.igashop.com.au/product/always-discreet-pads-normal-862216
862389,Always Discreet Small Plus Pads,$8.00,https://www.igashop.com.au/product/always-discreet-small-plus-pads-862389
862193,Always Discreet Underwear Large,$23.50,https://www.igashop.com.au/product/always-discreet-underwear-large-862193
862208,Always Discreet Underwear Plus Medium,$23.50,https://www.igashop.com.au/product/always-discreet-underwear-plus-medium-862208
21381,Bic Disposable Shaver Sensitive,$7.00,https://www.igashop.com.au/product/bic-disposable-shaver-sensitive-21381
422401,Bic Razor Soleil Glow,$7.38,https://www.igashop.com.au/product/bic-razor-soleil-glow-422401
639582,Bic Shaver Twin Lady,$3.68,https://www.igashop.com.au/product/bic-shaver-twin-lady-639582
947524,Bic Simply Soleil Click Razors,$8.50,https://www.igashop.com.au/product/bic-simply-soleil-click-razors-947524
20000004772,Bic Simply Soleil Disposable Razor,$3.52,https://www.igashop.com.au/product/bic-simply-soleil-disposable-razor-20000004772
678808,Bic Soleil Razor Coloreal Collection,$8.41,https://www.igashop.com.au/product/bic-soleil-razor-coloreal-collection-678808
316142,Bic Soleil Twilight Lavender Razor,$5.42,https://www.igashop.com.au/product/bic-soleil-twilight-lavender-razor-316142
821090,Carefree Barely There Unscented Panty Liners,$5.00,https://www.igashop.com.au/product/carefree-barely-there-unscented-panty-liners-821090
91213,Carefree Flat Panty Liners Regular,$6.50,https://www.igashop.com.au/product/carefree-flat-panty-liners-regular-91213
323385,Carefree Flexia Super Tampons With Wings,$6.50,https://www.igashop.com.au/product/carefree-flexia-super-tampons-with-wings-323385
56378,Carefree Original Tampons Regular,$4.25,https://www.igashop.com.au/product/carefree-original-tampons-regular-56378
56718,Carefree Original Tampons Super,$8.50,https://www.igashop.com.au/product/carefree-original-tampons-super-56718
44509,Carefree Panty Liner Barely There Scented,$5.50,https://www.igashop.com.au/product/carefree-panty-liner-barely-there-scented-44509
669668,Carefree Panty Liner Long,$5.50,https://www.igashop.com.au/product/carefree-panty-liner-long-669668
660402,Carefree Panty Liners Regular,$5.50,https://www.igashop.com.au/product/carefree-panty-liners-regular-660402
660397,Carefree Panty Liners Shower Fresh Liners,$5.00,https://www.igashop.com.au/product/carefree-panty-liners-shower-fresh-liners-660397
96124,Carefree Procomfort Super Tampons,$5.55,https://www.igashop.com.au/product/carefree-procomfort-super-tampons-96124
96035,Carefree Procomfort Tampons Regular,$6.50,https://www.igashop.com.au/product/carefree-procomfort-tampons-regular-96035
323084,Carefree Tampons Flexia Regular,$6.50,https://www.igashop.com.au/product/carefree-tampons-flexia-regular-323084
56776,Carefree Tampons Regular,$8.00,https://www.igashop.com.au/product/carefree-tampons-regular-56776
190000001523,Community Co For U Super Tampons,$1.90,https://www.igashop.com.au/product/community-co-for-u-super-tampons-190000001523
20000000021,Community Co For U Tampons Regular,$3.15,https://www.igashop.com.au/product/community-co-for-u-tampons-regular-20000000021
650106,Cottons Organic 100 Cotton Super Tampons,$5.80,https://www.igashop.com.au/product/cottons-organic-100-cotton-super-tampons-650106
835463,Cottons Organic Overnight Pads With Wings,$5.65,https://www.igashop.com.au/product/cottons-organic-overnight-pads-with-wings-835463
650083,Cottons Organic Tampons Regular,$5.80,https://www.igashop.com.au/product/cottons-organic-tampons-regular-650083
401329,Cottons Organic Ultra Thin Pads With Wings Regular,$5.80,https://www.igashop.com.au/product/cottons-organic-ultra-thin-pads-with-wings-regular-401329
401183,Cottons Organic Ultra Thin Pads With Wings Super,$5.80,https://www.igashop.com.au/product/cottons-organic-ultra-thin-pads-with-wings-super-401183
430637,Cutex Nail Polish Remover Strengthening,$6.00,https://www.igashop.com.au/product/cutex-nail-polish-remover-strengthening-430637
497367,Depend Female Underwear Super Extra Large,$15.00,https://www.igashop.com.au/product/depend-female-underwear-super-extra-large-497367
380942,Depend Real Fit For Men Underwear Large,$13.95,https://www.igashop.com.au/product/depend-real-fit-for-men-underwear-large-380942
380950,Depend Real Fit For Mens Underwear Medium,$13.95,https://www.igashop.com.au/product/depend-real-fit-for-mens-underwear-medium-380950
380984,Depend Real Fit For Women Underwear Extra Large,$12.95,https://www.igashop.com.au/product/depend-real-fit-for-women-underwear-extra-large-380984
228828,Depend Real Fit For Women Underwear Heavy Absorbency Large,$12.95,https://www.igashop.com.au/product/depend-real-fit-for-women-underwear-heavy-absorbency-large-228828
228771,Depend Real Fit For Women Underwear Heavy Absorbency Medium,$12.95,https://www.igashop.com.au/product/depend-real-fit-for-women-underwear-heavy-absorbency-medium-228771
810099,Durex Fetherlite Condoms,$7.00,https://www.igashop.com.au/product/durex-fetherlite-condoms-810099
743404,Durex K Y Jelly Personal Lubricant,$10.00,https://www.igashop.com.au/product/durex-k-y-jelly-personal-lubricant-743404
444534,Durex K Y Personal Lubricant Use With Condoms,$5.80,https://www.igashop.com.au/product/durex-k-y-personal-lubricant-use-with-condoms-444534
15725,Durex Play Aloe Vera 2 In 1 Massage Gel Lubricant,$10.00,https://www.igashop.com.au/product/durex-play-aloe-vera-2-in-1-massage-gel-lubricant-15725
810073,Durex Pleasure Me Condoms Regular,$6.50,https://www.igashop.com.au/product/durex-pleasure-me-condoms-regular-810073
823432,Durex Regular Condoms Original,$6.50,https://www.igashop.com.au/product/durex-regular-condoms-original-823432
457105,Elite Condoms,$7.70,https://www.igashop.com.au/product/elite-condoms-457105
356786,Femfresh Daily Intimate Wash,$7.50,https://www.igashop.com.au/product/femfresh-daily-intimate-wash-356786
382193,Femfresh Intimate Hygiene Feminine Wipes,$7.15,https://www.igashop.com.au/product/femfresh-intimate-hygiene-feminine-wipes-382193
671275,Femfresh Sensitive Wash,$7.50,https://www.igashop.com.au/product/femfresh-sensitive-wash-671275
16221,First Response Dip Read Pregnancy Test,$9.40,https://www.igashop.com.au/product/first-response-dip-read-pregnancy-test-16221
892457,First Response Pregnancy Test Stream,$10.00,https://www.igashop.com.au/product/first-response-pregnancy-test-stream-892457
907252,Four Seasons Glow In The Dark Condoms,$4.90,https://www.igashop.com.au/product/four-seasons-glow-in-the-dark-condoms-907252
907210,Four Seasons Glow In The Dark Lube Tube,$6.20,https://www.igashop.com.au/product/four-seasons-glow-in-the-dark-lube-tube-907210
285838,Four Seasons Lubricants Massage Oil,$7.20,https://www.igashop.com.au/product/four-seasons-lubricants-massage-oil-285838
285919,Four Seasons Lush Aloe Vera Lube,$10.00,https://www.igashop.com.au/product/four-seasons-lush-aloe-vera-lube-285919
640711,Four Seasons Naked Classic Condoms,$7.00,https://www.igashop.com.au/product/four-seasons-naked-classic-condoms-640711
626393,Four Seasons Naked Closer Condoms,$7.00,https://www.igashop.com.au/product/four-seasons-naked-closer-condoms-626393
28590,Four Seasons Naked Large Condoms,$6.30,https://www.igashop.com.au/product/four-seasons-naked-large-condoms-28590
13804,Gillette Venus Comfortglide White Tea Womens Disposable Razor,$10.00,https://www.igashop.com.au/product/gillette-venus-comfortglide-white-tea-womens-disposable-razor-13804
473164,Gillette Venus Satin Care Shaving Gel Sensitive Skin,$8.00,https://www.igashop.com.au/product/gillette-venus-satin-care-shaving-gel-sensitive-skin-473164
312520,Gillette Venus Sensitive Womens Disposable Razors,$11.00,https://www.igashop.com.au/product/gillette-venus-sensitive-womens-disposable-razors-312520
55377,Gillette Venus Simply 3 Sensitive Womens Disposable Razors,$9.50,https://www.igashop.com.au/product/gillette-venus-simply-3-sensitive-womens-disposable-razors-55377
394187,Gillette Venus Simply Womens Razor 4 Blade Refills,$8.00,https://www.igashop.com.au/product/gillette-venus-simply-womens-razor-4-blade-refills-394187
17230,Gillette Venus Tropical Womens Disposable Razor,$11.00,https://www.igashop.com.au/product/gillette-venus-tropical-womens-disposable-razor-17230
55974,Libra Body Fit Regular Tampons,$3.60,https://www.igashop.com.au/product/libra-body-fit-regular-tampons-55974
56205,Libra Body Fit Regular Tampons,$6.50,https://www.igashop.com.au/product/libra-body-fit-regular-tampons-56205
56085,Libra Body Fit Super Tampons,$6.50,https://www.igashop.com.au/product/libra-body-fit-super-tampons-56085
56417,Libra Body Fit Super Tampons,$3.60,https://www.igashop.com.au/product/libra-body-fit-super-tampons-56417
901057,Libra Extra Goodnights Long Wide Pads,$3.60,https://www.igashop.com.au/product/libra-extra-goodnights-long-wide-pads-901057
649286,Libra Extra Pads Goodnights With Wings,$3.60,https://www.igashop.com.au/product/libra-extra-pads-goodnights-with-wings-649286
900894,Libra Extra Pads Regular,$3.60,https://www.igashop.com.au/product/libra-extra-pads-regular-900894
360743,Libra Extra Pads Super With Wings,$3.60,https://www.igashop.com.au/product/libra-extra-pads-super-with-wings-360743
687030,Libra Girl Good Night Pads With Wings,$3.60,https://www.igashop.com.au/product/libra-girl-good-night-pads-with-wings-687030
372685,Libra Girl Pads Regular With Wings,$3.60,https://www.igashop.com.au/product/libra-girl-pads-regular-with-wings-372685
59685,Libra Goodnights Pads Ultra Thin Wings,$3.60,https://www.igashop.com.au/product/libra-goodnights-pads-ultra-thin-wings-59685
608206,Libra Invisible Pads Extra Long With Wings,$3.60,https://www.igashop.com.au/product/libra-invisible-pads-extra-long-with-wings-608206
607967,Libra Invisible Pads Regular With Wings,$3.60,https://www.igashop.com.au/product/libra-invisible-pads-regular-with-wings-607967
607983,Libra Invisible Pads Super With Wings,$3.60,https://www.igashop.com.au/product/libra-invisible-pads-super-with-wings-607983
496146,Libra Invisible Sport Pads Regular With Wings,$5.90,https://www.igashop.com.au/product/libra-invisible-sport-pads-regular-with-wings-496146
496219,Libra Invisible Sport Pads Super With Wings,$5.90,https://www.igashop.com.au/product/libra-invisible-sport-pads-super-with-wings-496219
64436,Libra Maternity Pads Extra Long With Wings,$5.00,https://www.igashop.com.au/product/libra-maternity-pads-extra-long-with-wings-64436
190000002864,Libra Pads Ultrathin Wings Super 12,$3.60,https://www.igashop.com.au/product/libra-pads-ultrathin-wings-super-12-190000002864
687234,Libra Tampons Girl Regular,$4.30,https://www.igashop.com.au/product/libra-tampons-girl-regular-687234
57065,Libra Ultra Thin Pads Goodnight,$5.50,https://www.igashop.com.au/product/libra-ultra-thin-pads-goodnight-57065
56954,Libra Ultra Thin Pads Regular Wing,$5.50,https://www.igashop.com.au/product/libra-ultra-thin-pads-regular-wing-56954
361448,Libra Ultra Thin Pads Regular With Wings,$3.60,https://www.igashop.com.au/product/libra-ultra-thin-pads-regular-with-wings-361448
360361,Libra Ultra Thin Pads Super With Wings,$5.00,https://www.igashop.com.au/product/libra-ultra-thin-pads-super-with-wings-360361
57023,Libra Ultra Thin Pads Super With Wings,$5.50,https://www.igashop.com.au/product/libra-ultra-thin-pads-super-with-wings-57023
190000002865,Libra Ultra Thin Super Pads,$3.60,https://www.igashop.com.au/product/libra-ultra-thin-super-pads-190000002865
908075,Libra Ultra Thins Sanitary Pads Thin Regular,$5.00,https://www.igashop.com.au/product/libra-ultra-thins-sanitary-pads-thin-regular-908075
796818,Lifestyles Condoms Regular,$6.50,https://www.igashop.com.au/product/lifestyles-condoms-regular-796818
796834,Lifestyles Condoms Ultra Thin,$6.50,https://www.igashop.com.au/product/lifestyles-condoms-ultra-thin-796834
160000002372,Lifestyles Large Condoms,$6.00,https://www.igashop.com.au/product/lifestyles-large-condoms-160000002372
435140,Lifestyles Luxe Lubricant,$11.00,https://www.igashop.com.au/product/lifestyles-luxe-lubricant-435140
160000002364,Lifestyles Party Mix Condoms,$6.50,https://www.igashop.com.au/product/lifestyles-party-mix-condoms-160000002364
190000000884,Lifestyles Regular Condom,$4.20,https://www.igashop.com.au/product/lifestyles-regular-condom-190000000884
160000002367,Lifestyles Regular Condoms,$9.00,https://www.igashop.com.au/product/lifestyles-regular-condoms-160000002367
160000002375,Lifestyles Regular Condoms,$4.20,https://www.igashop.com.au/product/lifestyles-regular-condoms-160000002375
477760,Lifestyles Silky Smooth Water Based Lubricant,$5.70,https://www.igashop.com.au/product/lifestyles-silky-smooth-water-based-lubricant-477760
160000002371,Lifestyles Ultra Natural Intimate Gel,$10.00,https://www.igashop.com.au/product/lifestyles-ultra-natural-intimate-gel-160000002371
807038,Lifestyles Zero Uber Thin Condoms,$10.50,https://www.igashop.com.au/product/lifestyles-zero-uber-thin-condoms-807038
23087,Nair Easiwax Mini Wax Strips,$4.50,https://www.igashop.com.au/product/nair-easiwax-mini-wax-strips-23087
448648,Nair Hair Removal Cream Facial Hair Remover,$3.40,https://www.igashop.com.au/product/nair-hair-removal-cream-facial-hair-remover-448648
63176,Nair Hair Removal Cream Shower Power Max,$8.00,https://www.igashop.com.au/product/nair-hair-removal-cream-shower-power-max-63176
319713,Nair Hair Removal Wax Easiwax Large Strips,$5.50,https://www.igashop.com.au/product/nair-hair-removal-wax-easiwax-large-strips-319713
23095,Nair Sensitive Hair Removal Cream,$3.60,https://www.igashop.com.au/product/nair-sensitive-hair-removal-cream-23095
678442,Nair Sensitive Hair Removal Cream,$13.00,https://www.igashop.com.au/product/nair-sensitive-hair-removal-cream-678442
678549,Nair Sensitive Mini Wax Strips,$5.65,https://www.igashop.com.au/product/nair-sensitive-mini-wax-strips-678549
373555,Poise Incontinence Pads Extra Absorbency,$6.95,https://www.igashop.com.au/product/poise-incontinence-pads-extra-absorbency-373555
373678,Poise Incontinence Pads Extra Plus Absorbency,$6.95,https://www.igashop.com.au/product/poise-incontinence-pads-extra-plus-absorbency-373678
347062,Poise Incontinence Pads Overnight Absorbency,$6.95,https://www.igashop.com.au/product/poise-incontinence-pads-overnight-absorbency-347062
321341,Poise Liners Extra Long,$6.15,https://www.igashop.com.au/product/poise-liners-extra-long-321341
17073,Poise Liners Light,$3.70,https://www.igashop.com.au/product/poise-liners-light-17073
365858,Poise Liners Regular,$6.15,https://www.igashop.com.au/product/poise-liners-regular-365858
971280,Poise Pads Extra Plus,$10.60,https://www.igashop.com.au/product/poise-pads-extra-plus-971280
373513,Poise Pads Regular,$6.95,https://www.igashop.com.au/product/poise-pads-regular-373513
365332,Poise Pads Super,$10.60,https://www.igashop.com.au/product/poise-pads-super-365332
373547,Poise Pads Super,$6.95,https://www.igashop.com.au/product/poise-pads-super-373547
899645,Poise Thin Discreet Extra Pads,$6.50,https://www.igashop.com.au/product/poise-thin-discreet-extra-pads-899645
895007,Poise Thin Discreet Regular Pads,$6.50,https://www.igashop.com.au/product/poise-thin-discreet-regular-pads-895007
20000005392,Redberry Manicure Set,$8.05,https://www.igashop.com.au/product/redberry-manicure-set-20000005392
248085,Redberry Nail Brush,$2.20,https://www.igashop.com.au/product/redberry-nail-brush-248085
248027,Redberry Nail Clippers,$4.30,https://www.igashop.com.au/product/redberry-nail-clippers-248027
20000005393,Redberry Tweezer Straight,$5.40,https://www.igashop.com.au/product/redberry-tweezer-straight-20000005393
321972,Schick Exacta 2 For Women,$4.50,https://www.igashop.com.au/product/schick-exacta-2-for-women-321972
361778,Schick Hydro Silk Razor Kit 2,$16.50,https://www.igashop.com.au/product/schick-hydro-silk-razor-kit-2-361778
361786,Schick Hydro Silk Refills,$24.00,https://www.igashop.com.au/product/schick-hydro-silk-refills-361786
678175,Schick Hydro Silk Womens Disposable Razor,$10.00,https://www.igashop.com.au/product/schick-hydro-silk-womens-disposable-razor-678175
747615,Schick Intuition Fab Blades,$12.50,https://www.igashop.com.au/product/schick-intuition-fab-blades-747615
396480,Schick Intuition Razor Pure Nourish Cartridges,$15.50,https://www.igashop.com.au/product/schick-intuition-razor-pure-nourish-cartridges-396480
1268,Schick Quattro For Women Disposable,$10.00,https://www.igashop.com.au/product/schick-quattro-for-women-disposable-1268
73891,Schick Quattro For Women Kit,$8.50,https://www.igashop.com.au/product/schick-quattro-for-women-kit-73891
74504,Schick Quattro For Women Refills,$13.50,https://www.igashop.com.au/product/schick-quattro-for-women-refills-74504
396498,Schick Razor Intuition Pure Nourish Kit,$15.00,https://www.igashop.com.au/product/schick-razor-intuition-pure-nourish-kit-396498
404377,Schick Silk Effects,$8.40,https://www.igashop.com.au/product/schick-silk-effects-404377
66938,Schick Silk Effects Refills,$7.00,https://www.igashop.com.au/product/schick-silk-effects-refills-66938
883893,Schick Womens Xtreme 3 Hawaiian Tropic,$11.00,https://www.igashop.com.au/product/schick-womens-xtreme-3-hawaiian-tropic-883893
323393,Schick Xtreme 3 Sensitive Disposables For Women,$6.00,https://www.igashop.com.au/product/schick-xtreme-3-sensitive-disposables-for-women-323393
797267,Skyn Condoms Close Feel,$12.00,https://www.igashop.com.au/product/skyn-condoms-close-feel-797267
387677,Skyn Extra Lube Condoms,$12.00,https://www.igashop.com.au/product/skyn-extra-lube-condoms-387677
160000003246,Skyn Intense Feel Condoms,$12.00,https://www.igashop.com.au/product/skyn-intense-feel-condoms-160000003246
56917,Skyn Original Condoms,$12.00,https://www.igashop.com.au/product/skyn-original-condoms-56917
698552,Stayfree All Nights Extra Long With Wings Pads,$6.00,https://www.igashop.com.au/product/stayfree-all-nights-extra-long-with-wings-pads-698552
80657,Stayfree Light Ultra Thin With Wings,$6.00,https://www.igashop.com.au/product/stayfree-light-ultra-thin-with-wings-80657
374344,Stayfree Pads Regular No Wings,$7.00,https://www.igashop.com.au/product/stayfree-pads-regular-no-wings-374344
441688,Stayfree Pads Super No Wings,$7.00,https://www.igashop.com.au/product/stayfree-pads-super-no-wings-441688
695172,Stayfree Super Pads With Wings,$6.50,https://www.igashop.com.au/product/stayfree-super-pads-with-wings-695172
384064,Stayfree Ultra Thin All Nights With Wings,$6.00,https://www.igashop.com.au/product/stayfree-ultra-thin-all-nights-with-wings-384064
80665,Stayfree Ultra Thin Regular Pads,$6.00,https://www.igashop.com.au/product/stayfree-ultra-thin-regular-pads-80665
14952,Stayfree Ultra Thin Super With Wings,$6.00,https://www.igashop.com.au/product/stayfree-ultra-thin-super-with-wings-14952
81530,Stayfree Ultrathin Regular Pads With Wings,$6.00,https://www.igashop.com.au/product/stayfree-ultrathin-regular-pads-with-wings-81530
353144,Swisspers Absorbent Nursing Pads,$4.20,https://www.igashop.com.au/product/swisspers-absorbent-nursing-pads-353144
392559,Tampax Regular Light Flow Tampons With Applicator,$8.50,https://www.igashop.com.au/product/tampax-regular-light-flow-tampons-with-applicator-392559
394412,Tampax Super Medium Flow Tampons With Applicator,$8.50,https://www.igashop.com.au/product/tampax-super-medium-flow-tampons-with-applicator-394412
686987,Tena Discreet High Waist Underwear Creme Super Medium,$16.50,https://www.igashop.com.au/product/tena-discreet-high-waist-underwear-creme-super-medium-686987
11734,Tena Extra Long Length Liner,$3.85,https://www.igashop.com.au/product/tena-extra-long-length-liner-11734
640486,Tena Lady Pads Mini Plus,$5.45,https://www.igashop.com.au/product/tena-lady-pads-mini-plus-640486
687072,Tena Liners Ultimate Coverage Ultra Long Liner,$3.85,https://www.igashop.com.au/product/tena-liners-ultimate-coverage-ultra-long-liner-687072
498708,Tena Long Length Liner,$3.85,https://www.igashop.com.au/product/tena-long-length-liner-498708
939398,Tena Men Absorbent Protector Level 2 Medium,$6.15,https://www.igashop.com.au/product/tena-men-absorbent-protector-level-2-medium-939398
883966,Tena Men Absorbent Protector Level 3,$6.15,https://www.igashop.com.au/product/tena-men-absorbent-protector-level-3-883966
351668,Tena Men Discreet Protection Protective Underwear Level 4 Maxi,$15.20,https://www.igashop.com.au/product/tena-men-discreet-protection-protective-underwear-level-4-maxi-351668
62706,Tena Men Level 1,$8.80,https://www.igashop.com.au/product/tena-men-level-1-62706
496125,Tena Night Pants Large,$21.90,https://www.igashop.com.au/product/tena-night-pants-large-496125
55597,Tena Pads Extra Long Length,$9.00,https://www.igashop.com.au/product/tena-pads-extra-long-length-55597
57138,Tena Pads Instadry Long Length,$4.00,https://www.igashop.com.au/product/tena-pads-instadry-long-length-57138
302839,Tena Pads Maxi Night,$10.00,https://www.igashop.com.au/product/tena-pads-maxi-night-302839
351650,Tena Pants For Women Large,$14.30,https://www.igashop.com.au/product/tena-pants-for-women-large-351650
351663,Tena Pants For Women Medium,$14.30,https://www.igashop.com.au/product/tena-pants-for-women-medium-351663
687129,Tena Ultra Thin Pads Long Length,$5.30,https://www.igashop.com.au/product/tena-ultra-thin-pads-long-length-687129
687103,Tena Ultra Thin Pads Standard Length,$5.30,https://www.igashop.com.au/product/tena-ultra-thin-pads-standard-length-687103
160000010725,Tena Womens Pants Low Waist Noir Large,$17.60,https://www.igashop.com.au/product/tena-womens-pants-low-waist-noir-large-160000010725
160000010723,Tena Womens Pants Low Waist Noir Medium,$17.60,https://www.igashop.com.au/product/tena-womens-pants-low-waist-noir-medium-160000010723
384946,U By Kotex Designer Series Ultrathin With Wings Regular,$5.60,https://www.igashop.com.au/product/u-by-kotex-designer-series-ultrathin-with-wings-regular-384946
384954,U By Kotex Designer Series Ultrathin With Wings Super,$5.60,https://www.igashop.com.au/product/u-by-kotex-designer-series-ultrathin-with-wings-super-384954
55482,U By Kotex Maternity Pads,$5.00,https://www.igashop.com.au/product/u-by-kotex-maternity-pads-55482
497375,U By Kotex Maxi Overnight Pad Long,$5.00,https://www.igashop.com.au/product/u-by-kotex-maxi-overnight-pad-long-497375
978041,U By Kotex Mini Slim Tampons,$5.00,https://www.igashop.com.au/product/u-by-kotex-mini-slim-tampons-978041
383819,U By Kotex Nude Liners,$4.20,https://www.igashop.com.au/product/u-by-kotex-nude-liners-383819
55495,U By Kotex Overnight Pads Extra,$5.00,https://www.igashop.com.au/product/u-by-kotex-overnight-pads-extra-55495
491882,U By Kotex Overnight Ultrathins Long Pads,$5.00,https://www.igashop.com.au/product/u-by-kotex-overnight-ultrathins-long-pads-491882
384938,U By Kotex Overnight Ultrathins Regular,$5.00,https://www.igashop.com.au/product/u-by-kotex-overnight-ultrathins-regular-384938
383788,U By Kotex Protect Liners With Design,$3.50,https://www.igashop.com.au/product/u-by-kotex-protect-liners-with-design-383788
29389,U By Kotex Regular Designer Series Ultrathins With Wings,$8.40,https://www.igashop.com.au/product/u-by-kotex-regular-designer-series-ultrathins-with-wings-29389
55513,U By Kotex Regular Extra Pads With Wings,$5.00,https://www.igashop.com.au/product/u-by-kotex-regular-extra-pads-with-wings-55513
384899,U By Kotex Regular Ultrathins,$5.00,https://www.igashop.com.au/product/u-by-kotex-regular-ultrathins-384899
55474,U By Kotex Sanitary Pads Super With Wings,$5.00,https://www.igashop.com.au/product/u-by-kotex-sanitary-pads-super-with-wings-55474
383796,U By Kotex Sport Liners,$3.50,https://www.igashop.com.au/product/u-by-kotex-sport-liners-383796
802274,U By Kotex Sport Tampons Regular,$5.90,https://www.igashop.com.au/product/u-by-kotex-sport-tampons-regular-802274
802282,U By Kotex Sport Tampons Super,$5.90,https://www.igashop.com.au/product/u-by-kotex-sport-tampons-super-802282
335549,U By Kotex Sport Ultrathin Regular,$5.60,https://www.igashop.com.au/product/u-by-kotex-sport-ultrathin-regular-335549
335557,U By Kotex Super Sport Ultrathins With Wings,$5.60,https://www.igashop.com.au/product/u-by-kotex-super-sport-ultrathins-with-wings-335557
384904,U By Kotex Super Ultrathins With Wings,$5.00,https://www.igashop.com.au/product/u-by-kotex-super-ultrathins-with-wings-384904
978059,U By Kotex Tampons Regular,$4.75,https://www.igashop.com.au/product/u-by-kotex-tampons-regular-978059
889967,U By Kotex Tampons Regular Bulk,$8.00,https://www.igashop.com.au/product/u-by-kotex-tampons-regular-bulk-889967
978075,U By Kotex Tampons Super,$4.75,https://www.igashop.com.au/product/u-by-kotex-tampons-super-978075
864137,U By Kotex Tampons Super Bulk,$8.00,https://www.igashop.com.au/product/u-by-kotex-tampons-super-bulk-864137
384881,U By Kotex Ultrathin Pads Regular With Wings,$5.00,https://www.igashop.com.au/product/u-by-kotex-ultrathin-pads-regular-with-wings-384881
14177,Veet Easy Grip Wax Strips Hair Removal,$15.00,https://www.igashop.com.au/product/veet-easy-grip-wax-strips-hair-removal-14177
440276,Veet Easy Gel Legs Wax Strips Shea Butter And Acai Berries Scent,$9.00,https://www.igashop.com.au/product/veet-easy-gel-legs-wax-strips-shea-butter-and-acai-berries-scent-440276
53760,Veet Hair Removal Cream For Normal Skin Soft Silk Extract,$7.00,https://www.igashop.com.au/product/veet-hair-removal-cream-for-normal-skin-soft-silk-extract-53760
