ID,Name,Price,URL
44478,Citro Clean Multipurpose Cleaner,$9.75,https://www.igashop.com.au/product/citro-clean-multipurpose-cleaner-44478
936191,Community Co Clean Freak Bath Shower Spray,$2.65,https://www.igashop.com.au/product/community-co-clean-freak-bath-shower-spray-936191
905307,Community Co Clean Freak Bathroom Wipes,$2.00,https://www.igashop.com.au/product/community-co-clean-freak-bathroom-wipes-905307
936463,Community Co Clean Freak Glass Window Cleaner,$2.00,https://www.igashop.com.au/product/community-co-clean-freak-glass-window-cleaner-936463
905292,Community Co Clean Freak Glass Window Wipes,$2.00,https://www.igashop.com.au/product/community-co-clean-freak-glass-window-wipes-905292
936484,Community Co Clean Freak Multi Purpose Cleaner Spray,$2.00,https://www.igashop.com.au/product/community-co-clean-freak-multi-purpose-cleaner-spray-936484
942249,Community Co Furniture Polish,$3.95,https://www.igashop.com.au/product/community-co-furniture-polish-942249
905218,Community Co Multi Purpose Surface Wipes,$2.00,https://www.igashop.com.au/product/community-co-multi-purpose-surface-wipes-905218
700650,Dettol 100 Biodegradable Disinfectant Wipes Lemon,$10.00,https://www.igashop.com.au/product/dettol-100-biodegradable-disinfectant-wipes-lemon-700650
769557,Dettol Antibacterial Disinfectant Surface Cleaning 45 Pack,$6.00,https://www.igashop.com.au/product/dettol-antibacterial-disinfectant-surface-cleaning-45-pack-769557
769358,Dettol Antibacterial Disinfectant Surface Cleaning Wipes,$12.00,https://www.igashop.com.au/product/dettol-antibacterial-disinfectant-surface-cleaning-wipes-769358
700692,Dettol Antibacterial Floor Cleaning Wipes Lemon And Lime,$9.00,https://www.igashop.com.au/product/dettol-antibacterial-floor-cleaning-wipes-lemon-and-lime-700692
815073,Dettol Biodegradeable Wipes Multipurpose Cleaner,$4.75,https://www.igashop.com.au/product/dettol-biodegradeable-wipes-multipurpose-cleaner-815073
460161,Dettol Healthy Clean Antibacterial Bathroom Cleaner Trigger Spray,$5.00,https://www.igashop.com.au/product/dettol-healthy-clean-antibacterial-bathroom-cleaner-trigger-spray-460161
460132,Dettol Healthy Clean Antibacterial Kitchen Cleaner Trigger Spray,$5.00,https://www.igashop.com.au/product/dettol-healthy-clean-antibacterial-kitchen-cleaner-trigger-spray-460132
785309,Dettol Multipurpose Antibacterial Disinfectant Surface Cleaning Lemon 120 Pack,$12.00,https://www.igashop.com.au/product/dettol-multipurpose-antibacterial-disinfectant-surface-cleaning-lemon-120-pack-785309
170000003458,Dettol Multipurpose Healthy Clean Surface Spray Citrus Lemon Lime,$7.00,https://www.igashop.com.au/product/dettol-multipurpose-healthy-clean-surface-spray-citrus-lemon-lime-170000003458
170000003447,Dettol Multipurpose Healthy Clean Surface Spray Crisp Apple Burst,$7.00,https://www.igashop.com.au/product/dettol-multipurpose-healthy-clean-surface-spray-crisp-apple-burst-170000003447
394551,Dettol Surface Cleanser Lime Mint Trigger,$5.00,https://www.igashop.com.au/product/dettol-surface-cleanser-lime-mint-trigger-394551
810837,Dettol Tropical Disinfectant Wipes,$10.00,https://www.igashop.com.au/product/dettol-tropical-disinfectant-wipes-810837
862313,Diggers Kerosene,$8.90,https://www.igashop.com.au/product/diggers-kerosene-862313
609210,Diggers Turpentine,$7.80,https://www.igashop.com.au/product/diggers-turpentine-609210
282424,Dishmatic Handle,$4.20,https://www.igashop.com.au/product/dishmatic-handle-282424
285626,Dishmatic Micro Soft Refills,$6.30,https://www.igashop.com.au/product/dishmatic-micro-soft-refills-285626
285537,Dishmatic Refill Extra Heavy Duty,$6.30,https://www.igashop.com.au/product/dishmatic-refill-extra-heavy-duty-285537
180000000436,Domestos Bleach Disinfectant Cleaner Regular,$6.60,https://www.igashop.com.au/product/domestos-bleach-disinfectant-cleaner-regular-180000000436
7727,Domestos Multipurpose Bleach Mountain Fresh,$6.60,https://www.igashop.com.au/product/domestos-multipurpose-bleach-mountain-fresh-7727
417689,Domestos Multipurpose Bleach Original,$6.60,https://www.igashop.com.au/product/domestos-multipurpose-bleach-original-417689
16470,Duck Deep Action Gel Marine,$7.00,https://www.igashop.com.au/product/duck-deep-action-gel-marine-16470
12845,Duck Foam Bleach Gel Citrus,$6.80,https://www.igashop.com.au/product/duck-foam-bleach-gel-citrus-12845
388076,Earth Choice Floor Surface Eucalyptus Cleaner,$3.35,https://www.igashop.com.au/product/earth-choice-floor-surface-eucalyptus-cleaner-388076
363615,Earth Choice Floor Cleaner Wooden Surface,$4.68,https://www.igashop.com.au/product/earth-choice-floor-cleaner-wooden-surface-363615
243292,Earth Choice Kitchen Cleaner,$4.20,https://www.igashop.com.au/product/earth-choice-kitchen-cleaner-243292
71666,Earth Choice Lavender Toilet Cleaner,$3.50,https://www.igashop.com.au/product/earth-choice-lavender-toilet-cleaner-71666
389137,Earth Choice Multi Purpose Spray Clean,$3.00,https://www.igashop.com.au/product/earth-choice-multi-purpose-spray-clean-389137
346870,Earth Choice Shower Cleaner,$3.90,https://www.igashop.com.au/product/earth-choice-shower-cleaner-346870
346749,Earth Choice Window Cleaner Window,$2.95,https://www.igashop.com.au/product/earth-choice-window-cleaner-window-346749
22599,Easy Off Bam Cleaning Products Heavy Duty Oven,$5.75,https://www.igashop.com.au/product/easy-off-bam-cleaning-products-heavy-duty-oven-22599
23579,Easy Off Fume Free Oven Cleaner,$5.75,https://www.igashop.com.au/product/easy-off-fume-free-oven-cleaner-23579
170000004003,Easy Off Drain Cleaner 2In1,$11.50,https://www.igashop.com.au/product/easy-off-drain-cleaner-2in1-170000004003
37329,Easy Off Drain Cleaner Turbo Gel,$18.00,https://www.igashop.com.au/product/easy-off-drain-cleaner-turbo-gel-37329
63472,Eit Mould Cleaning Products Trigger,$9.50,https://www.igashop.com.au/product/eit-mould-cleaning-products-trigger-63472
375052,Febreze With Ambi Pur Fabric Spray Anti Bacterial,$6.50,https://www.igashop.com.au/product/febreze-with-ambi-pur-fabric-spray-anti-bacterial-375052
749748,Finish Dishwasher Rinse Aid 0,$10.50,https://www.igashop.com.au/product/finish-dishwasher-rinse-aid-0-749748
42992,Finish Liquid Household Products Dishwasher Cleaner,$10.50,https://www.igashop.com.au/product/finish-liquid-household-products-dishwasher-cleaner-42992
490263,Glad Bag Handle Tie Lavender Large,$4.00,https://www.igashop.com.au/product/glad-bag-handle-tie-lavender-large-490263
490271,Glad Bag Handle Tie Lavender Medium,$4.00,https://www.igashop.com.au/product/glad-bag-handle-tie-lavender-medium-490271
8715,Glad Council Bin Liner,$5.00,https://www.igashop.com.au/product/glad-council-bin-liner-8715
490289,Glad Garden Bag,$3.75,https://www.igashop.com.au/product/glad-garden-bag-490289
449694,Glad Kitchen Tidy Bag Tuff Stuff Drawstring Large,$4.50,https://www.igashop.com.au/product/glad-kitchen-tidy-bag-tuff-stuff-drawstring-large-449694
395463,Glad Kitchen Tidy Bag Wavetop Large,$9.15,https://www.igashop.com.au/product/glad-kitchen-tidy-bag-wavetop-large-395463
610871,Glad Kitchen Tidy Bag Wavetop Large,$3.80,https://www.igashop.com.au/product/glad-kitchen-tidy-bag-wavetop-large-610871
610889,Glad Kitchen Tidy Bag Wavetop Medium,$3.80,https://www.igashop.com.au/product/glad-kitchen-tidy-bag-wavetop-medium-610889
926515,Glad Kitchen Tidy Bag Wavetop X Large,$3.80,https://www.igashop.com.au/product/glad-kitchen-tidy-bag-wavetop-x-large-926515
873673,Glad Kitchen Tidy Plant Bio Medium,$5.00,https://www.igashop.com.au/product/glad-kitchen-tidy-plant-bio-medium-873673
395382,Glad Kitchen Tidy Wavetop Roll Medium,$6.80,https://www.igashop.com.au/product/glad-kitchen-tidy-wavetop-roll-medium-395382
497647,Glad Small Kitchen Tidy Bags,$3.80,https://www.igashop.com.au/product/glad-small-kitchen-tidy-bags-497647
160000011742,Glad To Be Green 50 Plant Based Bags Large,$5.00,https://www.igashop.com.au/product/glad-to-be-green-50-plant-based-bags-large-160000011742
160000011741,Glad To Be Green 50 Plant Based Bags Smal,$5.00,https://www.igashop.com.au/product/glad-to-be-green-50-plant-based-bags-smal-160000011741
160000011740,Glad To Be Green 95 Recycled Kitchen Tidy Bags Large,$4.30,https://www.igashop.com.au/product/glad-to-be-green-95-recycled-kitchen-tidy-bags-large-160000011740
160000011739,Glad To Be Green 95 Recycled Kitchen Tidy Bags Medium,$4.30,https://www.igashop.com.au/product/glad-to-be-green-95-recycled-kitchen-tidy-bags-medium-160000011739
160000011738,Glad To Be Green 95 Recycled Kitchen Tidy Bags Small,$4.30,https://www.igashop.com.au/product/glad-to-be-green-95-recycled-kitchen-tidy-bags-small-160000011738
675889,Glad To Be Green Compostable Mini,$3.80,https://www.igashop.com.au/product/glad-to-be-green-compostable-mini-675889
675897,Glad To Be Green Compostable Small,$3.80,https://www.igashop.com.au/product/glad-to-be-green-compostable-small-675897
48545,Glad Tuff Stuff Extra Wide Drawstring Garbage Bags,$4.90,https://www.igashop.com.au/product/glad-tuff-stuff-extra-wide-drawstring-garbage-bags-48545
676327,Glade 2 In 1 Candle Fresh Berries Wild Raspberry,$7.30,https://www.igashop.com.au/product/glade-2-in-1-candle-fresh-berries-wild-raspberry-676327
657129,Glade 2 In 1 Candle Passionfruit Hawaiian Breeze,$7.30,https://www.igashop.com.au/product/glade-2-in-1-candle-passionfruit-hawaiian-breeze-657129
38710,Glade Candle Angel Whispers,$7.30,https://www.igashop.com.au/product/glade-candle-angel-whispers-38710
39114,Glade Candle Vanilla,$7.30,https://www.igashop.com.au/product/glade-candle-vanilla-39114
609503,Glade Clean Linen Aerosol,$4.00,https://www.igashop.com.au/product/glade-clean-linen-aerosol-609503
609553,Glade Essence Of Vanilla Aerosol,$4.00,https://www.igashop.com.au/product/glade-essence-of-vanilla-aerosol-609553
353050,Glade Hawaiian Breeze Aerosol,$4.00,https://www.igashop.com.au/product/glade-hawaiian-breeze-aerosol-353050
45770,Glade Ocean Mist Air Freshener Aerosol Spray,$4.00,https://www.igashop.com.au/product/glade-ocean-mist-air-freshener-aerosol-spray-45770
190000000222,Glade Scented Candle Smoldering Volcanic Coconut,$7.30,https://www.igashop.com.au/product/glade-scented-candle-smoldering-volcanic-coconut-190000000222
779772,Glade Sense Spray Automatic Freshener Sheer Vanilla Embrace,$17.50,https://www.igashop.com.au/product/glade-sense-spray-automatic-freshener-sheer-vanilla-embrace-779772
43922,Glade Sense Spray Automatic Spray Air Freshener Clean Lin Refill,$7.50,https://www.igashop.com.au/product/glade-sense-spray-automatic-spray-air-freshener-clean-lin-refill-43922
327758,Glade Sense Spray Automatic Spray Air Freshener Hawaii Br Refill,$7.50,https://www.igashop.com.au/product/glade-sense-spray-automatic-spray-air-freshener-hawaii-br-refill-327758
387538,Glade Sense Spray Automatic Spray Hawaiian Breeze,$15.00,https://www.igashop.com.au/product/glade-sense-spray-automatic-spray-hawaiian-breeze-387538
327740,Glade Sense Spray Lavender Vanilla Refill,$7.50,https://www.igashop.com.au/product/glade-sense-spray-lavender-vanilla-refill-327740
56792,Glade Sense Spray Pomegranate Cranberries Refill,$7.50,https://www.igashop.com.au/product/glade-sense-spray-pomegranate-cranberries-refill-56792
779675,Glade Sense Spray Vanilla Refill,$7.50,https://www.igashop.com.au/product/glade-sense-spray-vanilla-refill-779675
610512,Glade Suddenly Spring Aerosol,$4.00,https://www.igashop.com.au/product/glade-suddenly-spring-aerosol-610512
610481,Glade Wild Lavender Aerosol,$4.00,https://www.igashop.com.au/product/glade-wild-lavender-aerosol-610481
459136,Glen 20 All In One Disinfectant Spray Country Scent,$9.50,https://www.igashop.com.au/product/glen-20-all-in-one-disinfectant-spray-country-scent-459136
765985,Glen 20 Disinfectant Berry Breeze,$9.50,https://www.igashop.com.au/product/glen-20-disinfectant-berry-breeze-765985
765977,Glen 20 Disinfectant Summer Garden,$9.50,https://www.igashop.com.au/product/glen-20-disinfectant-summer-garden-765977
160000011476,Glen 20 On The Go Disinfectant Spray Citrus Notes,$5.25,https://www.igashop.com.au/product/glen-20-on-the-go-disinfectant-spray-citrus-notes-160000011476
160000011463,Glen 20 On The Go Disinfectant Spray Crisp Linen,$5.25,https://www.igashop.com.au/product/glen-20-on-the-go-disinfectant-spray-crisp-linen-160000011463
160000011479,Glen 20 On The Go Disinfectant Wipes Eucalyptus,$3.15,https://www.igashop.com.au/product/glen-20-on-the-go-disinfectant-wipes-eucalyptus-160000011479
160000011478,Glen 20 On The Go Disinfectant Wipes Lemon Lime,$3.15,https://www.igashop.com.au/product/glen-20-on-the-go-disinfectant-wipes-lemon-lime-160000011478
160000011440,Glen 20 Pure Disinfectant Mist Fresh Water,$11.50,https://www.igashop.com.au/product/glen-20-pure-disinfectant-mist-fresh-water-160000011440
160000011441,Glen 20 Pure Disinfectant Spray Morning Breeze,$11.50,https://www.igashop.com.au/product/glen-20-pure-disinfectant-spray-morning-breeze-160000011441
13799,Glen 20 Spray Disinfectant All In One Citrus Breeze,$9.50,https://www.igashop.com.au/product/glen-20-spray-disinfectant-all-in-one-citrus-breeze-13799
391689,Glen 20 Spray Disinfectant All In One Country Scent,$11.50,https://www.igashop.com.au/product/glen-20-spray-disinfectant-all-in-one-country-scent-391689
458928,Glen 20 Spray Disinfectant All In One Country Scent,$6.00,https://www.igashop.com.au/product/glen-20-spray-disinfectant-all-in-one-country-scent-458928
459102,Glen 20 Spray Disinfectant All In One Crisp Linen,$6.00,https://www.igashop.com.au/product/glen-20-spray-disinfectant-all-in-one-crisp-linen-459102
300154,Glen 20 Spray Disinfectant All In One Lavender,$9.50,https://www.igashop.com.au/product/glen-20-spray-disinfectant-all-in-one-lavender-300154
379849,Glen 20 Spray Disinfectant All In One Original,$6.00,https://www.igashop.com.au/product/glen-20-spray-disinfectant-all-in-one-original-379849
64208,Glen 20 Spray Disinfectant All In One Original,$9.50,https://www.igashop.com.au/product/glen-20-spray-disinfectant-all-in-one-original-64208
63820,Gumption Multi Purpose Cleaner Lemon,$4.80,https://www.igashop.com.au/product/gumption-multi-purpose-cleaner-lemon-63820
690596,Handee Wipes Multi Purpose,$8.00,https://www.igashop.com.au/product/handee-wipes-multi-purpose-690596
691128,Handee Wipes Multi Purpose Natural,$4.00,https://www.igashop.com.au/product/handee-wipes-multi-purpose-natural-691128
300450,Handy Andy 2 In 1 Cleaner Disinfectant,$3.60,https://www.igashop.com.au/product/handy-andy-2-in-1-cleaner-disinfectant-300450
99740,Handy Andy Original Cleaner Fresh Scent,$3.60,https://www.igashop.com.au/product/handy-andy-original-cleaner-fresh-scent-99740
371485,Harpers Borax,$5.50,https://www.igashop.com.au/product/harpers-borax-371485
346901,Harpic Blue Toilet Cleaner Block In Cistern,$4.95,https://www.igashop.com.au/product/harpic-blue-toilet-cleaner-block-in-cistern-346901
898550,Harpic Fresh Power Toilet Cleaner Marine Splash,$7.00,https://www.igashop.com.au/product/harpic-fresh-power-toilet-cleaner-marine-splash-898550
898660,Harpic Fresh Power Toilet Cleaner Marine Splash,$7.00,https://www.igashop.com.au/product/harpic-fresh-power-toilet-cleaner-marine-splash-898660
898571,Harpic Fresh Power Toilet Cleaner Tropical Blossom,$7.00,https://www.igashop.com.au/product/harpic-fresh-power-toilet-cleaner-tropical-blossom-898571
838500,Harpic Marine Toilet Cleaner,$5.00,https://www.igashop.com.au/product/harpic-marine-toilet-cleaner-838500
898563,Harpic Toilet Cleaner Summer Breeze Citrus,$7.00,https://www.igashop.com.au/product/harpic-toilet-cleaner-summer-breeze-citrus-898563
456714,Harpic White Shine Toilet Cleaner Citrus,$3.50,https://www.igashop.com.au/product/harpic-white-shine-toilet-cleaner-citrus-456714
456683,Harpic White Shine Toilet Cleaner Fresh,$3.50,https://www.igashop.com.au/product/harpic-white-shine-toilet-cleaner-fresh-456683
17052,Hillmark Cerapol,$6.45,https://www.igashop.com.au/product/hillmark-cerapol-17052
17078,Hillmark Steel Clean,$8.80,https://www.igashop.com.au/product/hillmark-steel-clean-17078
487781,Hippo Closet Container Moisture Absorber Small Spaces,$7.50,https://www.igashop.com.au/product/hippo-closet-container-moisture-absorber-small-spaces-487781
856728,Jif Cream Cleanser With Micro Particles Lemon,$4.80,https://www.igashop.com.au/product/jif-cream-cleanser-with-micro-particles-lemon-856728
856744,Jif Cream Cleanser With Micro Particles Original,$4.80,https://www.igashop.com.au/product/jif-cream-cleanser-with-micro-particles-original-856744
51488,Kleenex Anti Bacterial Wipes,$2.35,https://www.igashop.com.au/product/kleenex-anti-bacterial-wipes-51488
41755,Mclintocks Vanilla Fresh Fridge Wipe Deodorizer,$5.25,https://www.igashop.com.au/product/mclintocks-vanilla-fresh-fridge-wipe-deodorizer-41755
160000013355,Medix Eucalyptus Oil Solution,$7.40,https://www.igashop.com.au/product/medix-eucalyptus-oil-solution-160000013355
160000013356,Medix Eucalyptus Spray,$9.75,https://www.igashop.com.au/product/medix-eucalyptus-spray-160000013356
726355,Method Cleaner All Purpose Antibacterial Wild Rhubarb,$5.00,https://www.igashop.com.au/product/method-cleaner-all-purpose-antibacterial-wild-rhubarb-726355
726290,Method Cleaner Glass Spray,$5.00,https://www.igashop.com.au/product/method-cleaner-glass-spray-726290
392075,Milton Anti Bacterial Tablets,$10.50,https://www.igashop.com.au/product/milton-anti-bacterial-tablets-392075
124799,Mlrl Dish Handle Refill,$5.00,https://www.igashop.com.au/product/mlrl-dish-handle-refill-124799
432613,Mr Muscle Drain Cleaner Crystals,$15.75,https://www.igashop.com.au/product/mr-muscle-drain-cleaner-crystals-432613
428800,Mr Muscle Oven Cleaner,$4.40,https://www.igashop.com.au/product/mr-muscle-oven-cleaner-428800
485381,Mr Sheen Surface Cleaner Polish Trigger Spray,$8.00,https://www.igashop.com.au/product/mr-sheen-surface-cleaner-polish-trigger-spray-485381
485200,Mr Sheen Surface Cleaning Aerosol Regular,$8.20,https://www.igashop.com.au/product/mr-sheen-surface-cleaning-aerosol-regular-485200
484068,Multix Bag Compostable Green Medium,$6.30,https://www.igashop.com.au/product/multix-bag-compostable-green-medium-484068
28024,Multix Bag Handy Tie Large,$5.30,https://www.igashop.com.au/product/multix-bag-handy-tie-large-28024
28016,Multix Bag Handy Tie Medium,$5.30,https://www.igashop.com.au/product/multix-bag-handy-tie-medium-28016
375853,Multix Colour Scents Handy Ties Tidy Bags Large Lemon Scent,$2.50,https://www.igashop.com.au/product/multix-colour-scents-handy-ties-tidy-bags-large-lemon-scent-375853
301134,Multix Colour Scents Handy Ties Tidy Bags Medium Lavender Scent,$3.90,https://www.igashop.com.au/product/multix-colour-scents-handy-ties-tidy-bags-medium-lavender-scent-301134
371964,Multix Disposable Bag Kitchen Tidy Medium,$3.50,https://www.igashop.com.au/product/multix-disposable-bag-kitchen-tidy-medium-371964
49347,Multix Drawtight Roll Garbage Bags,$4.00,https://www.igashop.com.au/product/multix-drawtight-roll-garbage-bags-49347
604618,Multix Extra Wide Roll Garbage Bags,$4.50,https://www.igashop.com.au/product/multix-extra-wide-roll-garbage-bags-604618
413512,Multix Garbage Bag Council Bin Liner,$6.00,https://www.igashop.com.au/product/multix-garbage-bag-council-bin-liner-413512
604202,Multix Garbage Bag Drawtight,$4.50,https://www.igashop.com.au/product/multix-garbage-bag-drawtight-604202
70602,Multix Garbage Bags,$9.20,https://www.igashop.com.au/product/multix-garbage-bags-70602
417590,Multix Garden Drawtight Garbage Bags,$4.00,https://www.igashop.com.au/product/multix-garden-drawtight-garbage-bags-417590
675588,Multix Greener 60 Plant Based Kitchen Tidy Garbage Bags Small,$4.50,https://www.igashop.com.au/product/multix-greener-60-plant-based-kitchen-tidy-garbage-bags-small-675588
483685,Multix Greener Mini Plant Based Compostable Bags,$4.20,https://www.igashop.com.au/product/multix-greener-mini-plant-based-compostable-bags-483685
675805,Multix Kitchen Tidy Greener Medium,$4.50,https://www.igashop.com.au/product/multix-kitchen-tidy-greener-medium-675805
674401,Multix Kitchen Tidy Greener Mini,$3.80,https://www.igashop.com.au/product/multix-kitchen-tidy-greener-mini-674401
340484,Multix Kitchen Tidy Grip Tight Large,$3.40,https://www.igashop.com.au/product/multix-kitchen-tidy-grip-tight-large-340484
340620,Multix Kitchen Tidy Grip Tight Medium,$3.40,https://www.igashop.com.au/product/multix-kitchen-tidy-grip-tight-medium-340620
32662,Multix Kitchen Tidy Rose Scented,$3.35,https://www.igashop.com.au/product/multix-kitchen-tidy-rose-scented-32662
385890,Multix Kitchen Tidy Rose Scented Large,$2.50,https://www.igashop.com.au/product/multix-kitchen-tidy-rose-scented-large-385890
862363,Multix Kitchen Tidy Vanilla Scented Large,$2.50,https://www.igashop.com.au/product/multix-kitchen-tidy-vanilla-scented-large-862363
676380,Multix Recycled Garbage Bags,$3.80,https://www.igashop.com.au/product/multix-recycled-garbage-bags-676380
688997,Multix Trolley Liner Garbage Bags,$6.50,https://www.igashop.com.au/product/multix-trolley-liner-garbage-bags-688997
422901,Nifti All Purpose Cleaner,$5.00,https://www.igashop.com.au/product/nifti-all-purpose-cleaner-422901
333160,Nilodor Concentrated Deodoriser,$8.00,https://www.igashop.com.au/product/nilodor-concentrated-deodoriser-333160
305670,Nilodor Mist Deodorant Pump,$8.00,https://www.igashop.com.au/product/nilodor-mist-deodorant-pump-305670
79452,No Vac Foam Carpet Sanitiser Deodoriser Fresh Pet,$6.00,https://www.igashop.com.au/product/no-vac-foam-carpet-sanitiser-deodoriser-fresh-pet-79452
79444,No Vac Foam Carpet Sanitiser Deodoriser Garden Breeze,$6.00,https://www.igashop.com.au/product/no-vac-foam-carpet-sanitiser-deodoriser-garden-breeze-79444
715647,Oates Enviro Dusting Floor Mop,$31.80,https://www.igashop.com.au/product/oates-enviro-dusting-floor-mop-715647
224125,Oates General Scrub Brush With Handle,$8.40,https://www.igashop.com.au/product/oates-general-scrub-brush-with-handle-224125
221486,Oates Mop Tiltamatic Squeeze,$17.65,https://www.igashop.com.au/product/oates-mop-tiltamatic-squeeze-221486
946060,Oates Multi Fit Squeeze Mop Refill,$12.25,https://www.igashop.com.au/product/oates-multi-fit-squeeze-mop-refill-946060
716596,Oates Soft Grip Electrostatic Duster,$5.00,https://www.igashop.com.au/product/oates-soft-grip-electrostatic-duster-716596
715956,Oates Toilet Tidy Brush Set,$5.60,https://www.igashop.com.au/product/oates-toilet-tidy-brush-set-715956
907299,Oates Wonder Cloth,$5.90,https://www.igashop.com.au/product/oates-wonder-cloth-907299
454262,Orange Power Lemon Myrtle Orange Air Freshener,$4.50,https://www.igashop.com.au/product/orange-power-lemon-myrtle-orange-air-freshener-454262
452529,Orange Power Manual Spray Air Freshener Lime Orange,$4.50,https://www.igashop.com.au/product/orange-power-manual-spray-air-freshener-lime-orange-452529
395714,Oso Garbage Bag Twin Tie,$6.70,https://www.igashop.com.au/product/oso-garbage-bag-twin-tie-395714
51970,Oso Garbage Bags Roll,$4.30,https://www.igashop.com.au/product/oso-garbage-bags-roll-51970
67785,Oust 3 In 1 Garden Fresh,$9.00,https://www.igashop.com.au/product/oust-3-in-1-garden-fresh-67785
68032,Oust 3 In 1 Outdoor Scent,$9.00,https://www.igashop.com.au/product/oust-3-in-1-outdoor-scent-68032
354941,Ozkleen Disinfectant Power,$4.50,https://www.igashop.com.au/product/ozkleen-disinfectant-power-354941
60822,Ozkleen Floor Carpet Cleaner Lavender,$8.00,https://www.igashop.com.au/product/ozkleen-floor-carpet-cleaner-lavender-60822
406243,Ozkleen Grease Power,$6.20,https://www.igashop.com.au/product/ozkleen-grease-power-406243
417257,Ozkleen Mould Power Remover,$7.40,https://www.igashop.com.au/product/ozkleen-mould-power-remover-417257
367193,Ozkleen Oven Cleaner Power Kit,$9.60,https://www.igashop.com.au/product/ozkleen-oven-cleaner-power-kit-367193
463745,Ozkleen Shower Power Squeeze,$7.30,https://www.igashop.com.au/product/ozkleen-shower-power-squeeze-463745
470310,Ozkleen Shower Power Trigger,$7.35,https://www.igashop.com.au/product/ozkleen-shower-power-trigger-470310
707092,Pascoes Drain Clean Liquid,$7.50,https://www.igashop.com.au/product/pascoes-drain-clean-liquid-707092
64054,Pine O Cleen Antibacterial Disinfectant,$4.20,https://www.igashop.com.au/product/pine-o-cleen-antibacterial-disinfectant-64054
71569,Pine O Cleen Antibacterial Disinfectant Lemon Lime,$4.00,https://www.igashop.com.au/product/pine-o-cleen-antibacterial-disinfectant-lemon-lime-71569
64135,Pine O Cleen Antibacterial Disinfectant Liquid Lemon,$4.20,https://www.igashop.com.au/product/pine-o-cleen-antibacterial-disinfectant-liquid-lemon-64135
460616,Pine O Cleen Antibacterial Disinfectant Liquid Pine,$4.00,https://www.igashop.com.au/product/pine-o-cleen-antibacterial-disinfectant-liquid-pine-460616
15827,Pine O Cleen Antibacterial Disinfectant Liquid Pot Pourri,$4.20,https://www.igashop.com.au/product/pine-o-cleen-antibacterial-disinfectant-liquid-pot-pourri-15827
343945,Pine O Cleen Disinfectant Eucalyptus,$4.00,https://www.igashop.com.au/product/pine-o-cleen-disinfectant-eucalyptus-343945
143065,Pine O Cleen Disinfectant Floor Cleaner Pomegranate,$7.00,https://www.igashop.com.au/product/pine-o-cleen-disinfectant-floor-cleaner-pomegranate-143065
675350,Pine O Cleen Disinfectant Gel Bottle,$6.00,https://www.igashop.com.au/product/pine-o-cleen-disinfectant-gel-bottle-675350
150000000078,Pine O Cleen Disinfectant Multipurpose Wipes Eucalyptus,$12.00,https://www.igashop.com.au/product/pine-o-cleen-disinfectant-multipurpose-wipes-eucalyptus-150000000078
64070,Pine O Cleen Disinfectant Pine,$4.20,https://www.igashop.com.au/product/pine-o-cleen-disinfectant-pine-64070
185151,Pine O Cleen Disinfectant Spray Apple Crisp,$3.50,https://www.igashop.com.au/product/pine-o-cleen-disinfectant-spray-apple-crisp-185151
