ID,Name,Price,URL
185172,Pine O Cleen Disinfectant Spray Lemon Lime,$3.50,https://www.igashop.com.au/product/pine-o-cleen-disinfectant-spray-lemon-lime-185172
185193,Pine O Cleen Multi Purpose Spray Fresh Eucalyptus,$3.50,https://www.igashop.com.au/product/pine-o-cleen-multi-purpose-spray-fresh-eucalyptus-185193
829983,Pine O Cleen Simply Biodegradeable Wipes Grapefruit,$10.00,https://www.igashop.com.au/product/pine-o-cleen-simply-biodegradeable-wipes-grapefruit-829983
815272,Pine O Cleen Simply Multi Purpose Cleaner Trigger Apple,$6.00,https://www.igashop.com.au/product/pine-o-cleen-simply-multi-purpose-cleaner-trigger-apple-815272
815311,Pine O Cleen Simply Multi Purpose Cleaning Spray Grapefruit,$6.00,https://www.igashop.com.au/product/pine-o-cleen-simply-multi-purpose-cleaning-spray-grapefruit-815311
767327,Pine O Cleen Surface Wipes,$12.00,https://www.igashop.com.au/product/pine-o-cleen-surface-wipes-767327
769382,Pine O Cleen Surface Wipes,$6.00,https://www.igashop.com.au/product/pine-o-cleen-surface-wipes-769382
991735,Pine O Cleen Washing Machine Cleaner Fresh,$8.00,https://www.igashop.com.au/product/pine-o-cleen-washing-machine-cleaner-fresh-991735
326723,Pledge Grab It Duster Refill,$10.80,https://www.igashop.com.au/product/pledge-grab-it-duster-refill-326723
604383,Pledge Grab It Dusting Cloths Citrus,$8.50,https://www.igashop.com.au/product/pledge-grab-it-dusting-cloths-citrus-604383
370471,Pledge Lemon Extra Care,$5.40,https://www.igashop.com.au/product/pledge-lemon-extra-care-370471
190000000027,Renuzit Air Freshener Blissful Hawaiian Oasis,$4.35,https://www.igashop.com.au/product/renuzit-air-freshener-blissful-hawaiian-oasis-190000000027
977008,Renuzit Air Freshener Sensitive Pure Ocean Breeze,$4.35,https://www.igashop.com.au/product/renuzit-air-freshener-sensitive-pure-ocean-breeze-977008
852473,Rhythm Cleaner All Purpose,$6.00,https://www.igashop.com.au/product/rhythm-cleaner-all-purpose-852473
851396,Rhythm Cleaner Tile Grout,$6.20,https://www.igashop.com.au/product/rhythm-cleaner-tile-grout-851396
907956,Sabco Clean Line Dustpan Set,$5.00,https://www.igashop.com.au/product/sabco-clean-line-dustpan-set-907956
704544,Sabco Domed Cobweb Broom,$10.50,https://www.igashop.com.au/product/sabco-domed-cobweb-broom-704544
704578,Sabco Dual Angle Window Washer With Extendable Handle,$11.20,https://www.igashop.com.au/product/sabco-dual-angle-window-washer-with-extendable-handle-704578
700472,Sabco Duex Scrub Wipe Kitchen Sponge,$5.60,https://www.igashop.com.au/product/sabco-duex-scrub-wipe-kitchen-sponge-700472
704390,Sabco Long Handled Dustpan,$21.00,https://www.igashop.com.au/product/sabco-long-handled-dustpan-704390
700325,Sabco Sponge Duex Bathroom,$4.20,https://www.igashop.com.au/product/sabco-sponge-duex-bathroom-700325
698793,Sabco Sponge Wash Jumbo,$4.15,https://www.igashop.com.au/product/sabco-sponge-wash-jumbo-698793
704400,Sabco Ultra Grab Microfibre Flexible Duster,$6.30,https://www.igashop.com.au/product/sabco-ultra-grab-microfibre-flexible-duster-704400
20000006307,Scotch Brite Extreme Scourer,$4.50,https://www.igashop.com.au/product/scotch-brite-extreme-scourer-20000006307
20000006520,Scotch Brite Handy Sponge,$4.30,https://www.igashop.com.au/product/scotch-brite-handy-sponge-20000006520
74083,Scotch Brite Heavy Duty Scourer 3X Longer,$4.40,https://www.igashop.com.au/product/scotch-brite-heavy-duty-scourer-3x-longer-74083
318380,Scotch Brite Non Scratch Foam Scrub,$3.55,https://www.igashop.com.au/product/scotch-brite-non-scratch-foam-scrub-318380
623939,Scotch Brite Scrub Sponge No Scratch,$3.50,https://www.igashop.com.au/product/scotch-brite-scrub-sponge-no-scratch-623939
206567,Selleys Bbq Accessory Tough Clean,$8.60,https://www.igashop.com.au/product/selleys-bbq-accessory-tough-clean-206567
293962,Selleys Bbq Accessory Tough Wipes,$6.50,https://www.igashop.com.au/product/selleys-bbq-accessory-tough-wipes-293962
354580,Selleys Oven Kleen Fast Acting,$6.30,https://www.igashop.com.au/product/selleys-oven-kleen-fast-acting-354580
410360,Selleys Rapid Mould Killer Trigger,$6.45,https://www.igashop.com.au/product/selleys-rapid-mould-killer-trigger-410360
94106,Selleys Sugar Soap Liquid,$4.60,https://www.igashop.com.au/product/selleys-sugar-soap-liquid-94106
20000006309,Selleys Supercloth Regular,$3.20,https://www.igashop.com.au/product/selleys-supercloth-regular-20000006309
467139,Silvo Silver Polish,$13.80,https://www.igashop.com.au/product/silvo-silver-polish-467139
389195,Snowy Dishcloth Bleached,$1.00,https://www.igashop.com.au/product/snowy-dishcloth-bleached-389195
160000003307,Sorbent Hypo Allergenic Flushable Wipes,$3.80,https://www.igashop.com.au/product/sorbent-hypo-allergenic-flushable-wipes-160000003307
54041,Sparkle Daily Shower Cleaner,$5.20,https://www.igashop.com.au/product/sparkle-daily-shower-cleaner-54041
378429,Stay Fresh Edco Wonder Cloth,$2.65,https://www.igashop.com.au/product/stay-fresh-edco-wonder-cloth-378429
448787,Stay Fresh Scour Sponge,$1.00,https://www.igashop.com.au/product/stay-fresh-scour-sponge-448787
20000006315,Stay Fresh Sponge Spikbrite,$2.30,https://www.igashop.com.au/product/stay-fresh-sponge-spikbrite-20000006315
373453,Steelo Silver Scourer Metalware Polish Cleaner,$4.70,https://www.igashop.com.au/product/steelo-silver-scourer-metalware-polish-cleaner-373453
69452,Steelo Sponges Lemon,$6.00,https://www.igashop.com.au/product/steelo-sponges-lemon-69452
927294,Tlc All Bathroom Concentrate Sachet,$5.00,https://www.igashop.com.au/product/tlc-all-bathroom-concentrate-sachet-927294
927600,Tlc Jack Of All Concentrate Sachet,$5.00,https://www.igashop.com.au/product/tlc-jack-of-all-concentrate-sachet-927600
20000004189,Vileda Active Scourer Super Absorbent,$4.80,https://www.igashop.com.au/product/vileda-active-scourer-super-absorbent-20000004189
649676,Vileda Bamboo Cloth,$4.00,https://www.igashop.com.au/product/vileda-bamboo-cloth-649676
204345,Vileda Bucket Wringer,$23.00,https://www.igashop.com.au/product/vileda-bucket-wringer-204345
355272,Vileda Cleaning Cloth All Purpose Cloth,$6.40,https://www.igashop.com.au/product/vileda-cleaning-cloth-all-purpose-cloth-355272
207217,Vileda Extra Long Cotton Mop,$14.00,https://www.igashop.com.au/product/vileda-extra-long-cotton-mop-207217
245985,Vileda Mop Bath Magic Refill,$9.70,https://www.igashop.com.au/product/vileda-mop-bath-magic-refill-245985
273844,Vileda Mop Easy Wring Clean,$57.50,https://www.igashop.com.au/product/vileda-mop-easy-wring-clean-273844
207209,Vileda Mop Extra Long Cotton Refill,$9.70,https://www.igashop.com.au/product/vileda-mop-extra-long-cotton-refill-207209
269109,Vileda Mop Microfibre Refill,$13.90,https://www.igashop.com.au/product/vileda-mop-microfibre-refill-269109
262631,Vileda Mop Promist Durable Refill,$12.50,https://www.igashop.com.au/product/vileda-mop-promist-durable-refill-262631
262623,Vileda Mop Promist System,$45.00,https://www.igashop.com.au/product/vileda-mop-promist-system-262623
255396,Vileda Mop Super Microfibre Tx Handle,$23.00,https://www.igashop.com.au/product/vileda-mop-super-microfibre-tx-handle-255396
710891,Vileda Mop Super Soft Yellow,$13.00,https://www.igashop.com.au/product/vileda-mop-super-soft-yellow-710891
710914,Vileda Mop Super Soft Yellow,$10.75,https://www.igashop.com.au/product/vileda-mop-super-soft-yellow-710914
649757,Vileda Scourer Power Scrub,$2.90,https://www.igashop.com.au/product/vileda-scourer-power-scrub-649757
211423,Vileda Scrub Magic,$3.35,https://www.igashop.com.au/product/vileda-scrub-magic-211423
934055,Vileda Sweep Master Broom With Handle,$12.15,https://www.igashop.com.au/product/vileda-sweep-master-broom-with-handle-934055
211392,Vileda Tile Grout Cleaner,$5.15,https://www.igashop.com.au/product/vileda-tile-grout-cleaner-211392
472168,Vileda Wettex Cloth 1003,$4.70,https://www.igashop.com.au/product/vileda-wettex-cloth-1003-472168
413952,Vileda Wettex Cloth Sponge,$4.60,https://www.igashop.com.au/product/vileda-wettex-cloth-sponge-413952
357813,Vin A Clean Cleaning Vinegar,$3.00,https://www.igashop.com.au/product/vin-a-clean-cleaning-vinegar-357813
62816,White King Bleach Lemon,$3.75,https://www.igashop.com.au/product/white-king-bleach-lemon-62816
634817,White King Bleach Lemon Surface Spray,$4.80,https://www.igashop.com.au/product/white-king-bleach-lemon-surface-spray-634817
324700,White King Bleach Lemon Tablets,$5.65,https://www.igashop.com.au/product/white-king-bleach-lemon-tablets-324700
59449,White King Bleach Standard,$4.80,https://www.igashop.com.au/product/white-king-bleach-standard-59449
860183,White King Disinfectant Cleaner Hospital Grade Citrus,$6.00,https://www.igashop.com.au/product/white-king-disinfectant-cleaner-hospital-grade-citrus-860183
860159,White King Disinfectant Cleaner Hospital Grade Trigger Citrus,$4.80,https://www.igashop.com.au/product/white-king-disinfectant-cleaner-hospital-grade-trigger-citrus-860159
493708,White King Mould Soap Scum Remover Lemon,$5.40,https://www.igashop.com.au/product/white-king-mould-soap-scum-remover-lemon-493708
62840,White King Original Bleach Lemon,$2.75,https://www.igashop.com.au/product/white-king-original-bleach-lemon-62840
348725,White King Powerclean Bleach Lemon,$4.40,https://www.igashop.com.au/product/white-king-powerclean-bleach-lemon-348725
55152,White King Premium Bleach Lavender,$3.75,https://www.igashop.com.au/product/white-king-premium-bleach-lavender-55152
55241,White King Premium Bleach Lavender,$4.80,https://www.igashop.com.au/product/white-king-premium-bleach-lavender-55241
62866,White King Premium Bleach Lemon,$4.80,https://www.igashop.com.au/product/white-king-premium-bleach-lemon-62866
64680,White King Premium Bleach Regular,$3.75,https://www.igashop.com.au/product/white-king-premium-bleach-regular-64680
190000001703,White King Sink Drain Sanitiser,$6.00,https://www.igashop.com.au/product/white-king-sink-drain-sanitiser-190000001703
64648,Windex Glass Cleaner,$6.25,https://www.igashop.com.au/product/windex-glass-cleaner-64648
378932,Windex Glass Cleaner Refill,$4.80,https://www.igashop.com.au/product/windex-glass-cleaner-refill-378932
64575,Windex Glass Cleaner Trigger,$5.00,https://www.igashop.com.au/product/windex-glass-cleaner-trigger-64575
416023,Windex Shower Cleaner Refill,$4.90,https://www.igashop.com.au/product/windex-shower-cleaner-refill-416023
379750,Windex Shower Cleaner Trigger,$5.90,https://www.igashop.com.au/product/windex-shower-cleaner-trigger-379750
