ID,Name,Price,URL
722165,3 In One Degreaser,$7.50,https://www.igashop.com.au/product/3-in-one-degreaser-722165
425747,3M Scotchgard Fabric Protector Aerosol Can,$13.15,https://www.igashop.com.au/product/3m-scotchgard-fabric-protector-aerosol-can-425747
318864,Air Wick Air Freshener Aerosol Frangipani,$3.50,https://www.igashop.com.au/product/air-wick-air-freshener-aerosol-frangipani-318864
318848,Air Wick Air Freshener Aerosol Lavender,$3.50,https://www.igashop.com.au/product/air-wick-air-freshener-aerosol-lavender-318848
318872,Air Wick Air Freshener Spray Sparkling Citrus,$3.50,https://www.igashop.com.au/product/air-wick-air-freshener-spray-sparkling-citrus-318872
318851,Air Wick Air Freshener Spray Vanilla,$3.50,https://www.igashop.com.au/product/air-wick-air-freshener-spray-vanilla-318851
170177,Air Wick Botanica Candle Caribbean Vetiver Sandalwood,$14.00,https://www.igashop.com.au/product/air-wick-botanica-candle-caribbean-vetiver-sandalwood-170177
750749,Air Wick Botanica French Lavender,$6.30,https://www.igashop.com.au/product/air-wick-botanica-french-lavender-750749
750715,Air Wick Botanica Fresh Pineapple Tunisian Rosemary Room Spray,$6.30,https://www.igashop.com.au/product/air-wick-botanica-fresh-pineapple-tunisian-rosemary-room-spray-750715
750723,Air Wick Botanica Island Rose African Geranium Room Spray,$6.30,https://www.igashop.com.au/product/air-wick-botanica-island-rose-african-geranium-room-spray-750723
992184,Air Wick Essential Mist Prime,$30.00,https://www.igashop.com.au/product/air-wick-essential-mist-prime-992184
643905,Air Wick Essential Oil Air Freshener Le Vanilla Soft Cashmere,$14.00,https://www.igashop.com.au/product/air-wick-essential-oil-air-freshener-le-vanilla-soft-cashmere-643905
766004,Air Wick Essential Oil Candle Cherry Blossom,$6.00,https://www.igashop.com.au/product/air-wick-essential-oil-candle-cherry-blossom-766004
766169,Air Wick Essential Oil Candle Mango,$8.00,https://www.igashop.com.au/product/air-wick-essential-oil-candle-mango-766169
644040,Air Wick Essential Oil Candle Mountain Berry Blossom,$6.00,https://www.igashop.com.au/product/air-wick-essential-oil-candle-mountain-berry-blossom-644040
643989,Air Wick Essential Oil Candle Vanilla,$6.00,https://www.igashop.com.au/product/air-wick-essential-oil-candle-vanilla-643989
643612,Air Wick Essential Oil Freshmatic Refill Frangipani,$11.00,https://www.igashop.com.au/product/air-wick-essential-oil-freshmatic-refill-frangipani-643612
643620,Air Wick Essential Oil Freshmatic Refill Lavender,$11.00,https://www.igashop.com.au/product/air-wick-essential-oil-freshmatic-refill-lavender-643620
643492,Air Wick Essential Oil Freshmatic Refill Vanilla,$11.00,https://www.igashop.com.au/product/air-wick-essential-oil-freshmatic-refill-vanilla-643492
643450,Air Wick Essential Oil Turquoise Oasis Electric Twin Refill,$14.00,https://www.igashop.com.au/product/air-wick-essential-oil-turquoise-oasis-electric-twin-refill-643450
302135,Air Wick Floor Carpet Deodorant Vanilla,$5.25,https://www.igashop.com.au/product/air-wick-floor-carpet-deodorant-vanilla-302135
644032,Air Wick Freshmatic Essential Oil Vanilla Primary,$22.00,https://www.igashop.com.au/product/air-wick-freshmatic-essential-oil-vanilla-primary-644032
345227,Air Wick Life Scent Reed Turquoise Oasis,$14.00,https://www.igashop.com.au/product/air-wick-life-scent-reed-turquoise-oasis-345227
345418,Air Wick Life Scents Lf Pr Turquoise Oasis,$14.00,https://www.igashop.com.au/product/air-wick-life-scents-lf-pr-turquoise-oasis-345418
345230,Air Wick Life Scents Reed Magical Garden,$14.00,https://www.igashop.com.au/product/air-wick-life-scents-reed-magical-garden-345230
345612,Air Wick Life Scents Turquoise Oasis Freshmatic Refill,$11.00,https://www.igashop.com.au/product/air-wick-life-scents-turquoise-oasis-freshmatic-refill-345612
60254,Air Wick Mini Scents Decorative Air Fresheners Frangipani,$5.00,https://www.igashop.com.au/product/air-wick-mini-scents-decorative-air-fresheners-frangipani-60254
170282,Air Wick Odour Neutralising Air Spray Eucalyptus Freesia,$8.00,https://www.igashop.com.au/product/air-wick-odour-neutralising-air-spray-eucalyptus-freesia-170282
170339,Air Wick Odour Neutralising Air Spray Fresh Dew Jasmine,$8.00,https://www.igashop.com.au/product/air-wick-odour-neutralising-air-spray-fresh-dew-jasmine-170339
170287,Air Wick Odour Neutralising Air Spray Lavender Lily Of The Valley,$8.00,https://www.igashop.com.au/product/air-wick-odour-neutralising-air-spray-lavender-lily-of-the-valley-170287
94834,Air Wick Plug In Air Freshener Lavender Refill,$14.00,https://www.igashop.com.au/product/air-wick-plug-in-air-freshener-lavender-refill-94834
664561,Air Wick Pure Aerosol Fresh Berries,$8.00,https://www.igashop.com.au/product/air-wick-pure-aerosol-fresh-berries-664561
992273,Air Wick Pure Aerosol Purple Lavender,$8.00,https://www.igashop.com.au/product/air-wick-pure-aerosol-purple-lavender-992273
992252,Air Wick Pure Aerosol Soft Cotton,$8.00,https://www.igashop.com.au/product/air-wick-pure-aerosol-soft-cotton-992252
759361,Air Wick Pure Air Freshener Cherry,$8.00,https://www.igashop.com.au/product/air-wick-pure-air-freshener-cherry-759361
977011,Air Wick Pure Air Freshener Freshmatic Cherry Blossom,$11.00,https://www.igashop.com.au/product/air-wick-pure-air-freshener-freshmatic-cherry-blossom-977011
977087,Air Wick Pure Air Freshener Freshmatic Soft Cotton Refill,$11.00,https://www.igashop.com.au/product/air-wick-pure-air-freshener-freshmatic-soft-cotton-refill-977087
643688,Air Wick Pure Air Freshener Le Spring Delight Prime,$14.00,https://www.igashop.com.au/product/air-wick-pure-air-freshener-le-spring-delight-prime-643688
759379,Air Wick Pure Air Freshener Spring,$8.00,https://www.igashop.com.au/product/air-wick-pure-air-freshener-spring-759379
643743,Air Wick Pure Cherry Blossom Electric Primary,$14.00,https://www.igashop.com.au/product/air-wick-pure-cherry-blossom-electric-primary-643743
643646,Air Wick Pure Cherry Blossom Electric Twin Refill,$14.00,https://www.igashop.com.au/product/air-wick-pure-cherry-blossom-electric-twin-refill-643646
991968,Air Wick Pure Freshmatic Prime,$22.00,https://www.igashop.com.au/product/air-wick-pure-freshmatic-prime-991968
664579,Air Wick Pure Freshmatic Refill Spring Delight,$11.00,https://www.igashop.com.au/product/air-wick-pure-freshmatic-refill-spring-delight-664579
170000000236,Air Wick Pure White Vanilla,$8.00,https://www.igashop.com.au/product/air-wick-pure-white-vanilla-170000000236
391121,Air Wick Reed Diffuser Freesia Jasmine,$14.00,https://www.igashop.com.au/product/air-wick-reed-diffuser-freesia-jasmine-391121
391139,Air Wick Reed Diffuser Midnight Blackberry Vanilla,$14.00,https://www.igashop.com.au/product/air-wick-reed-diffuser-midnight-blackberry-vanilla-391139
677836,Ajax Cream Cleaner Baking Soda,$4.50,https://www.igashop.com.au/product/ajax-cream-cleaner-baking-soda-677836
669493,Ajax Divine Blends Floor Cleaner Tropical Breeze Slate,$4.00,https://www.igashop.com.au/product/ajax-divine-blends-floor-cleaner-tropical-breeze-slate-669493
815141,Ajax Eco Antibacterial Disinfectant Cleaning Wipes Lavender,$11.00,https://www.igashop.com.au/product/ajax-eco-antibacterial-disinfectant-cleaning-wipes-lavender-815141
687658,Ajax Eco Antibacterial Disinfectant Cleaning Wipes Lemon,$7.00,https://www.igashop.com.au/product/ajax-eco-antibacterial-disinfectant-cleaning-wipes-lemon-687658
687682,Ajax Eco Antibacterial Disinfectant Cleaning Wipes Vanilla,$11.00,https://www.igashop.com.au/product/ajax-eco-antibacterial-disinfectant-cleaning-wipes-vanilla-687682
812431,Ajax Eco Bathroom Cleaner Spray Orange Ginger,$5.00,https://www.igashop.com.au/product/ajax-eco-bathroom-cleaner-spray-orange-ginger-812431
332350,Ajax Eco Multipurpose Antibacterial Disinfectant Biodegradable Cleaning Wipes Fresh Lemon,$4.00,https://www.igashop.com.au/product/ajax-eco-multipurpose-antibacterial-disinfectant-biodegradable-cleaning-wipes-fresh-lemon-332350
812504,Ajax Eco Multipurpose Cleaner Spray Coconut Lime,$5.00,https://www.igashop.com.au/product/ajax-eco-multipurpose-cleaner-spray-coconut-lime-812504
370594,Ajax Floor Cleaner Baking Soda,$4.00,https://www.igashop.com.au/product/ajax-floor-cleaner-baking-soda-370594
92251,Ajax Floor Cleaner Lemon,$4.00,https://www.igashop.com.au/product/ajax-floor-cleaner-lemon-92251
63333,Ajax Powder Cleanser Disinfectant Household Grade Lemon,$5.00,https://www.igashop.com.au/product/ajax-powder-cleanser-disinfectant-household-grade-lemon-63333
392740,Ajax Professional Antibacterial Disinfectant Bathroom Clean,$7.00,https://www.igashop.com.au/product/ajax-professional-antibacterial-disinfectant-bathroom-clean-392740
87549,Ajax Professional Mould Power Household Cleaner Trigger,$7.00,https://www.igashop.com.au/product/ajax-professional-mould-power-household-cleaner-trigger-87549
347949,Ajax Spray N Wipe Glass Cleaner Trigger Ammonia Free Surface Spray Triple Action Made In Australia Recycled Bottle,$3.50,https://www.igashop.com.au/product/ajax-spray-n-wipe-glass-cleaner-trigger-ammonia-free-surface-spray-triple-action-made-in-australia-recycled-bottle-347949
37434,Ajax Spray N Wipe Multi Purpose Antibacterial Disinfectant Cleaner Lemon Citrus Refill,$4.00,https://www.igashop.com.au/product/ajax-spray-n-wipe-multi-purpose-antibacterial-disinfectant-cleaner-lemon-citrus-refill-37434
330811,Ajax Spray N Wipe Multi Purpose Antibacterial Disinfectant Cleaner Trigger Surface Spray Apple Citrus,$3.50,https://www.igashop.com.au/product/ajax-spray-n-wipe-multi-purpose-antibacterial-disinfectant-cleaner-trigger-surface-spray-apple-citrus-330811
347826,Ajax Spray N Wipe Multi Purpose Antibacterial Disinfectant Cleaner Trigger Surface Spray Lavender Citrus,$3.50,https://www.igashop.com.au/product/ajax-spray-n-wipe-multi-purpose-antibacterial-disinfectant-cleaner-trigger-surface-spray-lavender-citrus-347826
37442,Ajax Spray N Wipe Multi Purpose Antibacterial Disinfectant Cleaner Trigger Surface Spray Lemon Citrus,$3.50,https://www.igashop.com.au/product/ajax-spray-n-wipe-multi-purpose-antibacterial-disinfectant-cleaner-trigger-surface-spray-lemon-citrus-37442
37450,Ajax Spray N Wipe Multi Purpose Antibacterial Disinfectant Cleaner Trigger Surface Spray Ocean Fresh,$3.50,https://www.igashop.com.au/product/ajax-spray-n-wipe-multi-purpose-antibacterial-disinfectant-cleaner-trigger-surface-spray-ocean-fresh-37450
941285,Ajax Spray N Wipe Multi Purpose Kitchen Bathroom Cleaner Trigger Surface Spray Vanilla Berries,$3.50,https://www.igashop.com.au/product/ajax-spray-n-wipe-multi-purpose-kitchen-bathroom-cleaner-trigger-surface-spray-vanilla-berries-941285
630326,Ajax Spray N Wipe Multi Purpose Kitchen Household Cleaner Trigger Surface Spray Baking Soda Citrus Stone Safe,$3.50,https://www.igashop.com.au/product/ajax-spray-n-wipe-multi-purpose-kitchen-household-cleaner-trigger-surface-spray-baking-soda-citrus-stone-safe-630326
37395,Ajax Spray N Wipe Multipurpose Antibacterial Disinfectant Household Cleaner Lavender Citrus Refill Value Pack,$4.00,https://www.igashop.com.au/product/ajax-spray-n-wipe-multipurpose-antibacterial-disinfectant-household-cleaner-lavender-citrus-refill-value-pack-37395
778996,Ambi Pur Air Bathroom Spray Garden Fresh,$7.00,https://www.igashop.com.au/product/ambi-pur-air-bathroom-spray-garden-fresh-778996
779159,Ambi Pur Bathroom Air Freshener Lavender Mild,$9.50,https://www.igashop.com.au/product/ambi-pur-bathroom-air-freshener-lavender-mild-779159
779112,Ambi Pur Bathroom Fresh Air Freshener Refreshing Soap,$9.50,https://www.igashop.com.au/product/ambi-pur-bathroom-fresh-air-freshener-refreshing-soap-779112
779015,Ambi Pur Bathroom Spray Fresh Sky,$8.50,https://www.igashop.com.au/product/ambi-pur-bathroom-spray-fresh-sky-779015
251334,Ambi Pur Car Air Freshener Premium Clip For Her,$8.80,https://www.igashop.com.au/product/ambi-pur-car-air-freshener-premium-clip-for-her-251334
250980,Ambi Pur Car Air Freshener Premium Clip Vanilla Voyage,$8.80,https://www.igashop.com.au/product/ambi-pur-car-air-freshener-premium-clip-vanilla-voyage-250980
390793,Ambi Pur Mini Clip Car Air Freshener Sky Breeze,$6.00,https://www.igashop.com.au/product/ambi-pur-mini-clip-car-air-freshener-sky-breeze-390793
276410,Ansell Glove Disposable Heavy Duty,$15.50,https://www.igashop.com.au/product/ansell-glove-disposable-heavy-duty-276410
276389,Ansell Glove Heavy Duty Large,$3.60,https://www.igashop.com.au/product/ansell-glove-heavy-duty-large-276389
279196,Ansell Glove Hyflex Large,$6.00,https://www.igashop.com.au/product/ansell-glove-hyflex-large-279196
278807,Ansell Glove Hyflex Medium,$6.00,https://www.igashop.com.au/product/ansell-glove-hyflex-medium-278807
278776,Ansell Glove Hyflex Small,$7.00,https://www.igashop.com.au/product/ansell-glove-hyflex-small-278776
727408,Ansell Gloves Dermo Plus Large,$4.00,https://www.igashop.com.au/product/ansell-gloves-dermo-plus-large-727408
727369,Ansell Gloves Dermo Plus Medium,$4.00,https://www.igashop.com.au/product/ansell-gloves-dermo-plus-medium-727369
727393,Ansell Gloves Dermo Plus Small,$4.00,https://www.igashop.com.au/product/ansell-gloves-dermo-plus-small-727393
251033,Ansell Gloves Handy Fresh Disposable Large,$19.50,https://www.igashop.com.au/product/ansell-gloves-handy-fresh-disposable-large-251033
135211,Ansell Gloves Heavy Duty,$10.00,https://www.igashop.com.au/product/ansell-gloves-heavy-duty-135211
276371,Ansell Gloves Heavy Duty Medium,$3.60,https://www.igashop.com.au/product/ansell-gloves-heavy-duty-medium-276371
228598,Ansell Gloves Natural Medium,$3.00,https://www.igashop.com.au/product/ansell-gloves-natural-medium-228598
135127,Ansell Gloves Smart Large,$1.70,https://www.igashop.com.au/product/ansell-gloves-smart-large-135127
135054,Ansell Gloves Smart Small,$1.70,https://www.igashop.com.au/product/ansell-gloves-smart-small-135054
283593,Ansell Gloves Super Large Size 9,$3.90,https://www.igashop.com.au/product/ansell-gloves-super-large-size-9-283593
285464,Ansell Gloves Super Medium Size 8,$3.90,https://www.igashop.com.au/product/ansell-gloves-super-medium-size-8-285464
284808,Ansell Gloves Super Small Med Size 75,$3.90,https://www.igashop.com.au/product/ansell-gloves-super-small-med-size-75-284808
208488,Ansell Handy Clean Disposable Gloves,$6.50,https://www.igashop.com.au/product/ansell-handy-clean-disposable-gloves-208488
711114,Ansell Handy Clean Disposable Gloves,$15.50,https://www.igashop.com.au/product/ansell-handy-clean-disposable-gloves-711114
763357,Ansell Handy Clean Disposable Gloves,$18.50,https://www.igashop.com.au/product/ansell-handy-clean-disposable-gloves-763357
274374,Ansell Silverlined Pink Glove Large,$3.60,https://www.igashop.com.au/product/ansell-silverlined-pink-glove-large-274374
716148,Ansell Silverlined Pink Gloves Xl,$3.60,https://www.igashop.com.au/product/ansell-silverlined-pink-gloves-xl-716148
274382,Ansell Silverlined Rubber Gloves Small,$3.60,https://www.igashop.com.au/product/ansell-silverlined-rubber-gloves-small-274382
274308,Ansell Siverlined Pink Gloves Medium,$3.60,https://www.igashop.com.au/product/ansell-siverlined-pink-gloves-medium-274308
135091,Ansell Smart Medium Gloves Pair,$1.70,https://www.igashop.com.au/product/ansell-smart-medium-gloves-pair-135091
469453,Armor All Air Freshener Arctic Cool,$11.00,https://www.igashop.com.au/product/armor-all-air-freshener-arctic-cool-469453
222136,Armor All Air Freshener Card Frangipani,$4.60,https://www.igashop.com.au/product/armor-all-air-freshener-card-frangipani-222136
222128,Armor All Air Freshener Card Melon,$4.60,https://www.igashop.com.au/product/armor-all-air-freshener-card-melon-222128
222152,Armor All Air Freshener Card Vanilla,$4.60,https://www.igashop.com.au/product/armor-all-air-freshener-card-vanilla-222152
469432,Armor All Air Freshener Island Oasis,$11.00,https://www.igashop.com.au/product/armor-all-air-freshener-island-oasis-469432
469466,Armor All Air Freshener New Car,$11.00,https://www.igashop.com.au/product/armor-all-air-freshener-new-car-469466
469411,Armor All Air Freshener Vanilla,$11.00,https://www.igashop.com.au/product/armor-all-air-freshener-vanilla-469411
700058,Armor All Cloth All Purpose,$16.60,https://www.igashop.com.au/product/armor-all-cloth-all-purpose-700058
299861,Armor All Cloth Glass,$14.95,https://www.igashop.com.au/product/armor-all-cloth-glass-299861
490226,Armor All Essential Blends Citrus Pomegranate,$8.70,https://www.igashop.com.au/product/armor-all-essential-blends-citrus-pomegranate-490226
369894,Astra Cloths Microfibre,$4.60,https://www.igashop.com.au/product/astra-cloths-microfibre-369894
369954,Astra Everyday Wipes,$8.00,https://www.igashop.com.au/product/astra-everyday-wipes-369954
369983,Astra Everyday Wipes,$2.80,https://www.igashop.com.au/product/astra-everyday-wipes-369983
369886,Astra Scourer Mesh,$2.25,https://www.igashop.com.au/product/astra-scourer-mesh-369886
369789,Astra Scourer Scrub Heavy Duty,$2.25,https://www.igashop.com.au/product/astra-scourer-scrub-heavy-duty-369789
369852,Astra Scourer Scrub Non Scratch,$2.25,https://www.igashop.com.au/product/astra-scourer-scrub-non-scratch-369852
369917,Astra Scourer Sponge Thick,$2.80,https://www.igashop.com.au/product/astra-scourer-sponge-thick-369917
86797,Black Gold Air Fresh Country Garden,$3.00,https://www.igashop.com.au/product/black-gold-air-fresh-country-garden-86797
86802,Black Gold Air Fresh Lavender,$3.00,https://www.igashop.com.au/product/black-gold-air-fresh-lavender-86802
190000010084,Black Gold Basin With Handles Rectangle 125L,$4.70,https://www.igashop.com.au/product/black-gold-basin-with-handles-rectangle-125l-190000010084
87078,Black Gold Bleach Lemon,$2.00,https://www.igashop.com.au/product/black-gold-bleach-lemon-87078
322119,Black Gold Bleach Regular,$2.00,https://www.igashop.com.au/product/black-gold-bleach-regular-322119
190000010082,Black Gold Broom With Handle Household,$9.00,https://www.igashop.com.au/product/black-gold-broom-with-handle-household-190000010082
190000010085,Black Gold Bucket Heavy Duty 12L,$4.00,https://www.igashop.com.au/product/black-gold-bucket-heavy-duty-12l-190000010085
416167,Black Gold Bulldog Brush,$3.00,https://www.igashop.com.au/product/black-gold-bulldog-brush-416167
360939,Black Gold Cloudy Ammonia,$1.95,https://www.igashop.com.au/product/black-gold-cloudy-ammonia-360939
242068,Black Gold Dust Pan Brush Set,$2.70,https://www.igashop.com.au/product/black-gold-dust-pan-brush-set-242068
63595,Black Gold Eucalyptus Disinfectant,$1.40,https://www.igashop.com.au/product/black-gold-eucalyptus-disinfectant-63595
41836,Black Gold Giant Household Wipes,$2.00,https://www.igashop.com.au/product/black-gold-giant-household-wipes-41836
68228,Black Gold Household Sponge,$1.60,https://www.igashop.com.au/product/black-gold-household-sponge-68228
682496,Black Gold Methylated Spirit,$6.20,https://www.igashop.com.au/product/black-gold-methylated-spirit-682496
682682,Black Gold Mineral Turpentine,$6.90,https://www.igashop.com.au/product/black-gold-mineral-turpentine-682682
64193,Black Gold Regular Household Wipes,$0.99,https://www.igashop.com.au/product/black-gold-regular-household-wipes-64193
343042,Black Gold Scourer,$0.60,https://www.igashop.com.au/product/black-gold-scourer-343042
315861,Black Gold Scourer Stainless Steel,$0.89,https://www.igashop.com.au/product/black-gold-scourer-stainless-steel-315861
52829,Black Gold Sponge Cloths,$0.99,https://www.igashop.com.au/product/black-gold-sponge-cloths-52829
247275,Black Gold Sponge Mop Refill,$5.00,https://www.igashop.com.au/product/black-gold-sponge-mop-refill-247275
343050,Black Gold Sponge Scourers,$2.00,https://www.igashop.com.au/product/black-gold-sponge-scourers-343050
263577,Black Gold Squeeze Sponge Mop With Handle,$16.00,https://www.igashop.com.au/product/black-gold-squeeze-sponge-mop-with-handle-263577
951502,Black Gold Sugar Soap Pads,$4.15,https://www.igashop.com.au/product/black-gold-sugar-soap-pads-951502
498520,Black Gold Thick Sponges,$3.00,https://www.igashop.com.au/product/black-gold-thick-sponges-498520
47251,Bosistos Antiseptic Spray,$8.00,https://www.igashop.com.au/product/bosistos-antiseptic-spray-47251
682598,Bosistos Bathroom Shower Cleaner,$5.50,https://www.igashop.com.au/product/bosistos-bathroom-shower-cleaner-682598
800214,Bosistos Eucalyptus Oil,$17.00,https://www.igashop.com.au/product/bosistos-eucalyptus-oil-800214
491934,Bosistos Eucalyptus Spray,$10.60,https://www.igashop.com.au/product/bosistos-eucalyptus-spray-491934
947964,Bosistos Floor Cleaner,$6.00,https://www.igashop.com.au/product/bosistos-floor-cleaner-947964
671686,Bosistos Focus Aroma Mist,$12.00,https://www.igashop.com.au/product/bosistos-focus-aroma-mist-671686
241559,Bosistos Lavender Spray,$13.00,https://www.igashop.com.au/product/bosistos-lavender-spray-241559
682603,Bosistos Multipurpose Cleaner,$5.50,https://www.igashop.com.au/product/bosistos-multipurpose-cleaner-682603
329093,Bosistos Tea Tree Solution,$9.00,https://www.igashop.com.au/product/bosistos-tea-tree-solution-329093
242199,Bosistos Tea Tree Spray,$13.00,https://www.igashop.com.au/product/bosistos-tea-tree-spray-242199
170169,Botanica By Air Wick Candle Vanilla Himalayan Magnolia,$14.00,https://www.igashop.com.au/product/botanica-by-air-wick-candle-vanilla-himalayan-magnolia-170169
160000011434,Botanica By Air Wick Reed Caribbean Vetiver Sandalwood,$20.00,https://www.igashop.com.au/product/botanica-by-air-wick-reed-caribbean-vetiver-sandalwood-160000011434
160000011431,Botanica By Air Wick Reed Island Rose African Geranium,$14.00,https://www.igashop.com.au/product/botanica-by-air-wick-reed-island-rose-african-geranium-160000011431
160000011433,Botanica By Air Wick Reed Vanilla Himalayan Magnolia,$14.00,https://www.igashop.com.au/product/botanica-by-air-wick-reed-vanilla-himalayan-magnolia-160000011433
467325,Brasso Polish Metal,$13.80,https://www.igashop.com.au/product/brasso-polish-metal-467325
377588,Britex Defoamer,$7.78,https://www.igashop.com.au/product/britex-defoamer-377588
713153,Britex Odour Eliminator,$14.99,https://www.igashop.com.au/product/britex-odour-eliminator-713153
713137,Britex Universal Spot N Stain Remover,$14.99,https://www.igashop.com.au/product/britex-universal-spot-n-stain-remover-713137
439500,Cavalier Bremworth Floor Carpet Stain Remover,$8.70,https://www.igashop.com.au/product/cavalier-bremworth-floor-carpet-stain-remover-439500
368754,Chux Collections Multi Purpose Absorbent Cloth,$3.00,https://www.igashop.com.au/product/chux-collections-multi-purpose-absorbent-cloth-368754
396359,Chux Collections Thin Sponges,$4.00,https://www.igashop.com.au/product/chux-collections-thin-sponges-396359
251211,Chux Dishwand Handle,$5.10,https://www.igashop.com.au/product/chux-dishwand-handle-251211
245045,Chux Dishwand Non Scratch Refills,$6.00,https://www.igashop.com.au/product/chux-dishwand-non-scratch-refills-245045
884954,Chux Dual Action Wet Wipes Citrus Scent,$7.50,https://www.igashop.com.au/product/chux-dual-action-wet-wipes-citrus-scent-884954
884970,Chux Dual Action Wet Wipes Ocean Scent,$7.50,https://www.igashop.com.au/product/chux-dual-action-wet-wipes-ocean-scent-884970
369739,Chux Giant Stainless Steel Scourer,$2.20,https://www.igashop.com.au/product/chux-giant-stainless-steel-scourer-369739
243284,Chux Heavy Duty Scourer,$4.00,https://www.igashop.com.au/product/chux-heavy-duty-scourer-243284
9177,Chux Heavy Duty Scourer,$3.80,https://www.igashop.com.au/product/chux-heavy-duty-scourer-9177
957639,Chux Heavy Duty Scourer With Super Absorbent Sponge,$3.00,https://www.igashop.com.au/product/chux-heavy-duty-scourer-with-super-absorbent-sponge-957639
309637,Chux Heavy Duty Superwipes Roll,$6.50,https://www.igashop.com.au/product/chux-heavy-duty-superwipes-roll-309637
467480,Chux Magic Eraser Bathroom,$6.10,https://www.igashop.com.au/product/chux-magic-eraser-bathroom-467480
12251,Chux Magic Eraser Kitchen,$6.10,https://www.igashop.com.au/product/chux-magic-eraser-kitchen-12251
336320,Chux Magic Eraser Spot Cleaner,$4.65,https://www.igashop.com.au/product/chux-magic-eraser-spot-cleaner-336320
243315,Chux Non Scratch Scourer,$4.00,https://www.igashop.com.au/product/chux-non-scratch-scourer-243315
976426,Chux Non Scratch Scourer,$3.50,https://www.igashop.com.au/product/chux-non-scratch-scourer-976426
309653,Chux Non Scratch Scourer Sponge,$4.00,https://www.igashop.com.au/product/chux-non-scratch-scourer-sponge-309653
957605,Chux Non Scratch Scourer With Super Absorbent Sponge,$3.00,https://www.igashop.com.au/product/chux-non-scratch-scourer-with-super-absorbent-sponge-957605
69397,Chux Original Superwipes,$4.90,https://www.igashop.com.au/product/chux-original-superwipes-69397
69850,Chux Original Superwipes,$6.00,https://www.igashop.com.au/product/chux-original-superwipes-69850
68090,Chux Original Superwipes Giant,$6.50,https://www.igashop.com.au/product/chux-original-superwipes-giant-68090
69282,Chux Original Superwipes Giant,$4.50,https://www.igashop.com.au/product/chux-original-superwipes-giant-69282
887779,Chux Original Superwipes Handy Roll,$6.55,https://www.igashop.com.au/product/chux-original-superwipes-handy-roll-887779
957647,Chux Scourer Pad Heavy Duty,$2.20,https://www.igashop.com.au/product/chux-scourer-pad-heavy-duty-957647
380219,Chux Scourer Pads Non Scratch,$2.65,https://www.igashop.com.au/product/chux-scourer-pads-non-scratch-380219
336354,Chux Sponge Scourer Heavy Duty,$3.50,https://www.igashop.com.au/product/chux-sponge-scourer-heavy-duty-336354
9355,Chux Sponge Scourer Non Scratch,$3.80,https://www.igashop.com.au/product/chux-sponge-scourer-non-scratch-9355
53207,Chux Superwipes Robuste Wipes,$4.50,https://www.igashop.com.au/product/chux-superwipes-robuste-wipes-53207
49287,Chux Wonder Cloth,$6.00,https://www.igashop.com.au/product/chux-wonder-cloth-49287
