ID,Name,Price,URL
399132,Aurora Coffee Ground Italian,$19.00,https://www.igashop.com.au/product/aurora-coffee-ground-italian-399132
42413,Bickfords Iced Coffee Syrup,$7.00,https://www.igashop.com.au/product/bickfords-iced-coffee-syrup-42413
10518,Bushells Coffee,$5.00,https://www.igashop.com.au/product/bushells-coffee-10518
365400,Bushells Coffee Turkish Style,$9.00,https://www.igashop.com.au/product/bushells-coffee-turkish-style-365400
398568,Caffe Aurora Ground Coffee Italian Style,$6.20,https://www.igashop.com.au/product/caffe-aurora-ground-coffee-italian-style-398568
160000018185,Caffe Aurora Italian Blend Ground Coffee,$19.00,https://www.igashop.com.au/product/caffe-aurora-italian-blend-ground-coffee-160000018185
160000018186,Caffe Aurora Italian Style Ground Coffee,$6.20,https://www.igashop.com.au/product/caffe-aurora-italian-style-ground-coffee-160000018186
827457,Califia Farms Oat Barista Blend,$4.40,https://www.igashop.com.au/product/califia-farms-oat-barista-blend-827457
328987,Caro Coffee Caffeine Free,$7.20,https://www.igashop.com.au/product/caro-coffee-caffeine-free-328987
735862,Chicco Doro Espresso Coffee Capsules,$4.90,https://www.igashop.com.au/product/chicco-doro-espresso-coffee-capsules-735862
160355,Dare Iced Coffee Double Espresso,$4.49,https://www.igashop.com.au/product/dare-iced-coffee-double-espresso-160355
882046,Dare Iced Coffee Double Espresso,$3.30,https://www.igashop.com.au/product/dare-iced-coffee-double-espresso-882046
631152,Dare Iced Coffee Double Espresso No Added Sugar,$3.30,https://www.igashop.com.au/product/dare-iced-coffee-double-espresso-no-added-sugar-631152
160517,Dare Iced Coffee Espresso,$4.49,https://www.igashop.com.au/product/dare-iced-coffee-espresso-160517
872766,Dare Iced Coffee Espresso,$3.30,https://www.igashop.com.au/product/dare-iced-coffee-espresso-872766
704345,Dare Iced Coffee Mocha,$3.30,https://www.igashop.com.au/product/dare-iced-coffee-mocha-704345
926625,Dare Iced Coffee Triple Espresso,$3.30,https://www.igashop.com.au/product/dare-iced-coffee-triple-espresso-926625
43553,Delta Chicco Doro Ground Coffee,$4.00,https://www.igashop.com.au/product/delta-chicco-doro-ground-coffee-43553
907692,Global Cafe Direct Decaffeinated Organic Coffee,$10.50,https://www.igashop.com.au/product/global-cafe-direct-decaffeinated-organic-coffee-907692
473928,Grinders Coffee Beans Espresso,$28.00,https://www.igashop.com.au/product/grinders-coffee-beans-espresso-473928
473999,Grinders Coffee Capsules Crema Caffitaly System,$8.00,https://www.igashop.com.au/product/grinders-coffee-capsules-crema-caffitaly-system-473999
690355,Grinders Coffee Roasters Deep Full Bodied Rich Espresso Coffee Beans,$28.00,https://www.igashop.com.au/product/grinders-coffee-roasters-deep-full-bodied-rich-espresso-coffee-beans-690355
877481,Grinders Coffee Roasters Espresso Ground Coffee,$11.00,https://www.igashop.com.au/product/grinders-coffee-roasters-espresso-ground-coffee-877481
690347,Grinders Coffee Roasters Organic Coffee Beans,$37.00,https://www.igashop.com.au/product/grinders-coffee-roasters-organic-coffee-beans-690347
473952,Grinders Crema,$28.00,https://www.igashop.com.au/product/grinders-crema-473952
689715,Grinders Double Espresso Coffee Capsules 80G,$8.00,https://www.igashop.com.au/product/grinders-double-espresso-coffee-capsules-80g-689715
474123,Grinders Espresso Coffee Capsules,$8.00,https://www.igashop.com.au/product/grinders-espresso-coffee-capsules-474123
352143,Grinders Ground Coffee Crema,$11.00,https://www.igashop.com.au/product/grinders-ground-coffee-crema-352143
352148,Grinders Ground Coffee Espresso,$11.00,https://www.igashop.com.au/product/grinders-ground-coffee-espresso-352148
858233,Harris Coffee Beans Smooth,$26.00,https://www.igashop.com.au/product/harris-coffee-beans-smooth-858233
858241,Harris Coffee Beans Strong,$19.50,https://www.igashop.com.au/product/harris-coffee-beans-strong-858241
858495,Harris Coffee Ground Smooth,$8.50,https://www.igashop.com.au/product/harris-coffee-ground-smooth-858495
858314,Harris Coffee Ground Strong,$26.00,https://www.igashop.com.au/product/harris-coffee-ground-strong-858314
858568,Harris Coffee Ground Very Strong,$9.50,https://www.igashop.com.au/product/harris-coffee-ground-very-strong-858568
484521,Harris Filter Papers 10 12 Cup,$3.00,https://www.igashop.com.au/product/harris-filter-papers-10-12-cup-484521
858542,Harris Strong Ground Coffee,$8.50,https://www.igashop.com.au/product/harris-strong-ground-coffee-858542
160000011801,Harris Very Strong Coffee Beans,$19.50,https://www.igashop.com.au/product/harris-very-strong-coffee-beans-160000011801
160000014086,Ice Break Iced Coffee Bold Espresso,$5.20,https://www.igashop.com.au/product/ice-break-iced-coffee-bold-espresso-160000014086
256038,Ice Break Iced Coffee No Sugar Added Espresso,$3.65,https://www.igashop.com.au/product/ice-break-iced-coffee-no-sugar-added-espresso-256038
164846,Ice Break Iced Coffee Regular Strength,$5.05,https://www.igashop.com.au/product/ice-break-iced-coffee-regular-strength-164846
176932,Ice Break Iced Coffee Regular Strength,$3.30,https://www.igashop.com.au/product/ice-break-iced-coffee-regular-strength-176932
697014,Ice Break Iced Coffee Triple Shot,$3.95,https://www.igashop.com.au/product/ice-break-iced-coffee-triple-shot-697014
697022,Ice Break Iced Coffee Triple Shot,$3.80,https://www.igashop.com.au/product/ice-break-iced-coffee-triple-shot-697022
694202,Illy Classico Espresso Capsules,$8.00,https://www.igashop.com.au/product/illy-classico-espresso-capsules-694202
693976,Illy Espresso Forte Capsules,$8.00,https://www.igashop.com.au/product/illy-espresso-forte-capsules-693976
10720,International Roast Instant Coffee,$14.00,https://www.igashop.com.au/product/international-roast-instant-coffee-10720
10746,International Roast Instant Coffee,$5.95,https://www.igashop.com.au/product/international-roast-instant-coffee-10746
808107,Lor Espresso Colombia Coffee Capsule,$7.50,https://www.igashop.com.au/product/lor-espresso-colombia-coffee-capsule-808107
160000000094,Lor Espresso Colombia Intensity 8,$13.00,https://www.igashop.com.au/product/lor-espresso-colombia-intensity-8-160000000094
426036,Lor Espresso Estremo Capsules,$7.50,https://www.igashop.com.au/product/lor-espresso-estremo-capsules-426036
807818,Lor Espresso Lungo Profondo Coffee Capsules,$7.50,https://www.igashop.com.au/product/lor-espresso-lungo-profondo-coffee-capsules-807818
425718,Lor Espresso Onyx Capsules,$13.00,https://www.igashop.com.au/product/lor-espresso-onyx-capsules-425718
807826,Lor Espresso Onyx Coffee Capsules Compatible With Nespresso,$7.50,https://www.igashop.com.au/product/lor-espresso-onyx-coffee-capsules-compatible-with-nespresso-807826
807062,Lor Espresso Papua Coffee Capsule,$7.50,https://www.igashop.com.au/product/lor-espresso-papua-coffee-capsule-807062
425577,Lor Espresso Profondo Capsules,$13.00,https://www.igashop.com.au/product/lor-espresso-profondo-capsules-425577
861862,Lor Espresso Ristretto Coffee Capsules,$22.00,https://www.igashop.com.au/product/lor-espresso-ristretto-coffee-capsules-861862
816176,Lor Espresso Ristretto Coffee Capsules Compatible With Nespresso,$7.50,https://www.igashop.com.au/product/lor-espresso-ristretto-coffee-capsules-compatible-with-nespresso-816176
425857,Lor Espresso Ristretto Decaf Coffee Capsule,$7.50,https://www.igashop.com.au/product/lor-espresso-ristretto-decaf-coffee-capsule-425857
160000000104,Lor Espresso Supremo Intensity,$13.00,https://www.igashop.com.au/product/lor-espresso-supremo-intensity-160000000104
807800,Lor Espresso Supremo Intensity Compatible With Nespresso,$7.50,https://www.igashop.com.au/product/lor-espresso-supremo-intensity-compatible-with-nespresso-807800
861888,Lor Espresso Ultimo Coffee Capsules,$7.50,https://www.igashop.com.au/product/lor-espresso-ultimo-coffee-capsules-861888
959356,Lavazza A Modo Mio Delizioso Coffee Capsules,$10.90,https://www.igashop.com.au/product/lavazza-a-modo-mio-delizioso-coffee-capsules-959356
898267,Lavazza A Modo Mio Intenso,$10.90,https://www.igashop.com.au/product/lavazza-a-modo-mio-intenso-898267
303615,Lavazza A Modo Mio Passionale Coffee Capsules,$10.90,https://www.igashop.com.au/product/lavazza-a-modo-mio-passionale-coffee-capsules-303615
20000002798,Lavazza Coffee Groud Qualita Rosa,$9.00,https://www.igashop.com.au/product/lavazza-coffee-groud-qualita-rosa-20000002798
898275,Lavazza Crema E Gusto Classico Ground Coffee,$9.00,https://www.igashop.com.au/product/lavazza-crema-e-gusto-classico-ground-coffee-898275
898348,Lavazza Espresso Barista Gran Crema Coffee Beans,$28.00,https://www.igashop.com.au/product/lavazza-espresso-barista-gran-crema-coffee-beans-898348
898372,Lavazza Espresso Barista Intenso Coffee Beans,$28.00,https://www.igashop.com.au/product/lavazza-espresso-barista-intenso-coffee-beans-898372
898322,Lavazza Espresso Barista Perfetto Coffee Beans,$28.00,https://www.igashop.com.au/product/lavazza-espresso-barista-perfetto-coffee-beans-898322
898259,Lavazza Espresso Italiano Classico Ground Coffee,$9.00,https://www.igashop.com.au/product/lavazza-espresso-italiano-classico-ground-coffee-898259
20000003324,Lavazza Ground Decaf Coffee,$9.00,https://www.igashop.com.au/product/lavazza-ground-decaf-coffee-20000003324
736431,Lavazza Prontissimo Intenso,$9.50,https://www.igashop.com.au/product/lavazza-prontissimo-intenso-736431
472265,Lavazza Qualita Oro Coffee Beans,$38.00,https://www.igashop.com.au/product/lavazza-qualita-oro-coffee-beans-472265
463397,Lavazza Qualita Oro Ground Coffee,$20.00,https://www.igashop.com.au/product/lavazza-qualita-oro-ground-coffee-463397
898241,Lavazza Qualita Oro Ground Coffee,$9.00,https://www.igashop.com.au/product/lavazza-qualita-oro-ground-coffee-898241
688418,Lavazza Tierra Bio Organic Coffee Beans,$22.00,https://www.igashop.com.au/product/lavazza-tierra-bio-organic-coffee-beans-688418
425726,Moccona Barista Reserve Dark Roast Espresso,$3.00,https://www.igashop.com.au/product/moccona-barista-reserve-dark-roast-espresso-425726
672467,Moccona Barista Reserve Long Black Intensity,$3.00,https://www.igashop.com.au/product/moccona-barista-reserve-long-black-intensity-672467
941361,Moccona Coffee Beans Dark Roast,$18.00,https://www.igashop.com.au/product/moccona-coffee-beans-dark-roast-941361
367465,Moccona Freeze Dried Instant Coffee Caramel,$11.50,https://www.igashop.com.au/product/moccona-freeze-dried-instant-coffee-caramel-367465
18634,Moccona Freeze Dried Instant Coffee Classic Dark Roast,$24.00,https://www.igashop.com.au/product/moccona-freeze-dried-instant-coffee-classic-dark-roast-18634
450881,Moccona Freeze Dried Instant Coffee Classic Dark Roast,$16.00,https://www.igashop.com.au/product/moccona-freeze-dried-instant-coffee-classic-dark-roast-450881
450954,Moccona Freeze Dried Instant Coffee Classic Dark Roast,$11.50,https://www.igashop.com.au/product/moccona-freeze-dried-instant-coffee-classic-dark-roast-450954
991667,Moccona Freeze Dried Instant Coffee Classic Decaffeinated,$12.50,https://www.igashop.com.au/product/moccona-freeze-dried-instant-coffee-classic-decaffeinated-991667
10144,Moccona Freeze Dried Instant Coffee Classic Medium Roast,$11.50,https://www.igashop.com.au/product/moccona-freeze-dried-instant-coffee-classic-medium-roast-10144
10990,Moccona Freeze Dried Instant Coffee Classic Medium Roast,$7.00,https://www.igashop.com.au/product/moccona-freeze-dried-instant-coffee-classic-medium-roast-10990
11124,Moccona Freeze Dried Instant Coffee Classic Medium Roast,$16.00,https://www.igashop.com.au/product/moccona-freeze-dried-instant-coffee-classic-medium-roast-11124
351493,Moccona Freeze Dried Instant Coffee Classic Medium Roast,$24.00,https://www.igashop.com.au/product/moccona-freeze-dried-instant-coffee-classic-medium-roast-351493
301582,Moccona Freeze Dried Instant Coffee Espresso,$24.00,https://www.igashop.com.au/product/moccona-freeze-dried-instant-coffee-espresso-301582
36810,Moccona Freeze Dried Instant Coffee Espresso Style,$16.00,https://www.igashop.com.au/product/moccona-freeze-dried-instant-coffee-espresso-style-36810
36797,Moccona Freeze Dried Instant Coffee French Style,$16.00,https://www.igashop.com.au/product/moccona-freeze-dried-instant-coffee-french-style-36797
367499,Moccona Freeze Dried Instant Coffee Hazelnut,$11.50,https://www.igashop.com.au/product/moccona-freeze-dried-instant-coffee-hazelnut-367499
78053,Moccona Freeze Dried Instant Coffee Indulgence,$13.50,https://www.igashop.com.au/product/moccona-freeze-dried-instant-coffee-indulgence-78053
36802,Moccona Freeze Dried Instant Coffee Mocha Kenya Style,$16.00,https://www.igashop.com.au/product/moccona-freeze-dried-instant-coffee-mocha-kenya-style-36802
80827,Moccona Freeze Dried Instant Coffee Rich,$13.50,https://www.igashop.com.au/product/moccona-freeze-dried-instant-coffee-rich-80827
858013,Moccona Intense Specialty Blends,$13.50,https://www.igashop.com.au/product/moccona-intense-specialty-blends-858013
672108,Moccona Ristretto,$13.50,https://www.igashop.com.au/product/moccona-ristretto-672108
425739,Moccona Ristretto Coffee Capsules,$3.00,https://www.igashop.com.au/product/moccona-ristretto-coffee-capsules-425739
190000002330,Nescafe 98 Sugar Free Caramel Latte Sachets,$7.60,https://www.igashop.com.au/product/nescafe-98-sugar-free-caramel-latte-sachets-190000002330
190000002331,Nescafe 98 Sugar Free Latte Sachets,$7.60,https://www.igashop.com.au/product/nescafe-98-sugar-free-latte-sachets-190000002331
190000002332,Nescafe 98 Sugar Free Mocha Sachets,$7.60,https://www.igashop.com.au/product/nescafe-98-sugar-free-mocha-sachets-190000002332
188222,Nescafe Blend 43 Smooth Creamy,$11.50,https://www.igashop.com.au/product/nescafe-blend-43-smooth-creamy-188222
10893,Nescafe Blend 43,$6.50,https://www.igashop.com.au/product/nescafe-blend-43-10893
416243,Nescafe Blend 43 Decaf,$21.00,https://www.igashop.com.au/product/nescafe-blend-43-decaf-416243
397766,Nescafe Blend 43 Espresso,$9.00,https://www.igashop.com.au/product/nescafe-blend-43-espresso-397766
397758,Nescafe Blend 43 Mild Roast,$9.00,https://www.igashop.com.au/product/nescafe-blend-43-mild-roast-397758
10869,Nescafe Blend 43 Soluble Instant Coffee,$18.00,https://www.igashop.com.au/product/nescafe-blend-43-soluble-instant-coffee-10869
636576,Nescafe Coffee Mixer Sachets Cappuccino,$7.00,https://www.igashop.com.au/product/nescafe-coffee-mixer-sachets-cappuccino-636576
382274,Nescafe Coffee Mixer Sachets Cappuccino Skim,$7.00,https://www.igashop.com.au/product/nescafe-coffee-mixer-sachets-cappuccino-skim-382274
349412,Nescafe Coffee Mixer Sachets Caramel Latte,$7.00,https://www.igashop.com.au/product/nescafe-coffee-mixer-sachets-caramel-latte-349412
395976,Nescafe Coffee Mixer Sachets Latte Hazelnut,$7.00,https://www.igashop.com.au/product/nescafe-coffee-mixer-sachets-latte-hazelnut-395976
349608,Nescafe Coffee Mixer Sachets Latte Vanilla,$7.00,https://www.igashop.com.au/product/nescafe-coffee-mixer-sachets-latte-vanilla-349608
349381,Nescafe Coffee Mixer Sachets Mocha,$7.00,https://www.igashop.com.au/product/nescafe-coffee-mixer-sachets-mocha-349381
458287,Nescafe Coffee Mixer Sachets Strong Cappucino,$7.00,https://www.igashop.com.au/product/nescafe-coffee-mixer-sachets-strong-cappucino-458287
663714,Nescafe Coffee Sachets Cappucino,$11.00,https://www.igashop.com.au/product/nescafe-coffee-sachets-cappucino-663714
663722,Nescafe Coffee Sachets Caramel Latte,$11.00,https://www.igashop.com.au/product/nescafe-coffee-sachets-caramel-latte-663722
663845,Nescafe Coffee Sachets Hazelnut,$11.00,https://www.igashop.com.au/product/nescafe-coffee-sachets-hazelnut-663845
668594,Nescafe Coffee Sachets Mocha,$11.00,https://www.igashop.com.au/product/nescafe-coffee-sachets-mocha-668594
663803,Nescafe Coffee Sachets Skim Cappucino,$11.00,https://www.igashop.com.au/product/nescafe-coffee-sachets-skim-cappucino-663803
663756,Nescafe Coffee Sachets Strong,$11.00,https://www.igashop.com.au/product/nescafe-coffee-sachets-strong-663756
663798,Nescafe Coffee Sachets Vanilla,$11.00,https://www.igashop.com.au/product/nescafe-coffee-sachets-vanilla-663798
864420,Nescafe Cookies Cream,$7.60,https://www.igashop.com.au/product/nescafe-cookies-cream-864420
672394,Nescafe Decaf Cappuccino Coffee Sachets,$7.60,https://www.igashop.com.au/product/nescafe-decaf-cappuccino-coffee-sachets-672394
366524,Nescafe Dolce Gusto Caf Au Lait Capsules,$10.00,https://www.igashop.com.au/product/nescafe-dolce-gusto-caf-au-lait-capsules-366524
430687,Nescafe Dolce Gusto Cappuccino Capsules,$10.00,https://www.igashop.com.au/product/nescafe-dolce-gusto-cappuccino-capsules-430687
473436,Nescafe Dolce Gusto Coffee Capsules Ristretto Ardenza,$10.00,https://www.igashop.com.au/product/nescafe-dolce-gusto-coffee-capsules-ristretto-ardenza-473436
431308,Nescafe Dolce Gusto Flat White Capsules,$10.00,https://www.igashop.com.au/product/nescafe-dolce-gusto-flat-white-capsules-431308
397716,Nescafe Espresso,$13.00,https://www.igashop.com.au/product/nescafe-espresso-397716
926455,Nescafe Espresso Blend 43,$18.00,https://www.igashop.com.au/product/nescafe-espresso-blend-43-926455
160000013906,Nescafe Farmers Origins Capsules 3 Americas Lungo,$7.00,https://www.igashop.com.au/product/nescafe-farmers-origins-capsules-3-americas-lungo-160000013906
160000013909,Nescafe Farmers Origins Capsules Africas,$7.00,https://www.igashop.com.au/product/nescafe-farmers-origins-capsules-africas-160000013909
160000013908,Nescafe Farmers Origins Capsules Brazil,$7.00,https://www.igashop.com.au/product/nescafe-farmers-origins-capsules-brazil-160000013908
160000013907,Nescafe Farmers Origins Capsules Colombia Ristretto Decaf,$5.98,https://www.igashop.com.au/product/nescafe-farmers-origins-capsules-colombia-ristretto-decaf-160000013907
160000013910,Nescafe Farmers Origins Coffee Capsules India Espresso,$5.98,https://www.igashop.com.au/product/nescafe-farmers-origins-coffee-capsules-india-espresso-160000013910
864200,Nescafe Gold Almond Latte Satchets,$7.60,https://www.igashop.com.au/product/nescafe-gold-almond-latte-satchets-864200
864289,Nescafe Gold Coconut Latte,$7.60,https://www.igashop.com.au/product/nescafe-gold-coconut-latte-864289
416714,Nescafe Gold Decaffeinated Instant Coffee,$13.50,https://www.igashop.com.au/product/nescafe-gold-decaffeinated-instant-coffee-416714
319904,Nescafe Gold Green And Roasted Instant Coffee,$13.50,https://www.igashop.com.au/product/nescafe-gold-green-and-roasted-instant-coffee-319904
430768,Nescafe Gold Intense Soluble Instant Coffee,$11.50,https://www.igashop.com.au/product/nescafe-gold-intense-soluble-instant-coffee-430768
439026,Nescafe Gold Intense Soluble Instant Coffee,$15.00,https://www.igashop.com.au/product/nescafe-gold-intense-soluble-instant-coffee-439026
11459,Nescafe Gold Original,$15.00,https://www.igashop.com.au/product/nescafe-gold-original-11459
12227,Nescafe Gold Original,$11.50,https://www.igashop.com.au/product/nescafe-gold-original-12227
76218,Nescafe Gold Short Black Espresso Instant Coffee,$13.50,https://www.igashop.com.au/product/nescafe-gold-short-black-espresso-instant-coffee-76218
431337,Nescafe Gold Smooth,$11.50,https://www.igashop.com.au/product/nescafe-gold-smooth-431337
425409,Nescafe Gold Smooth 3,$15.00,https://www.igashop.com.au/product/nescafe-gold-smooth-3-425409
672409,Nescafe Latte,$7.60,https://www.igashop.com.au/product/nescafe-latte-672409
690601,Nescafe Mild Roast,$13.00,https://www.igashop.com.au/product/nescafe-mild-roast-690601
10916,Nescaf Blend 43 Instant Coffee,$9.00,https://www.igashop.com.au/product/nescaf-blend-43-instant-coffee-10916
10924,Nescaf Blend 43 Instant Coffee,$13.00,https://www.igashop.com.au/product/nescaf-blend-43-instant-coffee-10924
983698,Nestle Coffee Mate Coffee Whitener,$9.50,https://www.igashop.com.au/product/nestle-coffee-mate-coffee-whitener-983698
37659,Nestl Coffee Mate Coffee Flavouring Whitener,$4.50,https://www.igashop.com.au/product/nestl-coffee-mate-coffee-flavouring-whitener-37659
981361,Nestl French Vanilla Coffee Mate,$5.30,https://www.igashop.com.au/product/nestl-french-vanilla-coffee-mate-981361
159362,Oak Iced Coffee,$3.70,https://www.igashop.com.au/product/oak-iced-coffee-159362
412260,Oak Iced Coffee,$4.35,https://www.igashop.com.au/product/oak-iced-coffee-412260
903261,Oak Iced Coffee,$4.55,https://www.igashop.com.au/product/oak-iced-coffee-903261
190000005106,Oak Iced Coffee Flavoured Milk,$6.40,https://www.igashop.com.au/product/oak-iced-coffee-flavoured-milk-190000005106
878851,Pauls Zymil Lactose Free Coffee Flavoured Milk,$3.65,https://www.igashop.com.au/product/pauls-zymil-lactose-free-coffee-flavoured-milk-878851
871846,Robert Timms Arabica Dark Roast Coffee Bag,$8.30,https://www.igashop.com.au/product/robert-timms-arabica-dark-roast-coffee-bag-871846
47303,Robert Timms Coffee Bags Italian Espresso,$5.60,https://www.igashop.com.au/product/robert-timms-coffee-bags-italian-espresso-47303
93485,Robert Timms Coffee Bags Italian Espresso,$10.00,https://www.igashop.com.au/product/robert-timms-coffee-bags-italian-espresso-93485
20000001074,Robert Timms Coffee Bags Mocha Kenya,$5.60,https://www.igashop.com.au/product/robert-timms-coffee-bags-mocha-kenya-20000001074
354881,Robert Timms Coffee Bags Mocha Kenya,$10.00,https://www.igashop.com.au/product/robert-timms-coffee-bags-mocha-kenya-354881
852541,Robert Timms Coffee Gran Instant Coffee,$20.00,https://www.igashop.com.au/product/robert-timms-coffee-gran-instant-coffee-852541
455687,Robert Timms Instant Granulated Coffee,$10.70,https://www.igashop.com.au/product/robert-timms-instant-granulated-coffee-455687
863953,Starbucks Blonde Espresso Capsules,$10.00,https://www.igashop.com.au/product/starbucks-blonde-espresso-capsules-863953
926390,Starbucks By Nespresso Blonde Espresso Roast Coffee Pods,$7.90,https://www.igashop.com.au/product/starbucks-by-nespresso-blonde-espresso-roast-coffee-pods-926390
926374,Starbucks By Nespresso Espresso Roast Coffee Pods,$7.90,https://www.igashop.com.au/product/starbucks-by-nespresso-espresso-roast-coffee-pods-926374
926329,Starbucks By Nespresso House Blend Coffee Pods,$7.90,https://www.igashop.com.au/product/starbucks-by-nespresso-house-blend-coffee-pods-926329
863961,Starbucks By Nespresso Pike Place Roast Lungo Coffee Pods,$7.90,https://www.igashop.com.au/product/starbucks-by-nespresso-pike-place-roast-lungo-coffee-pods-863961
927189,Starbucks By Nespresso Single Origin Colombia Coffee Pods,$7.90,https://www.igashop.com.au/product/starbucks-by-nespresso-single-origin-colombia-coffee-pods-927189
926340,Starbucks By Nespresso Single Origin Sumatra Coffee Pods,$7.90,https://www.igashop.com.au/product/starbucks-by-nespresso-single-origin-sumatra-coffee-pods-926340
927139,Starbucks Caffe Verona Coffee Pods,$7.90,https://www.igashop.com.au/product/starbucks-caffe-verona-coffee-pods-927139
865484,Starbucks Cappuccino Capsules,$10.00,https://www.igashop.com.au/product/starbucks-cappuccino-capsules-865484
160000013901,Starbucks Capsules Caffe Latte,$10.00,https://www.igashop.com.au/product/starbucks-capsules-caffe-latte-160000013901
160000013899,Starbucks Capsules Decaf Espresso Roast,$7.90,https://www.igashop.com.au/product/starbucks-capsules-decaf-espresso-roast-160000013899
20000002473,Starbucks Capsules Lungo Pike Place,$10.00,https://www.igashop.com.au/product/starbucks-capsules-lungo-pike-place-20000002473
160000013902,Starbucks Coffee Capsules Italian Roast,$7.90,https://www.igashop.com.au/product/starbucks-coffee-capsules-italian-roast-160000013902
864195,Starbucks Dark Roast Coffee Tin,$13.00,https://www.igashop.com.au/product/starbucks-dark-roast-coffee-tin-864195
864187,Starbucks Medium Roast Coffee Tin,$13.00,https://www.igashop.com.au/product/starbucks-medium-roast-coffee-tin-864187
703085,Suntory Boss Iced Latte Flash Brew Coffee,$3.50,https://www.igashop.com.au/product/suntory-boss-iced-latte-flash-brew-coffee-703085
848911,Vitasoy Almond Double Espresso,$2.59,https://www.igashop.com.au/product/vitasoy-almond-double-espresso-848911
358437,Vittoria Coffee Bean Mountain Grown,$44.00,https://www.igashop.com.au/product/vittoria-coffee-bean-mountain-grown-358437
87484,Vittoria Decaffeinated Ground Coffee Espresso,$12.00,https://www.igashop.com.au/product/vittoria-decaffeinated-ground-coffee-espresso-87484
428818,Vittoria Espresso Beans,$17.95,https://www.igashop.com.au/product/vittoria-espresso-beans-428818
927561,Vittoria Espresso Coffee Beans,$37.00,https://www.igashop.com.au/product/vittoria-espresso-coffee-beans-927561
329404,Vittoria Espresso Ground Coffee,$7.85,https://www.igashop.com.au/product/vittoria-espresso-ground-coffee-329404
419306,Vittoria Espresso Ground Coffee,$37.00,https://www.igashop.com.au/product/vittoria-espresso-ground-coffee-419306
900030,Vittoria Espresso Ground Coffee,$20.00,https://www.igashop.com.au/product/vittoria-espresso-ground-coffee-900030
729120,Vittoria Espressotoria Espresso Coffee Capsules,$5.00,https://www.igashop.com.au/product/vittoria-espressotoria-espresso-coffee-capsules-729120
735906,Vittoria Espressotoria Italian Coffee Capsules,$5.00,https://www.igashop.com.au/product/vittoria-espressotoria-italian-coffee-capsules-735906
729248,Vittoria Espressotoria Mountain Grown Coffee Capsules,$5.00,https://www.igashop.com.au/product/vittoria-espressotoria-mountain-grown-coffee-capsules-729248
735891,Vittoria Espressotoria Oro Coffee Capsules,$5.00,https://www.igashop.com.au/product/vittoria-espressotoria-oro-coffee-capsules-735891
20000005438,Vittoria Ground Coffee Italian Blend,$19.50,https://www.igashop.com.au/product/vittoria-ground-coffee-italian-blend-20000005438
683654,Vittoria Ground Oro Coffee,$40.00,https://www.igashop.com.au/product/vittoria-ground-oro-coffee-683654
52227,Vittoria Italian Blend Coffee Beans,$24.00,https://www.igashop.com.au/product/vittoria-italian-blend-coffee-beans-52227
