ID,Name,Price,URL
232018,Nestl Top N Fill Caramel,$5.90,https://www.igashop.com.au/product/nestl-top-n-fill-caramel-232018
53817,Anchor Baking Powder,$2.65,https://www.igashop.com.au/product/anchor-baking-powder-53817
23008,Angas Park Apricots,$9.00,https://www.igashop.com.au/product/angas-park-apricots-23008
404746,Angas Park Apricots Soft Juicy,$8.00,https://www.igashop.com.au/product/angas-park-apricots-soft-juicy-404746
605208,Angas Park Cranberry Soft Juicy,$5.00,https://www.igashop.com.au/product/angas-park-cranberry-soft-juicy-605208
404767,Angas Park Dried Apples,$5.30,https://www.igashop.com.au/product/angas-park-dried-apples-404767
309747,Angas Park Dried Apricots Diced,$6.00,https://www.igashop.com.au/product/angas-park-dried-apricots-diced-309747
991861,Angas Park Dried Pears,$6.00,https://www.igashop.com.au/product/angas-park-dried-pears-991861
401316,Angas Park Figs Soft Juicy,$5.00,https://www.igashop.com.au/product/angas-park-figs-soft-juicy-401316
70589,Angas Park Fruit Mix Medley,$9.00,https://www.igashop.com.au/product/angas-park-fruit-mix-medley-70589
333487,Angas Park Large Fancy Prunes,$4.80,https://www.igashop.com.au/product/angas-park-large-fancy-prunes-333487
94928,Angas Park Mixed Peel,$4.00,https://www.igashop.com.au/product/angas-park-mixed-peel-94928
690651,Angas Park Peaches,$6.30,https://www.igashop.com.au/product/angas-park-peaches-690651
613293,Angas Park Pitted Dates,$5.50,https://www.igashop.com.au/product/angas-park-pitted-dates-613293
58278,Angas Park Pitted Prunes,$14.00,https://www.igashop.com.au/product/angas-park-pitted-prunes-58278
46218,Angas Park Prunes Pitted,$5.30,https://www.igashop.com.au/product/angas-park-prunes-pitted-46218
643832,Angas Park Prunes Pitted Resealable,$8.50,https://www.igashop.com.au/product/angas-park-prunes-pitted-resealable-643832
34334,Angas Park Prunes Soft Juicy,$5.00,https://www.igashop.com.au/product/angas-park-prunes-soft-juicy-34334
50704,Angas Park Whole Prunes,$9.00,https://www.igashop.com.au/product/angas-park-whole-prunes-50704
974916,Betty Crocker 97 Fat Free Blueberry Muffin Mix,$7.00,https://www.igashop.com.au/product/betty-crocker-97-fat-free-blueberry-muffin-mix-974916
975653,Betty Crocker Apple Cinnamon 97 Fat Free Muffin Mix,$7.00,https://www.igashop.com.au/product/betty-crocker-apple-cinnamon-97-fat-free-muffin-mix-975653
232018,Nestl Top N Fill Caramel,$5.90,https://www.igashop.com.au/product/nestl-top-n-fill-caramel-232018
393521,Betty Crocker Chocolate Cup Cake Mix,$7.00,https://www.igashop.com.au/product/betty-crocker-chocolate-cup-cake-mix-393521
921167,Betty Crocker Chocolate Frosting,$6.50,https://www.igashop.com.au/product/betty-crocker-chocolate-frosting-921167
393490,Betty Crocker Chocolate Fudge Cake Mix,$7.00,https://www.igashop.com.au/product/betty-crocker-chocolate-fudge-cake-mix-393490
34994,Betty Crocker Cinnamon Crumble Muffin Mix,$7.00,https://www.igashop.com.au/product/betty-crocker-cinnamon-crumble-muffin-mix-34994
393505,Betty Crocker Devils Food Cake Mix,$7.00,https://www.igashop.com.au/product/betty-crocker-devils-food-cake-mix-393505
2382,Betty Crocker Frosted Chocolate Brownie Mix,$7.00,https://www.igashop.com.au/product/betty-crocker-frosted-chocolate-brownie-mix-2382
331964,Betty Crocker Gluten Free Chocolate Fudge Brownie Mix,$8.00,https://www.igashop.com.au/product/betty-crocker-gluten-free-chocolate-fudge-brownie-mix-331964
331956,Betty Crocker Gluten Free Devils Food Cake Mix,$8.00,https://www.igashop.com.au/product/betty-crocker-gluten-free-devils-food-cake-mix-331956
975792,Betty Crocker Milk Chocolate Chunk Cookie Mix,$7.00,https://www.igashop.com.au/product/betty-crocker-milk-chocolate-chunk-cookie-mix-975792
2235,Betty Crocker Rainbow Cookie Mix,$7.00,https://www.igashop.com.au/product/betty-crocker-rainbow-cookie-mix-2235
921337,Betty Crocker Strawberry Frosting,$6.50,https://www.igashop.com.au/product/betty-crocker-strawberry-frosting-921337
408402,Betty Crocker Triple Chocolate Fudge Brownie Mix,$7.00,https://www.igashop.com.au/product/betty-crocker-triple-chocolate-fudge-brownie-mix-408402
393513,Betty Crocker Vanilla Cupcake Mix,$7.00,https://www.igashop.com.au/product/betty-crocker-vanilla-cupcake-mix-393513
921256,Betty Crocker Vanilla Frosting,$6.50,https://www.igashop.com.au/product/betty-crocker-vanilla-frosting-921256
61438,Black Gold 100S 1000S,$3.20,https://www.igashop.com.au/product/black-gold-100s-1000s-61438
353018,Black Gold Bicarb Soda,$2.45,https://www.igashop.com.au/product/black-gold-bicarb-soda-353018
332164,Black Gold Bread Crumbs,$2.00,https://www.igashop.com.au/product/black-gold-bread-crumbs-332164
86488,Black Gold Brown Sugar,$3.30,https://www.igashop.com.au/product/black-gold-brown-sugar-86488
45301,Black Gold Butter Flavoured Cake Mix,$1.20,https://www.igashop.com.au/product/black-gold-butter-flavoured-cake-mix-45301
43155,Black Gold Caster Sugar,$2.20,https://www.igashop.com.au/product/black-gold-caster-sugar-43155
232018,Nestl Top N Fill Caramel,$5.90,https://www.igashop.com.au/product/nestl-top-n-fill-caramel-232018
325913,Black Gold Chocolate Chip Bits,$2.50,https://www.igashop.com.au/product/black-gold-chocolate-chip-bits-325913
45270,Black Gold Chocolate Flavoured Cake Mix,$1.20,https://www.igashop.com.au/product/black-gold-chocolate-flavoured-cake-mix-45270
3299,Black Gold Cocoa Powder,$3.50,https://www.igashop.com.au/product/black-gold-cocoa-powder-3299
38257,Black Gold Cornflour,$2.25,https://www.igashop.com.au/product/black-gold-cornflour-38257
332180,Black Gold Custard Powder,$2.90,https://www.igashop.com.au/product/black-gold-custard-powder-332180
38605,Black Gold Desiccated Coconut,$2.40,https://www.igashop.com.au/product/black-gold-desiccated-coconut-38605
91239,Black Gold Desiccated Coconut,$3.60,https://www.igashop.com.au/product/black-gold-desiccated-coconut-91239
47484,Black Gold Fruit Mix,$5.50,https://www.igashop.com.au/product/black-gold-fruit-mix-47484
85026,Black Gold Icing Mixture,$3.95,https://www.igashop.com.au/product/black-gold-icing-mixture-85026
7599,Black Gold Pancake Shake Mix,$2.20,https://www.igashop.com.au/product/black-gold-pancake-shake-mix-7599
38095,Black Gold Plain Flour,$2.70,https://www.igashop.com.au/product/black-gold-plain-flour-38095
38079,Black Gold Plain Flour,$1.40,https://www.igashop.com.au/product/black-gold-plain-flour-38079
42549,Black Gold Raw Sugar,$3.20,https://www.igashop.com.au/product/black-gold-raw-sugar-42549
42557,Black Gold Raw Sugar,$1.80,https://www.igashop.com.au/product/black-gold-raw-sugar-42557
38477,Black Gold Self Raising Flour,$1.40,https://www.igashop.com.au/product/black-gold-self-raising-flour-38477
38485,Black Gold Self Raising Flour,$2.70,https://www.igashop.com.au/product/black-gold-self-raising-flour-38485
345052,Black Gold Shredded Coconut,$1.80,https://www.igashop.com.au/product/black-gold-shredded-coconut-345052
45319,Black Gold Sultanas,$5.00,https://www.igashop.com.au/product/black-gold-sultanas-45319
348505,Black Gold White Sugar,$2.85,https://www.igashop.com.au/product/black-gold-white-sugar-348505
41878,Black Gold White Sugar,$1.70,https://www.igashop.com.au/product/black-gold-white-sugar-41878
232018,Nestl Top N Fill Caramel,$5.90,https://www.igashop.com.au/product/nestl-top-n-fill-caramel-232018
423923,Black Gold White Sugar,$4.25,https://www.igashop.com.au/product/black-gold-white-sugar-423923
51742,Black Gold Whole Australian Prunes,$8.00,https://www.igashop.com.au/product/black-gold-whole-australian-prunes-51742
305874,Bundaberg Brown Sugar,$3.35,https://www.igashop.com.au/product/bundaberg-brown-sugar-305874
304412,Bundaberg Soft Icing Mix,$3.20,https://www.igashop.com.au/product/bundaberg-soft-icing-mix-304412
306236,Bundaberg White Sugar,$2.45,https://www.igashop.com.au/product/bundaberg-white-sugar-306236
96394,Bundaberg White Sugar,$3.80,https://www.igashop.com.au/product/bundaberg-white-sugar-96394
10657,Bushells Coffee Chicory Essence,$6.00,https://www.igashop.com.au/product/bushells-coffee-chicory-essence-10657
232013,Cadbury Baking Chips Caramilk,$6.00,https://www.igashop.com.au/product/cadbury-baking-chips-caramilk-232013
991706,Cadbury Baking Chocolate Chips White,$5.00,https://www.igashop.com.au/product/cadbury-baking-chocolate-chips-white-991706
454791,Cadbury Baking Dark Chocolate 70 Cacao,$5.00,https://www.igashop.com.au/product/cadbury-baking-dark-chocolate-70-cacao-454791
454830,Cadbury Baking Dark Chocolate Block,$5.00,https://www.igashop.com.au/product/cadbury-baking-dark-chocolate-block-454830
170000001459,Cadbury Baking Dark Chocolate Chips,$5.00,https://www.igashop.com.au/product/cadbury-baking-dark-chocolate-chips-170000001459
170000001448,Cadbury Baking Dark Chocolate Melts,$5.00,https://www.igashop.com.au/product/cadbury-baking-dark-chocolate-melts-170000001448
454717,Cadbury Baking Milk Chocolate Block,$5.00,https://www.igashop.com.au/product/cadbury-baking-milk-chocolate-block-454717
170000001419,Cadbury Baking Milk Chocolate Chips,$5.00,https://www.igashop.com.au/product/cadbury-baking-milk-chocolate-chips-170000001419
170000000933,Cadbury Baking Milk Chocolate Melts,$5.00,https://www.igashop.com.au/product/cadbury-baking-milk-chocolate-melts-170000000933
454738,Cadbury Baking White Chocolate,$5.00,https://www.igashop.com.au/product/cadbury-baking-white-chocolate-454738
10102,Cadbury Bournville Cocoa,$5.50,https://www.igashop.com.au/product/cadbury-bournville-cocoa-10102
853306,Community Co Almond Flaked,$4.00,https://www.igashop.com.au/product/community-co-almond-flaked-853306
846760,Community Co Almond Kernels,$3.65,https://www.igashop.com.au/product/community-co-almond-kernels-846760
232018,Nestl Top N Fill Caramel,$5.90,https://www.igashop.com.au/product/nestl-top-n-fill-caramel-232018
20000000017,Community Co Almond Meal,$10.50,https://www.igashop.com.au/product/community-co-almond-meal-20000000017
848092,Community Co Almond Meal,$3.00,https://www.igashop.com.au/product/community-co-almond-meal-848092
861427,Community Co Aussie Currant,$6.00,https://www.igashop.com.au/product/community-co-aussie-currant-861427
861485,Community Co Dried Apricots,$4.00,https://www.igashop.com.au/product/community-co-dried-apricots-861485
861370,Community Co Dried Cranberries,$3.30,https://www.igashop.com.au/product/community-co-dried-cranberries-861370
851168,Community Co Hazelnuts,$4.00,https://www.igashop.com.au/product/community-co-hazelnuts-851168
799141,Community Co Linseed,$2.90,https://www.igashop.com.au/product/community-co-linseed-799141
799125,Community Co Lsa,$3.00,https://www.igashop.com.au/product/community-co-lsa-799125
799206,Community Co Nibble Mix,$5.60,https://www.igashop.com.au/product/community-co-nibble-mix-799206
799183,Community Co Pepitas,$6.00,https://www.igashop.com.au/product/community-co-pepitas-799183
851202,Community Co Pine Nuts,$15.00,https://www.igashop.com.au/product/community-co-pine-nuts-851202
853291,Community Co Pine Nuts,$6.80,https://www.igashop.com.au/product/community-co-pine-nuts-853291
860989,Community Co Pitted Dates,$3.50,https://www.igashop.com.au/product/community-co-pitted-dates-860989
799159,Community Co Polenta,$2.50,https://www.igashop.com.au/product/community-co-polenta-799159
799117,Community Co Psyllium Husk,$6.20,https://www.igashop.com.au/product/community-co-psyllium-husk-799117
799214,Community Co Quinoa White,$5.70,https://www.igashop.com.au/product/community-co-quinoa-white-799214
860947,Community Co Raisins,$4.70,https://www.igashop.com.au/product/community-co-raisins-860947
851215,Community Co Raw Cashews,$5.50,https://www.igashop.com.au/product/community-co-raw-cashews-851215
861472,Community Co Raw Macadamias,$6.50,https://www.igashop.com.au/product/community-co-raw-macadamias-861472
860858,Community Co Raw Pistachio Nuts,$5.80,https://www.igashop.com.au/product/community-co-raw-pistachio-nuts-860858
232018,Nestl Top N Fill Caramel,$5.90,https://www.igashop.com.au/product/nestl-top-n-fill-caramel-232018
879166,Community Co Red Glace Cherries,$4.00,https://www.igashop.com.au/product/community-co-red-glace-cherries-879166
799162,Community Co Semolina,$2.30,https://www.igashop.com.au/product/community-co-semolina-799162
799175,Community Co Sesame Seeds,$5.20,https://www.igashop.com.au/product/community-co-sesame-seeds-799175
691770,Community Co Slivered Almonds,$3.50,https://www.igashop.com.au/product/community-co-slivered-almonds-691770
20000001004,Community Co Sultanas,$5.40,https://www.igashop.com.au/product/community-co-sultanas-20000001004
846692,Community Co Sultanas,$5.40,https://www.igashop.com.au/product/community-co-sultanas-846692
799191,Community Co Sunflower Seeds,$4.00,https://www.igashop.com.au/product/community-co-sunflower-seeds-799191
851142,Community Co Walnut,$3.50,https://www.igashop.com.au/product/community-co-walnut-851142
605509,Coopers Carbonated Drops,$4.50,https://www.igashop.com.au/product/coopers-carbonated-drops-605509
614406,Csr All Natural Buttercream Icing Mix Chocolate,$3.00,https://www.igashop.com.au/product/csr-all-natural-buttercream-icing-mix-chocolate-614406
614561,Csr All Natural Buttercream Icing Mix Vanilla,$3.00,https://www.igashop.com.au/product/csr-all-natural-buttercream-icing-mix-vanilla-614561
43008,Csr Brown Sugar,$2.50,https://www.igashop.com.au/product/csr-brown-sugar-43008
43016,Csr Brown Sugar,$4.30,https://www.igashop.com.au/product/csr-brown-sugar-43016
41983,Csr Caster Sugar,$3.00,https://www.igashop.com.au/product/csr-caster-sugar-41983
98697,Csr Dark Brown Sugar,$4.60,https://www.igashop.com.au/product/csr-dark-brown-sugar-98697
404916,Csr Icing Sugar Soft Mixture,$4.50,https://www.igashop.com.au/product/csr-icing-sugar-soft-mixture-404916
404932,Csr Icing Sugar Soft Mixture,$2.50,https://www.igashop.com.au/product/csr-icing-sugar-soft-mixture-404932
341388,Csr Jam Setting Sugar,$2.65,https://www.igashop.com.au/product/csr-jam-setting-sugar-341388
253904,Csr Organic Unrefined Coconut Sugar,$4.00,https://www.igashop.com.au/product/csr-organic-unrefined-coconut-sugar-253904
331451,Csr Premium Demerara Sugar,$3.00,https://www.igashop.com.au/product/csr-premium-demerara-sugar-331451
232018,Nestl Top N Fill Caramel,$5.90,https://www.igashop.com.au/product/nestl-top-n-fill-caramel-232018
404924,Csr Pure Icing Sugar,$2.50,https://www.igashop.com.au/product/csr-pure-icing-sugar-404924
43090,Csr Raw Sugar,$1.80,https://www.igashop.com.au/product/csr-raw-sugar-43090
44339,Csr Raw Sugar,$3.20,https://www.igashop.com.au/product/csr-raw-sugar-44339
694875,Csr Raw Sugar,$2.00,https://www.igashop.com.au/product/csr-raw-sugar-694875
4245,Csr Smart Blend White Sugar,$3.00,https://www.igashop.com.au/product/csr-smart-blend-white-sugar-4245
93809,Csr Sugar Cubes,$4.90,https://www.igashop.com.au/product/csr-sugar-cubes-93809
243593,Csr Sugar Muscovado,$4.00,https://www.igashop.com.au/product/csr-sugar-muscovado-243593
243307,Csr Unrefined Rapadura Sugar,$4.00,https://www.igashop.com.au/product/csr-unrefined-rapadura-sugar-243307
42971,Csr White Sugar,$2.50,https://www.igashop.com.au/product/csr-white-sugar-42971
42989,Csr White Sugar,$3.80,https://www.igashop.com.au/product/csr-white-sugar-42989
51459,Csr White Sugar,$1.95,https://www.igashop.com.au/product/csr-white-sugar-51459
328238,Csr White Sugar Premium Sticks,$3.00,https://www.igashop.com.au/product/csr-white-sugar-premium-sticks-328238
20000006072,Defiance Instant Dry Yeast,$4.50,https://www.igashop.com.au/product/defiance-instant-dry-yeast-20000006072
33794,Defiance Plain Flour,$3.25,https://www.igashop.com.au/product/defiance-plain-flour-33794
482888,Defiance Plain Flour,$5.55,https://www.igashop.com.au/product/defiance-plain-flour-482888
34350,Defiance Self Raising Flour,$3.45,https://www.igashop.com.au/product/defiance-self-raising-flour-34350
622349,Defiance White Bakers Flour,$13.50,https://www.igashop.com.au/product/defiance-white-bakers-flour-622349
312148,Dollar Sweets 100S 1000S,$2.30,https://www.igashop.com.au/product/dollar-sweets-100s-1000s-312148
75762,Dollar Sweets 100S 1000S Magic,$4.50,https://www.igashop.com.au/product/dollar-sweets-100s-1000s-magic-75762
34172,Dollar Sweets Cake Tops Bright,$2.30,https://www.igashop.com.au/product/dollar-sweets-cake-tops-bright-34172
232018,Nestl Top N Fill Caramel,$5.90,https://www.igashop.com.au/product/nestl-top-n-fill-caramel-232018
323628,Dollar Sweets Chocolettes,$2.30,https://www.igashop.com.au/product/dollar-sweets-chocolettes-323628
799609,Dollar Sweets Happy Birthday Candle,$3.65,https://www.igashop.com.au/product/dollar-sweets-happy-birthday-candle-799609
799463,Dollar Sweets Party Candles,$3.00,https://www.igashop.com.au/product/dollar-sweets-party-candles-799463
38396,Dollar Sweets Sprinkles Fives,$2.50,https://www.igashop.com.au/product/dollar-sweets-sprinkles-fives-38396
799586,Dollar Sweets Unicorn Sprinkle Jar,$6.00,https://www.igashop.com.au/product/dollar-sweets-unicorn-sprinkle-jar-799586
675818,Dr Oetker Designer Icing White,$4.50,https://www.igashop.com.au/product/dr-oetker-designer-icing-white-675818
677852,Dr Oetker Edible Decorations Giant Chocolate Stars,$4.25,https://www.igashop.com.au/product/dr-oetker-edible-decorations-giant-chocolate-stars-677852
789324,Dr Oetker Midnight Magic Sprinkles,$4.20,https://www.igashop.com.au/product/dr-oetker-midnight-magic-sprinkles-789324
232830,Dr Oetker Queen Icing Salted Caramel Flavouring,$2.15,https://www.igashop.com.au/product/dr-oetker-queen-icing-salted-caramel-flavouring-232830
618829,Easy Bakers Gluten Free Meal Grain,$7.55,https://www.igashop.com.au/product/easy-bakers-gluten-free-meal-grain-618829
618316,Easy Bakers Gluten Free Special White,$7.55,https://www.igashop.com.au/product/easy-bakers-gluten-free-special-white-618316
682501,Edmonds Fielders Corn Flour Gluten Free,$3.40,https://www.igashop.com.au/product/edmonds-fielders-corn-flour-gluten-free-682501
402171,Equal Low Calorie Sweetener Sachets,$6.60,https://www.igashop.com.au/product/equal-low-calorie-sweetener-sachets-402171
55306,Equal Low Calorie Sweetener Tablets,$3.10,https://www.igashop.com.au/product/equal-low-calorie-sweetener-tablets-55306
55314,Equal Sweetener Sachets,$4.20,https://www.igashop.com.au/product/equal-sweetener-sachets-55314
498114,Equal Sweetener Tablets,$8.80,https://www.igashop.com.au/product/equal-sweetener-tablets-498114
93265,Equal Sweetener Tablets Refill,$12.95,https://www.igashop.com.au/product/equal-sweetener-tablets-refill-93265
830450,Food Guru Icing Bag Set,$4.40,https://www.igashop.com.au/product/food-guru-icing-bag-set-830450
30704,Fowlers Jamsetta,$3.00,https://www.igashop.com.au/product/fowlers-jamsetta-30704
921010,G Fresh Poppy Seeds,$3.99,https://www.igashop.com.au/product/g-fresh-poppy-seeds-921010
232018,Nestl Top N Fill Caramel,$5.90,https://www.igashop.com.au/product/nestl-top-n-fill-caramel-232018
908842,G Fresh Vanilla Sugar,$3.99,https://www.igashop.com.au/product/g-fresh-vanilla-sugar-908842
884129,Golden Days Apricot Delight,$3.00,https://www.igashop.com.au/product/golden-days-apricot-delight-884129
350081,Greens Buttermilk Pancake Shake Mix,$3.00,https://www.igashop.com.au/product/greens-buttermilk-pancake-shake-mix-350081
613188,Greens Cake Mix Traditional Carrot,$3.50,https://www.igashop.com.au/product/greens-cake-mix-traditional-carrot-613188
91352,Greens Cake Mix Traditional Date Loaf,$3.50,https://www.igashop.com.au/product/greens-cake-mix-traditional-date-loaf-91352
61836,Greens Cake Mix Traditional Sultana,$3.50,https://www.igashop.com.au/product/greens-cake-mix-traditional-sultana-61836
347075,Greens Caramel Mud Cake Mix,$5.00,https://www.igashop.com.au/product/greens-caramel-mud-cake-mix-347075
388437,Greens Chocolate Brownie Mix,$3.50,https://www.igashop.com.au/product/greens-chocolate-brownie-mix-388437
1310,Greens Chocolate Mud Cake Mix,$5.00,https://www.igashop.com.au/product/greens-chocolate-mud-cake-mix-1310
425933,Greens Chocolate Sponge Pudding,$3.50,https://www.igashop.com.au/product/greens-chocolate-sponge-pudding-425933
332070,Greens Cookies Cream Cupcakes Mix,$5.00,https://www.igashop.com.au/product/greens-cookies-cream-cupcakes-mix-332070
347017,Greens Essential Chocolate Cake Mix,$3.00,https://www.igashop.com.au/product/greens-essential-chocolate-cake-mix-347017
347025,Greens Essential Vanilla Cake Mix,$3.00,https://www.igashop.com.au/product/greens-essential-vanilla-cake-mix-347025
160000012898,Greens Gluten Free Chocolate Cake Mix,$5.00,https://www.igashop.com.au/product/greens-gluten-free-chocolate-cake-mix-160000012898
451138,Greens Gluten Free Golden Butter Cake,$5.00,https://www.igashop.com.au/product/greens-gluten-free-golden-butter-cake-451138
93794,Greens Maple Syrup Pancake Shake,$3.00,https://www.igashop.com.au/product/greens-maple-syrup-pancake-shake-93794
29732,Greens Multi Purpose Muffin Mix,$3.00,https://www.igashop.com.au/product/greens-multi-purpose-muffin-mix-29732
601246,Greens Original Pancake Mix Shaker,$2.20,https://www.igashop.com.au/product/greens-original-pancake-mix-shaker-601246
342575,Greens Pancake Mix Original Shake,$3.50,https://www.igashop.com.au/product/greens-pancake-mix-original-shake-342575
55275,Greens Pink Vanilla Cupcake Mix,$5.00,https://www.igashop.com.au/product/greens-pink-vanilla-cupcake-mix-55275
232018,Nestl Top N Fill Caramel,$5.90,https://www.igashop.com.au/product/nestl-top-n-fill-caramel-232018
425991,Greens Pudding Butterscotch Sponge Mix,$3.50,https://www.igashop.com.au/product/greens-pudding-butterscotch-sponge-mix-425991
483525,Greens Pudding Lemon Sponge,$3.50,https://www.igashop.com.au/product/greens-pudding-lemon-sponge-483525
433431,Greens Pudding Traditional Sticky Date,$3.50,https://www.igashop.com.au/product/greens-pudding-traditional-sticky-date-433431
347122,Greens Red Velvet Cupcake Mix,$5.00,https://www.igashop.com.au/product/greens-red-velvet-cupcake-mix-347122
319886,Greens Traditional Classic Chocolate Cake Mix,$3.50,https://www.igashop.com.au/product/greens-traditional-classic-chocolate-cake-mix-319886
319894,Greens Traditional Golden Butter Cake Mix,$3.50,https://www.igashop.com.au/product/greens-traditional-golden-butter-cake-mix-319894
346650,Greens Traditional Moist Vanilla Cake Mix,$3.50,https://www.igashop.com.au/product/greens-traditional-moist-vanilla-cake-mix-346650
630423,Greens Triple Chocolate Fudge Brownie Mix,$5.00,https://www.igashop.com.au/product/greens-triple-chocolate-fudge-brownie-mix-630423
497451,Greens Vanilla Cupcakes,$5.00,https://www.igashop.com.au/product/greens-vanilla-cupcakes-497451
50720,Greens Velvety Chocolate Cupcake Mix,$5.00,https://www.igashop.com.au/product/greens-velvety-chocolate-cupcake-mix-50720
442359,Hermesetas Granulated Sweetener Jar,$6.15,https://www.igashop.com.au/product/hermesetas-granulated-sweetener-jar-442359
699061,Hermesetas Mini Sweetener Tablets,$7.10,https://www.igashop.com.au/product/hermesetas-mini-sweetener-tablets-699061
2581,Hermesetas Sweetener Tablets,$4.30,https://www.igashop.com.au/product/hermesetas-sweetener-tablets-2581
334124,Hoyts Poppy Seed,$5.00,https://www.igashop.com.au/product/hoyts-poppy-seed-334124
76611,Hoyts Poppy Seed,$2.25,https://www.igashop.com.au/product/hoyts-poppy-seed-76611
466345,Kelloggs Cornflakes Crumbs,$3.60,https://www.igashop.com.au/product/kelloggs-cornflakes-crumbs-466345
20000001032,Kream Cornflour,$3.40,https://www.igashop.com.au/product/kream-cornflour-20000001032
40987,Krummies Breadcrumbs,$3.00,https://www.igashop.com.au/product/krummies-breadcrumbs-40987
34504,Laucke Barossa Sourdough Rye Bread Mix,$9.80,https://www.igashop.com.au/product/laucke-barossa-sourdough-rye-bread-mix-34504
34805,Laucke Bread Mix Super Soft,$9.80,https://www.igashop.com.au/product/laucke-bread-mix-super-soft-34805
232018,Nestl Top N Fill Caramel,$5.90,https://www.igashop.com.au/product/nestl-top-n-fill-caramel-232018
404534,Laucke Ciabatta Mix,$6.80,https://www.igashop.com.au/product/laucke-ciabatta-mix-404534
737050,Laucke Country Womens Scone Mix,$5.00,https://www.igashop.com.au/product/laucke-country-womens-scone-mix-737050
34677,Laucke Crusty White Bread Mix,$9.80,https://www.igashop.com.au/product/laucke-crusty-white-bread-mix-34677
34407,Laucke German Grain Bread Mix,$9.80,https://www.igashop.com.au/product/laucke-german-grain-bread-mix-34407
190000003127,Laucke Pizza Focaccia Dough Mix,$6.80,https://www.igashop.com.au/product/laucke-pizza-focaccia-dough-mix-190000003127
190000003128,Laucke Type 00 Flour,$5.30,https://www.igashop.com.au/product/laucke-type-00-flour-190000003128
329860,Laucke Wallaby Bakers Flour,$12.60,https://www.igashop.com.au/product/laucke-wallaby-bakers-flour-329860
897504,Lighthouse Bread Pizza Plain Flour,$4.00,https://www.igashop.com.au/product/lighthouse-bread-pizza-plain-flour-897504
13333,Lion Pastry Mix,$3.40,https://www.igashop.com.au/product/lion-pastry-mix-13333
79473,Lowan Yeast Dried Instant,$4.80,https://www.igashop.com.au/product/lowan-yeast-dried-instant-79473
273679,Ma Baker Baking Mallows Multicolor,$3.00,https://www.igashop.com.au/product/ma-baker-baking-mallows-multicolor-273679
273661,Ma Baker Baking Mallows Pink White,$3.00,https://www.igashop.com.au/product/ma-baker-baking-mallows-pink-white-273661
610091,Mary Macks Instant Batter Mix,$2.50,https://www.igashop.com.au/product/mary-macks-instant-batter-mix-610091
363864,Masterfoods Sesame Seeds,$3.15,https://www.igashop.com.au/product/masterfoods-sesame-seeds-363864
401719,Mckenzies Acid Citric,$3.00,https://www.igashop.com.au/product/mckenzies-acid-citric-401719
393550,Mckenzies Arrowroot,$1.90,https://www.igashop.com.au/product/mckenzies-arrowroot-393550
401890,Mckenzies Baking Aids Acid Tartaric,$3.40,https://www.igashop.com.au/product/mckenzies-baking-aids-acid-tartaric-401890
