ID,Name,Price,URL
20000003003,Airheads Bites Original Fruit,$2.20,https://www.igashop.com.au/product/airheads-bites-original-fruit-20000003003
3820,Allens Anticol Throat Lozenge,$6.50,https://www.igashop.com.au/product/allens-anticol-throat-lozenge-3820
473554,Allens Anticol Throat Lozenge Vapour Action,$2.75,https://www.igashop.com.au/product/allens-anticol-throat-lozenge-vapour-action-473554
965386,Allens Black Cats,$5.00,https://www.igashop.com.au/product/allens-black-cats-965386
3812,Allens Butter Menthol Throat Lozenge,$6.50,https://www.igashop.com.au/product/allens-butter-menthol-throat-lozenge-3812
473538,Allens Butter Menthol Throat Lozenges,$2.75,https://www.igashop.com.au/product/allens-butter-menthol-throat-lozenges-473538
190000003434,Allens Cheekies Lollies Bag,$5.00,https://www.igashop.com.au/product/allens-cheekies-lollies-bag-190000003434
723543,Allens Chocolate Coated Raspberries,$5.00,https://www.igashop.com.au/product/allens-chocolate-coated-raspberries-723543
882648,Allens Fantales,$2.95,https://www.igashop.com.au/product/allens-fantales-882648
22183,Allens Frogs Alive Lollies Bag,$5.00,https://www.igashop.com.au/product/allens-frogs-alive-lollies-bag-22183
17497,Allens Jelly Beans Lollies Bag,$5.00,https://www.igashop.com.au/product/allens-jelly-beans-lollies-bag-17497
234811,Allens Killer Pythons,$5.00,https://www.igashop.com.au/product/allens-killer-pythons-234811
440640,Allens Minties Mint Chew Lollies Bag,$5.00,https://www.igashop.com.au/product/allens-minties-mint-chew-lollies-bag-440640
25220,Allens Party Mix,$5.00,https://www.igashop.com.au/product/allens-party-mix-25220
597913,Allens Pineapples,$5.00,https://www.igashop.com.au/product/allens-pineapples-597913
25288,Allens Retro Party Mix Lollies Bag,$5.00,https://www.igashop.com.au/product/allens-retro-party-mix-lollies-bag-25288
2353,Allens Ripe Raspberries,$5.00,https://www.igashop.com.au/product/allens-ripe-raspberries-2353
18029,Allens Snakes Alive Lollies Bag,$5.00,https://www.igashop.com.au/product/allens-snakes-alive-lollies-bag-18029
20000004745,Allens Sourz Tangy Randoms,$3.60,https://www.igashop.com.au/product/allens-sourz-tangy-randoms-20000004745
21763,Allens Strawberry Cream Lollies Bag,$5.00,https://www.igashop.com.au/product/allens-strawberry-cream-lollies-bag-21763
150813,Allens White Chocolate Coat Raspberry,$5.00,https://www.igashop.com.au/product/allens-white-chocolate-coat-raspberry-150813
323369,Allens Xxx Mints,$1.50,https://www.igashop.com.au/product/allens-xxx-mints-323369
441361,Allens Xxx Mints,$5.00,https://www.igashop.com.au/product/allens-xxx-mints-441361
383974,Anticol Extra Strong,$2.75,https://www.igashop.com.au/product/anticol-extra-strong-383974
938279,Atkins Endulge Cherry Coconut,$15.00,https://www.igashop.com.au/product/atkins-endulge-cherry-coconut-938279
180000000326,Aussie Drops Eucalyptus,$3.49,https://www.igashop.com.au/product/aussie-drops-eucalyptus-180000000326
20000003199,Big Lolly Banana,$2.50,https://www.igashop.com.au/product/big-lolly-banana-20000003199
180000000353,Big Lolly Fizzy Worms,$2.30,https://www.igashop.com.au/product/big-lolly-fizzy-worms-180000000353
20000003209,Big Lolly Hard Jubes,$2.30,https://www.igashop.com.au/product/big-lolly-hard-jubes-20000003209
20000003206,Big Lolly Licorice Allsorts,$2.30,https://www.igashop.com.au/product/big-lolly-licorice-allsorts-20000003206
20000004563,Big Lolly Milk Bottles,$2.50,https://www.igashop.com.au/product/big-lolly-milk-bottles-20000004563
20000003211,Big Lolly Party Mix,$2.30,https://www.igashop.com.au/product/big-lolly-party-mix-20000003211
663418,Big Lolly Sour Cola Bottles,$2.30,https://www.igashop.com.au/product/big-lolly-sour-cola-bottles-663418
20000004763,Big Lolly Spearmint Leaves,$3.19,https://www.igashop.com.au/product/big-lolly-spearmint-leaves-20000004763
20000004565,Big Lolly Teeth,$2.50,https://www.igashop.com.au/product/big-lolly-teeth-20000004565
325913,Black Gold Chocolate Chip Bits,$2.50,https://www.igashop.com.au/product/black-gold-chocolate-chip-bits-325913
22358,Bosistos Eucalyptus Drops Sugar Free,$3.80,https://www.igashop.com.au/product/bosistos-eucalyptus-drops-sugar-free-22358
926269,Bounty Bar,$1.10,https://www.igashop.com.au/product/bounty-bar-926269
20000006644,Butter Menthol Honey Centre,$6.50,https://www.igashop.com.au/product/butter-menthol-honey-centre-20000006644
954152,Butter Menthol Honey Centre Stick,$2.75,https://www.igashop.com.au/product/butter-menthol-honey-centre-stick-954152
461942,Cadbury Black Forest Milk Chocolate Block,$4.00,https://www.igashop.com.au/product/cadbury-black-forest-milk-chocolate-block-461942
351118,Cadbury Boost,$2.50,https://www.igashop.com.au/product/cadbury-boost-351118
940975,Cadbury Caramel Chomp Sharepack,$6.00,https://www.igashop.com.au/product/cadbury-caramel-chomp-sharepack-940975
898657,Cadbury Caramello Egg Bag,$5.50,https://www.igashop.com.au/product/cadbury-caramello-egg-bag-898657
442977,Cadbury Caramello Gift Box,$10.00,https://www.igashop.com.au/product/cadbury-caramello-gift-box-442977
307203,Cadbury Caramello Koala,$0.85,https://www.igashop.com.au/product/cadbury-caramello-koala-307203
10020510,Cadbury Caramels,$3.50,https://www.igashop.com.au/product/cadbury-caramels-10020510
311037,Cadbury Caramels,$3.50,https://www.igashop.com.au/product/cadbury-caramels-311037
930218,Cadbury Caramilk,$4.00,https://www.igashop.com.au/product/cadbury-caramilk-930218
386993,Cadbury Cherry Ripe,$2.50,https://www.igashop.com.au/product/cadbury-cherry-ripe-386993
913261,Cadbury Cherry Ripe Bites,$5.00,https://www.igashop.com.au/product/cadbury-cherry-ripe-bites-913261
343584,Cadbury Cherry Ripe Double Dipped Chocolate Bar,$2.50,https://www.igashop.com.au/product/cadbury-cherry-ripe-double-dipped-chocolate-bar-343584
898584,Cadbury Cherry Ripe Easter Bunny,$6.00,https://www.igashop.com.au/product/cadbury-cherry-ripe-easter-bunny-898584
898500,Cadbury Cherry Ripe Egg,$5.00,https://www.igashop.com.au/product/cadbury-cherry-ripe-egg-898500
898518,Cadbury Cherry Ripe Gift Box,$10.00,https://www.igashop.com.au/product/cadbury-cherry-ripe-gift-box-898518
307371,Cadbury Cherry Ripe Sharepack,$6.00,https://www.igashop.com.au/product/cadbury-cherry-ripe-sharepack-307371
387305,Cadbury Cherry Ripe Twin Pack,$2.50,https://www.igashop.com.au/product/cadbury-cherry-ripe-twin-pack-387305
231062,Cadbury Chocolate Caramilk,$2.50,https://www.igashop.com.au/product/cadbury-chocolate-caramilk-231062
236949,Cadbury Chocolate Caramilk Marble,$4.00,https://www.igashop.com.au/product/cadbury-chocolate-caramilk-marble-236949
894938,Cadbury Chocolate Easter Bunny Caramilk,$6.00,https://www.igashop.com.au/product/cadbury-chocolate-easter-bunny-caramilk-894938
343005,Cadbury Chocolate Eclairs,$3.50,https://www.igashop.com.au/product/cadbury-chocolate-eclairs-343005
206834,Cadbury Chocolate Fruit Nut,$12.00,https://www.igashop.com.au/product/cadbury-chocolate-fruit-nut-206834
801891,Cadbury Chocolate Sultanas,$10.00,https://www.igashop.com.au/product/cadbury-chocolate-sultanas-801891
431170,Cadbury Chomp Chocolate Bar,$1.00,https://www.igashop.com.au/product/cadbury-chomp-chocolate-bar-431170
795388,Cadbury Christmas Stocking,$6.50,https://www.igashop.com.au/product/cadbury-christmas-stocking-795388
905470,Cadbury Cookie Crunchy Choc Filled,$4.00,https://www.igashop.com.au/product/cadbury-cookie-crunchy-choc-filled-905470
691872,Cadbury Creme Egg Gift Box,$10.00,https://www.igashop.com.au/product/cadbury-creme-egg-gift-box-691872
48566,Cadbury Creme Egg Minis Egg Bag,$5.50,https://www.igashop.com.au/product/cadbury-creme-egg-minis-egg-bag-48566
104875,Cadbury Crunchie Bunny,$7.00,https://www.igashop.com.au/product/cadbury-crunchie-bunny-104875
327185,Cadbury Crunchie Chocolate Bar,$2.50,https://www.igashop.com.au/product/cadbury-crunchie-chocolate-bar-327185
342070,Cadbury Crunchie Chocolate Bar King Size,$2.50,https://www.igashop.com.au/product/cadbury-crunchie-chocolate-bar-king-size-342070
898673,Cadbury Crunchie Egg Bag,$5.50,https://www.igashop.com.au/product/cadbury-crunchie-egg-bag-898673
442859,Cadbury Crunchie Gift Box,$10.00,https://www.igashop.com.au/product/cadbury-crunchie-gift-box-442859
104752,Cadbury Crunchie Milk Chocolate Easter Egg,$5.00,https://www.igashop.com.au/product/cadbury-crunchie-milk-chocolate-easter-egg-104752
307130,Cadbury Crunchie Sharepack,$6.00,https://www.igashop.com.au/product/cadbury-crunchie-sharepack-307130
160000012100,Cadbury Curly Wurly,$1.00,https://www.igashop.com.au/product/cadbury-curly-wurly-160000012100
292665,Cadbury Curlywurly Squirlies,$5.00,https://www.igashop.com.au/product/cadbury-curlywurly-squirlies-292665
170000001296,Cadbury Dairy Milk Bubbly Mint,$4.00,https://www.igashop.com.au/product/cadbury-dairy-milk-bubbly-mint-170000001296
170000000455,Cadbury Dairy Milk Caramello,$7.00,https://www.igashop.com.au/product/cadbury-dairy-milk-caramello-170000000455
462095,Cadbury Dairy Milk Caramello Chocolate Block,$4.00,https://www.igashop.com.au/product/cadbury-dairy-milk-caramello-chocolate-block-462095
170000001061,Cadbury Dairy Milk Caramello Koala Chocolate Sharepack,$6.00,https://www.igashop.com.au/product/cadbury-dairy-milk-caramello-koala-chocolate-sharepack-170000001061
170000001160,Cadbury Dairy Milk Caramello Milk Chocolate Bar,$2.50,https://www.igashop.com.au/product/cadbury-dairy-milk-caramello-milk-chocolate-bar-170000001160
386935,Cadbury Dairy Milk Chocolate Bar,$2.50,https://www.igashop.com.au/product/cadbury-dairy-milk-chocolate-bar-386935
414932,Cadbury Dairy Milk Chocolate Bar,$2.50,https://www.igashop.com.au/product/cadbury-dairy-milk-chocolate-bar-414932
463075,Cadbury Dairy Milk Chocolate Block,$4.00,https://www.igashop.com.au/product/cadbury-dairy-milk-chocolate-block-463075
398547,Cadbury Dairy Milk Chocolate Christmas Santa Sharepack,$6.00,https://www.igashop.com.au/product/cadbury-dairy-milk-chocolate-christmas-santa-sharepack-398547
898607,Cadbury Dairy Milk Chocolate Easter Egg Bag,$5.50,https://www.igashop.com.au/product/cadbury-dairy-milk-chocolate-easter-egg-bag-898607
122108,Cadbury Dairy Milk Chocolate Easter Egg Carry Pack,$12.50,https://www.igashop.com.au/product/cadbury-dairy-milk-chocolate-easter-egg-carry-pack-122108
898649,Cadbury Dairy Milk Chocolate Easter Eggs Bag,$10.00,https://www.igashop.com.au/product/cadbury-dairy-milk-chocolate-easter-eggs-bag-898649
170000001339,Cadbury Dairy Milk Chocolate Fruit Nut Bar,$2.50,https://www.igashop.com.au/product/cadbury-dairy-milk-chocolate-fruit-nut-bar-170000001339
414982,Cadbury Dairy Milk Chocolate Hazelnut Bar,$2.00,https://www.igashop.com.au/product/cadbury-dairy-milk-chocolate-hazelnut-bar-414982
462922,Cadbury Dairy Milk Crunchie Chocolate Block,$4.00,https://www.igashop.com.au/product/cadbury-dairy-milk-crunchie-chocolate-block-462922
143620,Cadbury Dairy Milk Easter Bunny,$6.00,https://www.igashop.com.au/product/cadbury-dairy-milk-easter-bunny-143620
143633,Cadbury Dairy Milk Easter Bunny,$7.00,https://www.igashop.com.au/product/cadbury-dairy-milk-easter-bunny-143633
909505,Cadbury Dairy Milk Easter Bunny,$8.00,https://www.igashop.com.au/product/cadbury-dairy-milk-easter-bunny-909505
442809,Cadbury Dairy Milk Easter Egg Gift Box,$20.00,https://www.igashop.com.au/product/cadbury-dairy-milk-easter-egg-gift-box-442809
443009,Cadbury Dairy Milk Easter Egg Gift Box,$10.00,https://www.igashop.com.au/product/cadbury-dairy-milk-easter-egg-gift-box-443009
3639,Cadbury Dairy Milk Freddo Frog,$1.00,https://www.igashop.com.au/product/cadbury-dairy-milk-freddo-frog-3639
20000003224,Cadbury Dairy Milk Freddo Gift Box,$7.00,https://www.igashop.com.au/product/cadbury-dairy-milk-freddo-gift-box-20000003224
873487,Cadbury Dairy Milk Freddo Milky Top Sharepack,$6.00,https://www.igashop.com.au/product/cadbury-dairy-milk-freddo-milky-top-sharepack-873487
873495,Cadbury Dairy Milk Freddo Sharepack,$6.00,https://www.igashop.com.au/product/cadbury-dairy-milk-freddo-sharepack-873495
941125,Cadbury Dairy Milk Freddo Strawberry,$6.00,https://www.igashop.com.au/product/cadbury-dairy-milk-freddo-strawberry-941125
160000012098,Cadbury Dairy Milk Fruit Nut,$7.00,https://www.igashop.com.au/product/cadbury-dairy-milk-fruit-nut-160000012098
462972,Cadbury Dairy Milk Fruit Nut Milk Chocolate Block,$4.00,https://www.igashop.com.au/product/cadbury-dairy-milk-fruit-nut-milk-chocolate-block-462972
20000003227,Cadbury Dairy Milk Hazelnut,$2.00,https://www.igashop.com.au/product/cadbury-dairy-milk-hazelnut-20000003227
468148,Cadbury Dairy Milk Hazelnut Milk Chocolate Block,$4.00,https://www.igashop.com.au/product/cadbury-dairy-milk-hazelnut-milk-chocolate-block-468148
135342,Cadbury Dairy Milk Hollow Easter Egg,$5.00,https://www.igashop.com.au/product/cadbury-dairy-milk-hollow-easter-egg-135342
190000009720,Cadbury Dairy Milk Hollow Egg,$3.00,https://www.igashop.com.au/product/cadbury-dairy-milk-hollow-egg-190000009720
820887,Cadbury Dairy Milk Marble Chocolate Block,$4.00,https://www.igashop.com.au/product/cadbury-dairy-milk-marble-chocolate-block-820887
349116,Cadbury Dairy Milk Marvellous Creations Jelly Popping Candy Beanies Milk Chocolate Bar,$2.50,https://www.igashop.com.au/product/cadbury-dairy-milk-marvellous-creations-jelly-popping-candy-beanies-milk-chocolate-bar-349116
461976,Cadbury Dairy Milk Marvellous Creations Jelly Popping Candy Chocolate Block,$4.00,https://www.igashop.com.au/product/cadbury-dairy-milk-marvellous-creations-jelly-popping-candy-chocolate-block-461976
160000011336,Cadbury Dairy Milk Milk Chocolate,$7.00,https://www.igashop.com.au/product/cadbury-dairy-milk-milk-chocolate-160000011336
644312,Cadbury Dairy Milk Oreo Egg Bag,$5.50,https://www.igashop.com.au/product/cadbury-dairy-milk-oreo-egg-bag-644312
462126,Cadbury Dairy Milk Peppermint Chocolate Block,$4.00,https://www.igashop.com.au/product/cadbury-dairy-milk-peppermint-chocolate-block-462126
600957,Cadbury Dairy Milk Peppermint Milk Chocolate Bar,$2.00,https://www.igashop.com.au/product/cadbury-dairy-milk-peppermint-milk-chocolate-bar-600957
461879,Cadbury Dairy Milk Roast Almond Chocolate Block,$4.00,https://www.igashop.com.au/product/cadbury-dairy-milk-roast-almond-chocolate-block-461879
898623,Cadbury Dairy Milk Salted Caramel Easter Egg Bag,$5.50,https://www.igashop.com.au/product/cadbury-dairy-milk-salted-caramel-easter-egg-bag-898623
873518,Cadbury Dairy Milk Sharepack,$6.00,https://www.igashop.com.au/product/cadbury-dairy-milk-sharepack-873518
462529,Cadbury Dairy Milk Snack,$4.00,https://www.igashop.com.au/product/cadbury-dairy-milk-snack-462529
462906,Cadbury Dairy Milk Top Deck Chocolate Block,$4.00,https://www.igashop.com.au/product/cadbury-dairy-milk-top-deck-chocolate-block-462906
898665,Cadbury Dairy Milk Top Deck Egg Bag,$5.50,https://www.igashop.com.au/product/cadbury-dairy-milk-top-deck-egg-bag-898665
463017,Cadbury Dairy Milk Tropical Pineapple Milk Chocolate Block,$4.00,https://www.igashop.com.au/product/cadbury-dairy-milk-tropical-pineapple-milk-chocolate-block-463017
468465,Cadbury Dairy Milk Turkish Delight Milk Chocolate Block,$4.00,https://www.igashop.com.au/product/cadbury-dairy-milk-turkish-delight-milk-chocolate-block-468465
123492,Cadbury Dream Easter Bunny,$7.00,https://www.igashop.com.au/product/cadbury-dream-easter-bunny-123492
143366,Cadbury Dream Easter Egg Bag,$5.50,https://www.igashop.com.au/product/cadbury-dream-easter-egg-bag-143366
469157,Cadbury Dream White Chocolate,$4.00,https://www.igashop.com.au/product/cadbury-dream-white-chocolate-469157
71904,Cadbury Dream White Chocolate Bar,$2.50,https://www.igashop.com.au/product/cadbury-dream-white-chocolate-bar-71904
917472,Cadbury Easter Mixed Egg Bag,$10.00,https://www.igashop.com.au/product/cadbury-easter-mixed-egg-bag-917472
677205,Cadbury Eggcellent Easter Assortment Gift Box,$20.00,https://www.igashop.com.au/product/cadbury-eggcellent-easter-assortment-gift-box-677205
20000005779,Cadbury Favourites,$16.00,https://www.igashop.com.au/product/cadbury-favourites-20000005779
442707,Cadbury Favourites Easter Egg Gift Box,$20.00,https://www.igashop.com.au/product/cadbury-favourites-easter-egg-gift-box-442707
928164,Cadbury Favourites Party Pack,$22.00,https://www.igashop.com.au/product/cadbury-favourites-party-pack-928164
95518,Cadbury Flake Chocolate Bar,$2.50,https://www.igashop.com.au/product/cadbury-flake-chocolate-bar-95518
90437,Cadbury Flake Sharepack,$6.00,https://www.igashop.com.au/product/cadbury-flake-sharepack-90437
398270,Cadbury Freddo Strawberry Chocolate,$0.85,https://www.igashop.com.au/product/cadbury-freddo-strawberry-chocolate-398270
477590,Cadbury Frys Turkish Delight,$2.50,https://www.igashop.com.au/product/cadbury-frys-turkish-delight-477590
627179,Cadbury Frys Turkish Delight Sharepack,$6.00,https://www.igashop.com.au/product/cadbury-frys-turkish-delight-sharepack-627179
490187,Cadbury Furry Friends,$3.50,https://www.igashop.com.au/product/cadbury-furry-friends-490187
307185,Cadbury Giant Caramello Koala Bar,$1.00,https://www.igashop.com.au/product/cadbury-giant-caramello-koala-bar-307185
190000009704,Cadbury Marshmallow Eggs,$5.00,https://www.igashop.com.au/product/cadbury-marshmallow-eggs-190000009704
218632,Cadbury Marshmallow Eggs,$1.20,https://www.igashop.com.au/product/cadbury-marshmallow-eggs-218632
690368,Cadbury Marshmallow Eggs Milk Chocolate,$6.00,https://www.igashop.com.au/product/cadbury-marshmallow-eggs-milk-chocolate-690368
690211,Cadbury Marshmallow Pascall Pineapple Lumps,$5.00,https://www.igashop.com.au/product/cadbury-marshmallow-pascall-pineapple-lumps-690211
20000003226,Cadbury Marvellous Creation Chocolate Bar Jelly Pop Candy,$2.50,https://www.igashop.com.au/product/cadbury-marvellous-creation-chocolate-bar-jelly-pop-candy-20000003226
171136,Cadbury Mini Egg Bag,$5.50,https://www.igashop.com.au/product/cadbury-mini-egg-bag-171136
150000007759,Cadbury Mini Eggs,$2.20,https://www.igashop.com.au/product/cadbury-mini-eggs-150000007759
917464,Cadbury Mixed Easter Egg Bag,$15.00,https://www.igashop.com.au/product/cadbury-mixed-easter-egg-bag-917464
461426,Cadbury Old Gold Dark Chocolate 70 Cocoa,$4.00,https://www.igashop.com.au/product/cadbury-old-gold-dark-chocolate-70-cocoa-461426
809556,Cadbury Old Gold Dark Chocolate Cherry Ripe,$4.00,https://www.igashop.com.au/product/cadbury-old-gold-dark-chocolate-cherry-ripe-809556
180672,Cadbury Old Gold Dark Chocolate Coated Almonds,$12.00,https://www.igashop.com.au/product/cadbury-old-gold-dark-chocolate-coated-almonds-180672
160000011334,Cadbury Old Gold Dark Chocolate Old Jamaica Rum N Raisin,$7.00,https://www.igashop.com.au/product/cadbury-old-gold-dark-chocolate-old-jamaica-rum-n-raisin-160000011334
462419,Cadbury Old Gold Dark Chocolate Old Jamaica Rum N Raisin,$4.00,https://www.igashop.com.au/product/cadbury-old-gold-dark-chocolate-old-jamaica-rum-n-raisin-462419
469097,Cadbury Old Gold Dark Chocolate Original,$4.00,https://www.igashop.com.au/product/cadbury-old-gold-dark-chocolate-original-469097
461853,Cadbury Old Gold Dark Chocolate Peppermint,$4.00,https://www.igashop.com.au/product/cadbury-old-gold-dark-chocolate-peppermint-461853
463693,Cadbury Old Gold Roast Almond,$4.00,https://www.igashop.com.au/product/cadbury-old-gold-roast-almond-463693
442980,Cadbury Oreo Egg Gift Box,$10.00,https://www.igashop.com.au/product/cadbury-oreo-egg-gift-box-442980
170000004653,Cadbury Pascall Chocolate Eclairs,$3.50,https://www.igashop.com.au/product/cadbury-pascall-chocolate-eclairs-170000004653
677302,Cadbury Peppermint Milk Chocolate Eggs,$5.50,https://www.igashop.com.au/product/cadbury-peppermint-milk-chocolate-eggs-677302
386919,Cadbury Picnic,$2.50,https://www.igashop.com.au/product/cadbury-picnic-386919
387208,Cadbury Picnic Chocolate Bar King Size,$2.50,https://www.igashop.com.au/product/cadbury-picnic-chocolate-bar-king-size-387208
307473,Cadbury Picnic Chocolate Sharepack 180G,$6.00,https://www.igashop.com.au/product/cadbury-picnic-chocolate-sharepack-180g-307473
49156,Cadbury Roses Chocolate Gift Box,$8.75,https://www.igashop.com.au/product/cadbury-roses-chocolate-gift-box-49156
443038,Cadbury Roses Milk Chocolate Easter Egg Gift Box,$20.00,https://www.igashop.com.au/product/cadbury-roses-milk-chocolate-easter-egg-gift-box-443038
180907,Cadbury Scorched Almonds,$12.00,https://www.igashop.com.au/product/cadbury-scorched-almonds-180907
180664,Cadbury Scorched Hazelnuts,$12.00,https://www.igashop.com.au/product/cadbury-scorched-hazelnuts-180664
180999,Cadbury Scorched Peanuts,$12.00,https://www.igashop.com.au/product/cadbury-scorched-peanuts-180999
181385,Cadbury Scorched Sultanas,$12.00,https://www.igashop.com.au/product/cadbury-scorched-sultanas-181385
307347,Cadbury Special Treats Chocolate Sharepack,$6.00,https://www.igashop.com.au/product/cadbury-special-treats-chocolate-sharepack-307347
930027,Cadbury Turkish Delight Egg Bag,$5.50,https://www.igashop.com.au/product/cadbury-turkish-delight-egg-bag-930027
386927,Cadbury Twirl,$2.50,https://www.igashop.com.au/product/cadbury-twirl-386927
152014,Cadbury Twirl Breakaway Wafer Chocolate Bar,$2.50,https://www.igashop.com.au/product/cadbury-twirl-breakaway-wafer-chocolate-bar-152014
678586,Cadbury Twirl Caramilk,$2.50,https://www.igashop.com.au/product/cadbury-twirl-caramilk-678586
170000001007,Cadbury Twirl Sharepack,$6.00,https://www.igashop.com.au/product/cadbury-twirl-sharepack-170000001007
20000004576,Candy Cottage Butter Menthol,$4.50,https://www.igashop.com.au/product/candy-cottage-butter-menthol-20000004576
180000000260,Candy Cottage Eucalyptus Drops,$4.50,https://www.igashop.com.au/product/candy-cottage-eucalyptus-drops-180000000260
20000004577,Candy Cottage Rosey Apple Drops,$4.50,https://www.igashop.com.au/product/candy-cottage-rosey-apple-drops-20000004577
930912,Candy Market Candy Teeth,$2.50,https://www.igashop.com.au/product/candy-market-candy-teeth-930912
932087,Candy Market Choc Mints,$2.50,https://www.igashop.com.au/product/candy-market-choc-mints-932087
931887,Candy Market Chocolate Coated Scr Peanuts,$2.50,https://www.igashop.com.au/product/candy-market-chocolate-coated-scr-peanuts-931887
931609,Candy Market Fruit Sticks,$2.50,https://www.igashop.com.au/product/candy-market-fruit-sticks-931609
932558,Candy Market Humbugs,$2.50,https://www.igashop.com.au/product/candy-market-humbugs-932558
932346,Candy Market Licorice Bullets,$2.50,https://www.igashop.com.au/product/candy-market-licorice-bullets-932346
931293,Candy Market Milk Bottles,$2.50,https://www.igashop.com.au/product/candy-market-milk-bottles-931293
935310,Candy Market Mints,$2.20,https://www.igashop.com.au/product/candy-market-mints-935310
930899,Candy Market Party Mix,$2.50,https://www.igashop.com.au/product/candy-market-party-mix-930899
931277,Candy Market Raspberries,$2.50,https://www.igashop.com.au/product/candy-market-raspberries-931277
931455,Candy Market Sour Cola Bottle,$2.50,https://www.igashop.com.au/product/candy-market-sour-cola-bottle-931455
930904,Candy Market Spearmint Leaves,$2.50,https://www.igashop.com.au/product/candy-market-spearmint-leaves-930904
708967,Christmas Star Candy Cane Rainbow,$2.40,https://www.igashop.com.au/product/christmas-star-candy-cane-rainbow-708967
708938,Christmas Star Candy Cane Red White,$3.75,https://www.igashop.com.au/product/christmas-star-candy-cane-red-white-708938
708962,Christmas Star Candy Cane Red White,$2.40,https://www.igashop.com.au/product/christmas-star-candy-cane-red-white-708962
790304,Chupa Chup And Mentos Mix Of Mini Stocking,$5.00,https://www.igashop.com.au/product/chupa-chup-and-mentos-mix-of-mini-stocking-790304
787482,Chupa Chup Assorted Flavour Lollipops,$2.50,https://www.igashop.com.au/product/chupa-chup-assorted-flavour-lollipops-787482
3582,Chupa Chup Best Of Bag Bun,$2.75,https://www.igashop.com.au/product/chupa-chup-best-of-bag-bun-3582
187917,Chupa Chup Candy Cane Bag,$6.25,https://www.igashop.com.au/product/chupa-chup-candy-cane-bag-187917
415637,Chupa Chup Faces Flat Lollipops,$5.00,https://www.igashop.com.au/product/chupa-chup-faces-flat-lollipops-415637
47353,Chupa Chup Lollipop,$0.65,https://www.igashop.com.au/product/chupa-chup-lollipop-47353
415108,Chupa Chup Lollipops The Best Of,$6.25,https://www.igashop.com.au/product/chupa-chup-lollipops-the-best-of-415108
45411,Chupa Chup Strawberry Medloy Pop,$0.80,https://www.igashop.com.au/product/chupa-chup-strawberry-medloy-pop-45411
407558,Chupa Chup Surprise Licensed Lollipops,$3.15,https://www.igashop.com.au/product/chupa-chup-surprise-licensed-lollipops-407558
350997,Chupa Chup Xxl Trio,$1.20,https://www.igashop.com.au/product/chupa-chup-xxl-trio-350997
608374,Codral Lozenges Honey Lemon,$6.50,https://www.igashop.com.au/product/codral-lozenges-honey-lemon-608374
608421,Codral Lozenges Lime Lemon,$6.75,https://www.igashop.com.au/product/codral-lozenges-lime-lemon-608421
20000004795,Cosmic Fruity Pops,$2.99,https://www.igashop.com.au/product/cosmic-fruity-pops-20000004795
622632,Cosmic Sour Rainbow Karate Belts,$2.75,https://www.igashop.com.au/product/cosmic-sour-rainbow-karate-belts-622632
846189,Ctc Aussie Drops Honey Eucalyptus,$3.49,https://www.igashop.com.au/product/ctc-aussie-drops-honey-eucalyptus-846189
44321,Ctc Australian Eucalyptus Drops,$1.90,https://www.igashop.com.au/product/ctc-australian-eucalyptus-drops-44321
463928,Darrell Lea Allsorts Liquorice,$5.50,https://www.igashop.com.au/product/darrell-lea-allsorts-liquorice-463928
459123,Darrell Lea Batch 37 Liquorice,$5.50,https://www.igashop.com.au/product/darrell-lea-batch-37-liquorice-459123
682548,Darrell Lea Caramel Craving Block,$6.00,https://www.igashop.com.au/product/darrell-lea-caramel-craving-block-682548
826121,Darrell Lea Dark Chocolate Block,$6.00,https://www.igashop.com.au/product/darrell-lea-dark-chocolate-block-826121
