ID,Name,Price,URL
10173,Mms Peanut Chocolate Singles Bag,$1.10,https://www.igashop.com.au/product/mms-peanut-chocolate-singles-bag-10173
934754,Mms Peanut Pouch,$7.00,https://www.igashop.com.au/product/mms-peanut-pouch-934754
10181,Mms Plain Milk Chocolate,$1.10,https://www.igashop.com.au/product/mms-plain-milk-chocolate-10181
622394,Mms Crispy Pouch,$6.00,https://www.igashop.com.au/product/mms-crispy-pouch-622394
622572,Mms Milk Chocolate Pouch,$2.80,https://www.igashop.com.au/product/mms-milk-chocolate-pouch-622572
827046,Mms Peanut Bucket,$17.00,https://www.igashop.com.au/product/mms-peanut-bucket-827046
59452,Maltesers,$8.00,https://www.igashop.com.au/product/maltesers-59452
150494,Maltesers Dark,$6.00,https://www.igashop.com.au/product/maltesers-dark-150494
720906,Maltesers Extra Choc Medium Pouch,$6.00,https://www.igashop.com.au/product/maltesers-extra-choc-medium-pouch-720906
621568,Maltesers Milk Chocolate Family Share Pouch,$6.00,https://www.igashop.com.au/product/maltesers-milk-chocolate-family-share-pouch-621568
622807,Maltesers Milk Chocolate King Share,$2.20,https://www.igashop.com.au/product/maltesers-milk-chocolate-king-share-622807
622072,Maltesers Milk Chocolate Medium Party Share Bag,$5.00,https://www.igashop.com.au/product/maltesers-milk-chocolate-medium-party-share-bag-622072
826529,Maltesers Milk Chocolate Party Share Bucket,$17.00,https://www.igashop.com.au/product/maltesers-milk-chocolate-party-share-bucket-826529
954076,Maltesers Pouch,$7.00,https://www.igashop.com.au/product/maltesers-pouch-954076
190000004719,Mars Bar Funsize,$6.50,https://www.igashop.com.au/product/mars-bar-funsize-190000004719
304459,Mentos Clean Breath Peppermint,$3.10,https://www.igashop.com.au/product/mentos-clean-breath-peppermint-304459
304438,Mentos Clean Breath Spearmint,$3.10,https://www.igashop.com.au/product/mentos-clean-breath-spearmint-304438
55288,Mentos Fruit Chews Rainbow,$1.60,https://www.igashop.com.au/product/mentos-fruit-chews-rainbow-55288
95092,Mentos Fruit Chews Rainbow Minis,$2.75,https://www.igashop.com.au/product/mentos-fruit-chews-rainbow-minis-95092
160000000566,Mentos Fruit Roll,$1.60,https://www.igashop.com.au/product/mentos-fruit-roll-160000000566
657920,Mentos Mint,$3.10,https://www.igashop.com.au/product/mentos-mint-657920
160000000565,Mentos Mint Roll,$1.60,https://www.igashop.com.au/product/mentos-mint-roll-160000000565
947029,Mentos Pure Fresh Bubble Fresh Flavour Sugar Free Gum,$2.20,https://www.igashop.com.au/product/mentos-pure-fresh-bubble-fresh-flavour-sugar-free-gum-947029
906581,Mentos Pure Fresh Grape Gum,$2.20,https://www.igashop.com.au/product/mentos-pure-fresh-grape-gum-906581
947053,Mentos Pure Fresh Gum Strawberry Pocket Bottle,$2.20,https://www.igashop.com.au/product/mentos-pure-fresh-gum-strawberry-pocket-bottle-947053
807232,Mentos Pure Fresh Spearmint Bottle,$3.80,https://www.igashop.com.au/product/mentos-pure-fresh-spearmint-bottle-807232
961049,Mentos Pure Fresh Spearmint Gum Tower,$2.20,https://www.igashop.com.au/product/mentos-pure-fresh-spearmint-gum-tower-961049
657938,Mentos Regular Fruit,$3.10,https://www.igashop.com.au/product/mentos-regular-fruit-657938
33914,Mentos Spearmint,$3.10,https://www.igashop.com.au/product/mentos-spearmint-33914
639998,Mentos Spearmint Roll,$1.60,https://www.igashop.com.au/product/mentos-spearmint-roll-639998
465713,Menz Bumbles Milk Choc Honeycomb,$5.00,https://www.igashop.com.au/product/menz-bumbles-milk-choc-honeycomb-465713
178256,Menz Jelichocs Choccy Froggies,$5.70,https://www.igashop.com.au/product/menz-jelichocs-choccy-froggies-178256
178264,Menz Jelichocs Choccy Snakes,$5.70,https://www.igashop.com.au/product/menz-jelichocs-choccy-snakes-178264
180000000431,Mike And Ike Mega Mix,$4.00,https://www.igashop.com.au/product/mike-and-ike-mega-mix-180000000431
20000003126,Mike And Ike Mega Mix Theatre Box,$4.00,https://www.igashop.com.au/product/mike-and-ike-mega-mix-theatre-box-20000003126
20000003084,Mike And Ike Mega Sour Mix,$4.00,https://www.igashop.com.au/product/mike-and-ike-mega-sour-mix-20000003084
160000014046,Milky Way Chocolate Whip Funsize Bag,$6.50,https://www.igashop.com.au/product/milky-way-chocolate-whip-funsize-bag-160000014046
622048,Milky Way Funsize,$6.50,https://www.igashop.com.au/product/milky-way-funsize-622048
92845,Nestle Kit Kat Chocolate,$1.25,https://www.igashop.com.au/product/nestle-kit-kat-chocolate-92845
12751,Nestl Aero Peppermint,$1.25,https://www.igashop.com.au/product/nestl-aero-peppermint-12751
18731,Nestl Aero Peppermint,$6.00,https://www.igashop.com.au/product/nestl-aero-peppermint-18731
76103,Nestl Aero Peppermint King Size,$3.05,https://www.igashop.com.au/product/nestl-aero-peppermint-king-size-76103
38985,Nestl Butter Menthol Liquid Centres Honey Lemon,$2.75,https://www.igashop.com.au/product/nestl-butter-menthol-liquid-centres-honey-lemon-38985
41459,Nestl Chokito,$2.20,https://www.igashop.com.au/product/nestl-chokito-41459
70398,Nestl Crunch Chocolate Bar,$1.25,https://www.igashop.com.au/product/nestl-crunch-chocolate-bar-70398
91962,Nestl Crunch Milk Chocolate,$5.50,https://www.igashop.com.au/product/nestl-crunch-milk-chocolate-91962
964937,Nestl Kitkat 4 Finger King Size Chocolate Bar,$3.05,https://www.igashop.com.au/product/nestl-kitkat-4-finger-king-size-chocolate-bar-964937
20000004074,Nestl Kitkat Chocolate Bunny,$1.50,https://www.igashop.com.au/product/nestl-kitkat-chocolate-bunny-20000004074
150774,Nestl Kitkat Chunky Bar,$1.25,https://www.igashop.com.au/product/nestl-kitkat-chunky-bar-150774
151076,Nestl Kitkat Chunky Gooey Caramel,$2.20,https://www.igashop.com.au/product/nestl-kitkat-chunky-gooey-caramel-151076
151092,Nestl Kitkat Chunky King Size,$3.05,https://www.igashop.com.au/product/nestl-kitkat-chunky-king-size-151092
649095,Nestl Kitkat Dark Block,$5.50,https://www.igashop.com.au/product/nestl-kitkat-dark-block-649095
220870,Nestl Kitkat Dark Mint,$5.50,https://www.igashop.com.au/product/nestl-kitkat-dark-mint-220870
190000002334,Nestl Kitkat Dark With Southern Australian Orange Block,$5.50,https://www.igashop.com.au/product/nestl-kitkat-dark-with-southern-australian-orange-block-190000002334
922516,Nestl Kitkat Gold Bar 45G,$1.25,https://www.igashop.com.au/product/nestl-kitkat-gold-bar-45g-922516
745176,Nestl Kitkat Gold Block,$5.50,https://www.igashop.com.au/product/nestl-kitkat-gold-block-745176
837847,Nestl Kitkat Large Share Pack,$6.00,https://www.igashop.com.au/product/nestl-kitkat-large-share-pack-837847
468224,Nestl Kitkat Milk Chocolate,$5.50,https://www.igashop.com.au/product/nestl-kitkat-milk-chocolate-468224
373673,Nestl Kitkat Original,$5.50,https://www.igashop.com.au/product/nestl-kitkat-original-373673
394085,Nestl Milky Bar,$1.25,https://www.igashop.com.au/product/nestl-milky-bar-394085
92104,Nestl Milky Bar,$5.50,https://www.igashop.com.au/product/nestl-milky-bar-92104
87565,Nestl Milky Bar Milk Cookies,$5.50,https://www.igashop.com.au/product/nestl-milky-bar-milk-cookies-87565
373893,Nestl Milky Bar Share Pack,$5.50,https://www.igashop.com.au/product/nestl-milky-bar-share-pack-373893
92219,Nestl Milky Bar With Cookies,$3.05,https://www.igashop.com.au/product/nestl-milky-bar-with-cookies-92219
328636,Nestl Milkybar King Size Chocolate Bar,$3.05,https://www.igashop.com.au/product/nestl-milkybar-king-size-chocolate-bar-328636
371215,Nestl Mint Pattie,$1.50,https://www.igashop.com.au/product/nestl-mint-pattie-371215
92015,Nestl Peppermint Crisp,$1.25,https://www.igashop.com.au/product/nestl-peppermint-crisp-92015
45903,Nestl Rolo Chocolate Block,$5.50,https://www.igashop.com.au/product/nestl-rolo-chocolate-block-45903
63870,Nestl Smarties,$6.00,https://www.igashop.com.au/product/nestl-smarties-63870
93710,Nestl Smarties,$1.25,https://www.igashop.com.au/product/nestl-smarties-93710
58508,Nestl Smarties Large Bag,$6.80,https://www.igashop.com.au/product/nestl-smarties-large-bag-58508
374166,Nestl Smarties Sharepack,$5.50,https://www.igashop.com.au/product/nestl-smarties-sharepack-374166
170000001234,Pascall Cadbury Clinkers Lollies,$3.50,https://www.igashop.com.au/product/pascall-cadbury-clinkers-lollies-170000001234
335374,Pascall Marshmallows,$6.50,https://www.igashop.com.au/product/pascall-marshmallows-335374
311207,Pascall Marshmallows Vanilla Raspberry,$3.50,https://www.igashop.com.au/product/pascall-marshmallows-vanilla-raspberry-311207
311176,Pascall Pineapple Lumps,$3.50,https://www.igashop.com.au/product/pascall-pineapple-lumps-311176
160000000810,Pascall Sherbet Strawberries,$4.00,https://www.igashop.com.au/product/pascall-sherbet-strawberries-160000000810
792160,Pez Candy Dispensers Winter Stars,$4.00,https://www.igashop.com.au/product/pez-candy-dispensers-winter-stars-792160
622695,Pods Mars Chocolate Share Pack,$6.00,https://www.igashop.com.au/product/pods-mars-chocolate-share-pack-622695
622742,Pods Snickers Chocolate Share Pack,$6.00,https://www.igashop.com.au/product/pods-snickers-chocolate-share-pack-622742
881812,Pop Rocks Strawberry,$1.00,https://www.igashop.com.au/product/pop-rocks-strawberry-881812
836477,Pop Rocks Tutti Frutti Gum,$0.60,https://www.igashop.com.au/product/pop-rocks-tutti-frutti-gum-836477
180000001551,Popcorn People Fairy Floss Bag,$2.55,https://www.igashop.com.au/product/popcorn-people-fairy-floss-bag-180000001551
372839,Quick Eze Chewy Forest Berry Antacid Tablets,$3.50,https://www.igashop.com.au/product/quick-eze-chewy-forest-berry-antacid-tablets-372839
366765,Quick Eze Chewy Peppermint Multipack,$9.00,https://www.igashop.com.au/product/quick-eze-chewy-peppermint-multipack-366765
446280,Quick Eze Chewy Peppermint Stick Pack,$3.50,https://www.igashop.com.au/product/quick-eze-chewy-peppermint-stick-pack-446280
94562,Quick Eze Tablet Original Stick Pack,$3.50,https://www.igashop.com.au/product/quick-eze-tablet-original-stick-pack-94562
750676,Raffaello 10 Piece Chocolate Heart Gift Box,$4.50,https://www.igashop.com.au/product/raffaello-10-piece-chocolate-heart-gift-box-750676
452168,Raffaello 24 Piece Chocolate Gift Box,$18.00,https://www.igashop.com.au/product/raffaello-24-piece-chocolate-gift-box-452168
317499,Raffaello Coconut Cream Gift Box,$11.00,https://www.igashop.com.au/product/raffaello-coconut-cream-gift-box-317499
126686,Red Tulip Carnival Easter Rabbit,$8.00,https://www.igashop.com.au/product/red-tulip-carnival-easter-rabbit-126686
400747,Red Tulip Milk Chocolate Easter Egg Crate,$7.50,https://www.igashop.com.au/product/red-tulip-milk-chocolate-easter-egg-crate-400747
916455,Red Tulip Ultimate Easter Hunt Bag,$23.00,https://www.igashop.com.au/product/red-tulip-ultimate-easter-hunt-bag-916455
190000004539,Reeses Peanut Butter Cup Milk Chocolate,$3.00,https://www.igashop.com.au/product/reeses-peanut-butter-cup-milk-chocolate-190000004539
75746,Reeses Peanut Butter Cup Milk Chocolate,$3.00,https://www.igashop.com.au/product/reeses-peanut-butter-cup-milk-chocolate-75746
190000004583,Reeses Peanut Butter Cups Miniatures Milk Chocolate,$5.00,https://www.igashop.com.au/product/reeses-peanut-butter-cups-miniatures-milk-chocolate-190000004583
20000001475,Scorched Peanut Bar Bites,$5.50,https://www.igashop.com.au/product/scorched-peanut-bar-bites-20000001475
25474,Skittles Fruits Lollies Box,$1.55,https://www.igashop.com.au/product/skittles-fruits-lollies-box-25474
43281,Skittles Fruits Lollies Large Bag,$6.00,https://www.igashop.com.au/product/skittles-fruits-lollies-large-bag-43281
762149,Skittles Fruits Lollies Party Share Bag,$4.20,https://www.igashop.com.au/product/skittles-fruits-lollies-party-share-bag-762149
25479,Skittles Sours Lollies Box,$1.55,https://www.igashop.com.au/product/skittles-sours-lollies-box-25479
43299,Skittles Sours Lollies Large Bag,$6.00,https://www.igashop.com.au/product/skittles-sours-lollies-large-bag-43299
446256,Smyths Christmas Mix,$6.30,https://www.igashop.com.au/product/smyths-christmas-mix-446256
622022,Snickers Chocolate Large Party Share Bag 360 Grams,$5.00,https://www.igashop.com.au/product/snickers-chocolate-large-party-share-bag-360-grams-622022
622030,Snickers Chocolate Medium Party Share Bag 216G,$5.00,https://www.igashop.com.au/product/snickers-chocolate-medium-party-share-bag-216g-622030
638413,Soothers Blackcurrant Stick,$2.75,https://www.igashop.com.au/product/soothers-blackcurrant-stick-638413
638390,Soothers Blackcurrant Stick Multipack,$6.50,https://www.igashop.com.au/product/soothers-blackcurrant-stick-multipack-638390
3341,Soothers Eucalmenthol Stick Multipack,$6.50,https://www.igashop.com.au/product/soothers-eucalmenthol-stick-multipack-3341
20000002481,Soothers Honey Lemon Lozenges,$6.50,https://www.igashop.com.au/product/soothers-honey-lemon-lozenges-20000002481
667789,Soothers Honey Lemon Lozenges,$2.75,https://www.igashop.com.au/product/soothers-honey-lemon-lozenges-667789
34724,Soothers Liquid Centres Lemon Lime Stick,$2.75,https://www.igashop.com.au/product/soothers-liquid-centres-lemon-lime-stick-34724
20000004524,Soothers Lozenges Eucalyptus Menthol,$2.75,https://www.igashop.com.au/product/soothers-lozenges-eucalyptus-menthol-20000004524
178895,Sour Patch Kids Berry Lollies,$4.00,https://www.igashop.com.au/product/sour-patch-kids-berry-lollies-178895
15482,Strepsils Double Antibacterial Soothing Sore Throat Lozenges Orange,$6.00,https://www.igashop.com.au/product/strepsils-double-antibacterial-soothing-sore-throat-lozenges-orange-15482
373990,Strepsils Double Antibacterial Soothing Sore Throat Lozenges Orange,$12.50,https://www.igashop.com.au/product/strepsils-double-antibacterial-soothing-sore-throat-lozenges-orange-373990
373908,Strepsils Double Antibacterial Soothing Throat Lozenge Honey And Lemon,$12.50,https://www.igashop.com.au/product/strepsils-double-antibacterial-soothing-throat-lozenge-honey-and-lemon-373908
622975,Strepsils Extra Honey And Lemon Sore Throat Fast Numb Lozenges,$19.00,https://www.igashop.com.au/product/strepsils-extra-honey-and-lemon-sore-throat-fast-numb-lozenges-622975
386786,Strepsils Plus Anaesthetic Lozenges,$19.00,https://www.igashop.com.au/product/strepsils-plus-anaesthetic-lozenges-386786
386825,Strepsils Plus Anaesthetic Lozenges,$9.50,https://www.igashop.com.au/product/strepsils-plus-anaesthetic-lozenges-386825
339807,Strepsils Sore Throat Sugar Free Lemon Lozenges,$12.50,https://www.igashop.com.au/product/strepsils-sore-throat-sugar-free-lemon-lozenges-339807
20000003107,Swedish Fish Red Box,$3.00,https://www.igashop.com.au/product/swedish-fish-red-box-20000003107
672200,Terrys Chocolate Orange Milk,$7.20,https://www.igashop.com.au/product/terrys-chocolate-orange-milk-672200
160000013406,The Market Grocer Chocolate Bullets Plain,$6.00,https://www.igashop.com.au/product/the-market-grocer-chocolate-bullets-plain-160000013406
5130,The Market Grocer Dark Chocolate Cranberries,$8.39,https://www.igashop.com.au/product/the-market-grocer-dark-chocolate-cranberries-5130
8581,The Market Grocer Milk Bottles,$3.69,https://www.igashop.com.au/product/the-market-grocer-milk-bottles-8581
160000013402,The Market Grocer Spearmint Leaves,$4.79,https://www.igashop.com.au/product/the-market-grocer-spearmint-leaves-160000013402
8588,The Market Grocer Strawberries Cream,$3.69,https://www.igashop.com.au/product/the-market-grocer-strawberries-cream-8588
4798,The Market Grocer Turkish Delight Rose,$5.89,https://www.igashop.com.au/product/the-market-grocer-turkish-delight-rose-4798
906361,The Natural Confectionery Co Frogs Reduced Sugar,$3.50,https://www.igashop.com.au/product/the-natural-confectionery-co-frogs-reduced-sugar-906361
906311,The Natural Confectionery Co Fruit Basket Reduced Sugar,$3.50,https://www.igashop.com.au/product/the-natural-confectionery-co-fruit-basket-reduced-sugar-906311
379831,Tic Tac Orange,$2.00,https://www.igashop.com.au/product/tic-tac-orange-379831
405349,Tic Tac Orange Mints Bigbox,$3.20,https://www.igashop.com.au/product/tic-tac-orange-mints-bigbox-405349
380264,Tic Tac Peppermint,$2.00,https://www.igashop.com.au/product/tic-tac-peppermint-380264
405577,Tic Tac Peppermint,$3.20,https://www.igashop.com.au/product/tic-tac-peppermint-405577
20000006946,Tnt Sour Blasts,$2.19,https://www.igashop.com.au/product/tnt-sour-blasts-20000006946
62921,Toblerone,$4.40,https://www.igashop.com.au/product/toblerone-62921
61624,Toblerone Milk Chocolate Bar,$2.50,https://www.igashop.com.au/product/toblerone-milk-chocolate-bar-61624
653230,Toblerone Milk Chocolate Bar,$8.00,https://www.igashop.com.au/product/toblerone-milk-chocolate-bar-653230
918685,Toblerone Milk Chocolate Gift Bag,$6.00,https://www.igashop.com.au/product/toblerone-milk-chocolate-gift-bag-918685
803115,Tom Luke Dark Chocolate Mint Snackballs,$5.50,https://www.igashop.com.au/product/tom-luke-dark-chocolate-mint-snackballs-803115
803259,Tom Luke Original Dark Chocolate Snackballs,$5.50,https://www.igashop.com.au/product/tom-luke-original-dark-chocolate-snackballs-803259
621076,Twix Bar,$2.20,https://www.igashop.com.au/product/twix-bar-621076
925072,Twix Bar,$1.10,https://www.igashop.com.au/product/twix-bar-925072
620368,Twix Pods Chocolate Share Pack,$6.00,https://www.igashop.com.au/product/twix-pods-chocolate-share-pack-620368
98943,Unicorn Dipper Stand,$2.29,https://www.igashop.com.au/product/unicorn-dipper-stand-98943
83621,Vicks Lozenges Original Menthol,$5.90,https://www.igashop.com.au/product/vicks-lozenges-original-menthol-83621
83613,Vicks Vapodrops Lozenges Butter Menthol,$5.90,https://www.igashop.com.au/product/vicks-vapodrops-lozenges-butter-menthol-83613
83639,Vicks Vapodrops Lozenges Peppermint,$5.90,https://www.igashop.com.au/product/vicks-vapodrops-lozenges-peppermint-83639
418685,Violet Crumble,$1.25,https://www.igashop.com.au/product/violet-crumble-418685
409898,Violet Crumble Bites,$5.00,https://www.igashop.com.au/product/violet-crumble-bites-409898
947391,Violet Crumble Dark Chocolate Honeycomb Bag,$5.00,https://www.igashop.com.au/product/violet-crumble-dark-chocolate-honeycomb-bag-947391
160834,Violet Crumble Honeycomb Caramel,$5.00,https://www.igashop.com.au/product/violet-crumble-honeycomb-caramel-160834
20000003700,Warheads All Mixed Up Sour Chewy Candy,$3.00,https://www.igashop.com.au/product/warheads-all-mixed-up-sour-chewy-candy-20000003700
20000003701,Warheads Cubes,$3.00,https://www.igashop.com.au/product/warheads-cubes-20000003701
180000000444,Warheads Sour Chewy Cubes,$3.50,https://www.igashop.com.au/product/warheads-sour-chewy-cubes-180000000444
701944,Well Naturally Bar Milk,$5.30,https://www.igashop.com.au/product/well-naturally-bar-milk-701944
700744,Well Naturally Bar Sugar Free Dark,$5.30,https://www.igashop.com.au/product/well-naturally-bar-sugar-free-dark-700744
702377,Well Naturally Chocolate Almond Dark No Sugar Add,$3.15,https://www.igashop.com.au/product/well-naturally-chocolate-almond-dark-no-sugar-add-702377
701915,Well Naturally Chocolate Mint Dark No Sugar Add,$5.30,https://www.igashop.com.au/product/well-naturally-chocolate-mint-dark-no-sugar-add-701915
701936,Well Naturally Dark Chocolate Coconut Rough No Sugar Added,$5.30,https://www.igashop.com.au/product/well-naturally-dark-chocolate-coconut-rough-no-sugar-added-701936
612674,Well Naturally No Sugar Added Milk Choc Bar,$2.50,https://www.igashop.com.au/product/well-naturally-no-sugar-added-milk-choc-bar-612674
702000,Well Naturally No Sugar Added Milk Choc Coconut,$5.30,https://www.igashop.com.au/product/well-naturally-no-sugar-added-milk-choc-coconut-702000
359551,Werthers Original Chewy Toffees,$2.40,https://www.igashop.com.au/product/werthers-original-chewy-toffees-359551
362473,Werthers Original Chewy Toffees,$4.25,https://www.igashop.com.au/product/werthers-original-chewy-toffees-362473
456308,Werthers Original Cream Candies,$4.95,https://www.igashop.com.au/product/werthers-original-cream-candies-456308
55186,Werthers Original Cream Candies,$2.40,https://www.igashop.com.au/product/werthers-original-cream-candies-55186
52756,Werthers Original Cream Candies Classic,$4.25,https://www.igashop.com.au/product/werthers-original-cream-candies-classic-52756
28600,Werthers Original Cream Candies Minis No Sugar Added,$2.25,https://www.igashop.com.au/product/werthers-original-cream-candies-minis-no-sugar-added-28600
460828,Werthers Original Cream Candies No Sugar Added,$4.25,https://www.igashop.com.au/product/werthers-original-cream-candies-no-sugar-added-460828
351870,Werthers Original Creamy Filling,$4.25,https://www.igashop.com.au/product/werthers-original-creamy-filling-351870
40712,Werthers Original Toffee Eclairs,$4.25,https://www.igashop.com.au/product/werthers-original-toffee-eclairs-40712
20000003449,White Orchid Caramel Fudge,$2.00,https://www.igashop.com.au/product/white-orchid-caramel-fudge-20000003449
874302,Whittakers Almond Gold Slab,$2.50,https://www.igashop.com.au/product/whittakers-almond-gold-slab-874302
343097,Whittakers Block Coconut 33 Cocoa,$8.00,https://www.igashop.com.au/product/whittakers-block-coconut-33-cocoa-343097
343136,Whittakers Block Creamy Milk 33 Cocoa,$8.00,https://www.igashop.com.au/product/whittakers-block-creamy-milk-33-cocoa-343136
928313,Whittakers Block Dark Salted Caramel,$8.00,https://www.igashop.com.au/product/whittakers-block-dark-salted-caramel-928313
336930,Whittakers Coconut Slab Milk Chocolate,$2.50,https://www.igashop.com.au/product/whittakers-coconut-slab-milk-chocolate-336930
471764,Whittakers Peanut Slab Milk Chocolate,$2.50,https://www.igashop.com.au/product/whittakers-peanut-slab-milk-chocolate-471764
664448,Willy Wonka Fabulicious Raspberry Twists,$13.75,https://www.igashop.com.au/product/willy-wonka-fabulicious-raspberry-twists-664448
190000001620,Wonka Big Chewy Nerds,$3.50,https://www.igashop.com.au/product/wonka-big-chewy-nerds-190000001620
190000001626,Wonka Bottle Caps,$3.00,https://www.igashop.com.au/product/wonka-bottle-caps-190000001626
190000001622,Wonka Everlasting Gobstopper Box,$3.00,https://www.igashop.com.au/product/wonka-everlasting-gobstopper-box-190000001622
190000001623,Wonka Nerds Grape Strawberry,$3.00,https://www.igashop.com.au/product/wonka-nerds-grape-strawberry-190000001623
190000001629,Wonka Nerds Gummy Clusters Box,$5.19,https://www.igashop.com.au/product/wonka-nerds-gummy-clusters-box-190000001629
190000001624,Wonka Rainbow Nerds,$3.50,https://www.igashop.com.au/product/wonka-rainbow-nerds-190000001624
190000001621,Wonka Sour Chewy Nerds,$3.00,https://www.igashop.com.au/product/wonka-sour-chewy-nerds-190000001621
717123,Wrigler 5 Gum Stick Chewing Gum Watermelon,$5.50,https://www.igashop.com.au/product/wrigler-5-gum-stick-chewing-gum-watermelon-717123
711444,Wrigleys 5 Gum Blueberry Rush Stick Sugarfree,$2.50,https://www.igashop.com.au/product/wrigleys-5-gum-blueberry-rush-stick-sugarfree-711444
717097,Wrigleys 5 Gum Blueberry Rush Sugar Free,$5.50,https://www.igashop.com.au/product/wrigleys-5-gum-blueberry-rush-sugar-free-717097
722084,Wrigleys 5 Gum Watermelon Burst Sugar Free,$2.50,https://www.igashop.com.au/product/wrigleys-5-gum-watermelon-burst-sugar-free-722084
160000017890,Wrigleys Big Red,$3.60,https://www.igashop.com.au/product/wrigleys-big-red-160000017890
160000017891,Wrigleys Double Mint,$3.60,https://www.igashop.com.au/product/wrigleys-double-mint-160000017891
44949,Wrigleys Extra Strawberry Chewing Gum Sugar Free,$2.50,https://www.igashop.com.au/product/wrigleys-extra-strawberry-chewing-gum-sugar-free-44949
160000017903,Wrigleys Extra Sweet Watermelon,,https://www.igashop.com.au/product/wrigleys-extra-sweet-watermelon-160000017903
88846,Wrigleys Juicy Fruit Chewing Gum Multipack,,https://www.igashop.com.au/product/wrigleys-juicy-fruit-chewing-gum-multipack-88846
88820,Wrigleys Pk Gold Original Chewing Gum Multipack,,https://www.igashop.com.au/product/wrigleys-pk-gold-original-chewing-gum-multipack-88820
955828,Yupi Gummi Lunch,,https://www.igashop.com.au/product/yupi-gummi-lunch-955828
321066,Yupi Gummy Happy Bear Bag,,https://www.igashop.com.au/product/yupi-gummy-happy-bear-bag-321066
708530,Yupi Gummy Hot Dog,,https://www.igashop.com.au/product/yupi-gummy-hot-dog-708530
321448,Yupi Mega Pizza,,https://www.igashop.com.au/product/yupi-mega-pizza-321448
180000000259,Yupi Mini Burger Bag,,https://www.igashop.com.au/product/yupi-mini-burger-bag-180000000259
321040,Yupi Yupi Neon Worms Bag,,https://www.igashop.com.au/product/yupi-yupi-neon-worms-bag-321040
