ID,Name,Price,URL
694008,Darrell Lea Easter Treats Speckled Chick Eggs,$5.00,https://www.igashop.com.au/product/darrell-lea-easter-treats-speckled-chick-eggs-694008
459542,Darrell Lea Liqourice Twist Milk Chocolate Raspberry,$5.50,https://www.igashop.com.au/product/darrell-lea-liqourice-twist-milk-chocolate-raspberry-459542
978517,Darrell Lea Liquorice Eggs,$5.00,https://www.igashop.com.au/product/darrell-lea-liquorice-eggs-978517
827562,Darrell Lea Liquorice Mixed Flavours,$4.90,https://www.igashop.com.au/product/darrell-lea-liquorice-mixed-flavours-827562
459301,Darrell Lea Liquorice Twists,$5.50,https://www.igashop.com.au/product/darrell-lea-liquorice-twists-459301
978575,Darrell Lea Milk Chocolate Bunny,$7.50,https://www.igashop.com.au/product/darrell-lea-milk-chocolate-bunny-978575
160000012172,Darrell Lea Milk Chocolate Coated Original Liquorice Twists,$5.50,https://www.igashop.com.au/product/darrell-lea-milk-chocolate-coated-original-liquorice-twists-160000012172
978504,Darrell Lea Milk Chocolate Eggs,$5.00,https://www.igashop.com.au/product/darrell-lea-milk-chocolate-eggs-978504
459628,Darrell Lea Milk Chocolate Liquorice Bullets,$4.90,https://www.igashop.com.au/product/darrell-lea-milk-chocolate-liquorice-bullets-459628
370379,Darrell Lea Milk Chocolate Rocklea Road,$5.00,https://www.igashop.com.au/product/darrell-lea-milk-chocolate-rocklea-road-370379
397591,Darrell Lea Nougat Egg,$10.00,https://www.igashop.com.au/product/darrell-lea-nougat-egg-397591
825853,Darrell Lea Raspberry Liquorice Milk Chocolate Block,$5.50,https://www.igashop.com.au/product/darrell-lea-raspberry-liquorice-milk-chocolate-block-825853
684723,Darrell Lea Rocklea Road Block,$6.00,https://www.igashop.com.au/product/darrell-lea-rocklea-road-block-684723
698015,Darrell Lea Rocklea Road Milk Chocolate Bunny,$7.50,https://www.igashop.com.au/product/darrell-lea-rocklea-road-milk-chocolate-bunny-698015
196733,Darrell Lea Rocky Road Raspberry,$6.00,https://www.igashop.com.au/product/darrell-lea-rocky-road-raspberry-196733
966895,Darrell Lea Soft Centre Gift Box,$14.00,https://www.igashop.com.au/product/darrell-lea-soft-centre-gift-box-966895
681979,Darrell Lea Traditional Liquorice Block,$6.00,https://www.igashop.com.au/product/darrell-lea-traditional-liquorice-block-681979
826171,Darrell Lea Traditional Liquorice Block,$5.50,https://www.igashop.com.au/product/darrell-lea-traditional-liquorice-block-826171
826082,Darrell Lea Traditional Milk Chocolate Block,$5.00,https://www.igashop.com.au/product/darrell-lea-traditional-milk-chocolate-block-826082
459385,Darrell Lea Twists Dark Chocolate Liquorice,$5.50,https://www.igashop.com.au/product/darrell-lea-twists-dark-chocolate-liquorice-459385
459343,Darrell Lea Twists Raspberry Liquorice,$5.50,https://www.igashop.com.au/product/darrell-lea-twists-raspberry-liquorice-459343
841325,Darrell Lea White Chocolate Raspberry Bullets,$4.90,https://www.igashop.com.au/product/darrell-lea-white-chocolate-raspberry-bullets-841325
670868,Difflam Plus Anaesthetic Sore Throat Lozenges Blackcurrant Flavour,$10.00,https://www.igashop.com.au/product/difflam-plus-anaesthetic-sore-throat-lozenges-blackcurrant-flavour-670868
670915,Difflam Plus Sore Throat Lozenges Anaesthetic Blackcurrant,$10.00,https://www.igashop.com.au/product/difflam-plus-sore-throat-lozenges-anaesthetic-blackcurrant-670915
671872,Difflam Sore Throat Lozenge Honey Lemon Flavour,$6.50,https://www.igashop.com.au/product/difflam-sore-throat-lozenge-honey-lemon-flavour-671872
344022,Double D Eucalyptus Honey Drops Eucalyptus Honey,$2.00,https://www.igashop.com.au/product/double-d-eucalyptus-honey-drops-eucalyptus-honey-344022
303885,Double D Sugar Free Butter Candy Drops,$2.70,https://www.igashop.com.au/product/double-d-sugar-free-butter-candy-drops-303885
303893,Double D Sugar Free Clear Mints,$2.70,https://www.igashop.com.au/product/double-d-sugar-free-clear-mints-303893
303869,Double D Sugar Free Fruit Drops,$2.70,https://www.igashop.com.au/product/double-d-sugar-free-fruit-drops-303869
303843,Double D Sugar Free Lemon Lime Drops,$2.70,https://www.igashop.com.au/product/double-d-sugar-free-lemon-lime-drops-303843
20000002239,Double D Sugarfree Marshmallows,$2.70,https://www.igashop.com.au/product/double-d-sugarfree-marshmallows-20000002239
762123,Eclipse Chewy Mints Peppermint Bottle,$4.50,https://www.igashop.com.au/product/eclipse-chewy-mints-peppermint-bottle-762123
357371,Eclipse Chewy Mints Peppermint Tin,$2.00,https://www.igashop.com.au/product/eclipse-chewy-mints-peppermint-tin-357371
762131,Eclipse Chewy Mints Spearmint Bottle,$4.50,https://www.igashop.com.au/product/eclipse-chewy-mints-spearmint-bottle-762131
357363,Eclipse Chewy Mints Spearmint Tin Spearmint,$2.00,https://www.igashop.com.au/product/eclipse-chewy-mints-spearmint-tin-spearmint-357363
440925,Eclipse Intense Mints Sugar Free Large Tin,$4.00,https://www.igashop.com.au/product/eclipse-intense-mints-sugar-free-large-tin-440925
320468,Eclipse Peppermint Ice Chewing Gum Sugar Free Multipack,$4.00,https://www.igashop.com.au/product/eclipse-peppermint-ice-chewing-gum-sugar-free-multipack-320468
440878,Eclipse Peppermint Mints Sugar Free Large Tin,$4.00,https://www.igashop.com.au/product/eclipse-peppermint-mints-sugar-free-large-tin-440878
440598,Eclipse Spearmint Mints Sugar Free Large Tin,$4.00,https://www.igashop.com.au/product/eclipse-spearmint-mints-sugar-free-large-tin-440598
440661,Eclipse Strawberry Mints Sugar Free Large Tin,$4.00,https://www.igashop.com.au/product/eclipse-strawberry-mints-sugar-free-large-tin-440661
387062,Europe Nougat Honey Log,$2.50,https://www.igashop.com.au/product/europe-nougat-honey-log-387062
387020,Europe Summer Roll,$2.50,https://www.igashop.com.au/product/europe-summer-roll-387020
952003,Evropa Candy Mixed Fruit,$3.99,https://www.igashop.com.au/product/evropa-candy-mixed-fruit-952003
952029,Evropa Cherry Candy,$2.50,https://www.igashop.com.au/product/evropa-cherry-candy-952029
58281,Extra Peppermint Chewing Gum Sugar Free,$5.50,https://www.igashop.com.au/product/extra-peppermint-chewing-gum-sugar-free-58281
25725,Extra Peppermint Chewing Gum Sugar Free Bottle,$4.50,https://www.igashop.com.au/product/extra-peppermint-chewing-gum-sugar-free-bottle-25725
197629,Extra Peppermint Sugar Free Chewing Gum,$5.00,https://www.igashop.com.au/product/extra-peppermint-sugar-free-chewing-gum-197629
82442,Extra Peppermint Sugar Free Gum,$2.50,https://www.igashop.com.au/product/extra-peppermint-sugar-free-gum-82442
481879,Extra Soft Chew White Peppermint Chewing Gum Sugar Free Bottle,$4.50,https://www.igashop.com.au/product/extra-soft-chew-white-peppermint-chewing-gum-sugar-free-bottle-481879
481829,Extra Soft Chew White Spearmint Chewing Gum Sugar Free Bottle,$4.50,https://www.igashop.com.au/product/extra-soft-chew-white-spearmint-chewing-gum-sugar-free-bottle-481829
58435,Extra Spearmint Chewing Gum Sugar Free,$5.50,https://www.igashop.com.au/product/extra-spearmint-chewing-gum-sugar-free-58435
81909,Extra Spearmint Chewing Gum Sugar Free,$2.50,https://www.igashop.com.au/product/extra-spearmint-chewing-gum-sugar-free-81909
25686,Extra Spearmint Chewing Gum Sugar Free Bottle,$4.50,https://www.igashop.com.au/product/extra-spearmint-chewing-gum-sugar-free-bottle-25686
603324,Extra Strawberry Chewing Gum Sugar Free,$5.50,https://www.igashop.com.au/product/extra-strawberry-chewing-gum-sugar-free-603324
761716,Extra Strawberry Chewing Gum Sugar Free Bottle,$4.50,https://www.igashop.com.au/product/extra-strawberry-chewing-gum-sugar-free-bottle-761716
323911,Extra White Bubblemint Chewing Gum Sugar Free,$5.00,https://www.igashop.com.au/product/extra-white-bubblemint-chewing-gum-sugar-free-323911
323929,Extra White Bubblemint Chewing Gum Sugar Free Bottle,$4.50,https://www.igashop.com.au/product/extra-white-bubblemint-chewing-gum-sugar-free-bottle-323929
603316,Extra White Lemon Lime Chewing Gum Sugar Free Bottle,$4.50,https://www.igashop.com.au/product/extra-white-lemon-lime-chewing-gum-sugar-free-bottle-603316
8710,Extra White Lemon Lime Chewing Gum Sugar Free Multipack,$4.00,https://www.igashop.com.au/product/extra-white-lemon-lime-chewing-gum-sugar-free-multipack-8710
89884,Extra White Peppermint Chewing Gum Sugar Free,$5.00,https://www.igashop.com.au/product/extra-white-peppermint-chewing-gum-sugar-free-89884
499827,Extra White Peppermint Chewing Gum Sugar Free Bottle,$4.50,https://www.igashop.com.au/product/extra-white-peppermint-chewing-gum-sugar-free-bottle-499827
178311,Extra White Spearmint Chewing Gum Sugar Free,$5.00,https://www.igashop.com.au/product/extra-white-spearmint-chewing-gum-sugar-free-178311
197637,Extra White Spearmint Chewing Gum Sugar Free,$5.00,https://www.igashop.com.au/product/extra-white-spearmint-chewing-gum-sugar-free-197637
178308,Extra White Spearmint Chewing Gum Sugar Free Bottle,$4.50,https://www.igashop.com.au/product/extra-white-spearmint-chewing-gum-sugar-free-bottle-178308
959733,Favourites Dark Edition,$12.00,https://www.igashop.com.au/product/favourites-dark-edition-959733
391605,Ferrero Rocher,$2.25,https://www.igashop.com.au/product/ferrero-rocher-391605
979893,Ferrero Rocher 17 Piece Cone,$20.00,https://www.igashop.com.au/product/ferrero-rocher-17-piece-cone-979893
937804,Ferrero Rocher 8 Piece Heart Boxed Chocolate Gift,$8.50,https://www.igashop.com.au/product/ferrero-rocher-8-piece-heart-boxed-chocolate-gift-937804
170000000774,Ferrero Rocher Boxed Chocolate,$8.00,https://www.igashop.com.au/product/ferrero-rocher-boxed-chocolate-170000000774
170000001206,Ferrero Rocher Boxed Chocolate Gift,$20.00,https://www.igashop.com.au/product/ferrero-rocher-boxed-chocolate-gift-170000001206
32730,Ferrero Rocher Chocolate,$28.00,https://www.igashop.com.au/product/ferrero-rocher-chocolate-32730
105619,Ferrero Rocher Chocolate Easter Egg Gift Sleever,$18.00,https://www.igashop.com.au/product/ferrero-rocher-chocolate-easter-egg-gift-sleever-105619
490629,Ferrero Rocher Chocolates Box,$4.50,https://www.igashop.com.au/product/ferrero-rocher-chocolates-box-490629
219984,Ferrero Rocher Christmas Cube,$20.00,https://www.igashop.com.au/product/ferrero-rocher-christmas-cube-219984
20000003779,Ferrero Rocher Cocoa Eggs,$7.50,https://www.igashop.com.au/product/ferrero-rocher-cocoa-eggs-20000003779
409275,Ferrero Rocher Collection Chocolates Rocher Rondnoir Raffaello,$10.00,https://www.igashop.com.au/product/ferrero-rocher-collection-chocolates-rocher-rondnoir-raffaello-409275
190000009762,Ferrero Rocher Dark Chocolate Crunchy Hazelnut Hollow Easter Gift,$12.00,https://www.igashop.com.au/product/ferrero-rocher-dark-chocolate-crunchy-hazelnut-hollow-easter-gift-190000009762
170000001032,Ferrero Rocher Milk Chocolate And Hazelnut Hollow Squirrel,$8.00,https://www.igashop.com.au/product/ferrero-rocher-milk-chocolate-and-hazelnut-hollow-squirrel-170000001032
316451,Ferrero Rocher Raffaello T3 Chocolate Pack,$2.25,https://www.igashop.com.au/product/ferrero-rocher-raffaello-t3-chocolate-pack-316451
26894,Ferrero Rocher Star T3,$4.50,https://www.igashop.com.au/product/ferrero-rocher-star-t3-26894
409259,Ferrero Rocher T24 Collection,$28.00,https://www.igashop.com.au/product/ferrero-rocher-t24-collection-409259
799227,Ferrero Rocher Tree Boxed Chocolate Gift,$17.00,https://www.igashop.com.au/product/ferrero-rocher-tree-boxed-chocolate-gift-799227
632174,Fibre One Chocolate Fudge Brownies,$5.50,https://www.igashop.com.au/product/fibre-one-chocolate-fudge-brownies-632174
931772,Fishermans Friend Blackcurrant Sugar Free,$3.00,https://www.igashop.com.au/product/fishermans-friend-blackcurrant-sugar-free-931772
678170,Fishermans Friend Honey Lemon Sugar Free,$3.00,https://www.igashop.com.au/product/fishermans-friend-honey-lemon-sugar-free-678170
89818,Fishermans Friend Mints Extra Strong,$3.00,https://www.igashop.com.au/product/fishermans-friend-mints-extra-strong-89818
976633,Fishermans Friend Mints Fresh Sugar Free,$3.00,https://www.igashop.com.au/product/fishermans-friend-mints-fresh-sugar-free-976633
60534,Fishermans Friend Mints Spearmint Sugar Free,$3.00,https://www.igashop.com.au/product/fishermans-friend-mints-spearmint-sugar-free-60534
99889,Fishermans Friend Strong Menthol And Aniseed,$3.00,https://www.igashop.com.au/product/fishermans-friend-strong-menthol-and-aniseed-99889
151335,Fruits Lollies Party Share Bucket,$14.30,https://www.igashop.com.au/product/fruits-lollies-party-share-bucket-151335
386414,Frys Turkish Delight Twin Pack,$2.50,https://www.igashop.com.au/product/frys-turkish-delight-twin-pack-386414
884365,Golden Days Bars Sesame Snaps Dark Chocolate,$3.50,https://www.igashop.com.au/product/golden-days-bars-sesame-snaps-dark-chocolate-884365
371168,Golden Rough Milk Chocolate Bar,$1.25,https://www.igashop.com.au/product/golden-rough-milk-chocolate-bar-371168
146212,Haribo Confectionery Goldbears,$1.30,https://www.igashop.com.au/product/haribo-confectionery-goldbears-146212
146440,Haribo Confectionery Tangfastics,$1.30,https://www.igashop.com.au/product/haribo-confectionery-tangfastics-146440
806888,Haribo Goldbears,$4.00,https://www.igashop.com.au/product/haribo-goldbears-806888
180000000290,Haribo Mega Roulette,$1.20,https://www.igashop.com.au/product/haribo-mega-roulette-180000000290
807004,Haribo Starmix,$4.00,https://www.igashop.com.au/product/haribo-starmix-807004
807012,Haribo Tangfastics,$4.00,https://www.igashop.com.au/product/haribo-tangfastics-807012
20000002309,Harringtons Chocolate Mint Cream Thins,$3.80,https://www.igashop.com.au/product/harringtons-chocolate-mint-cream-thins-20000002309
16000001580,Hersheys Milk Duds,$4.00,https://www.igashop.com.au/product/hersheys-milk-duds-16000001580
624587,Hubba Bubba Groovy Grape Bubble Gum Tape,$3.00,https://www.igashop.com.au/product/hubba-bubba-groovy-grape-bubble-gum-tape-624587
396299,Hubba Bubba Outrageously Original Bubble Gum Chunk 5 Piece,$1.50,https://www.igashop.com.au/product/hubba-bubba-outrageously-original-bubble-gum-chunk-5-piece-396299
89452,Hubba Bubba Seriously Strawberry Bubble Gum Chunk 5 Piece,$1.50,https://www.igashop.com.au/product/hubba-bubba-seriously-strawberry-bubble-gum-chunk-5-piece-89452
624579,Hubba Bubba Seriously Strawberry Bubble Gum Tape,$3.00,https://www.igashop.com.au/product/hubba-bubba-seriously-strawberry-bubble-gum-tape-624579
641830,Hubba Bubba Variety Pack Bubble Gum Multipack 5 Piece,$5.50,https://www.igashop.com.au/product/hubba-bubba-variety-pack-bubble-gum-multipack-5-piece-641830
20000001757,Jolly Lolly Jersey Caramels,$2.30,https://www.igashop.com.au/product/jolly-lolly-jersey-caramels-20000001757
20000001399,Jolly Rancher Gummies Sours,$10.00,https://www.igashop.com.au/product/jolly-rancher-gummies-sours-20000001399
160000018126,Jolly Rancher Hard Candy,$6.00,https://www.igashop.com.au/product/jolly-rancher-hard-candy-160000018126
180000000725,Joo Joos Blugo Berry Clouds,$3.00,https://www.igashop.com.au/product/joo-joos-blugo-berry-clouds-180000000725
81051,Joo Joos Fantasy Belts,$3.00,https://www.igashop.com.au/product/joo-joos-fantasy-belts-81051
20000002353,Joo Joos Sour Party Mix,$3.00,https://www.igashop.com.au/product/joo-joos-sour-party-mix-20000002353
80966,Joo Joos Strawberry Belts,$3.00,https://www.igashop.com.au/product/joo-joos-strawberry-belts-80966
20000002354,Joo Joos Wilbo Worms Sour,$3.00,https://www.igashop.com.au/product/joo-joos-wilbo-worms-sour-20000002354
458193,Joojoos Clouds Ruby Strawberry,$3.00,https://www.igashop.com.au/product/joojoos-clouds-ruby-strawberry-458193
691089,Kinder Bueno Chocolate Bar,$2.50,https://www.igashop.com.au/product/kinder-bueno-chocolate-bar-691089
657527,Kinder Bueno White Chocolate Bar,$2.50,https://www.igashop.com.au/product/kinder-bueno-white-chocolate-bar-657527
428452,Kinder Chocolate 6 Snack Bar Pack,$5.00,https://www.igashop.com.au/product/kinder-chocolate-6-snack-bar-pack-428452
831930,Kinder Chocolate Little Ones,$2.50,https://www.igashop.com.au/product/kinder-chocolate-little-ones-831930
375798,Kinder Chocolate Sharepack,$6.00,https://www.igashop.com.au/product/kinder-chocolate-sharepack-375798
190000009778,Kinder Easter Bunny,$12.00,https://www.igashop.com.au/product/kinder-easter-bunny-190000009778
105245,Kinder Figure Santa,$3.00,https://www.igashop.com.au/product/kinder-figure-santa-105245
26909,Kinder Figurines Christmas,$6.00,https://www.igashop.com.au/product/kinder-figurines-christmas-26909
20000003833,Kinder Mini Milk Chocolate Hazelnut Easter Eggs,$5.50,https://www.igashop.com.au/product/kinder-mini-milk-chocolate-hazelnut-easter-eggs-20000003833
144,Kinder Santa,$3.50,https://www.igashop.com.au/product/kinder-santa-144
26925,Kinder Santa,$6.00,https://www.igashop.com.au/product/kinder-santa-26925
739146,Kinder Surprise Chocolate Egg Blue,$2.50,https://www.igashop.com.au/product/kinder-surprise-chocolate-egg-blue-739146
739104,Kinder Surprise Chocolate Egg Pink,$2.50,https://www.igashop.com.au/product/kinder-surprise-chocolate-egg-pink-739104
135978,Kinder Surprise Maxi Justice League,$11.00,https://www.igashop.com.au/product/kinder-surprise-maxi-justice-league-135978
646576,Kinder Surprise Maxi Miraculous,$11.00,https://www.igashop.com.au/product/kinder-surprise-maxi-miraculous-646576
71580,Kinder Surprise Natoons,$6.00,https://www.igashop.com.au/product/kinder-surprise-natoons-71580
739162,Kinder Surprise Natoons,$2.50,https://www.igashop.com.au/product/kinder-surprise-natoons-739162
334077,Kinder Surprise T3 Pink,$6.00,https://www.igashop.com.au/product/kinder-surprise-t3-pink-334077
150000007533,Life Savers Fruit Pastilles,$1.25,https://www.igashop.com.au/product/life-savers-fruit-pastilles-150000007533
150000007534,Life Savers Fruit Tingles,$3.55,https://www.igashop.com.au/product/life-savers-fruit-tingles-150000007534
173984,Lindt Caramel Square Milk Bag,$10.00,https://www.igashop.com.au/product/lindt-caramel-square-milk-bag-173984
421743,Lindt Carrot Easter,$1.25,https://www.igashop.com.au/product/lindt-carrot-easter-421743
798920,Lindt Christmas Festive Selection Gift Box,$23.00,https://www.igashop.com.au/product/lindt-christmas-festive-selection-gift-box-798920
844828,Lindt Classic Milk Hazelnut Chocolate,$5.50,https://www.igashop.com.au/product/lindt-classic-milk-hazelnut-chocolate-844828
193743,Lindt Easter Casket,$12.00,https://www.igashop.com.au/product/lindt-easter-casket-193743
923326,Lindt Easter Gift Box,$23.00,https://www.igashop.com.au/product/lindt-easter-gift-box-923326
90822,Lindt Easter Gold Bunny Milk Chocolate,$14.00,https://www.igashop.com.au/product/lindt-easter-gold-bunny-milk-chocolate-90822
922503,Lindt Easter Gold Bunny Perforated Milk Chocolate,$7.00,https://www.igashop.com.au/product/lindt-easter-gold-bunny-perforated-milk-chocolate-922503
161830,Lindt Easter Gold Bunny White Chocolate,$8.00,https://www.igashop.com.au/product/lindt-easter-gold-bunny-white-chocolate-161830
376647,Lindt Excellence 70 Dark,$4.75,https://www.igashop.com.au/product/lindt-excellence-70-dark-376647
811760,Lindt Excellence 78 Cocoa,$4.75,https://www.igashop.com.au/product/lindt-excellence-78-cocoa-811760
19449,Lindt Excellence 85 Cocoa,$4.75,https://www.igashop.com.au/product/lindt-excellence-85-cocoa-19449
628280,Lindt Excellence 95 Cocoa,$4.75,https://www.igashop.com.au/product/lindt-excellence-95-cocoa-628280
261753,Lindt Excellence Cranberry Almond Hazelnut Dark Chocolate,$4.75,https://www.igashop.com.au/product/lindt-excellence-cranberry-almond-hazelnut-dark-chocolate-261753
160000000423,Lindt Excellence Dark Chocolate With A Touch Of Sea Salt,$4.75,https://www.igashop.com.au/product/lindt-excellence-dark-chocolate-with-a-touch-of-sea-salt-160000000423
317240,Lindt Excellence Dark Sea Salt Caramel,$4.75,https://www.igashop.com.au/product/lindt-excellence-dark-sea-salt-caramel-317240
611966,Lindt Excellence Intense Mint,$4.75,https://www.igashop.com.au/product/lindt-excellence-intense-mint-611966
342321,Lindt Excellence Intense Organic,$4.75,https://www.igashop.com.au/product/lindt-excellence-intense-organic-342321
376613,Lindt Excellence Milk,$4.75,https://www.igashop.com.au/product/lindt-excellence-milk-376613
830002,Lindt Excellence Milk Sea Salt Caramel,$4.75,https://www.igashop.com.au/product/lindt-excellence-milk-sea-salt-caramel-830002
317253,Lindt Excellence Raspberry Intense,$4.75,https://www.igashop.com.au/product/lindt-excellence-raspberry-intense-317253
353979,Lindt Excellence Roasted Almond,$4.75,https://www.igashop.com.au/product/lindt-excellence-roasted-almond-353979
591349,Lindt Excellence Roasted Hazelnut Dark Chocolate,$5.50,https://www.igashop.com.au/product/lindt-excellence-roasted-hazelnut-dark-chocolate-591349
190000004569,Lindt Excellence Supreme Dark Chocolate 90 Cocoa Block,$4.75,https://www.igashop.com.au/product/lindt-excellence-supreme-dark-chocolate-90-cocoa-block-190000004569
372428,Lindt Fruit Sensation Raspberry And Cranberry,$6.00,https://www.igashop.com.au/product/lindt-fruit-sensation-raspberry-and-cranberry-372428
90830,Lindt Gold Bunny Dark Chocolate Easter,$14.00,https://www.igashop.com.au/product/lindt-gold-bunny-dark-chocolate-easter-90830
165960,Lindt Gold Bunny Easter Milk Chocolate,$1.25,https://www.igashop.com.au/product/lindt-gold-bunny-easter-milk-chocolate-165960
167836,Lindt Gold Bunny Hazelnut Chocolate Easter,$8.00,https://www.igashop.com.au/product/lindt-gold-bunny-hazelnut-chocolate-easter-167836
420446,Lindt Gold Bunny Milk Chocolate Easter,$5.00,https://www.igashop.com.au/product/lindt-gold-bunny-milk-chocolate-easter-420446
190000009628,Lindt Gold Bunny Mini Pouch Bag,$9.00,https://www.igashop.com.au/product/lindt-gold-bunny-mini-pouch-bag-190000009628
190000009652,Lindt Gold Bunny Plush With Mini Milk White Chocolate Eggs,$17.00,https://www.igashop.com.au/product/lindt-gold-bunny-plush-with-mini-milk-white-chocolate-eggs-190000009652
999291,Lindt Gold Milk Chocolate Easter Bunny,$8.00,https://www.igashop.com.au/product/lindt-gold-milk-chocolate-easter-bunny-999291
160000000421,Lindt Gourmet Truffles,$18.50,https://www.igashop.com.au/product/lindt-gourmet-truffles-160000000421
994615,Lindt Lindor 70 Cocoa Bag,$7.00,https://www.igashop.com.au/product/lindt-lindor-70-cocoa-bag-994615
190000009746,Lindt Lindor Assorted Milk Egg Gift Box,$17.00,https://www.igashop.com.au/product/lindt-lindor-assorted-milk-egg-gift-box-190000009746
978753,Lindt Lindor Assorted Cornet,$26.00,https://www.igashop.com.au/product/lindt-lindor-assorted-cornet-978753
190000009787,Lindt Lindor Assorted Eggs Pouch Bag,$9.00,https://www.igashop.com.au/product/lindt-lindor-assorted-eggs-pouch-bag-190000009787
15364,Lindt Lindor Chocolate Balls Assorted,$7.00,https://www.igashop.com.au/product/lindt-lindor-chocolate-balls-assorted-15364
374085,Lindt Lindor Chocolate Balls Assorted,$8.00,https://www.igashop.com.au/product/lindt-lindor-chocolate-balls-assorted-374085
81470,Lindt Lindor Chocolate Balls Assorted,$16.00,https://www.igashop.com.au/product/lindt-lindor-chocolate-balls-assorted-81470
14229,Lindt Lindor Chocolate Balls Milk,$7.00,https://www.igashop.com.au/product/lindt-lindor-chocolate-balls-milk-14229
998059,Lindt Lindor Chocolate Balls Milk,$8.00,https://www.igashop.com.au/product/lindt-lindor-chocolate-balls-milk-998059
80953,Lindt Lindor Chocolate Balls Milk Chocolate,$16.00,https://www.igashop.com.au/product/lindt-lindor-chocolate-balls-milk-chocolate-80953
175334,Lindt Lindor Double Chocolate,$10.00,https://www.igashop.com.au/product/lindt-lindor-double-chocolate-175334
829080,Lindt Lindor Limited Edition Assorted Gift Box,$8.00,https://www.igashop.com.au/product/lindt-lindor-limited-edition-assorted-gift-box-829080
642632,Lindt Lindor Milk Chocolate,$4.75,https://www.igashop.com.au/product/lindt-lindor-milk-chocolate-642632
392096,Lindt Lindor Milk Chocolate Bar,$2.50,https://www.igashop.com.au/product/lindt-lindor-milk-chocolate-bar-392096
165978,Lindt Lindor Milk Easter Egg,$1.25,https://www.igashop.com.au/product/lindt-lindor-milk-easter-egg-165978
128895,Lindt Lindor Milk Mint,$7.00,https://www.igashop.com.au/product/lindt-lindor-milk-mint-128895
317431,Lindt Lindor Strawberries And Cream Bag,$10.00,https://www.igashop.com.au/product/lindt-lindor-strawberries-and-cream-bag-317431
642624,Lindt Lindor White Chocolate,$4.75,https://www.igashop.com.au/product/lindt-lindor-white-chocolate-642624
852300,Lindt Milk Chocolate Classic Caramel Sea Salt,$5.50,https://www.igashop.com.au/product/lindt-milk-chocolate-classic-caramel-sea-salt-852300
456413,Lindt Mini Santa Pouch Bag,$10.00,https://www.igashop.com.au/product/lindt-mini-santa-pouch-bag-456413
348500,Lindt Mini Teddy Pouch Bag,$10.00,https://www.igashop.com.au/product/lindt-mini-teddy-pouch-bag-348500
684867,Lindt Pink Or Blue Chick Milk Chocolate,$8.00,https://www.igashop.com.au/product/lindt-pink-or-blue-chick-milk-chocolate-684867
923287,Lindt Twin Gold Bunnies In Flower Box,$11.50,https://www.igashop.com.au/product/lindt-twin-gold-bunnies-in-flower-box-923287
933685,Mms Chocolate Pouch,$7.00,https://www.igashop.com.au/product/mms-chocolate-pouch-933685
933473,Mms Crispy,$7.00,https://www.igashop.com.au/product/mms-crispy-933473
826553,Mms Milk Chocolate Party Bucket,$17.00,https://www.igashop.com.au/product/mms-milk-chocolate-party-bucket-826553
953664,Mms Minis,$7.00,https://www.igashop.com.au/product/mms-minis-953664
932511,Mms Minis Chocolate Medium Bag,$6.00,https://www.igashop.com.au/product/mms-minis-chocolate-medium-bag-932511
932600,Mms Minis Chocolate Multicolour Tube,$1.10,https://www.igashop.com.au/product/mms-minis-chocolate-multicolour-tube-932600
934152,Mms Mix Ups,$7.00,https://www.igashop.com.au/product/mms-mix-ups-934152
622580,Mms Peanut Chocolate Medium Bag,$6.00,https://www.igashop.com.au/product/mms-peanut-chocolate-medium-bag-622580
