ID,Name,Price,URL
170000000588,Aveeno Baby Fragrance Free Daily Baby Lotion,$12.50,https://www.igashop.com.au/product/aveeno-baby-fragrance-free-daily-baby-lotion-170000000588
362499,Bepanthen Antiseptic Soothing Cream,$17.50,https://www.igashop.com.au/product/bepanthen-antiseptic-soothing-cream-362499
409225,Bepanthen Baby Nappy Rash Ointment,$12.25,https://www.igashop.com.au/product/bepanthen-baby-nappy-rash-ointment-409225
607438,Bepanthen Nappy Rash Ointment,$15.50,https://www.igashop.com.au/product/bepanthen-nappy-rash-ointment-607438
240320,Bubba Zoo Nappy Bags,$2.00,https://www.igashop.com.au/product/bubba-zoo-nappy-bags-240320
228535,Gaia Baby Bath Sleeptime,$17.00,https://www.igashop.com.au/product/gaia-baby-bath-sleeptime-228535
999377,Gaia Baby Hair Body Wash,$17.00,https://www.igashop.com.au/product/gaia-baby-hair-body-wash-999377
944607,Huggies Essential Clean Baby Wipes,$4.50,https://www.igashop.com.au/product/huggies-essential-clean-baby-wipes-944607
392847,Johnsons Baby Bedtime Bath,$4.50,https://www.igashop.com.au/product/johnsons-baby-bedtime-bath-392847
413041,Johnsons Baby Conditioning Shampoo,$4.50,https://www.igashop.com.au/product/johnsons-baby-conditioning-shampoo-413041
59669,Johnsons Baby Oil,$4.50,https://www.igashop.com.au/product/johnsons-baby-oil-59669
346210,Johnsons Baby Oil With Aloe Vera Vitamin E,$12.50,https://www.igashop.com.au/product/johnsons-baby-oil-with-aloe-vera-vitamin-e-346210
432079,Johnsons Baby Powder,$4.20,https://www.igashop.com.au/product/johnsons-baby-powder-432079
481400,Johnsons Baby Powder,$5.50,https://www.igashop.com.au/product/johnsons-baby-powder-481400
59708,Johnsons Baby Powder,$7.25,https://www.igashop.com.au/product/johnsons-baby-powder-59708
653510,Johnsons Baby Powder Pure Cornstarch With Aloe Vitamin E,$5.50,https://www.igashop.com.au/product/johnsons-baby-powder-pure-cornstarch-with-aloe-vitamin-e-653510
57293,Johnsons Baby Shampoo Original,$4.50,https://www.igashop.com.au/product/johnsons-baby-shampoo-original-57293
430124,Johnsons Baby Soap Twin Pack 95G,$4.00,https://www.igashop.com.au/product/johnsons-baby-soap-twin-pack-95g-430124
904327,Johnsons Baby Top To Toe Baby Wash,$6.00,https://www.igashop.com.au/product/johnsons-baby-top-to-toe-baby-wash-904327
395667,Johnsons Baby Wash Bedtime Bath,$11.00,https://www.igashop.com.au/product/johnsons-baby-wash-bedtime-bath-395667
495823,Johnsons Baby Wash Bedtime Bath,$10.00,https://www.igashop.com.au/product/johnsons-baby-wash-bedtime-bath-495823
903884,Johnsons Baby Wash Top To Toe Bath,$11.00,https://www.igashop.com.au/product/johnsons-baby-wash-top-to-toe-bath-903884
35615,Johnsons Bedtime Baby Lotion,$4.50,https://www.igashop.com.au/product/johnsons-bedtime-baby-lotion-35615
59619,Johnsons Bedtime Baby Lotion,$4.50,https://www.igashop.com.au/product/johnsons-bedtime-baby-lotion-59619
883880,Johnsons Top To Toe Sensitive Touch Baby Wash,$7.50,https://www.igashop.com.au/product/johnsons-top-to-toe-sensitive-touch-baby-wash-883880
337363,Macleans Milk Teeth Fluoride Toothpaste For 0 3 Years,$2.00,https://www.igashop.com.au/product/macleans-milk-teeth-fluoride-toothpaste-for-0-3-years-337363
366833,Organic Care Kids Bubble Bath,$4.00,https://www.igashop.com.au/product/organic-care-kids-bubble-bath-366833
781554,Sudocrem Healing Cream,$35.00,https://www.igashop.com.au/product/sudocrem-healing-cream-781554
951874,Sudocrem Healing Cream,$24.00,https://www.igashop.com.au/product/sudocrem-healing-cream-951874
16687,Sudocrem Tube,$8.25,https://www.igashop.com.au/product/sudocrem-tube-16687
353144,Swisspers Absorbent Nursing Pads,$4.20,https://www.igashop.com.au/product/swisspers-absorbent-nursing-pads-353144
432689,Vicks Vaporub Baby Balsam,$10.50,https://www.igashop.com.au/product/vicks-vaporub-baby-balsam-432689
