623034,Coca - Cola Zero Sugar Soft Drink Bottle 1.25l,$3.85,https://www.woolworths.com.au/shop/productdetails/623034/coca-cola-zero-sugar-soft-drink-bottle
706329,Sacred Grounds Breezy Blend Ground Coffee 200g,$9.00,https://www.woolworths.com.au/shop/productdetails/706329/sacred-grounds-breezy-blend-ground-coffee
253808,Schweppes Indian Tonic Water Classic Mixers Glass Bottle Multipack 300ml X 4 Pack,$5.50,https://www.woolworths.com.au/shop/productdetails/253808/schweppes-indian-tonic-water-classic-mixers-glass-bottle-multipack
230840,Pepsi Max No Sugar Cola Soft Drink Bottles Multipack 450ml X 12 Pack,$20.00,https://www.woolworths.com.au/shop/productdetails/230840/pepsi-max-no-sugar-cola-soft-drink-bottles-multipack
802510,Gatorade G Active Sports Drinks Mango Water Electrolytes & Vitamins 600ml,$4.00,https://www.woolworths.com.au/shop/productdetails/802510/gatorade-g-active-sports-drinks-mango-water-electrolytes-vitamins
253766,Schweppes Lemon Lime Bitters Soft Drink Mixers Glass Bottle Multipack 300ml X 4 Pack,$5.50,https://www.woolworths.com.au/shop/productdetails/253766/schweppes-lemon-lime-bitters-soft-drink-mixers-glass-bottle-multipack
1074576369,Vital Zing Watermelon Waterdrops 45mL x 9 (case),$60.00,https://www.woolworths.com.au/shop/productdetails/1074576369/vital-zing-watermelon-waterdrops-45ml-x-9-case-
938254,Eastcoast Country Style Lemonade 2l,$6.00,https://www.woolworths.com.au/shop/productdetails/938254/eastcoast-country-style-lemonade
244282,Fanta Orange Zero Sugar Soft Drink Bottles 600ml,$4.25,https://www.woolworths.com.au/shop/productdetails/244282/fanta-orange-zero-sugar-soft-drink-bottles
392079,Remedy Kick Energy Drink Lemon Lime Cans 250ml X 4 Pack,$6.00,https://www.woolworths.com.au/shop/productdetails/392079/remedy-kick-energy-drink-lemon-lime-cans
623069,Coca - Cola Zero Sugar Soft Drink Mini Can 250ml,$2.50,https://www.woolworths.com.au/shop/productdetails/623069/coca-cola-zero-sugar-soft-drink-mini-can
387645,Grove Juice Mandarin Juice 1.5l,$6.00,https://www.woolworths.com.au/shop/productdetails/387645/grove-juice-mandarin-juice
228519,Lotus Peak White Tea Bags 25 Pack 50g,$4.00,https://www.woolworths.com.au/shop/productdetails/228519/lotus-peak-white-tea-bags
686999,Nescafe Gold Short Black Soluble Instant Coffee 100g,$13.50,https://www.woolworths.com.au/shop/productdetails/686999/nescafe-gold-short-black-soluble-instant-coffee
231188,Strangelove Nectarine Sparkling Water Zero Sugar All Natural Cans 4 X330ml,$8.50,https://www.woolworths.com.au/shop/productdetails/231188/strangelove-nectarine-sparkling-water-zero-sugar-all-natural-cans
425685,Kintra Foods Dandy Chai Blend 90g,$7.50,https://www.woolworths.com.au/shop/productdetails/425685/kintra-foods-dandy-chai-blend
663267,Nescafe Farmers Origin Pods Colombia Espresso Coffee Capsules 10 Pack,$7.00,https://www.woolworths.com.au/shop/productdetails/663267/nescafe-farmers-origin-pods-colombia-espresso-coffee-capsules
222977,Suntory Boss Coffee Iced Vanilla Latte Cans 237ml X4 Pack,$11.20,https://www.woolworths.com.au/shop/productdetails/222977/suntory-boss-coffee-iced-vanilla-latte-cans
95879,"Twinings Asha Turmeric Temple Turmeric, Ginger & Grapefruit Tea Bags 18 Pack",$7.50,https://www.woolworths.com.au/shop/productdetails/95879/twinings-asha-turmeric-temple-turmeric-ginger-grapefruit-tea-bags
659656,Bickford's Iced Caramel Coffee Syrup 500ml,$7.00,https://www.woolworths.com.au/shop/productdetails/659656/bickford-s-iced-caramel-coffee-syrup
291041,Diet Rite Orange Mango 375ml X 12 Pack,$8.75,https://www.woolworths.com.au/shop/productdetails/291041/diet-rite-orange-mango
222739,Hardys Zero Sparkling Alcohol Free Chardonnay 750ml,$8.00,https://www.woolworths.com.au/shop/productdetails/222739/hardys-zero-sparkling-alcohol-free-chardonnay
22552,Impressed Cold Pressed Juice Raspberry Beret 1l,$5.50,https://www.woolworths.com.au/shop/productdetails/22552/impressed-cold-pressed-juice-raspberry-beret
253811,Schweppes Dry Ginger Ale Soft Drink Bottle Mixers Multipack 300ml X 4 Pack,$5.50,https://www.woolworths.com.au/shop/productdetails/253811/schweppes-dry-ginger-ale-soft-drink-bottle-mixers-multipack
59706,Starbucks By Nespresso House Blend Coffee Pods Capsules 10 Pack,$7.90,https://www.woolworths.com.au/shop/productdetails/59706/starbucks-by-nespresso-house-blend-coffee-pods-capsules
121164,Schweppes Zero Sugar Classic Mixers Lemon Lime Bitters Soft Drink 300ml X 4 Pack,$5.50,https://www.woolworths.com.au/shop/productdetails/121164/schweppes-zero-sugar-classic-mixers-lemon-lime-bitters-soft-drink
231593,Solo Zero Sugar Original Lemon Soft Drink Bottles Multipack 450ml X 12 Pack,$20.00,https://www.woolworths.com.au/shop/productdetails/231593/solo-zero-sugar-original-lemon-soft-drink-bottles-multipack
214141,L'or Espresso Vanilla Capsules 10 Pack,$5.50,https://www.woolworths.com.au/shop/productdetails/214141/l-or-espresso-vanilla-capsules
112517,T2 Tea French Earl Grey Tea Bags 10 Pack,$7.50,https://www.woolworths.com.au/shop/productdetails/112517/t2-tea-french-earl-grey-tea-bags
41859,Twinings Earl Grey Loose Leaf Tea 125g,$6.50,https://www.woolworths.com.au/shop/productdetails/41859/twinings-earl-grey-loose-leaf-tea-loose-leaf-tea
990001,Fever-tree Refreshingly Light Premium Indian Tonic Water Bottles 200ml X 4 Pack,$9.00,https://www.woolworths.com.au/shop/productdetails/990001/fever-tree-refreshingly-light-premium-indian-tonic-water-bottles
1075316730,Fiji Water 1Lt Natural Artesian Water 12Pk,$46.50,https://www.woolworths.com.au/shop/productdetails/1075316730/fiji-water-1lt-natural-artesian-water-12pk
180910,Coca - Cola Vanilla  Soft Drink Bottle 600ml,$4.25,https://www.woolworths.com.au/shop/productdetails/180910/coca-cola-vanilla-soft-drink-bottle
253771,Schweppes Bitter Lemon Soft Drink Classic Mixers Multipack 300ml X 4 Pack,$5.50,https://www.woolworths.com.au/shop/productdetails/253771/schweppes-bitter-lemon-soft-drink-classic-mixers-multipack
253828,Schweppes Lemonade Soft Drink Bottle Glass Multipack 300ml X 4 Pack,$5.50,https://www.woolworths.com.au/shop/productdetails/253828/schweppes-lemonade-soft-drink-bottle-glass-multipack
253773,Schweppes Zero Sugar Dry Ginger Ale Soft Drink Mixers Multipack 300ml X 4 Pack,$5.50,https://www.woolworths.com.au/shop/productdetails/253773/schweppes-zero-sugar-dry-ginger-ale-soft-drink-mixers-multipack
253762,Schweppes Natural Mineral Water Bottle Glass Multipack 300ml X 4 Pack,$5.50,https://www.woolworths.com.au/shop/productdetails/253762/schweppes-natural-mineral-water-bottle-glass-multipack
387509,Grove Juice Orange With Pulp Juice 1.5l,$6.00,https://www.woolworths.com.au/shop/productdetails/387509/grove-juice-orange-with-pulp-juice
687775,L'or Espresso Lungo Estremo Intensity 10 Coffee Capsules 10 Pack,$5.50,https://www.woolworths.com.au/shop/productdetails/687775/l-or-espresso-lungo-estremo-intensity-10-coffee-capsules
160945,Lavazza Crema E Gusto Ground Coffee 1kg,$19.60,https://www.woolworths.com.au/shop/productdetails/160945/lavazza-crema-e-gusto-ground-coffee
32182,Vittoria Espressotoria Maragogype Coffee Capsules 12 Pack,$5.00,https://www.woolworths.com.au/shop/productdetails/32182/vittoria-espressotoria-maragogype-coffee-capsules
187000,Mcguigan Zero Alcohol Free Sparkling Rose 750ml,$12.50,https://www.woolworths.com.au/shop/productdetails/187000/mcguigan-zero-alcohol-free-sparkling-rose
95082,Starbucks By Nespresso Pike Place Roast Coffee Pods Capsules 10 Pack,$7.90,https://www.woolworths.com.au/shop/productdetails/95082/starbucks-by-nespresso-pike-place-roast-coffee-pods-capsules
59695,Starbucks By Nespresso Single Origin Sumatra Coffee Pods Capsules 10 Pack,$7.90,https://www.woolworths.com.au/shop/productdetails/59695/starbucks-by-nespresso-single-origin-sumatra-coffee-pods-capsules
25125,Strangelove Light Tonic 540ml,$5.60,https://www.woolworths.com.au/shop/productdetails/25125/strangelove-light-tonic
307989,Arkadia Chai Spice Tea 99% Sugar Free 8 Pack,$5.40,https://www.woolworths.com.au/shop/productdetails/307989/arkadia-chai-spice-tea-99-sugar-free
307523,Campos Decaf Coffee Capsules Syrupy & Bold Blend 10 Pack,$7.60,https://www.woolworths.com.au/shop/productdetails/307523/campos-decaf-coffee-capsules-syrupy-bold-blend
309584,Lavazza Espresso Ristretto Nespresso Compatible Coffee Pods 30 Pack,$13.60,https://www.woolworths.com.au/shop/productdetails/309584/lavazza-espresso-ristretto-nespresso-compatible-coffee-pods
158983,Vittoria Latte Coffee Beans 1kg,$22.00,https://www.woolworths.com.au/shop/productdetails/158983/vittoria-latte-coffee-beans
307598,Arkadia Chai Tea Vanilla 8 Pack,$5.40,https://www.woolworths.com.au/shop/productdetails/307598/arkadia-chai-tea-vanilla
307057,Campos Chapel Street Coffee Capsules 10 Pack,$7.60,https://www.woolworths.com.au/shop/productdetails/307057/campos-chapel-street-coffee-capsules
161073,Juicy Isle Lime Flavoured Cordial 2l,$4.00,https://www.woolworths.com.au/shop/productdetails/161073/juicy-isle-lime-flavoured-cordial
791769,Madame Flavour Lemongrass Lime & Ginger Tea Pods 18 Pack,$7.50,https://www.woolworths.com.au/shop/productdetails/791769/madame-flavour-lemongrass-lime-ginger-tea-pods
394217,P&n Sunrise Juice 2l,$3.50,https://www.woolworths.com.au/shop/productdetails/394217/p-n-sunrise-juice
227404,Buderim Ginger No Sugar Ginger Lemon Lime & Bitters Cordial 750ml,$4.50,https://www.woolworths.com.au/shop/productdetails/227404/buderim-ginger-no-sugar-ginger-lemon-lime-bitters-cordial
773144,Schweppes Lemonade Soft Drink Cans Multipack 375ml X 30 Pack,$26.00,https://www.woolworths.com.au/shop/productdetails/773144/schweppes-lemonade-soft-drink-cans-multipack
773142,Solo Thirst Crusher Original Lemon Soft Drink Cans Multipack 375ml X 30 Pack,$26.00,https://www.woolworths.com.au/shop/productdetails/773142/solo-thirst-crusher-original-lemon-soft-drink-cans-multipack
442190,Pepsi Max No Sugar Cola Soft Drink Cans Multipack 375ml X 10 Pack,$9.00,https://www.woolworths.com.au/shop/productdetails/442190/pepsi-max-no-sugar-cola-soft-drink-cans-multipack
773147,Pepsi Cola Soft Drink Cans Multipack 375ml X 30 Pack,$26.00,https://www.woolworths.com.au/shop/productdetails/773147/pepsi-cola-soft-drink-cans-multipack
214182,Moccona Cadbury Hazelnut Mocha Sachets 8 Pack,$6.00,https://www.woolworths.com.au/shop/productdetails/214182/moccona-cadbury-hazelnut-mocha-sachets
326750,Red Bull Energy Drink Sugarfree Energy Drink Apricot & Strawberry Can 250ml,$3.10,https://www.woolworths.com.au/shop/productdetails/326750/red-bull-energy-drink-sugarfree-energy-drink-apricot-strawberry-can
167556,Vittoria Espresso Beans 500g,$12.00,https://www.woolworths.com.au/shop/productdetails/167556/vittoria-espresso-beans
92399,Vittoria Valentina Nespresso Compatible Coffee Capsules Pack 10,$4.50,https://www.woolworths.com.au/shop/productdetails/92399/vittoria-valentina-nespresso-compatible-coffee-capsules
1074303415,Fruity Burst 250Ml Peppa Pig Orange 24Pk,$53.00,https://www.woolworths.com.au/shop/productdetails/1074303415/fruity-burst-250ml-peppa-pig-orange-24pk
804300,Grinders Crema Ground Coffee 200g,$8.80,https://www.woolworths.com.au/shop/productdetails/804300/grinders-crema-ground-coffee
442191,Solo Thirst Crusher Original Lemon Soft Drink Cans Multipack 375ml X 10 Pack,$9.00,https://www.woolworths.com.au/shop/productdetails/442191/solo-thirst-crusher-original-lemon-soft-drink-cans-multipack
442185,Schweppes Lemonade Soft Drink Cans Multipack 375ml X 10 Pack,$9.00,https://www.woolworths.com.au/shop/productdetails/442185/schweppes-lemonade-soft-drink-cans-multipack
676314,Solo Zero Sugar Original Lemon Soft Drink Cans Multipack 375ml X 10 Pack,$9.00,https://www.woolworths.com.au/shop/productdetails/676314/solo-zero-sugar-original-lemon-soft-drink-cans-multipack
141053,Sunkist Zero Sugar Orange Soft Drink Cans Multipack 375ml X 10 Pack,$9.00,https://www.woolworths.com.au/shop/productdetails/141053/sunkist-zero-sugar-orange-soft-drink-cans-multipack
275018,Monster Energy Ultra Gold Cans 500ml X 4 Pack,$15.20,https://www.woolworths.com.au/shop/productdetails/275018/monster-energy-ultra-gold-cans
156801,Vittoria Coffee Bags Long Black 20 Pack,$7.50,https://www.woolworths.com.au/shop/productdetails/156801/vittoria-coffee-bags-long-black
157499,Youjuice Getcha Greens 350ml,$4.00,https://www.woolworths.com.au/shop/productdetails/157499/youjuice-getcha-greens
750005,Devondale Full Cream Milk Powder Long Life Uht 1kg,$16.50,https://www.woolworths.com.au/shop/productdetails/750005/devondale-full-cream-milk-powder-long-life-uht
247557,The Juice Lab Well Immune Multidose Orange Turmeric Ginger 350ml,$12.00,https://www.woolworths.com.au/shop/productdetails/247557/the-juice-lab-well-immune-multidose-orange-turmeric-ginger
257225,Twinings Ceylon Orange Pekoe Tea Bags 50 Pack,$8.50,https://www.woolworths.com.au/shop/productdetails/257225/twinings-ceylon-orange-pekoe-tea-bags-tea-bags
286195,Vibe Gut With Prebiotics Lemonade Soft Drink Multipack Cans 330ml X 4 Pack,$10.00,https://www.woolworths.com.au/shop/productdetails/286195/vibe-gut-with-prebiotics-lemonade-soft-drink-multipack-cans
1074294363,Coca Cola 600Ml Coke 24Pk,$84.00,https://www.woolworths.com.au/shop/productdetails/1074294363/coca-cola-600ml-coke-24pk
859536,Lo Bros Kombucha Passionfruit 750ml,$7.70,https://www.woolworths.com.au/shop/productdetails/859536/lo-bros-kombucha-passionfruit
648129,Moccona Iced/hot Vanilla Latte Sachets 8 Pack,$6.00,https://www.woolworths.com.au/shop/productdetails/648129/moccona-iced-hot-vanilla-latte-sachets
222738,Hardys Zero Shiraz Alcohol Free 750ml,$13.00,https://www.woolworths.com.au/shop/productdetails/222738/hardys-zero-shiraz-alcohol-free
1074432227,Lavazza Espresso Classico Nespresso Compatible Coffee Capsules 120 Pack (12 x 10 Pack),$49.00,https://www.woolworths.com.au/shop/productdetails/1074432227/lavazza-espresso-classico-nespresso-compatible-coffee-capsules-120-pack-12-x-10-pack-
112518,T2 Tea Melbourne Breakfast Tea Bags 10 Pack,$7.50,https://www.woolworths.com.au/shop/productdetails/112518/t2-tea-melbourne-breakfast-tea-bags
616140,Higher Living Organic Honeybush Rooibos African Tea Bags 40 Pack,$5.50,https://www.woolworths.com.au/shop/productdetails/616140/higher-living-organic-honeybush-rooibos-african-tea-bags
106546,Juicy Isle Organic Orange Juice 1.5l,$5.50,https://www.woolworths.com.au/shop/productdetails/106546/juicy-isle-organic-orange-juice
216874,Lo Bros Kombucha Orange & Mango 750ml,$7.70,https://www.woolworths.com.au/shop/productdetails/216874/lo-bros-kombucha-orange-mango
13159,Saxbys Ginger Beer 750ml,$2.50,https://www.woolworths.com.au/shop/productdetails/13159/saxbys-ginger-beer
307009,C4 Smart Energy Icy Blue Razz Can 473ml,$5.50,https://www.woolworths.com.au/shop/productdetails/307009/c4-smart-energy-icy-blue-razz-can
580912,Pepsi Max No Sugar Vanilla Cola Soft Drink Cans Multipack 375ml X 10 Pack,$9.00,https://www.woolworths.com.au/shop/productdetails/580912/pepsi-max-no-sugar-vanilla-cola-soft-drink-cans-multipack
442182,Pepsi Cola Soft Drink Cans Multipack 375ml X 10 Pack,$9.00,https://www.woolworths.com.au/shop/productdetails/442182/pepsi-cola-soft-drink-cans-multipack
140921,Sunkist Orange Soft Drink Cans Multipack 375ml X 10 Pack,$9.00,https://www.woolworths.com.au/shop/productdetails/140921/sunkist-orange-soft-drink-cans-multipack
723453,Powerade Mountain Blast Zero Sports Drink Sipper Cap 600ml,$2.50,https://www.woolworths.com.au/shop/productdetails/723453/powerade-mountain-blast-zero-sports-drink-sipper-cap
390708,Dole Pine-mango 100% Juice 240ml,$1.30,https://www.woolworths.com.au/shop/productdetails/390708/dole-pine-mango-100-juice
179818,Naked Life Non Alcoholic Italian Spritz 250ml X4 Pack,$15.00,https://www.woolworths.com.au/shop/productdetails/179818/naked-life-non-alcoholic-italian-spritz
226882,Twinings Live Well Cleanse Tea Bags 18 Pack,$4.25,https://www.woolworths.com.au/shop/productdetails/226882/twinings-live-well-cleanse-tea-bags
678579,Belvoir Farm Elderflower & Rose Cordial 500ml,$5.00,https://www.woolworths.com.au/shop/productdetails/678579/belvoir-farm-elderflower-rose-cordial
285384,Coca - Cola Raspberry Zero Sugar Soft Drink Bottle 600ml,$4.25,https://www.woolworths.com.au/shop/productdetails/285384/coca-cola-raspberry-zero-sugar-soft-drink-bottle
555385,Edenvale Sauvignon Blanc Alcohol Removed 750ml,$8.40,https://www.woolworths.com.au/shop/productdetails/555385/edenvale-sauvignon-blanc-alcohol-removed
279908,Powerade Ion4 Blackcurrant Sports Drink Sipper Cap 600ml,$2.50,https://www.woolworths.com.au/shop/productdetails/279908/powerade-ion4-blackcurrant-sports-drink-sipper-cap
365190,Powerade Ion4 Mountain Blast Sports Drink Sipper Cap 600ml,$2.50,https://www.woolworths.com.au/shop/productdetails/365190/powerade-ion4-mountain-blast-sports-drink-sipper-cap
51569,Powerade Active Water Mango Sports Drink Sipper Cap 600ml,$2.50,https://www.woolworths.com.au/shop/productdetails/51569/powerade-active-water-mango-sports-drink-sipper-cap
262843,Powerade Isotonic Mountain Blast Powder 500g,$13.70,https://www.woolworths.com.au/shop/productdetails/262843/powerade-isotonic-mountain-blast-powder
1075250613,Gatorade 600Ml Green Apple 12Pk,$50.00,https://www.woolworths.com.au/shop/productdetails/1075250613/gatorade-600ml-green-apple-12pk
937546,Nippy's Apple & Blackcurrant Juice 2l,$6.90,https://www.woolworths.com.au/shop/productdetails/937546/nippy-s-apple-blackcurrant-juice
308422,Celestial Seasonings Bengal Spice Herbal Tea Bags 20 Pack,$6.50,https://www.woolworths.com.au/shop/productdetails/308422/celestial-seasonings-bengal-spice-herbal-tea-bags
1073908268,Illy Blend Instant Smooth Coffee 95g 3PK,$49.00,https://www.woolworths.com.au/shop/productdetails/1073908268/illy-blend-instant-smooth-coffee-95g-3pk
291038,Strangelove Yuzu Sparkling Water Zero Sugar 330ml X 4 Pack,$8.50,https://www.woolworths.com.au/shop/productdetails/291038/strangelove-yuzu-sparkling-water-zero-sugar
804688,V Refresh Green Apple Lemonade Zero Sugar Energy Drink 500ml X 4 Pack,$16.00,https://www.woolworths.com.au/shop/productdetails/804688/v-refresh-green-apple-lemonade-zero-sugar-energy-drink
306978,Bottlegreen Cordial Elderflower 500ml,$6.50,https://www.woolworths.com.au/shop/productdetails/306978/bottlegreen-cordial-elderflower
230165,Level Lemonade 300ml X 4 Pack,$6.00,https://www.woolworths.com.au/shop/productdetails/230165/level-lemonade
175459,Lo Bros Pineapple & Lime Kombucha 330ml,$3.20,https://www.woolworths.com.au/shop/productdetails/175459/lo-bros-pineapple-lime-kombucha
223415,Vittoria Decaffeinated Coffee Beans 500g,$15.00,https://www.woolworths.com.au/shop/productdetails/223415/vittoria-decaffeinated-coffee-beans
829710,Woolworths Lemon Lime & Bitters 750ml,$3.00,https://www.woolworths.com.au/shop/productdetails/829710/woolworths-lemon-lime-bitters
931405,Vittoria Espressotoria Decaf Coffee Capsules 12 Pack,$5.00,https://www.woolworths.com.au/shop/productdetails/931405/vittoria-espressotoria-decaf-coffee-capsules
271777,Famous Soda Co Zero Sugar Tangerine 330ml,$2.80,https://www.woolworths.com.au/shop/productdetails/271777/famous-soda-co-zero-sugar-tangerine
63426,Jose Cuervo Margarita Cocktail Mix 1l,$15.50,https://www.woolworths.com.au/shop/productdetails/63426/jose-cuervo-margarita-cocktail-mix
864460,Sprite Zero Sugar Soft Drink Bottle 600ml,$4.25,https://www.woolworths.com.au/shop/productdetails/864460/sprite-zero-sugar-soft-drink-bottle
1074294350,Gatorade 600Ml Lemon Lime 12Pk,$50.00,https://www.woolworths.com.au/shop/productdetails/1074294350/gatorade-600ml-lemon-lime-12pk
387538,Grove Juice Cloudy Apple 1.5l,$6.00,https://www.woolworths.com.au/shop/productdetails/387538/grove-juice-cloudy-apple
623034,Coca - Cola Zero Sugar Soft Drink Bottle 1.25l,$3.85,https://www.woolworths.com.au/shop/productdetails/623034/coca-cola-zero-sugar-soft-drink-bottle
365186,Powerade Ion4 Gold Rush Sports Drink Sipper Cap 600ml,$2.50,https://www.woolworths.com.au/shop/productdetails/365186/powerade-ion4-gold-rush-sports-drink-sipper-cap
365189,Powerade Ion4 Berry Ice Sports Drink Sipper Cap 600ml,$2.50,https://www.woolworths.com.au/shop/productdetails/365189/powerade-ion4-berry-ice-sports-drink-sipper-cap
32812,Fanta Orange Soft Drink Bottle 1.25l,$3.85,https://www.woolworths.com.au/shop/productdetails/32812/fanta-orange-soft-drink-bottle
986010,Heineken Zero Bottle 330ml X24 Case,$48.00,https://www.woolworths.com.au/shop/productdetails/986010/heineken-zero-bottle
222908,Vittoria Coffee Decaffinated Coffee Bags 20 Pack,$8.10,https://www.woolworths.com.au/shop/productdetails/222908/vittoria-coffee-decaffinated-coffee-bags
323213,Woolworths Lemon Mixer Cordial 750ml,$3.00,https://www.woolworths.com.au/shop/productdetails/323213/woolworths-lemon-mixer-cordial
785433,Sacred Grounds Breezy Blend Coffee Beans 500g,$20.00,https://www.woolworths.com.au/shop/productdetails/785433/sacred-grounds-breezy-blend-coffee-beans
306380,Twinings English Breakfast Loose Leaf Tea Extra Strong 125g,$6.50,https://www.woolworths.com.au/shop/productdetails/306380/twinings-english-breakfast-loose-leaf-tea-extra-strong
62170,Sprite Zero Sugar Lemonade Soft Drink Bottle 1.25l,$3.85,https://www.woolworths.com.au/shop/productdetails/62170/sprite-zero-sugar-lemonade-soft-drink-bottle
215509,Powerade Flo Cap Ion 4 Kiwi & Pineapple Bottle 600ml,$2.50,https://www.woolworths.com.au/shop/productdetails/215509/powerade-flo-cap-ion-4-kiwi-pineapple-bottle
360462,Powerade Zero Sugar Blackcurrant 600ml,$2.50,https://www.woolworths.com.au/shop/productdetails/360462/powerade-zero-sugar-blackcurrant
723452,Powerade Berry Ice Zero Sports Drink Sipper Cap 600ml,$2.50,https://www.woolworths.com.au/shop/productdetails/723452/powerade-berry-ice-zero-sports-drink-sipper-cap
757042,Bushells Turkish Coffee 250g,$9.00,https://www.woolworths.com.au/shop/productdetails/757042/bushells-turkish-coffee
307662,C4 Smart Energy Drink Watermelon Burst 473ml,$5.50,https://www.woolworths.com.au/shop/productdetails/307662/c4-smart-energy-drink-watermelon-burst
1074294315,Gatorade 600Ml Fierce Grape 12Pk,$50.00,https://www.woolworths.com.au/shop/productdetails/1074294315/gatorade-600ml-fierce-grape-12pk
359115,Boost Energy Lift 350ml,$4.40,https://www.woolworths.com.au/shop/productdetails/359115/boost-energy-lift
1075250607,Gatorade 600Ml Watermelon Chill 12Pk,$50.00,https://www.woolworths.com.au/shop/productdetails/1075250607/gatorade-600ml-watermelon-chill-12pk
390445,Raw C Pure Natural Coconut Water 350ml,$2.40,https://www.woolworths.com.au/shop/productdetails/390445/raw-c-pure-natural-coconut-water
225618,Twinings Live Well Focus Tea Bags 22 Pack,$4.25,https://www.woolworths.com.au/shop/productdetails/225618/twinings-live-well-focus-tea-bags
94147,Lavazza Espresso Barista Gran Crema Coffee Beans 1kg,$40.00,https://www.woolworths.com.au/shop/productdetails/94147/lavazza-espresso-barista-gran-crema-coffee-beans
1074294324,Lipton Ice Tea 500Ml Lemon 12Pk,$40.00,https://www.woolworths.com.au/shop/productdetails/1074294324/lipton-ice-tea-500ml-lemon-12pk
88122,Mcguigan Zero Alcohol Free Sparkling 750ml,$12.50,https://www.woolworths.com.au/shop/productdetails/88122/mcguigan-zero-alcohol-free-sparkling
227407,"Mood Tea Happy Days Hibiscus, Apple & Ginger 10 Pack",$4.95,https://www.woolworths.com.au/shop/productdetails/227407/mood-tea-happy-days-hibiscus-apple-ginger
183861,Nature's Cuppa Organic Ceylon Premium Tea Bags 120 Pack,$12.00,https://www.woolworths.com.au/shop/productdetails/183861/nature-s-cuppa-organic-ceylon-premium-tea-bags
390582,Original Juice Co. Black Label Clear Apple 1.5l,$6.50,https://www.woolworths.com.au/shop/productdetails/390582/original-juice-co-black-label-clear-apple
64675,Pukka Feel New Inner Beauty Organic Herbal Tea Sachets 20 Pack,$7.00,https://www.woolworths.com.au/shop/productdetails/64675/pukka-feel-new-inner-beauty-organic-herbal-tea-sachets
155697,Starbucks By Nescafe Dolce Gusto Caffe Latte Coffee Pods Capsules 12 Pack,$10.00,https://www.woolworths.com.au/shop/productdetails/155697/starbucks-by-nescafe-dolce-gusto-caffe-latte-coffee-pods-capsules
226199,Twinings Live Well Digest Tea Bags 22 Pack,$4.25,https://www.woolworths.com.au/shop/productdetails/226199/twinings-live-well-digest-tea-bags
808083,Boost Berry Happy 350ml,$4.40,https://www.woolworths.com.au/shop/productdetails/808083/boost-berry-happy
285271,Capi Australian Sparkling Water 750ml,$3.40,https://www.woolworths.com.au/shop/productdetails/285271/capi-australian-sparkling-water
242184,Nescafe Gold Original Soluble Instant Coffee 400g,$28.00,https://www.woolworths.com.au/shop/productdetails/242184/nescafe-gold-original-soluble-instant-coffee
78095,Arepa The Brain Drink Performance 300ml,$7.00,https://www.woolworths.com.au/shop/productdetails/78095/arepa-the-brain-drink-performance
231850,Arepa Performance Brain Shot 90ml,$4.00,https://www.woolworths.com.au/shop/productdetails/231850/arepa-performance-brain-shot
313019,Coca - Cola Classic  Soft Drink Mini Bottles 300ml X 12 Pack,$11.40,https://www.woolworths.com.au/shop/productdetails/313019/coca-cola-classic-soft-drink-mini-bottles
309564,Lavazza Tales Of Italy Eternal Roma Ground Coffee 250g,$14.00,https://www.woolworths.com.au/shop/productdetails/309564/lavazza-tales-of-italy-eternal-roma-ground-coffee
1074424856,Lotus Peak Bubble Tea Strawberry w/ Tapioca Pearls 490m 6pc,$45.00,https://www.woolworths.com.au/shop/productdetails/1074424856/lotus-peak-bubble-tea-strawberry-w-tapioca-pearls-490m-6pc
71481,Moccona Freeze Dried Instant Coffee Indulgence 100g,$9.00,https://www.woolworths.com.au/shop/productdetails/71481/moccona-freeze-dried-instant-coffee-indulgence
178861,Naked Life Non Alcoholic Negroni Spritz 250ml X4 Pack,$15.00,https://www.woolworths.com.au/shop/productdetails/178861/naked-life-non-alcoholic-negroni-spritz
