623034,Coca - Cola Zero Sugar Soft Drink Bottle 1.25l,$3.85,https://www.woolworths.com.au/shop/productdetails/623034/coca-cola-zero-sugar-soft-drink-bottle
136874,Mount Franklin Lightly Sparkling Water Pasionfruit Multipack Cans 375ml X10 Pack,$19.00,https://www.woolworths.com.au/shop/productdetails/136874/mount-franklin-lightly-sparkling-water-pasionfruit-multipack-cans
287016,Mount Franklin Lightly Sparkling Mineral Water Passionfruit 250ml X 6 Pack,$6.75,https://www.woolworths.com.au/shop/productdetails/287016/mount-franklin-lightly-sparkling-mineral-water-passionfruit
787164,Golden Circle Apple Blackcurrant Juice No Added Sugar Fruit Juices 2l,$4.80,https://www.woolworths.com.au/shop/productdetails/787164/golden-circle-apple-blackcurrant-juice-no-added-sugar-fruit-juices
174914,Moccona Coffee Sachets Cappuccino 10 Pack,$6.00,https://www.woolworths.com.au/shop/productdetails/174914/moccona-coffee-sachets-cappuccino
124312,Monster Energy Ultra Rosa Can 500ml,$4.05,https://www.woolworths.com.au/shop/productdetails/124312/monster-energy-ultra-rosa-can
799842,Cococoast Natural Coconut Water Passionfruit 500ml,$2.50,https://www.woolworths.com.au/shop/productdetails/799842/cococoast-natural-coconut-water-passionfruit
221228,Lipton Ice Tea Lipton Sugar Free Ice Tea Lemon Iced Tea Bottle 1.5l,$3.50,https://www.woolworths.com.au/shop/productdetails/221228/lipton-ice-tea-lipton-sugar-free-ice-tea-lemon-iced-tea-bottle
186269,Woolworths Instant Chocolate Powdered Drink 400g,$3.00,https://www.woolworths.com.au/shop/productdetails/186269/woolworths-instant-chocolate-powdered-drink
242611,Mount Franklin Lightly Sparkling Water Raspberry Cans 250ml X 6 Pack,$6.75,https://www.woolworths.com.au/shop/productdetails/242611/mount-franklin-lightly-sparkling-water-raspberry-cans
242089,Mount Franklin Lightly Sparkling Water Mango Flavour Cans 250ml X 6 Pack,$6.75,https://www.woolworths.com.au/shop/productdetails/242089/mount-franklin-lightly-sparkling-water-mango-flavour-cans
261247,Fever-tree Mediterranean Light Tonic Water 8 X 150ml,$12.50,https://www.woolworths.com.au/shop/productdetails/261247/fever-tree-mediterranean-light-tonic-water
222952,Hardys Zero Chardonnay Alcohol Free 750ml,$5.00,https://www.woolworths.com.au/shop/productdetails/222952/hardys-zero-chardonnay-alcohol-free
416231,Glee Tropical Treat Flavoured Sparkling Fruit Juice 250ml,$2.00,https://www.woolworths.com.au/shop/productdetails/416231/glee-tropical-treat-flavoured-sparkling-fruit-juice
228496,Twinings Green Tea & Lemon Tea Bags 10 Pack,$1.80,https://www.woolworths.com.au/shop/productdetails/228496/twinings-green-tea-lemon-tea-bags-bags
268297,Nudie Nothing But Aloha Juice 2l,$7.00,https://www.woolworths.com.au/shop/productdetails/268297/nudie-nothing-but-aloha-juice
65620,Impressed Pressed Juice Tropical Breakfast Juice 1l,$4.00,https://www.woolworths.com.au/shop/productdetails/65620/impressed-pressed-juice-tropical-breakfast-juice
59298,Spc Spc Pear Juice Can 850ml,$3.60,https://www.woolworths.com.au/shop/productdetails/59298/spc-pear-juice-can
317793,Lipton Ice Tea Mango Tea Iced Tea Bottle Mango 1.5l,$3.50,https://www.woolworths.com.au/shop/productdetails/317793/lipton-ice-tea-mango-tea-iced-tea-bottle-mango
33832,Nescafe Blend 43 Instant Coffee 50g,$6.50,https://www.woolworths.com.au/shop/productdetails/33832/nescafe-blend-43-instant-coffee
756087,Woolworths Lightly Sparkling Water With Lemon 1.25l,$1.60,https://www.woolworths.com.au/shop/productdetails/756087/woolworths-lightly-sparkling-water-with-lemon
700536,Berri Pop Tops Apple Blackcurrant Juice 250ml,$1.50,https://www.woolworths.com.au/shop/productdetails/700536/berri-pop-tops-apple-blackcurrant-juice
227739,Cottee's Zero Sugar Cordial Fruit Cup Cordial Bottle 1l,$5.90,https://www.woolworths.com.au/shop/productdetails/227739/cottee-s-zero-sugar-cordial-fruit-cup-cordial-bottle
262843,Powerade Isotonic Mountain Blast Powder 500g,$13.70,https://www.woolworths.com.au/shop/productdetails/262843/powerade-isotonic-mountain-blast-powder
886819,Bundaberg Sparkling Passionfruit Drink 375ml X4 Pack,$7.35,https://www.woolworths.com.au/shop/productdetails/886819/bundaberg-sparkling-passionfruit-drink
58968,Twinings Lemon Twist Tea Bags 10 Pack,$1.80,https://www.woolworths.com.au/shop/productdetails/58968/twinings-lemon-twist-tea-bags-tea-bags
142929,Woolworths Orange Juice With Pulp 2l,$5.00,https://www.woolworths.com.au/shop/productdetails/142929/woolworths-orange-juice-with-pulp
156070,The Juice Lab Wellness Immune Vitality Super Shot 60ml,$3.50,https://www.woolworths.com.au/shop/productdetails/156070/the-juice-lab-wellness-immune-vitality-super-shot
821283,Liddells Lactose Free Chocolate Milk Long Life Uht Milk 250ml X 3 Pack,$5.15,https://www.woolworths.com.au/shop/productdetails/821283/liddells-lactose-free-chocolate-milk-long-life-uht-milk
787819,Bickford's Cloudy Pear Juice 1l,$5.50,https://www.woolworths.com.au/shop/productdetails/787819/bickford-s-cloudy-pear-juice
222739,Hardys Zero Sparkling Alcohol Free Chardonnay 750ml,$8.00,https://www.woolworths.com.au/shop/productdetails/222739/hardys-zero-sparkling-alcohol-free-chardonnay
222738,Hardys Zero Shiraz Alcohol Free 750ml,$13.00,https://www.woolworths.com.au/shop/productdetails/222738/hardys-zero-shiraz-alcohol-free
25119,Strangelove Tonic Number 8 540ml,$5.60,https://www.woolworths.com.au/shop/productdetails/25119/strangelove-tonic-number-8
165748,Fever-tree Refreshingly Light Indian Tonic Water 150ml X 8 Pack,$12.50,https://www.woolworths.com.au/shop/productdetails/165748/fever-tree-refreshingly-light-indian
884260,Bundaberg Lemon Lime & Bitters 375ml X4 Pack,$7.35,https://www.woolworths.com.au/shop/productdetails/884260/bundaberg-lemon-lime-bitters
307864,Twinings English Breakfast Tea Bags Decaffeinated 80 Pack,$6.75,https://www.woolworths.com.au/shop/productdetails/307864/twinings-english-breakfast-tea-bags-decaffeinated
229030,Daily Juice Co Breakfast A C & E Juice 2l,$6.20,https://www.woolworths.com.au/shop/productdetails/229030/daily-juice-co-breakfast-a-c-e-juice
936138,Grinders Espresso Coffee Beans 1kg,$35.00,https://www.woolworths.com.au/shop/productdetails/936138/grinders-espresso-coffee-beans-coffee-beans
186699,H2juice Pineapple 1.25l,$5.00,https://www.woolworths.com.au/shop/productdetails/186699/h2juice-pineapple
305554,Lindt Hot Chocolate Flakes Milk 210g,$10.00,https://www.woolworths.com.au/shop/productdetails/305554/lindt-hot-chocolate-flakes-milk
109276,Fever-tree Indian Tonic Water Cans 150ml X8 Pack,$12.50,https://www.woolworths.com.au/shop/productdetails/109276/fever-tree-indian-tonic-water-cans
199689,Dilmah Extra Strength Tea Bags 50 Pack,$4.80,https://www.woolworths.com.au/shop/productdetails/199689/dilmah-extra-strength-tea-bags
196566,Dilmah Extra Strength Tea Bags 100 Pack,$8.80,https://www.woolworths.com.au/shop/productdetails/196566/dilmah-extra-strength-tea-bags
5306,Dilmah Ceylon Tea Bags 50 Pack,$4.50,https://www.woolworths.com.au/shop/productdetails/5306/dilmah-ceylon-tea-bags
291865,Solo Zero Sugar Original Lemon Soft Drink Mini Cans Multipack 275ml X 6 Pack,$9.00,https://www.woolworths.com.au/shop/productdetails/291865/solo-zero-sugar-original-lemon-soft-drink-mini-cans-multipack
172439,H2coco Pure Coconut Water 2l,$6.00,https://www.woolworths.com.au/shop/productdetails/172439/h2coco-pure-coconut-water
687774,L'or Espresso Decaf Ristretto Intensity 9 Coffee Capsules 10 Pack,$5.50,https://www.woolworths.com.au/shop/productdetails/687774/l-or-espresso-decaf-ristretto-intensity-9-coffee-capsules
221028,Lavazza Espresso Intenso Nespresso Compatible Coffee Pods 10 Pack,$6.90,https://www.woolworths.com.au/shop/productdetails/221028/lavazza-espresso-intenso-nespresso-compatible-coffee-pods
190178,"Nudie Immunity Hit Beetroot, Carrot, Orange, Pear & Ginger 1l",$5.00,https://www.woolworths.com.au/shop/productdetails/190178/nudie-immunity-hit-beetroot-carrot-orange-pear-ginger
365259,V8 Tropical Juce Multipack 3 X 250ml,$4.50,https://www.woolworths.com.au/shop/productdetails/365259/v8-tropical-juce-multipack
701518,Nudie 100% Orange Juice 400ml,$3.90,https://www.woolworths.com.au/shop/productdetails/701518/nudie-100-orange-juice
315123,Pump Berry Storm Water Bottle Berry Bottle 750ml,$4.00,https://www.woolworths.com.au/shop/productdetails/315123/pump-berry-storm-water-bottle-berry-bottle
399589,Sprite Lemonade 300ml X 12 Pack,$11.40,https://www.woolworths.com.au/shop/productdetails/399589/sprite-lemonade
24570,Vittoria Chocochino Drinking Chocolate 375g,$5.20,https://www.woolworths.com.au/shop/productdetails/24570/vittoria-chocochino-drinking-chocolate
370743,Fanta Orange Soft Drink Cans 375ml X24 Pack,$23.10,https://www.woolworths.com.au/shop/productdetails/370743/fanta-orange-soft-drink-cans
150073,Pips Cordial Fruit Cup Crush Double Concentrate 1l,$2.40,https://www.woolworths.com.au/shop/productdetails/150073/pips-cordial-fruit-cup-crush-double-concentrate
201688,Lipton Ice Tea Lemon Tea Iced Tea Bottle Lemon 500ml,$3.00,https://www.woolworths.com.au/shop/productdetails/201688/lipton-ice-tea-lemon-tea-iced-tea-bottle-lemon
226153,Avalanche 99% Sugar Free Vanilla Chai Latte 10 Pack,$5.50,https://www.woolworths.com.au/shop/productdetails/226153/avalanche-99-sugar-free-vanilla-chai-latte
3154,Bickford's Lemon Barley Cordial 750ml,$4.00,https://www.woolworths.com.au/shop/productdetails/3154/bickford-s-lemon-barley-cordial
406578,Nudie Nothing But Orange Juice Pulp Free 3l,$11.00,https://www.woolworths.com.au/shop/productdetails/406578/nudie-nothing-but-orange-juice-pulp-free
95459,Twinings Green Tea & Jasmine Tea Bags 10 Pack,$1.80,https://www.woolworths.com.au/shop/productdetails/95459/twinings-green-tea-jasmine-tea-bags
38288,Dilmah Premium Quality Tea Bags 100 Pack,$7.20,https://www.woolworths.com.au/shop/productdetails/38288/dilmah-premium-quality-tea-bags
979808,Fever-tree Meditteranean Tonic Water Bottles 200ml X 4 Pack,$9.00,https://www.woolworths.com.au/shop/productdetails/979808/fever-tree-meditteranean-tonic-water-bottles
352019,Fever-tree Premium Indian Tonic Water Bottles 200ml X 4 Pack,$9.00,https://www.woolworths.com.au/shop/productdetails/352019/fever-tree-premium-indian-tonic-water-bottles
995405,Fever-tree Elderflower Tonic Water Bottles 200ml X 4 Pack,$9.00,https://www.woolworths.com.au/shop/productdetails/995405/fever-tree-elderflower-tonic-water-bottles
315784,Just Juice Orange Juice 6x200ml,$6.30,https://www.woolworths.com.au/shop/productdetails/315784/just-juice-orange-juice
33072,Nerada Loose Leaf Tea 250g,$2.80,https://www.woolworths.com.au/shop/productdetails/33072/nerada-loose-leaf-tea
253828,Schweppes Lemonade Soft Drink Bottle Glass Multipack 300ml X 4 Pack,$5.50,https://www.woolworths.com.au/shop/productdetails/253828/schweppes-lemonade-soft-drink-bottle-glass-multipack
61962,Pepsi Max No Sugar Cola Soft Drink Bottles Multipack 300ml X 4 Pack,$5.00,https://www.woolworths.com.au/shop/productdetails/61962/pepsi-max-no-sugar-cola-soft-drink-bottles-multipack
222419,Alka Power Ph9-10 Alkaline Water 12 X600ml,$15.00,https://www.woolworths.com.au/shop/productdetails/222419/alka-power-ph9-10-alkaline-water
808011,Nexba Mixed Berry Sugar-free Kombucha 330ml X 4 Pack,$8.95,https://www.woolworths.com.au/shop/productdetails/808011/nexba-mixed-berry-sugar-free-kombucha
990001,Fever-tree Refreshingly Light Premium Indian Tonic Water Bottles 200ml X 4 Pack,$9.00,https://www.woolworths.com.au/shop/productdetails/990001/fever-tree-refreshingly-light-premium-indian-tonic-water-bottles
216877,4 Pines Ultra Low Alcohol 0.5% Beer Cans Multipack 375ml X 4 Pack,$11.70,https://www.woolworths.com.au/shop/productdetails/216877/4-pines-ultra-low-alcohol-0-5-beer-cans-multipack
255679,Fever-tree Mediterranean Light Tonic Water 4 X 200ml,$9.00,https://www.woolworths.com.au/shop/productdetails/255679/fever-tree-mediterranean-light-tonic-water
352013,Fever-tree Premium Dry Ginger Ale  Bottles 200ml X 4 Pack,$9.00,https://www.woolworths.com.au/shop/productdetails/352013/fever-tree-premium-dry-ginger-ale-bottles
483537,Oak Chocolate Milk 200ml X 6 Pack,$7.25,https://www.woolworths.com.au/shop/productdetails/483537/oak-chocolate-milk
217096,Lo Bros Kombucha Passionfruit Cans 250ml X4 Pack,$6.20,https://www.woolworths.com.au/shop/productdetails/217096/lo-bros-kombucha-passionfruit-cans
139864,V Energy Energy Drink 250ml,$2.60,https://www.woolworths.com.au/shop/productdetails/139864/v-energy-energy-drink
82871,Bickford's Iced Coffee Syrup 500ml,$7.00,https://www.woolworths.com.au/shop/productdetails/82871/bickford-s-iced-coffee-syrup
194667,Ribena Blackcurrant Drink 6 Pack,$6.00,https://www.woolworths.com.au/shop/productdetails/194667/ribena-blackcurrant-drink
134830,Sunraysia Apple Juice 200ml,$1.50,https://www.woolworths.com.au/shop/productdetails/134830/sunraysia-apple-juice
388459,Dole 100% Pineapple Juice 240ml,$1.30,https://www.woolworths.com.au/shop/productdetails/388459/dole-100-pineapple-juice
290348,Schweppes Lemonade Soft Drink Mini Cans Multipack 275ml X 6 Pack,$9.00,https://www.woolworths.com.au/shop/productdetails/290348/schweppes-lemonade-soft-drink-mini-cans-multipack
229039,Bundaberg Sarsaparilla 375ml X4 Pack,$7.35,https://www.woolworths.com.au/shop/productdetails/229039/bundaberg-sarsaparilla
308940,Edenvale Non Alcoholic Wine Shiraz 750ml,$8.40,https://www.woolworths.com.au/shop/productdetails/308940/edenvale-non-alcoholic-wine-shiraz
749803,V8 Apple Berry Juice Multipack 3 X 250ml,$4.50,https://www.woolworths.com.au/shop/productdetails/749803/v8-apple-berry-juice-multipack
229425,H2juice Watermelon Juice 1.25l,$5.00,https://www.woolworths.com.au/shop/productdetails/229425/h2juice-watermelon-juice
105018,Pepsi Max Sodastream Soda Mix 440ml,$7.00,https://www.woolworths.com.au/shop/productdetails/105018/pepsi-max-sodastream-soda-mix
247957,Woolworths Ground Coffee Espresso 250g,$4.50,https://www.woolworths.com.au/shop/productdetails/247957/woolworths-ground-coffee-espresso
155824,Fever-tree Refreshingly Light Premium Mediterranean Tonic Water 500ml,$3.95,https://www.woolworths.com.au/shop/productdetails/155824/fever-tree-refreshingly-light-premium-mediterranean-tonic-water
739656,Mildura Orange Fruit Drink 3l,$5.80,https://www.woolworths.com.au/shop/productdetails/739656/mildura-orange-fruit-drink
749800,V8 Breakfast Juice Multipack 3 X 250ml,$4.50,https://www.woolworths.com.au/shop/productdetails/749800/v8-breakfast-juice-multipack
800325,Nescafe Blend 43 Smooth & Creamy Instant Coffee 140g,$11.50,https://www.woolworths.com.au/shop/productdetails/800325/nescafe-blend-43-smooth-creamy-instant-coffee
120830,Great Northern Brewing Co Non Alcoholic Beer Cans Multipack 375ml X 6 Pack,$13.50,https://www.woolworths.com.au/shop/productdetails/120830/great-northern-brewing-co-non-alcoholic-beer-cans-multipack
549559,Nescafe Cappuccino Coffee Sachets 26 Pack,$11.00,https://www.woolworths.com.au/shop/productdetails/549559/nescafe-cappuccino-coffee-sachets
35694,Nescafe Blend 43 Instant Coffee 500g,$26.00,https://www.woolworths.com.au/shop/productdetails/35694/nescafe-blend-43-instant-coffee
59706,Starbucks By Nespresso House Blend Coffee Pods Capsules 10 Pack,$7.90,https://www.woolworths.com.au/shop/productdetails/59706/starbucks-by-nespresso-house-blend-coffee-pods-capsules
430139,Solo Zero Sugar Lemon Mango Flavour 1.25l,$2.00,https://www.woolworths.com.au/shop/productdetails/430139/solo-zero-sugar-lemon-mango-flavour
84244,Devondale Skim Milk Long Life Uht Milk 200ml X 6 Pack,$6.00,https://www.woolworths.com.au/shop/productdetails/84244/devondale-skim-milk-long-life-uht-milk
227947,Bickford's Pineapple & Passionfruit Cordial 750ml,$4.00,https://www.woolworths.com.au/shop/productdetails/227947/bickford-s-pineapple-passionfruit-cordial
341051,Staminade Lemon & Lime Powder 585g,$10.80,https://www.woolworths.com.au/shop/productdetails/341051/staminade-lemon-lime-powder
448581,Nudie Nothing But Orange Double Pulp 2l,$8.50,https://www.woolworths.com.au/shop/productdetails/448581/nudie-nothing-but-orange-double-pulp
149281,Pips Apple Raspberry Flavoured Cordial 1l,$2.40,https://www.woolworths.com.au/shop/productdetails/149281/pips-apple-raspberry-flavoured-cordial
173487,Gatorade G Active Sports Drinks Grape Water Electrolytes & Vitamins 600ml,$4.00,https://www.woolworths.com.au/shop/productdetails/173487/gatorade-g-active-sports-drinks-grape-water-electrolytes-vitamins
802510,Gatorade G Active Sports Drinks Mango Water Electrolytes & Vitamins 600ml,$4.00,https://www.woolworths.com.au/shop/productdetails/802510/gatorade-g-active-sports-drinks-mango-water-electrolytes-vitamins
594960,Gatorade G Active Sports Drinks Berry Water Electrolytes & Vitamins 600ml,$4.00,https://www.woolworths.com.au/shop/productdetails/594960/gatorade-g-active-sports-drinks-berry-water-electrolytes-vitamins
231593,Solo Zero Sugar Original Lemon Soft Drink Bottles Multipack 450ml X 12 Pack,$20.00,https://www.woolworths.com.au/shop/productdetails/231593/solo-zero-sugar-original-lemon-soft-drink-bottles-multipack
841115,Fever-tree Premium Indian Tonic Water 500ml,$3.95,https://www.woolworths.com.au/shop/productdetails/841115/fever-tree-premium-indian-tonic-water
151688,Remedy Organic Kombucha Passionfruit 1.25l,$8.95,https://www.woolworths.com.au/shop/productdetails/151688/remedy-organic-kombucha-passionfruit
92329,L'or Espresso Ultimo Intensity 13 Coffee Capsules 10 Pack,$5.50,https://www.woolworths.com.au/shop/productdetails/92329/l-or-espresso-ultimo-intensity-13-coffee-capsules
315761,Prima Orange Fruit Drink 6x200ml,$4.10,https://www.woolworths.com.au/shop/productdetails/315761/prima-orange-fruit-drink
23766,Nexba Rose Lemonade Sugar-free Kombucha 330ml X 4 Pack,$8.95,https://www.woolworths.com.au/shop/productdetails/23766/nexba-rose-lemonade-sugar-free-kombucha
231302,Bundaberg Pink Grapefruit Sparkling Drink 200ml X6 Pack,$5.75,https://www.woolworths.com.au/shop/productdetails/231302/bundaberg-pink-grapefruit-sparkling-drink
468559,Impressed Cold Pressed Juice Easy Greens 1l,$5.50,https://www.woolworths.com.au/shop/productdetails/468559/impressed-cold-pressed-juice-easy-greens
728313,Twinings Assam Bold Black Tea Bags 80 Pack,$6.75,https://www.woolworths.com.au/shop/productdetails/728313/twinings-assam-bold-black-tea-bags-tea
399131,Glee Sparkling Fruit Juice Bubblegum Grape 250ml,$2.00,https://www.woolworths.com.au/shop/productdetails/399131/glee-sparkling-fruit-juice-bubblegum-grape
51659,Golden Circle Tomato Juice No Added Sugar Vegetable Juice 2l,$4.80,https://www.woolworths.com.au/shop/productdetails/51659/golden-circle-tomato-juice-no-added-sugar-vegetable-juice
315125,Mother Energy Drink Original Can 500ml,$3.15,https://www.woolworths.com.au/shop/productdetails/315125/mother-energy-drink-original-can
789937,Devondale Moo Strawberry Milk Long Life Uht Milk 200ml X 6 Pack,$7.45,https://www.woolworths.com.au/shop/productdetails/789937/devondale-moo-strawberry-milk-long-life-uht-milk
708119,Monster Energy Juice Mango Loco 500ml X4 Pack,$15.20,https://www.woolworths.com.au/shop/productdetails/708119/monster-energy-juice-mango-loco
175763,Pepsi Max No Sugar Cola Soft Drink Bottle 600ml,$3.95,https://www.woolworths.com.au/shop/productdetails/175763/pepsi-max-no-sugar-cola-soft-drink-bottle
801323,Bundaberg Traditional Lemonade 4x375ml 4x375ml,$7.35,https://www.woolworths.com.au/shop/productdetails/801323/bundaberg-traditional-lemonade-4x375ml
688226,Macro Organic Coconut Water 1l,$5.00,https://www.woolworths.com.au/shop/productdetails/688226/macro-organic-coconut-water
313153,Robert Timms Premium Espresso Granulated Coffee 200g,$10.70,https://www.woolworths.com.au/shop/productdetails/313153/robert-timms-premium-espresso-granulated-coffee
986011,Heineken Alcohol Free Pure Malt Lager Bottles 330ml X6 Pack,$15.50,https://www.woolworths.com.au/shop/productdetails/986011/heineken-alcohol-free-pure-malt-lager-bottles
253770,Schweppes Soda Water Bottle Classic Mixers Glass Multipack 300ml X 4 Pack,$5.50,https://www.woolworths.com.au/shop/productdetails/253770/schweppes-soda-water-bottle-classic-mixers-glass-multipack
253808,Schweppes Indian Tonic Water Classic Mixers Glass Bottle Multipack 300ml X 4 Pack,$5.50,https://www.woolworths.com.au/shop/productdetails/253808/schweppes-indian-tonic-water-classic-mixers-glass-bottle-multipack
230840,Pepsi Max No Sugar Cola Soft Drink Bottles Multipack 450ml X 12 Pack,$20.00,https://www.woolworths.com.au/shop/productdetails/230840/pepsi-max-no-sugar-cola-soft-drink-bottles-multipack
253766,Schweppes Lemon Lime Bitters Soft Drink Mixers Glass Bottle Multipack 300ml X 4 Pack,$5.50,https://www.woolworths.com.au/shop/productdetails/253766/schweppes-lemon-lime-bitters-soft-drink-mixers-glass-bottle-multipack
151706,Nestle Reduced Fat Uht Cream 230ml,$4.00,https://www.woolworths.com.au/shop/productdetails/151706/nestle-reduced-fat-uht-cream
159797,Kirks Lemon Squash Soft Drink Multipack Cans 375ml X10 Pack,$10.15,https://www.woolworths.com.au/shop/productdetails/159797/kirks-lemon-squash-soft-drink-multipack-cans
95162,Mcguigan Zero Alcohol Free Sauvignon Blanc 750ml,$12.50,https://www.woolworths.com.au/shop/productdetails/95162/mcguigan-zero-alcohol-free-sauvignon-blanc
256700,Moccona Freeze Dried Instant Coffee Classic Dark Roast 400g,$28.00,https://www.woolworths.com.au/shop/productdetails/256700/moccona-freeze-dried-instant-coffee-classic-dark-roast
701531,Nudie 100% Apple Juice 400ml,$3.90,https://www.woolworths.com.au/shop/productdetails/701531/nudie-100-apple-juice
175028,Moccona Coffee Sachets Caramel Latte 10 Pack,$6.00,https://www.woolworths.com.au/shop/productdetails/175028/moccona-coffee-sachets-caramel-latte
253811,Schweppes Dry Ginger Ale Soft Drink Bottle Mixers Multipack 300ml X 4 Pack,$5.50,https://www.woolworths.com.au/shop/productdetails/253811/schweppes-dry-ginger-ale-soft-drink-bottle-mixers-multipack
121164,Schweppes Zero Sugar Classic Mixers Lemon Lime Bitters Soft Drink 300ml X 4 Pack,$5.50,https://www.woolworths.com.au/shop/productdetails/121164/schweppes-zero-sugar-classic-mixers-lemon-lime-bitters-soft-drink
253771,Schweppes Bitter Lemon Soft Drink Classic Mixers Multipack 300ml X 4 Pack,$5.50,https://www.woolworths.com.au/shop/productdetails/253771/schweppes-bitter-lemon-soft-drink-classic-mixers-multipack
253773,Schweppes Zero Sugar Dry Ginger Ale Soft Drink Mixers Multipack 300ml X 4 Pack,$5.50,https://www.woolworths.com.au/shop/productdetails/253773/schweppes-zero-sugar-dry-ginger-ale-soft-drink-mixers-multipack
728344,Higher Living Rooibos African Tea 40 Pack,$5.50,https://www.woolworths.com.au/shop/productdetails/728344/higher-living-rooibos-african-tea
253048,Bickford's Pomegranate Juice 1l,$5.50,https://www.woolworths.com.au/shop/productdetails/253048/bickford-s-pomegranate-juice
169393,Nestle Sweetened Condensed Milk 170g,$3.20,https://www.woolworths.com.au/shop/productdetails/169393/nestle-sweetened-condensed-milk
93221,Vittoria Espresso Nespresso Compatible Coffee Capsules Pack 10,$4.50,https://www.woolworths.com.au/shop/productdetails/93221/vittoria-espresso-nespresso-compatible-coffee-capsules
262165,Nerada Organic Camomile Tea Bags 40 Pack,$6.00,https://www.woolworths.com.au/shop/productdetails/262165/nerada-organic-camomile-tea-bags
159977,Original Juice Co. Orange Juice 600ml,$3.80,https://www.woolworths.com.au/shop/productdetails/159977/original-juice-co-orange-juice
46667,Bickford's Tropical Cordial 750ml,$4.00,https://www.woolworths.com.au/shop/productdetails/46667/bickford-s-tropical-cordial
769415,Lucozade Orange Energy Drink 380ml,$3.00,https://www.woolworths.com.au/shop/productdetails/769415/lucozade-orange-energy-drink
149010,Pips Cordial Lime Double Concentrate 1l,$2.40,https://www.woolworths.com.au/shop/productdetails/149010/pips-cordial-lime-double-concentrate
601864,Almond Breeze Barista Blend Blue Diamond 1l,$4.80,https://www.woolworths.com.au/shop/productdetails/601864/almond-breeze-barista-blend-blue-diamond
442187,Schweppes Traditional Raspberry Soft Drink Cans Multipack 375ml X 10 Pack,$9.00,https://www.woolworths.com.au/shop/productdetails/442187/schweppes-traditional-raspberry-soft-drink-cans-multipack
750803,V8 Tropical Juice Juice 300ml,$2.00,https://www.woolworths.com.au/shop/productdetails/750803/v8-tropical-juice-juice
189081,Daily Juice Co Orange & Fibre 1l,$3.80,https://www.woolworths.com.au/shop/productdetails/189081/daily-juice-co-orange-fibre
690360,Macro Organic Fairtrade Ground Coffee Medium 200g,$6.60,https://www.woolworths.com.au/shop/productdetails/690360/macro-organic-fairtrade-ground-coffee-medium
269088,Maximus Lemonade Ice Block Isotonic Sports Drink 1l,$2.80,https://www.woolworths.com.au/shop/productdetails/269088/maximus-lemonade-ice-block-isotonic-sports-drink
629484,Impressed Cold Pressed Juice Ginger Ninja 1l,$5.50,https://www.woolworths.com.au/shop/productdetails/629484/impressed-cold-pressed-juice-ginger-ninja
773129,Pepsi Max No Sugar Cola Soft Drink Cans Multipack 375ml X 30 Pack,$26.00,https://www.woolworths.com.au/shop/productdetails/773129/pepsi-max-no-sugar-cola-soft-drink-cans-multipack
773144,Schweppes Lemonade Soft Drink Cans Multipack 375ml X 30 Pack,$26.00,https://www.woolworths.com.au/shop/productdetails/773144/schweppes-lemonade-soft-drink-cans-multipack
773142,Solo Thirst Crusher Original Lemon Soft Drink Cans Multipack 375ml X 30 Pack,$26.00,https://www.woolworths.com.au/shop/productdetails/773142/solo-thirst-crusher-original-lemon-soft-drink-cans-multipack
773147,Pepsi Cola Soft Drink Cans Multipack 375ml X 30 Pack,$26.00,https://www.woolworths.com.au/shop/productdetails/773147/pepsi-cola-soft-drink-cans-multipack
647107,Santa Vittoria Sparkling Mineral Water 6x750ml,$11.80,https://www.woolworths.com.au/shop/productdetails/647107/santa-vittoria-sparkling-mineral-water
