623034,Coca - Cola Zero Sugar Soft Drink Bottle 1.25l,$3.85,https://www.woolworths.com.au/shop/productdetails/623034/coca-cola-zero-sugar-soft-drink-bottle
32812,Fanta Orange Soft Drink Bottle 1.25l,$3.85,https://www.woolworths.com.au/shop/productdetails/32812/fanta-orange-soft-drink-bottle
62170,Sprite Zero Sugar Lemonade Soft Drink Bottle 1.25l,$3.85,https://www.woolworths.com.au/shop/productdetails/62170/sprite-zero-sugar-lemonade-soft-drink-bottle
360462,Powerade Zero Sugar Blackcurrant 600ml,$2.50,https://www.woolworths.com.au/shop/productdetails/360462/powerade-zero-sugar-blackcurrant
748595,Woolworths Uht Full Cream Milk 1l,$1.60,https://www.woolworths.com.au/shop/productdetails/748595/woolworths-uht-full-cream-milk
748597,Woolworths Uht Skim Milk 1l,$1.60,https://www.woolworths.com.au/shop/productdetails/748597/woolworths-uht-skim-milk
116784,Woolworths Spring Water Bottles 600ml X24 Pack,$9.50,https://www.woolworths.com.au/shop/productdetails/116784/woolworths-spring-water-bottles
32731,Coca - Cola Classic  Soft Drink Bottle 1.25l,$3.85,https://www.woolworths.com.au/shop/productdetails/32731/coca-cola-classic-soft-drink-bottle
799811,Woolworths Free From Lactose Full Cream Milk 1l,$1.60,https://www.woolworths.com.au/shop/productdetails/799811/woolworths-free-from-lactose-full-cream-milk
748596,Woolworths Uht Lite Milk 1l,$1.60,https://www.woolworths.com.au/shop/productdetails/748596/woolworths-uht-lite-milk
242184,Nescafe Gold Original Soluble Instant Coffee 400g,$28.00,https://www.woolworths.com.au/shop/productdetails/242184/nescafe-gold-original-soluble-instant-coffee
51569,Powerade Active Water Mango Sports Drink Sipper Cap 600ml,$2.50,https://www.woolworths.com.au/shop/productdetails/51569/powerade-active-water-mango-sports-drink-sipper-cap
78095,Arepa The Brain Drink Performance 300ml,$7.00,https://www.woolworths.com.au/shop/productdetails/78095/arepa-the-brain-drink-performance
231850,Arepa Performance Brain Shot 90ml,$4.00,https://www.woolworths.com.au/shop/productdetails/231850/arepa-performance-brain-shot
779130,Woolworths Soy Milk 1l,$1.15,https://www.woolworths.com.au/shop/productdetails/779130/woolworths-soy-milk
749792,Woolworths Spring Water 6x1.5l Bottles,$4.80,https://www.woolworths.com.au/shop/productdetails/749792/woolworths-spring-water
799637,Woolworths Soda Water 1.25l,$1.20,https://www.woolworths.com.au/shop/productdetails/799637/woolworths-soda-water
825527,Woolworths Apple Juice 2l,$2.80,https://www.woolworths.com.au/shop/productdetails/825527/woolworths-apple-juice
310675,Vitasoy Oat Milk 1l,$2.00,https://www.woolworths.com.au/shop/productdetails/310675/vitasoy-oat-milk
7984,Pepsi Max No Sugar Cola Soft Drink Bottle 2l,$3.60,https://www.woolworths.com.au/shop/productdetails/7984/pepsi-max-no-sugar-cola-soft-drink-bottle
33557,Devondale 100% Pure Full Cream Milk Long Life Uht Milk 1l,$2.20,https://www.woolworths.com.au/shop/productdetails/33557/devondale-100-pure-full-cream-milk-long-life-uht-milk
799813,Woolworths Free From Lactose Lite Milk 1l,$1.60,https://www.woolworths.com.au/shop/productdetails/799813/woolworths-free-from-lactose-lite-milk
825528,Woolworths Orange Juice 2l,$3.35,https://www.woolworths.com.au/shop/productdetails/825528/woolworths-orange-juice
24318,Sanitarium So Good Long Life Regular Soy Milk 1l,$2.20,https://www.woolworths.com.au/shop/productdetails/24318/sanitarium-so-good-long-life-regular-soy-milk
799638,Woolworths Sparkling Mineral Water 1.25l,$1.00,https://www.woolworths.com.au/shop/productdetails/799638/woolworths-sparkling-mineral-water
84763,Woolworths Sweetened Condensed Milk 397g,$1.80,https://www.woolworths.com.au/shop/productdetails/84763/woolworths-sweetened-condensed-milk
30441,Gatorade Sports Drinks Lemon Lime Electrolyte Hydration Bottle 600ml,$4.00,https://www.woolworths.com.au/shop/productdetails/30441/gatorade-sports-drinks-lemon-lime-electrolyte-hydration-bottle
42605,Coca - Cola Classic  Soft Drink Multipack Cans 375ml X 24 Pack,$23.10,https://www.woolworths.com.au/shop/productdetails/42605/coca-cola-classic-soft-drink-multipack-cans
30446,Gatorade Sports Drinks Tropical Electrolyte Hydration Bottle 600ml,$4.00,https://www.woolworths.com.au/shop/productdetails/30446/gatorade-sports-drinks-tropical-electrolyte-hydration-bottle
635960,Schweppes Soda Water Bottle Classic Mixers 1.1l,$3.00,https://www.woolworths.com.au/shop/productdetails/635960/schweppes-soda-water-bottle-classic-mixers
773129,Pepsi Max No Sugar Cola Soft Drink Cans Multipack 375ml X 30 Pack,$26.00,https://www.woolworths.com.au/shop/productdetails/773129/pepsi-max-no-sugar-cola-soft-drink-cans-multipack
313019,Coca - Cola Classic  Soft Drink Mini Bottles 300ml X 12 Pack,$11.40,https://www.woolworths.com.au/shop/productdetails/313019/coca-cola-classic-soft-drink-mini-bottles
32731,Coca - Cola Classic  Soft Drink Bottle 1.25l,$3.85,https://www.woolworths.com.au/shop/productdetails/32731/coca-cola-classic-soft-drink-bottle
679122,Coca - Cola Zero Sugar Soft Drink Mini Bottles 12 X 300ml,$11.40,https://www.woolworths.com.au/shop/productdetails/679122/coca-cola-zero-sugar-soft-drink-mini-bottles
285271,Capi Australian Sparkling Water 750ml,$3.40,https://www.woolworths.com.au/shop/productdetails/285271/capi-australian-sparkling-water
56731,Bonsoy Long Life Soy Milk 1l,$4.50,https://www.woolworths.com.au/shop/productdetails/56731/bonsoy-long-life-soy-milk
633876,Woolworths Spring Water Minis 20x250ml,$5.55,https://www.woolworths.com.au/shop/productdetails/633876/woolworths-spring-water-minis
858008,Pureharvest Almond Milk Unsweetened 1l,$3.40,https://www.woolworths.com.au/shop/productdetails/858008/pureharvest-almond-milk-unsweetened
333339,Woolworths Lemonade Bottle 1.25l,$1.20,https://www.woolworths.com.au/shop/productdetails/333339/woolworths-lemonade-bottle
192985,Nestle Milo Choc-malt 1kg,$12.00,https://www.woolworths.com.au/shop/productdetails/192985/nestle-milo-choc-malt
86298,Pureharvest Organic Oat Milk 1l,$3.00,https://www.woolworths.com.au/shop/productdetails/86298/pureharvest-organic-oat-milk
841115,Fever-tree Premium Indian Tonic Water 500ml,$3.95,https://www.woolworths.com.au/shop/productdetails/841115/fever-tree-premium-indian-tonic-water
155824,Fever-tree Refreshingly Light Premium Mediterranean Tonic Water 500ml,$3.95,https://www.woolworths.com.au/shop/productdetails/155824/fever-tree-refreshingly-light-premium-mediterranean-tonic-water
255073,Fever-tree Pink Grapefruit Soda 500ml,$3.95,https://www.woolworths.com.au/shop/productdetails/255073/fever-tree-pink-grapefruit-soda
803904,Fever-tree Elderflower Tonic Water Bottle 500ml,$3.95,https://www.woolworths.com.au/shop/productdetails/803904/fever-tree-elderflower-tonic-water-bottle
365190,Powerade Ion4 Mountain Blast Sports Drink Sipper Cap 600ml,$2.50,https://www.woolworths.com.au/shop/productdetails/365190/powerade-ion4-mountain-blast-sports-drink-sipper-cap
83836,Sanitarium So Good Barista Edition Almond Milk 1l,$3.00,https://www.woolworths.com.au/shop/productdetails/83836/sanitarium-so-good-barista-edition-almond-milk
779134,Woolworths Unsweetened Almond Milk 1l,$2.00,https://www.woolworths.com.au/shop/productdetails/779134/woolworths-unsweetened-almond-milk
83273,Sanitarium So Good Barista Edition Oat Milk 1l,$3.00,https://www.woolworths.com.au/shop/productdetails/83273/sanitarium-so-good-barista-edition-oat-milk
749793,Woolworths Spring Water 1.5l Bottle,$0.80,https://www.woolworths.com.au/shop/productdetails/749793/woolworths-spring-water
7985,Pepsi Max No Sugar Cola Soft Drink Bottle 1.25l,$2.00,https://www.woolworths.com.au/shop/productdetails/7985/pepsi-max-no-sugar-cola-soft-drink-bottle
30486,Gatorade Sports Drinks Blue Bolt Electrolyte Hydration Bottle 600ml,$4.00,https://www.woolworths.com.au/shop/productdetails/30486/gatorade-sports-drinks-blue-bolt-electrolyte-hydration-bottle
744490,Sanitarium So Good Long Life Unsweetened Almond Milk 1l,$2.90,https://www.woolworths.com.au/shop/productdetails/744490/sanitarium-so-good-long-life-unsweetened-almond-milk
669683,Coca - Cola Zero Sugar Soft Drink Multipack Cans 24 X 375ml,$23.10,https://www.woolworths.com.au/shop/productdetails/669683/coca-cola-zero-sugar-soft-drink-multipack-cans
673135,Woolworths Apple & Mango Juice 2l,$2.80,https://www.woolworths.com.au/shop/productdetails/673135/woolworths-apple-mango-juice
262841,Gatorade Sports Drinks Grape Electrolyte Hydration Bottle 600ml,$4.00,https://www.woolworths.com.au/shop/productdetails/262841/gatorade-sports-drinks-grape-electrolyte-hydration-bottle
561890,Woolworths Lightly Sparkling Spring Water 500ml X 20 Pack,$12.00,https://www.woolworths.com.au/shop/productdetails/561890/woolworths-lightly-sparkling-spring-water
215455,Macro Organic Soy Long Life Milk 1l,$1.60,https://www.woolworths.com.au/shop/productdetails/215455/macro-organic-soy-long-life-milk
724514,Cocobella Coconut Water Straight Up 1l,$3.30,https://www.woolworths.com.au/shop/productdetails/724514/cocobella-coconut-water-straight-up
38121,Coca - Cola Classic  Soft Drink Bottle 2l,$3.90,https://www.woolworths.com.au/shop/productdetails/38121/coca-cola-classic-soft-drink-bottle-bottle
230367,Devondale Semi Skim Milk Long Life Uht Milk 1l,$2.20,https://www.woolworths.com.au/shop/productdetails/230367/devondale-semi-skim-milk-long-life-uht-milk
120207,Sanitarium So Good Oat No Added Sugar Uht Milk 1l,$2.80,https://www.woolworths.com.au/shop/productdetails/120207/sanitarium-so-good-oat-no-added-sugar-uht-milk
672966,Coca - Cola Zero Sugar Soft Drink Bottle 2l,$3.90,https://www.woolworths.com.au/shop/productdetails/672966/coca-cola-zero-sugar-soft-drink-bottle
609505,Fever-tree Meditteranean Tonic Water Bottles 500ml,$3.95,https://www.woolworths.com.au/shop/productdetails/609505/fever-tree-meditteranean-tonic-water-bottles
70446,Fever-tree Dry Ginger Ale 500ml,$3.95,https://www.woolworths.com.au/shop/productdetails/70446/fever-tree-dry-ginger-ale
229781,Strangelove Pineapple Sparkling Water Zero Sugar All Natural Cans 4 X330ml,$8.50,https://www.woolworths.com.au/shop/productdetails/229781/strangelove-pineapple-sparkling-water-zero-sugar-all-natural-cans
231188,Strangelove Nectarine Sparkling Water Zero Sugar All Natural Cans 4 X330ml,$8.50,https://www.woolworths.com.au/shop/productdetails/231188/strangelove-nectarine-sparkling-water-zero-sugar-all-natural-cans
81274,Nu Pure Still Spring Water 20x600ml,$10.50,https://www.woolworths.com.au/shop/productdetails/81274/nu-pure-still-spring-water
730998,Pauls Zymil Lactose Free Full Cream Long Life Milk 1l,$3.00,https://www.woolworths.com.au/shop/productdetails/730998/pauls-zymil-lactose-free-full-cream-long-life-milk
32063,Liddells Lactose Free Full Cream Milk Long Life Uht Milk 1l,$3.00,https://www.woolworths.com.au/shop/productdetails/32063/liddells-lactose-free-full-cream-milk-long-life-uht-milk
756025,Woolworths Lemonade Zero Sugar Bottle 1.25l,$1.20,https://www.woolworths.com.au/shop/productdetails/756025/woolworths-lemonade-zero-sugar-bottle
54291,Pepsi Max No Sugar Cola Soft Drink Cans Multipack 375ml X 24 Pack,$34.85,https://www.woolworths.com.au/shop/productdetails/54291/pepsi-max-no-sugar-cola-soft-drink-cans-multipack
94005,Pureau Pure Water Water 10l,$9.60,https://www.woolworths.com.au/shop/productdetails/94005/pureau-pure-water-water
230084,Strangelove Coastal Tonic 540ml,$5.60,https://www.woolworths.com.au/shop/productdetails/230084/strangelove-coastal-tonic
854136,Strangelove Double Ginger Beer 300ml,$12.50,https://www.woolworths.com.au/shop/productdetails/854136/strangelove-double-ginger-beer
25119,Strangelove Tonic Number 8 540ml,$5.60,https://www.woolworths.com.au/shop/productdetails/25119/strangelove-tonic-number-8
184133,Fever-tree Lime & Yuzu Soda 500ml,$3.95,https://www.woolworths.com.au/shop/productdetails/184133/fever-tree-lime-yuzu-soda
209424,Vitasoy Rice Milk 1l,$3.30,https://www.woolworths.com.au/shop/productdetails/209424/vitasoy-rice-milk
152988,Cadbury Drinking Chocolate 450g,$6.00,https://www.woolworths.com.au/shop/productdetails/152988/cadbury-drinking-chocolate
94493,Coca - Cola Diet Soft Drink Bottle 1.25l,$3.85,https://www.woolworths.com.au/shop/productdetails/94493/coca-cola-diet-soft-drink-bottle
365186,Powerade Ion4 Gold Rush Sports Drink Sipper Cap 600ml,$2.50,https://www.woolworths.com.au/shop/productdetails/365186/powerade-ion4-gold-rush-sports-drink-sipper-cap
95325,Sprite Lemonade Soft Drink Bottle 1.25l,$3.85,https://www.woolworths.com.au/shop/productdetails/95325/sprite-lemonade-soft-drink-bottle
35681,Moccona Freeze Dried Instant Coffee Classic Medium Roast 200g,$16.00,https://www.woolworths.com.au/shop/productdetails/35681/moccona-freeze-dried-instant-coffee-classic-medium-roast
90211,Daily Juice Co Pulp Free Orange Juice 2l,$6.20,https://www.woolworths.com.au/shop/productdetails/90211/daily-juice-co-pulp-free-orange-juice
72618,Twinings English Breakfast Tea Bags 100 Pack,$6.75,https://www.woolworths.com.au/shop/productdetails/72618/twinings-english-breakfast-tea-bags-tea-bags
150166,Macro Organic Oat Milk Unsweetened 1l,$2.25,https://www.woolworths.com.au/shop/productdetails/150166/macro-organic-oat-milk-unsweetened
825529,Woolworths Apple & Blackcurrant Juice 2l,$2.80,https://www.woolworths.com.au/shop/productdetails/825529/woolworths-apple-blackcurrant-juice
170011,Australian Mountain Waters Natural Spring Water 10l,$6.40,https://www.woolworths.com.au/shop/productdetails/170011/australian-mountain-waters-natural-spring-water
162609,Red Bull Energy Drink 4x250ml,$11.85,https://www.woolworths.com.au/shop/productdetails/162609/red-bull-energy-drink
702170,Nudie Nothing But Oranges Pulp Free Juice 2l,$8.50,https://www.woolworths.com.au/shop/productdetails/702170/nudie-nothing-but-oranges-pulp-free-juice
219582,Frantelle Australian Still Spring Water Bottles Multipack 600ml X 24 Pack,$11.00,https://www.woolworths.com.au/shop/productdetails/219582/frantelle-australian-still-spring-water-bottles-multipack
357252,Sanpellegrino Sparkling Mineral Water 1l,$4.25,https://www.woolworths.com.au/shop/productdetails/357252/sanpellegrino-sparkling-mineral-water-mineral-water
33637,Devondale Skim Milk Long Life Uht Milk 1l,$2.20,https://www.woolworths.com.au/shop/productdetails/33637/devondale-skim-milk-long-life-uht-milk
703393,Schweppes Lemonade Soft Drink Bottle 1.1l,$3.00,https://www.woolworths.com.au/shop/productdetails/703393/schweppes-lemonade-soft-drink-bottle
332730,Mount Franklin Lightly Sparkling Water Natural Bottle 1.25l,$3.10,https://www.woolworths.com.au/shop/productdetails/332730/mount-franklin-lightly-sparkling-water-natural-bottle
77938,Mount Franklin Lightly Sparkling Water Lime Multipack Cans 375ml X10 Pack,$19.00,https://www.woolworths.com.au/shop/productdetails/77938/mount-franklin-lightly-sparkling-water-lime-multipack-cans
242317,Mount Franklin Lightly Sparkling Water Lime Cans 250ml X 6 Pack,$6.75,https://www.woolworths.com.au/shop/productdetails/242317/mount-franklin-lightly-sparkling-water-lime-cans
136874,Mount Franklin Lightly Sparkling Water Pasionfruit Multipack Cans 375ml X10 Pack,$19.00,https://www.woolworths.com.au/shop/productdetails/136874/mount-franklin-lightly-sparkling-water-pasionfruit-multipack-cans
287016,Mount Franklin Lightly Sparkling Mineral Water Passionfruit 250ml X 6 Pack,$6.75,https://www.woolworths.com.au/shop/productdetails/287016/mount-franklin-lightly-sparkling-mineral-water-passionfruit
793391,Pureharvest Coco Quench Coconut Milk 1l,$2.15,https://www.woolworths.com.au/shop/productdetails/793391/pureharvest-coco-quench-coconut-milk
274341,Nestle Milo Choc-malt 200g,$5.00,https://www.woolworths.com.au/shop/productdetails/274341/nestle-milo-choc-malt
90032,Devondale 100% Pure Full Cream Milk Long Life Uht Milk 200ml X 6 Pack,$6.00,https://www.woolworths.com.au/shop/productdetails/90032/devondale-100-pure-full-cream-milk-long-life-uht-milk
16307,Sanitarium So Good Long Life Lite Soy Milk 1l,$2.20,https://www.woolworths.com.au/shop/productdetails/16307/sanitarium-so-good-long-life-lite-soy-milk
137848,Coca - Cola Caffeine Free Zero Sugar Soft Drink Bottle 1.25l,$3.85,https://www.woolworths.com.au/shop/productdetails/137848/coca-cola-caffeine-free-zero-sugar-soft-drink-bottle
148781,Vitasoy Oat Milky Uht Milk 1l,$3.00,https://www.woolworths.com.au/shop/productdetails/148781/vitasoy-oat-milky-uht-milk
242611,Mount Franklin Lightly Sparkling Water Raspberry Cans 250ml X 6 Pack,$6.75,https://www.woolworths.com.au/shop/productdetails/242611/mount-franklin-lightly-sparkling-water-raspberry-cans
242089,Mount Franklin Lightly Sparkling Water Mango Flavour Cans 250ml X 6 Pack,$6.75,https://www.woolworths.com.au/shop/productdetails/242089/mount-franklin-lightly-sparkling-water-mango-flavour-cans
261247,Fever-tree Mediterranean Light Tonic Water 8 X 150ml,$12.50,https://www.woolworths.com.au/shop/productdetails/261247/fever-tree-mediterranean-light-tonic-water
686285,Fever-tree Refreshingly Light Tonic Water 500ml,$3.95,https://www.woolworths.com.au/shop/productdetails/686285/fever-tree-refreshingly-light-tonic-water
35694,Nescafe Blend 43 Instant Coffee 500g,$26.00,https://www.woolworths.com.au/shop/productdetails/35694/nescafe-blend-43-instant-coffee
756086,Woolworths Lightly Sparkling Spring Water 1.25l,$1.60,https://www.woolworths.com.au/shop/productdetails/756086/woolworths-lightly-sparkling-spring-water
132815,V Original Guarana Energy Drink,$5.50,https://www.woolworths.com.au/shop/productdetails/132815/v-original-guarana-energy-drink
83995,Sanitarium So Good Barista Edition Soy Milk 1l,$2.00,https://www.woolworths.com.au/shop/productdetails/83995/sanitarium-so-good-barista-edition-soy-milk
42937,Vitasoy Calci Plus Soy Milk 1l,$3.00,https://www.woolworths.com.au/shop/productdetails/42937/vitasoy-calci-plus-soy-milk
84764,Woolworths Evaporated Milk 385ml,$2.00,https://www.woolworths.com.au/shop/productdetails/84764/woolworths-evaporated-milk
924245,Australia's Own Unsweetened Almond Milk 1l,$1.85,https://www.woolworths.com.au/shop/productdetails/924245/australia-s-own-unsweetened-almond-milk
30450,Gatorade Sports Drinks Orange Ice Electrolyte Hydration Bottle 600ml,$4.00,https://www.woolworths.com.au/shop/productdetails/30450/gatorade-sports-drinks-orange-ice-electrolyte-hydration-bottle
365189,Powerade Ion4 Berry Ice Sports Drink Sipper Cap 600ml,$2.50,https://www.woolworths.com.au/shop/productdetails/365189/powerade-ion4-berry-ice-sports-drink-sipper-cap
789357,Woolworths Full Cream Milk Powder 1kg,$10.00,https://www.woolworths.com.au/shop/productdetails/789357/woolworths-full-cream-milk-powder
146547,Pauls Zymil Lactose Free Low Fat Long Life Milk 1l,$3.00,https://www.woolworths.com.au/shop/productdetails/146547/pauls-zymil-lactose-free-low-fat-long-life-milk
243760,Coca - Cola Zero Sugar Soft Drink Mini Cans 6 X 250ml,$6.75,https://www.woolworths.com.au/shop/productdetails/243760/coca-cola-zero-sugar-soft-drink-mini-cans
245411,Gatorade Sports Drinks Watermelon Chill Electrolyte Hydration Bottle 600ml,$4.00,https://www.woolworths.com.au/shop/productdetails/245411/gatorade-sports-drinks-watermelon-chill-electrolyte-hydration-bottle
32812,Fanta Orange Soft Drink Bottle 1.25l,$3.85,https://www.woolworths.com.au/shop/productdetails/32812/fanta-orange-soft-drink-bottle
899990,Gatorade Sports Drinks Green Apple Electrolyte Hydration Bottle 600ml,$4.00,https://www.woolworths.com.au/shop/productdetails/899990/gatorade-sports-drinks-green-apple-electrolyte-hydration-bottle
756022,Woolworths Cola Bottle 1.25l,$1.20,https://www.woolworths.com.au/shop/productdetails/756022/woolworths-cola-bottle
244370,Coca - Cola Classic  Soft Drink Mini Cans 250ml X 6 Pack,$6.75,https://www.woolworths.com.au/shop/productdetails/244370/coca-cola-classic-soft-drink-mini-cans
710014,Sanitarium So Good Long Life Original Almond Milk 1l,$2.90,https://www.woolworths.com.au/shop/productdetails/710014/sanitarium-so-good-long-life-original-almond-milk
184132,Fever-tree Blood Orange Soda 500ml,$3.95,https://www.woolworths.com.au/shop/productdetails/184132/fever-tree-blood-orange-soda
222952,Hardys Zero Chardonnay Alcohol Free 750ml,$5.00,https://www.woolworths.com.au/shop/productdetails/222952/hardys-zero-chardonnay-alcohol-free
222739,Hardys Zero Sparkling Alcohol Free Chardonnay 750ml,$8.00,https://www.woolworths.com.au/shop/productdetails/222739/hardys-zero-sparkling-alcohol-free-chardonnay
25125,Strangelove Light Tonic 540ml,$5.60,https://www.woolworths.com.au/shop/productdetails/25125/strangelove-light-tonic
634274,Schweppes Zero Sugar Classic Mixers Indian Tonic Water Bottle 1.1l,$3.00,https://www.woolworths.com.au/shop/productdetails/634274/schweppes-zero-sugar-classic-mixers-indian-tonic-water-bottle
52558,Kirks Lemonade Soft Drink Bottle 1.25l,$1.60,https://www.woolworths.com.au/shop/productdetails/52558/kirks-lemonade-soft-drink-bottle
64810,Australia's Own Barista Almond 1l,$3.60,https://www.woolworths.com.au/shop/productdetails/64810/australia-s-own-barista-almond
105914,Nestle Sweetened Condensed Milk 395g,$3.80,https://www.woolworths.com.au/shop/productdetails/105914/nestle-sweetened-condensed-milk
62170,Sprite Zero Sugar Lemonade Soft Drink Bottle 1.25l,$3.85,https://www.woolworths.com.au/shop/productdetails/62170/sprite-zero-sugar-lemonade-soft-drink-bottle
756023,Woolworths Cola Sugar Zero Bottle 1.25l,$1.20,https://www.woolworths.com.au/shop/productdetails/756023/woolworths-cola-sugar-zero-bottle
222738,Hardys Zero Shiraz Alcohol Free 750ml,$13.00,https://www.woolworths.com.au/shop/productdetails/222738/hardys-zero-shiraz-alcohol-free
165748,Fever-tree Refreshingly Light Indian Tonic Water 150ml X 8 Pack,$12.50,https://www.woolworths.com.au/shop/productdetails/165748/fever-tree-refreshingly-light-indian
109276,Fever-tree Indian Tonic Water Cans 150ml X8 Pack,$12.50,https://www.woolworths.com.au/shop/productdetails/109276/fever-tree-indian-tonic-water-cans
199689,Dilmah Extra Strength Tea Bags 50 Pack,$4.80,https://www.woolworths.com.au/shop/productdetails/199689/dilmah-extra-strength-tea-bags
212841,Vitasoy Soy Milky Lite 1l,$2.45,https://www.woolworths.com.au/shop/productdetails/212841/vitasoy-soy-milky-lite
192366,Pureharvest Organic Malt Free Soy Milk 1l,$2.00,https://www.woolworths.com.au/shop/productdetails/192366/pureharvest-organic-malt-free-soy-milk
279908,Powerade Ion4 Blackcurrant Sports Drink Sipper Cap 600ml,$2.50,https://www.woolworths.com.au/shop/productdetails/279908/powerade-ion4-blackcurrant-sports-drink-sipper-cap
289272,Nestle Milo Refill Pack 730g,$9.90,https://www.woolworths.com.au/shop/productdetails/289272/nestle-milo-refill-pack
55071,Woolworths Breakfast Juice 2l,$2.80,https://www.woolworths.com.au/shop/productdetails/55071/woolworths-breakfast-juice
770183,Woolworths Spring Water 12x600ml,$5.00,https://www.woolworths.com.au/shop/productdetails/770183/woolworths-spring-water
180941,Coca - Cola Vanilla  Soft Drink Bottle 1.25l,$3.85,https://www.woolworths.com.au/shop/productdetails/180941/coca-cola-vanilla-soft-drink-bottle-bottle
203552,Bundaberg Ginger Beer 375ml X10 Pack,$12.50,https://www.woolworths.com.au/shop/productdetails/203552/bundaberg-ginger-beer
786195,H2coco 100% Natural Pure Coconut Water 1l,$4.00,https://www.woolworths.com.au/shop/productdetails/786195/h2coco-100-natural-pure-coconut-water
503111,Woolworths Fruit Drink 35% Tropical 6x250ml,$3.50,https://www.woolworths.com.au/shop/productdetails/503111/woolworths-fruit-drink-35-tropical
725866,Mount Franklin Lightly Sparkling Water Lime Bottle 1.25l,$3.10,https://www.woolworths.com.au/shop/productdetails/725866/mount-franklin-lightly-sparkling-water-lime-bottle
756045,Woolworths Tonic Water 1.25l,$1.20,https://www.woolworths.com.au/shop/productdetails/756045/woolworths-tonic-water
208575,Moccona Freeze Dried Instant Coffee Classic Medium Roast 400g,$28.00,https://www.woolworths.com.au/shop/productdetails/208575/moccona-freeze-dried-instant-coffee-classic-medium-roast
140090,Kirks Pasito Soft Drink Bottle 1.25l,$1.60,https://www.woolworths.com.au/shop/productdetails/140090/kirks-pasito-soft-drink-bottle
212840,Vitasoy Soy Milky Regular 1l,$2.45,https://www.woolworths.com.au/shop/productdetails/212840/vitasoy-soy-milky-regular
773144,Schweppes Lemonade Soft Drink Cans Multipack 375ml X 30 Pack,$26.00,https://www.woolworths.com.au/shop/productdetails/773144/schweppes-lemonade-soft-drink-cans-multipack
756049,Woolworths Diet Tonic Water 1.25l,$1.20,https://www.woolworths.com.au/shop/productdetails/756049/woolworths-diet-tonic-water
32673,Solo Thirst Crusher Original Lemon Soft Drink Bottle 1.25l,$2.00,https://www.woolworths.com.au/shop/productdetails/32673/solo-thirst-crusher-original-lemon-soft-drink-bottle
38288,Dilmah Premium Quality Tea Bags 100 Pack,$7.20,https://www.woolworths.com.au/shop/productdetails/38288/dilmah-premium-quality-tea-bags
196566,Dilmah Extra Strength Tea Bags 100 Pack,$8.80,https://www.woolworths.com.au/shop/productdetails/196566/dilmah-extra-strength-tea-bags
5306,Dilmah Ceylon Tea Bags 50 Pack,$4.50,https://www.woolworths.com.au/shop/productdetails/5306/dilmah-ceylon-tea-bags
979808,Fever-tree Meditteranean Tonic Water Bottles 200ml X 4 Pack,$9.00,https://www.woolworths.com.au/shop/productdetails/979808/fever-tree-meditteranean-tonic-water-bottles
739730,Woolworths Chocolate Milk 6x200ml,$5.00,https://www.woolworths.com.au/shop/productdetails/739730/woolworths-chocolate-milk
773142,Solo Thirst Crusher Original Lemon Soft Drink Cans Multipack 375ml X 30 Pack,$26.00,https://www.woolworths.com.au/shop/productdetails/773142/solo-thirst-crusher-original-lemon-soft-drink-cans-multipack
359118,Nudie Nothing But Oranges With Pulp 2l,$8.50,https://www.woolworths.com.au/shop/productdetails/359118/nudie-nothing-but-oranges-with-pulp
