ID,Name,Price,URL
797238,Atkins Endulge Bar Caramel Nut Multipack,$15.00,https://www.igashop.com.au/product/atkins-endulge-bar-caramel-nut-multipack-797238
797262,Atkins Endulge Bar Chcocolate Coconut,$15.00,https://www.igashop.com.au/product/atkins-endulge-bar-chcocolate-coconut-797262
797351,Atkins Endulge Mint Crisp,$3.40,https://www.igashop.com.au/product/atkins-endulge-mint-crisp-797351
866579,Aussie Bodies Keto Choc Hazelnut Wafer,$4.00,https://www.igashop.com.au/product/aussie-bodies-keto-choc-hazelnut-wafer-866579
361121,Epsom Salts,$3.85,https://www.igashop.com.au/product/epsom-salts-361121
828521,Hydralyte Effervescent Electrolyte Tablets Apple Blackcurrant,$6.00,https://www.igashop.com.au/product/hydralyte-effervescent-electrolyte-tablets-apple-blackcurrant-828521
223276,Hydralyte Effervescent Electrolyte Tablets Lemon Lime Flavoured,$6.00,https://www.igashop.com.au/product/hydralyte-effervescent-electrolyte-tablets-lemon-lime-flavoured-223276
907477,Kind Dark Chocolate Nut Protein Bar,$3.90,https://www.igashop.com.au/product/kind-dark-chocolate-nut-protein-bar-907477
609715,Laxettes Senna Chocolate Squares Laxatives,$5.30,https://www.igashop.com.au/product/laxettes-senna-chocolate-squares-laxatives-609715
395633,Metamucil Daily Fibre Supplement Lemon Lime Smooth,$26.50,https://www.igashop.com.au/product/metamucil-daily-fibre-supplement-lemon-lime-smooth-395633
988203,Metamucil Daily Fibre Supplement Orange Granular,$21.90,https://www.igashop.com.au/product/metamucil-daily-fibre-supplement-orange-granular-988203
866919,Musashi Deluxe Protein Bar Caramel Cookie Crunch,$4.50,https://www.igashop.com.au/product/musashi-deluxe-protein-bar-caramel-cookie-crunch-866919
866901,Musashi Deluxe Protein Bar Jam Donut,$4.50,https://www.igashop.com.au/product/musashi-deluxe-protein-bar-jam-donut-866901
103748,Musashi High Protein Bar Cookies Cream,$6.00,https://www.igashop.com.au/product/musashi-high-protein-bar-cookies-cream-103748
866870,Musashi High Protein Bar Peanut Butter,$6.00,https://www.igashop.com.au/product/musashi-high-protein-bar-peanut-butter-866870
866888,Musashi High Protein Bar Rocky Road,$6.00,https://www.igashop.com.au/product/musashi-high-protein-bar-rocky-road-866888
589067,Musashi High Protein Milk Choc Brownie Bar,$6.00,https://www.igashop.com.au/product/musashi-high-protein-milk-choc-brownie-bar-589067
676720,Musashi High Protein Salted Caramel Bar,$6.00,https://www.igashop.com.au/product/musashi-high-protein-salted-caramel-bar-676720
665685,Musashi Shred Burn Protein Shake Chocolate,$4.55,https://www.igashop.com.au/product/musashi-shred-burn-protein-shake-chocolate-665685
379072,Natures Way Instant Natural Protein Vanilla,$22.50,https://www.igashop.com.au/product/natures-way-instant-natural-protein-vanilla-379072
916447,Natures Way Protein Powder Chocolate,$22.50,https://www.igashop.com.au/product/natures-way-protein-powder-chocolate-916447
78964,Natures Way Super Greens Plus,$24.00,https://www.igashop.com.au/product/natures-way-super-greens-plus-78964
999806,Quest Chocolate Brownie Protein Bar,$4.80,https://www.igashop.com.au/product/quest-chocolate-brownie-protein-bar-999806
999720,Quest Chocolate Chip And Cookie Dough Protein Bar,$4.80,https://www.igashop.com.au/product/quest-chocolate-chip-and-cookie-dough-protein-bar-999720
999709,Quest Chocolate Chip Cookie Dough Protein Bar,$4.80,https://www.igashop.com.au/product/quest-chocolate-chip-cookie-dough-protein-bar-999709
999576,Quest Chocolate Chip Protein Cookie,$4.80,https://www.igashop.com.au/product/quest-chocolate-chip-protein-cookie-999576
999649,Quest Double Chocolate Chip Protein Cookie,$4.80,https://www.igashop.com.au/product/quest-double-chocolate-chip-protein-cookie-999649
258904,Quest White Chocolate Raspberry Protein Bar,$4.80,https://www.igashop.com.au/product/quest-white-chocolate-raspberry-protein-bar-258904
703831,The Bar Counter Bar High Protein Chocolate Mint,$3.50,https://www.igashop.com.au/product/the-bar-counter-bar-high-protein-chocolate-mint-703831
703768,The Bar Counter Plant Protein Dark Choc Coconut,$3.50,https://www.igashop.com.au/product/the-bar-counter-plant-protein-dark-choc-coconut-703768
590335,Tom Luke Peanut Butter Cacao,$5.50,https://www.igashop.com.au/product/tom-luke-peanut-butter-cacao-590335
160000017716,Vital Strength Ripped Protein Powder Chocolate,$52.00,https://www.igashop.com.au/product/vital-strength-ripped-protein-powder-chocolate-160000017716
160000017717,Vital Strength Ripped Protein Powder Vanilla,$52.00,https://www.igashop.com.au/product/vital-strength-ripped-protein-powder-vanilla-160000017717
160000017718,Vital Strength Whey Low Carb High Protein Choc,$52.00,https://www.igashop.com.au/product/vital-strength-whey-low-carb-high-protein-choc-160000017718
160000017719,Vital Strength Whey Low Carb High Protein Vanilla,$52.00,https://www.igashop.com.au/product/vital-strength-whey-low-carb-high-protein-vanilla-160000017719
