ID,Name,Price,URL
128816,Allowrie Butter,$5.20,https://www.igashop.com.au/product/allowrie-butter-128816
100402,Allowrie Unsalted Pat Butter,$5.20,https://www.igashop.com.au/product/allowrie-unsalted-pat-butter-100402
137213,Bertolli Olive Oil Classic Spread,$5.00,https://www.igashop.com.au/product/bertolli-olive-oil-classic-spread-137213
135287,Black Gold Butter Unsalted,$3.70,https://www.igashop.com.au/product/black-gold-butter-unsalted-135287
393398,Black Gold Caged Eggs,$4.75,https://www.igashop.com.au/product/black-gold-caged-eggs-393398
116754,Black Gold Large Caged Eggs 18 Pack,$7.65,https://www.igashop.com.au/product/black-gold-large-caged-eggs-18-pack-116754
100981,Black Gold Salted Butter,$3.70,https://www.igashop.com.au/product/black-gold-salted-butter-100981
107519,Black Gold Salted Butter,$6.40,https://www.igashop.com.au/product/black-gold-salted-butter-107519
174197,Black Gold X Large Caged Eggs,$4.90,https://www.igashop.com.au/product/black-gold-x-large-caged-eggs-174197
836176,Community Co Dairy Free Spread,$2.20,https://www.igashop.com.au/product/community-co-dairy-free-spread-836176
621851,Community Co Eggs Jumbo Free Range,$6.20,https://www.igashop.com.au/product/community-co-eggs-jumbo-free-range-621851
617218,Community Co Eggs Xl Free Range 6 Pack,$4.40,https://www.igashop.com.au/product/community-co-eggs-xl-free-range-6-pack-617218
495239,Community Co Free Range X Large Aussie Eggs,$5.60,https://www.igashop.com.au/product/community-co-free-range-x-large-aussie-eggs-495239
40429,Community Co Jumbo Free Range Eggs 18 Pack,$8.40,https://www.igashop.com.au/product/community-co-jumbo-free-range-eggs-18-pack-40429
190000010521,Community Co Olive Oil Spread,$2.70,https://www.igashop.com.au/product/community-co-olive-oil-spread-190000010521
100012,Copha Oil Solid Cooking Block,$3.00,https://www.igashop.com.au/product/copha-oil-solid-cooking-block-100012
100363,Devondale Butter,$7.90,https://www.igashop.com.au/product/devondale-butter-100363
142179,Devondale Butter Pat Salted,$5.30,https://www.igashop.com.au/product/devondale-butter-pat-salted-142179
195229,Devondale Dairy Soft Butter Blend,$7.50,https://www.igashop.com.au/product/devondale-dairy-soft-butter-blend-195229
195148,Devondale Dairy Soft Salt Reduced Butter Blend,$7.50,https://www.igashop.com.au/product/devondale-dairy-soft-salt-reduced-butter-blend-195148
190000002353,Devondale Dairy Soft Tub Regular,$4.60,https://www.igashop.com.au/product/devondale-dairy-soft-tub-regular-190000002353
198201,Devondale Extra Soft Butter Blend,$7.50,https://www.igashop.com.au/product/devondale-extra-soft-butter-blend-198201
696322,Devondale Extra Soft Butter Blend,$9.95,https://www.igashop.com.au/product/devondale-extra-soft-butter-blend-696322
222513,Devondale Unsalted Butter,$7.90,https://www.igashop.com.au/product/devondale-unsalted-butter-222513
611911,Devondale Unsalted Pat Butter,$5.30,https://www.igashop.com.au/product/devondale-unsalted-pat-butter-611911
100004,Eta Generic Margarine 5 Star,$3.00,https://www.igashop.com.au/product/eta-generic-margarine-5-star-100004
20000001755,Fairy Cooking Margarine,$2.60,https://www.igashop.com.au/product/fairy-cooking-margarine-20000001755
125787,Flora Buttery,$5.25,https://www.igashop.com.au/product/flora-buttery-125787
20000003265,Flora Lite Spread Pro Activ,$7.50,https://www.igashop.com.au/product/flora-lite-spread-pro-activ-20000003265
191178,Flora Margarine Spread Light,$5.25,https://www.igashop.com.au/product/flora-margarine-spread-light-191178
100884,Flora Margarine Spread Original,$7.90,https://www.igashop.com.au/product/flora-margarine-spread-original-100884
101050,Flora Margarine Spread Original,$5.25,https://www.igashop.com.au/product/flora-margarine-spread-original-101050
160000011646,Flora Margarine Spread Original,$7.90,https://www.igashop.com.au/product/flora-margarine-spread-original-160000011646
160000018086,Flora Margarine Spread Original,$5.25,https://www.igashop.com.au/product/flora-margarine-spread-original-160000018086
104163,Flora Margarine Spread Salt Reduced,$5.25,https://www.igashop.com.au/product/flora-margarine-spread-salt-reduced-104163
113772,Flora Margarine Spread Salt Reduced,$7.90,https://www.igashop.com.au/product/flora-margarine-spread-salt-reduced-113772
160000011647,Flora Margarine Spread Salt Reduced,$5.25,https://www.igashop.com.au/product/flora-margarine-spread-salt-reduced-160000011647
160000011648,Flora Margarine Spread Salt Reduced,$7.90,https://www.igashop.com.au/product/flora-margarine-spread-salt-reduced-160000011648
129503,Flora Proactiv Cholesterol Lowering Margarine Spread Light,$7.50,https://www.igashop.com.au/product/flora-proactiv-cholesterol-lowering-margarine-spread-light-129503
130054,Flora Proactiv Cholesterol Lowering Spread Buttery,$7.50,https://www.igashop.com.au/product/flora-proactiv-cholesterol-lowering-spread-buttery-130054
174155,Flora Proactiv Cholesterol Lowering Spread Buttery,$12.00,https://www.igashop.com.au/product/flora-proactiv-cholesterol-lowering-spread-buttery-174155
941769,Flora Proactiv Cholesterol Lowering Spread Buttery,$5.75,https://www.igashop.com.au/product/flora-proactiv-cholesterol-lowering-spread-buttery-941769
125591,Flora Proactiv Cholesterol Lowering Spread Original,$5.75,https://www.igashop.com.au/product/flora-proactiv-cholesterol-lowering-spread-original-125591
122501,Flora Proactiv Margarine Spread Original,$7.50,https://www.igashop.com.au/product/flora-proactiv-margarine-spread-original-122501
994453,Lurpak Slightly Salted Danish Butter,$5.80,https://www.igashop.com.au/product/lurpak-slightly-salted-danish-butter-994453
994518,Lurpak Spreadable Slightly Salted,$5.50,https://www.igashop.com.au/product/lurpak-spreadable-slightly-salted-994518
994445,Lurpak Unsalted Danish Butter,$5.80,https://www.igashop.com.au/product/lurpak-unsalted-danish-butter-994445
20000001962,Luv A Duck Duck Fat,$5.00,https://www.igashop.com.au/product/luv-a-duck-duck-fat-20000001962
168222,Mainland Buttersoft Salt Reduced Spreadable Butter,$5.60,https://www.igashop.com.au/product/mainland-buttersoft-salt-reduced-spreadable-butter-168222
171267,Mainland Buttersoft Salted Spreadable Butter,$5.60,https://www.igashop.com.au/product/mainland-buttersoft-salted-spreadable-butter-171267
172255,Mainland Buttersoft Salted Spreadable Butter,$3.85,https://www.igashop.com.au/product/mainland-buttersoft-salted-spreadable-butter-172255
33082,Mainland Organic Butter Salted,$4.20,https://www.igashop.com.au/product/mainland-organic-butter-salted-33082
425917,Mainland Organic Spreadable Salted Butter,$4.55,https://www.igashop.com.au/product/mainland-organic-spreadable-salted-butter-425917
925776,Mainland Pure Butter Salted,$5.00,https://www.igashop.com.au/product/mainland-pure-butter-salted-925776
789926,Meadowlea Buttery Margarine Spread,$4.50,https://www.igashop.com.au/product/meadowlea-buttery-margarine-spread-789926
100119,Meadowlea Original Margarine Spread,$4.50,https://www.igashop.com.au/product/meadowlea-original-margarine-spread-100119
100282,Meadowlea Original Margarine Spread,$6.65,https://www.igashop.com.au/product/meadowlea-original-margarine-spread-100282
190000000881,Meadowlea Original Spread Original,$2.75,https://www.igashop.com.au/product/meadowlea-original-spread-original-190000000881
114142,Meadowlea Salt Reduced Spread,$4.50,https://www.igashop.com.au/product/meadowlea-salt-reduced-spread-114142
9282230,Natural Living Free Range Eggs,$5.50,https://www.igashop.com.au/product/natural-living-free-range-eggs-9282230
445438,Nuttelex Buttery,$4.90,https://www.igashop.com.au/product/nuttelex-buttery-445438
731457,Nuttelex Coconut Oil Spread,$5.20,https://www.igashop.com.au/product/nuttelex-coconut-oil-spread-731457
731619,Nuttelex Lite Margarine Spread,$4.90,https://www.igashop.com.au/product/nuttelex-lite-margarine-spread-731619
147844,Nuttelex Original Plant Based Butter Alternative,$4.90,https://www.igashop.com.au/product/nuttelex-original-plant-based-butter-alternative-147844
156788,Olive Grove Classic Spread,$6.30,https://www.igashop.com.au/product/olive-grove-classic-spread-156788
160000001645,Olive Grove Extra Virgin Olive Oil Spread,$6.30,https://www.igashop.com.au/product/olive-grove-extra-virgin-olive-oil-spread-160000001645
180000000263,Pace Farm Barn Laid Eggs,$5.25,https://www.igashop.com.au/product/pace-farm-barn-laid-eggs-180000000263
20000003880,Pace Farm Fresh Eggs Xlarge 15 Pack,$7.00,https://www.igashop.com.au/product/pace-farm-fresh-eggs-xlarge-15-pack-20000003880
194702,Pace Farm Fresher Eggs 1 Dozen,$4.00,https://www.igashop.com.au/product/pace-farm-fresher-eggs-1-dozen-194702
180000000276,Pace Farm Massive Fresh Eggs 10 Pack,$4.75,https://www.igashop.com.au/product/pace-farm-massive-fresh-eggs-10-pack-180000000276
180000000246,Pace Farm Natural Free Range Egg,$6.50,https://www.igashop.com.au/product/pace-farm-natural-free-range-egg-180000000246
180000000297,Pace Farm Natural Free Range Eggs,$6.00,https://www.igashop.com.au/product/pace-farm-natural-free-range-eggs-180000000297
9282220,Pace Farm Wrap Eggs 6 Pack,$3.10,https://www.igashop.com.au/product/pace-farm-wrap-eggs-6-pack-9282220
798569,Puregg Simply Egg Whites,$6.75,https://www.igashop.com.au/product/puregg-simply-egg-whites-798569
179168,Tru Blu Garlic Butter,$3.35,https://www.igashop.com.au/product/tru-blu-garlic-butter-179168
164595,Western Star Chefs Choice Unsalted Cultured Butter,$5.20,https://www.igashop.com.au/product/western-star-chefs-choice-unsalted-cultured-butter-164595
195091,Western Star Chefs Choice Unsalted Cultured Butter,$8.00,https://www.igashop.com.au/product/western-star-chefs-choice-unsalted-cultured-butter-195091
102836,Western Star Original Butter Block,$8.00,https://www.igashop.com.au/product/western-star-original-butter-block-102836
114354,Western Star Original Salted Butter,$5.20,https://www.igashop.com.au/product/western-star-original-salted-butter-114354
145444,Western Star Original Spreadable,$5.20,https://www.igashop.com.au/product/western-star-original-spreadable-145444
145711,Western Star Spreadable Original Soft,$7.00,https://www.igashop.com.au/product/western-star-spreadable-original-soft-145711
145737,Western Star Spreadable Soft N Less Salt,$7.00,https://www.igashop.com.au/product/western-star-spreadable-soft-n-less-salt-145737
117653,Western Star Spreadable Supersoft,$5.20,https://www.igashop.com.au/product/western-star-spreadable-supersoft-117653
199956,Western Star Supersoft Spreadable,$7.00,https://www.igashop.com.au/product/western-star-supersoft-spreadable-199956
871948,Western Star Unsalted Butter,$5.20,https://www.igashop.com.au/product/western-star-unsalted-butter-871948
20000004744,Yamagishi Happy Eggs Xlarge,$3.50,https://www.igashop.com.au/product/yamagishi-happy-eggs-xlarge-20000004744
117221,Yorkfoods Premium Lard,$4.50,https://www.igashop.com.au/product/yorkfoods-premium-lard-117221
117255,Yorkfoods Prime Beef Dripping,$4.50,https://www.igashop.com.au/product/yorkfoods-prime-beef-dripping-117255
