ID,Name,Price,URL
274552,Abc Extra Hot Chilli Sauce,$3.40,https://www.igashop.com.au/product/abc-extra-hot-chilli-sauce-274552
341626,Abc Kecap Manis Sweet Soy Sauce Bottle,$3.20,https://www.igashop.com.au/product/abc-kecap-manis-sweet-soy-sauce-bottle-341626
448826,Always Fresh Artisan Collection Black Olives Pitted,$3.40,https://www.igashop.com.au/product/always-fresh-artisan-collection-black-olives-pitted-448826
449165,Always Fresh Asparagus Crisp Marinated,$5.00,https://www.igashop.com.au/product/always-fresh-asparagus-crisp-marinated-449165
1218,Always Fresh Asparagus In Springwater,$5.00,https://www.igashop.com.au/product/always-fresh-asparagus-in-springwater-1218
902757,Always Fresh Baby Cucumbers With Chilli,$4.60,https://www.igashop.com.au/product/always-fresh-baby-cucumbers-with-chilli-902757
659508,Always Fresh Balsamic Vinegar,$5.50,https://www.igashop.com.au/product/always-fresh-balsamic-vinegar-659508
9680,Always Fresh Cucumber Dill,$4.60,https://www.igashop.com.au/product/always-fresh-cucumber-dill-9680
324064,Always Fresh Cucumbers Baby,$4.60,https://www.igashop.com.au/product/always-fresh-cucumbers-baby-324064
575704,Always Fresh Cucumbers Bread Butter,$4.10,https://www.igashop.com.au/product/always-fresh-cucumbers-bread-butter-575704
400852,Always Fresh Cucumbers Polish Ogor,$4.60,https://www.igashop.com.au/product/always-fresh-cucumbers-polish-ogor-400852
400844,Always Fresh Cucumbers Sweet Sour,$4.60,https://www.igashop.com.au/product/always-fresh-cucumbers-sweet-sour-400844
645892,Always Fresh Garlic Freshly Minced,$3.30,https://www.igashop.com.au/product/always-fresh-garlic-freshly-minced-645892
659367,Always Fresh Garlic Olives,$6.00,https://www.igashop.com.au/product/always-fresh-garlic-olives-659367
635025,Always Fresh Jalapeno Olives,$6.00,https://www.igashop.com.au/product/always-fresh-jalapeno-olives-635025
641770,Always Fresh Kalamata Olives Pitted,$8.60,https://www.igashop.com.au/product/always-fresh-kalamata-olives-pitted-641770
641819,Always Fresh Kalamata Olives Pitted,$4.80,https://www.igashop.com.au/product/always-fresh-kalamata-olives-pitted-641819
641788,Always Fresh Kalamata Olives Sliced,$4.80,https://www.igashop.com.au/product/always-fresh-kalamata-olives-sliced-641788
637399,Always Fresh Kalamata Olives Wedges,$6.00,https://www.igashop.com.au/product/always-fresh-kalamata-olives-wedges-637399
642190,Always Fresh Marinated Artichoke Hearts,$3.50,https://www.igashop.com.au/product/always-fresh-marinated-artichoke-hearts-642190
949393,Always Fresh Medi Anchovy Fillets,$5.50,https://www.igashop.com.au/product/always-fresh-medi-anchovy-fillets-949393
635017,Always Fresh Mushrooms Whole,$4.60,https://www.igashop.com.au/product/always-fresh-mushrooms-whole-635017
35916,Always Fresh Olive Spanish Stuffed Pimento,$2.70,https://www.igashop.com.au/product/always-fresh-olive-spanish-stuffed-pimento-35916
324739,Always Fresh Olives Anchovy Stuffed,$4.00,https://www.igashop.com.au/product/always-fresh-olives-anchovy-stuffed-324739
394378,Always Fresh Olives Black Sliced,$3.40,https://www.igashop.com.au/product/always-fresh-olives-black-sliced-394378
867101,Always Fresh Olives Parmesan Stuffed,$6.00,https://www.igashop.com.au/product/always-fresh-olives-parmesan-stuffed-867101
641796,Always Fresh Olives Sicilian Pitted,$4.00,https://www.igashop.com.au/product/always-fresh-olives-sicilian-pitted-641796
66917,Always Fresh Olives Spanish Stuffed,$5.80,https://www.igashop.com.au/product/always-fresh-olives-spanish-stuffed-66917
35089,Always Fresh Olives Stuffed,$4.80,https://www.igashop.com.au/product/always-fresh-olives-stuffed-35089
637381,Always Fresh Onions Chilli,$3.60,https://www.igashop.com.au/product/always-fresh-onions-chilli-637381
603620,Always Fresh Piquillo Peppers,$3.60,https://www.igashop.com.au/product/always-fresh-piquillo-peppers-603620
461109,Always Fresh Pitted Kalamata Olives,$8.45,https://www.igashop.com.au/product/always-fresh-pitted-kalamata-olives-461109
658706,Always Fresh Red Wine Vinegar,$3.50,https://www.igashop.com.au/product/always-fresh-red-wine-vinegar-658706
642166,Always Fresh Roasted Peppers Whole,$4.90,https://www.igashop.com.au/product/always-fresh-roasted-peppers-whole-642166
659812,Always Fresh Smokey Olives,$5.30,https://www.igashop.com.au/product/always-fresh-smokey-olives-659812
336079,Always Fresh Spanish Extra Light Olive Oil,$11.75,https://www.igashop.com.au/product/always-fresh-spanish-extra-light-olive-oil-336079
635009,Always Fresh Stuffed Peppers,$7.30,https://www.igashop.com.au/product/always-fresh-stuffed-peppers-635009
642108,Always Fresh Sundried Tomato Strips,$6.00,https://www.igashop.com.au/product/always-fresh-sundried-tomato-strips-642108
641681,Always Fresh Sundried Tomatoes Halves,$4.80,https://www.igashop.com.au/product/always-fresh-sundried-tomatoes-halves-641681
642140,Always Fresh Sundried Tomatoes Strips,$5.00,https://www.igashop.com.au/product/always-fresh-sundried-tomatoes-strips-642140
637404,Always Fresh Traditional Sauerkraut,$3.80,https://www.igashop.com.au/product/always-fresh-traditional-sauerkraut-637404
35377,Always Fresh White Vinegar,$2.70,https://www.igashop.com.au/product/always-fresh-white-vinegar-35377
658714,Always Fresh White Wine Vinegar,$3.50,https://www.igashop.com.au/product/always-fresh-white-wine-vinegar-658714
436803,Ayam Fish Sauce,$4.00,https://www.igashop.com.au/product/ayam-fish-sauce-436803
683955,Ayam Hoisin Sauce,$4.00,https://www.igashop.com.au/product/ayam-hoisin-sauce-683955
456837,Ayam Oyster Sauce,$4.00,https://www.igashop.com.au/product/ayam-oyster-sauce-456837
456803,Ayam Plum Sauce,$4.00,https://www.igashop.com.au/product/ayam-plum-sauce-456803
604896,Ayam Pure Sesame Oil,$6.50,https://www.igashop.com.au/product/ayam-pure-sesame-oil-604896
69444,Azalea Grape Seed Oil,$18.00,https://www.igashop.com.au/product/azalea-grape-seed-oil-69444
930917,Baxters Caramelised Onion Relish,$5.40,https://www.igashop.com.au/product/baxters-caramelised-onion-relish-930917
931934,Baxters Classic Tomato Chutney,$5.40,https://www.igashop.com.au/product/baxters-classic-tomato-chutney-931934
931921,Baxters Fig Date Balsamic Chutney,$5.40,https://www.igashop.com.au/product/baxters-fig-date-balsamic-chutney-931921
190000002494,Baxters Pourable Tomato Relish,$4.75,https://www.igashop.com.au/product/baxters-pourable-tomato-relish-190000002494
926722,Bee Vital Organic Apple Cider Vinegar 500,$5.50,https://www.igashop.com.au/product/bee-vital-organic-apple-cider-vinegar-500-926722
160000012166,Bertolli Extra Virgin Olive Oil Originale,$26.00,https://www.igashop.com.au/product/bertolli-extra-virgin-olive-oil-originale-160000012166
190000004591,Bertolli Extra Virgin Olive Oil Originale,$7.00,https://www.igashop.com.au/product/bertolli-extra-virgin-olive-oil-originale-190000004591
640091,Bertolli Extra Virgin Olive Oil Robusto,$26.00,https://www.igashop.com.au/product/bertolli-extra-virgin-olive-oil-robusto-640091
640114,Bertolli Olive Oil Light In Taste,$26.00,https://www.igashop.com.au/product/bertolli-olive-oil-light-in-taste-640114
447812,Black Gold Australian Canola Oil,$7.20,https://www.igashop.com.au/product/black-gold-australian-canola-oil-447812
46721,Black Gold Barbeque Sauce,$5.30,https://www.igashop.com.au/product/black-gold-barbeque-sauce-46721
303026,Black Gold Brown Vinegar,$1.50,https://www.igashop.com.au/product/black-gold-brown-vinegar-303026
45644,Black Gold Canola Cooking Spray,$3.00,https://www.igashop.com.au/product/black-gold-canola-cooking-spray-45644
650619,Black Gold Canola Oil,$13.50,https://www.igashop.com.au/product/black-gold-canola-oil-650619
36239,Black Gold Cooking Salt,$2.70,https://www.igashop.com.au/product/black-gold-cooking-salt-36239
437532,Black Gold Cooking Salt,$2.00,https://www.igashop.com.au/product/black-gold-cooking-salt-437532
23359,Black Gold Curry Powder,$2.25,https://www.igashop.com.au/product/black-gold-curry-powder-23359
343709,Black Gold Ground White Pepper,$3.00,https://www.igashop.com.au/product/black-gold-ground-white-pepper-343709
15063,Black Gold Iodised Table Salt,$1.50,https://www.igashop.com.au/product/black-gold-iodised-table-salt-15063
628086,Black Gold Lemon Juice,$1.00,https://www.igashop.com.au/product/black-gold-lemon-juice-628086
71849,Black Gold Minced Garlic,$1.25,https://www.igashop.com.au/product/black-gold-minced-garlic-71849
41242,Black Gold Sunflower Oil,$8.50,https://www.igashop.com.au/product/black-gold-sunflower-oil-41242
15356,Black Gold Table Salt Plain Drum,$1.30,https://www.igashop.com.au/product/black-gold-table-salt-plain-drum-15356
402090,Black Gold Tomato Sauce,$5.30,https://www.igashop.com.au/product/black-gold-tomato-sauce-402090
39978,Black Gold Vegetable Oil,$13.50,https://www.igashop.com.au/product/black-gold-vegetable-oil-39978
41234,Black Gold Vegetable Oil,$7.20,https://www.igashop.com.au/product/black-gold-vegetable-oil-41234
28294,Black Gold White Vinegar,$1.70,https://www.igashop.com.au/product/black-gold-white-vinegar-28294
458083,Black Gold Worcestershire Sauce,$4.00,https://www.igashop.com.au/product/black-gold-worcestershire-sauce-458083
66349,Branston Pickle,$6.15,https://www.igashop.com.au/product/branston-pickle-66349
160000011384,Bulls Eye Carolina Reaper With Black Garlic,$3.00,https://www.igashop.com.au/product/bulls-eye-carolina-reaper-with-black-garlic-160000011384
160000011385,Bulls Eye Kentucky Style Habanero With Whisky,$3.00,https://www.igashop.com.au/product/bulls-eye-kentucky-style-habanero-with-whisky-160000011385
160000011386,Bulls Eye Louisiana Style Chipotle With Cajun Spices,$3.00,https://www.igashop.com.au/product/bulls-eye-louisiana-style-chipotle-with-cajun-spices-160000011386
635813,Bulls Eye Original Bbq Sauce,$3.00,https://www.igashop.com.au/product/bulls-eye-original-bbq-sauce-635813
635952,Bulls Eye Sweet Whiskey Glaze,$4.00,https://www.igashop.com.au/product/bulls-eye-sweet-whiskey-glaze-635952
386579,Changs Hoisin Sauce,$2.75,https://www.igashop.com.au/product/changs-hoisin-sauce-386579
451081,Changs Oyster Sauce,$2.00,https://www.igashop.com.au/product/changs-oyster-sauce-451081
813610,Changs Salad Dressing Oriental,$3.00,https://www.igashop.com.au/product/changs-salad-dressing-oriental-813610
65377,Changs Sesame Oil,$3.47,https://www.igashop.com.au/product/changs-sesame-oil-65377
346888,Clive Of India Curry Powder,$2.80,https://www.igashop.com.au/product/clive-of-india-curry-powder-346888
826228,Community Co Baby Capers,$2.50,https://www.igashop.com.au/product/community-co-baby-capers-826228
798954,Community Co Balsamic Vinegar,$4.85,https://www.igashop.com.au/product/community-co-balsamic-vinegar-798954
427728,Community Co Bbq Sauce,$1.95,https://www.igashop.com.au/product/community-co-bbq-sauce-427728
835832,Community Co Black Peppercorn Grinder,$3.50,https://www.igashop.com.au/product/community-co-black-peppercorn-grinder-835832
835780,Community Co Black Peppercorn Refill,$5.50,https://www.igashop.com.au/product/community-co-black-peppercorn-refill-835780
670892,Community Co Canola Oil,$3.55,https://www.igashop.com.au/product/community-co-canola-oil-670892
845269,Community Co Canola Oil Spray,$4.15,https://www.igashop.com.au/product/community-co-canola-oil-spray-845269
742149,Community Co Cocktail Onions,$3.70,https://www.igashop.com.au/product/community-co-cocktail-onions-742149
936515,Community Co Coconut Oil Spray,$4.50,https://www.igashop.com.au/product/community-co-coconut-oil-spray-936515
742398,Community Co Crinkle Cut Gherkin,$3.00,https://www.igashop.com.au/product/community-co-crinkle-cut-gherkin-742398
643138,Community Co Dijon Mustard,$2.75,https://www.igashop.com.au/product/community-co-dijon-mustard-643138
717589,Community Co Extra Virgin Olive Oil,$12.00,https://www.igashop.com.au/product/community-co-extra-virgin-olive-oil-717589
845285,Community Co Extra Virgin Olive Oil Spray,$4.65,https://www.igashop.com.au/product/community-co-extra-virgin-olive-oil-spray-845285
798975,Community Co Glaze With Balsamic Vinegar,$5.30,https://www.igashop.com.au/product/community-co-glaze-with-balsamic-vinegar-798975
805565,Community Co Jalapenos,$3.50,https://www.igashop.com.au/product/community-co-jalapenos-805565
180000000340,Community Co Oil Vegetable,$3.55,https://www.igashop.com.au/product/community-co-oil-vegetable-180000000340
717500,Community Co Organic Coconut Oil,$13.00,https://www.igashop.com.au/product/community-co-organic-coconut-oil-717500
798941,Community Co Red Wine Vinegar,$3.40,https://www.igashop.com.au/product/community-co-red-wine-vinegar-798941
805557,Community Co Rice Bran Oil,$3.70,https://www.igashop.com.au/product/community-co-rice-bran-oil-805557
845251,Community Co Rice Bran Oil Spray,$4.00,https://www.igashop.com.au/product/community-co-rice-bran-oil-spray-845251
825109,Community Co Semi Dried Tomato,$3.50,https://www.igashop.com.au/product/community-co-semi-dried-tomato-825109
829331,Community Co Stuffed Green Olives,$4.50,https://www.igashop.com.au/product/community-co-stuffed-green-olives-829331
670910,Community Co Sunflower Oil,$3.55,https://www.igashop.com.au/product/community-co-sunflower-oil-670910
742458,Community Co Sweet Spicy Gherkin,$3.00,https://www.igashop.com.au/product/community-co-sweet-spicy-gherkin-742458
437529,Community Co Taco Seasoning,$1.40,https://www.igashop.com.au/product/community-co-taco-seasoning-437529
425946,Community Co Tomato Sauce,$1.95,https://www.igashop.com.au/product/community-co-tomato-sauce-425946
670907,Community Co Vegetable Oil,$3.55,https://www.igashop.com.au/product/community-co-vegetable-oil-670907
798967,Community Co White Wine Vinegar,$3.40,https://www.igashop.com.au/product/community-co-white-wine-vinegar-798967
160000013589,Community Gardens The Bronx Greenmarket Hot Sauce,$3.40,https://www.igashop.com.au/product/community-gardens-the-bronx-greenmarket-hot-sauce-160000013589
418245,Continental Sauce White,$1.20,https://www.igashop.com.au/product/continental-sauce-white-418245
36302,Cornwells Brown Malt Vinegar,$2.50,https://www.igashop.com.au/product/cornwells-brown-malt-vinegar-36302
36352,Cornwells Brown Malt Vinegar,$4.50,https://www.igashop.com.au/product/cornwells-brown-malt-vinegar-36352
37120,Cornwells Lancashire Relish,$5.00,https://www.igashop.com.au/product/cornwells-lancashire-relish-37120
36687,Cornwells Mint Sauce Mint,$1.95,https://www.igashop.com.au/product/cornwells-mint-sauce-mint-36687
746245,Cornwells Organic Apple Cider Vinegar,$5.65,https://www.igashop.com.au/product/cornwells-organic-apple-cider-vinegar-746245
36310,Cornwells Vinegar Malt,$3.50,https://www.igashop.com.au/product/cornwells-vinegar-malt-36310
36182,Cornwells White Vinegar,$4.50,https://www.igashop.com.au/product/cornwells-white-vinegar-36182
36328,Cornwells White Vinegar White,$3.50,https://www.igashop.com.au/product/cornwells-white-vinegar-white-36328
36425,Cornwells White Vinegar White,$2.50,https://www.igashop.com.au/product/cornwells-white-vinegar-white-36425
418229,Cornwells Apple Cider Vinegar,$7.00,https://www.igashop.com.au/product/cornwells-apple-cider-vinegar-418229
22890,Crisco Canola Oil,$10.00,https://www.igashop.com.au/product/crisco-canola-oil-22890
23189,Crisco Canola Oil,$5.50,https://www.igashop.com.au/product/crisco-canola-oil-23189
392782,Crisco Peanut Oil,$9.00,https://www.igashop.com.au/product/crisco-peanut-oil-392782
356760,Crisco Sunflower Oil,$6.50,https://www.igashop.com.au/product/crisco-sunflower-oil-356760
40107,Crisco Sunflower Oil,$16.20,https://www.igashop.com.au/product/crisco-sunflower-oil-40107
40636,Crisco Vegetable Blended Oil,$5.50,https://www.igashop.com.au/product/crisco-vegetable-blended-oil-40636
40678,Crisco Vegetable Blended Oil,$10.00,https://www.igashop.com.au/product/crisco-vegetable-blended-oil-40678
361189,Epsom Salts,$9.00,https://www.igashop.com.au/product/epsom-salts-361189
36409,Eta Barbecue Sauce,$2.75,https://www.igashop.com.au/product/eta-barbecue-sauce-36409
34114,Eta Dressings Potato Salad,$4.00,https://www.igashop.com.au/product/eta-dressings-potato-salad-34114
669998,F Whitlock Sons Caramelised Onion Relish,$4.50,https://www.igashop.com.au/product/f-whitlock-sons-caramelised-onion-relish-669998
160000012242,F Whitlock Sons Chipotle Bbq Sauce,$4.50,https://www.igashop.com.au/product/f-whitlock-sons-chipotle-bbq-sauce-160000012242
659032,Fehlbergs Chipotle Cucumbers,$4.00,https://www.igashop.com.au/product/fehlbergs-chipotle-cucumbers-659032
433680,Fehlbergs Jalapenos Pickled,$4.00,https://www.igashop.com.au/product/fehlbergs-jalapenos-pickled-433680
689545,Fehlbergs Onions Pickled,$4.80,https://www.igashop.com.au/product/fehlbergs-onions-pickled-689545
659236,Fehlbergs Sandwich Stackers,$4.00,https://www.igashop.com.au/product/fehlbergs-sandwich-stackers-659236
321139,Fletchers Gherkins Sweet Spiced,$5.00,https://www.igashop.com.au/product/fletchers-gherkins-sweet-spiced-321139
40186,Fountain Barbecue Sauce,$6.00,https://www.igashop.com.au/product/fountain-barbecue-sauce-40186
392452,Fountain Barbecue Sauce Sauce Reduced Sugar,$2.40,https://www.igashop.com.au/product/fountain-barbecue-sauce-sauce-reduced-sugar-392452
372847,Fountain Barbecue Sauce Squeeze,$2.40,https://www.igashop.com.au/product/fountain-barbecue-sauce-squeeze-372847
615685,Fountain Hot Chilli Sauce,$3.50,https://www.igashop.com.au/product/fountain-hot-chilli-sauce-615685
615669,Fountain Mint Sauce,$3.50,https://www.igashop.com.au/product/fountain-mint-sauce-615669
36776,Fountain Mustard Sauce,$3.50,https://www.igashop.com.au/product/fountain-mustard-sauce-36776
324577,Fountain Plum Sauce,$3.50,https://www.igashop.com.au/product/fountain-plum-sauce-324577
615635,Fountain Satay Sauce,$3.50,https://www.igashop.com.au/product/fountain-satay-sauce-615635
355573,Fountain Soy Honey Sauce,$3.50,https://www.igashop.com.au/product/fountain-soy-honey-sauce-355573
615643,Fountain Soy Sauce,$3.50,https://www.igashop.com.au/product/fountain-soy-sauce-615643
36768,Fountain Spicy Red Sauce,$3.50,https://www.igashop.com.au/product/fountain-spicy-red-sauce-36768
36784,Fountain Steak Sauce,$3.50,https://www.igashop.com.au/product/fountain-steak-sauce-36784
486701,Fountain Sweet Chilli Sauce,$3.50,https://www.igashop.com.au/product/fountain-sweet-chilli-sauce-486701
373063,Fountain Sweet Chilli Squeeze Sauce,$4.20,https://www.igashop.com.au/product/fountain-sweet-chilli-squeeze-sauce-373063
615724,Fountain Thick Mint Sauce,$3.50,https://www.igashop.com.au/product/fountain-thick-mint-sauce-615724
36085,Fountain Tomato Sauce,$2.40,https://www.igashop.com.au/product/fountain-tomato-sauce-36085
37146,Fountain Tomato Sauce,$6.00,https://www.igashop.com.au/product/fountain-tomato-sauce-37146
392444,Fountain Tomato Sauce Reduced Sugar,$2.40,https://www.igashop.com.au/product/fountain-tomato-sauce-reduced-sugar-392444
372724,Fountain Tomato Sauce Squeeze,$2.40,https://www.igashop.com.au/product/fountain-tomato-sauce-squeeze-372724
190000001336,Franks Hot Sauce Original,$3.50,https://www.igashop.com.au/product/franks-hot-sauce-original-190000001336
190000001337,Franks Redhot Xtra Hot Sauce,$3.50,https://www.igashop.com.au/product/franks-redhot-xtra-hot-sauce-190000001337
910483,G Fresh All Season,$3.99,https://www.igashop.com.au/product/g-fresh-all-season-910483
909937,G Fresh All Spice Ground,$3.99,https://www.igashop.com.au/product/g-fresh-all-spice-ground-909937
918245,G Fresh Alseason Herb Garlic,$3.99,https://www.igashop.com.au/product/g-fresh-alseason-herb-garlic-918245
909686,G Fresh Basil Leaves,$3.99,https://www.igashop.com.au/product/g-fresh-basil-leaves-909686
909741,G Fresh Bay Leaves,$3.99,https://www.igashop.com.au/product/g-fresh-bay-leaves-909741
8829,G Fresh Black Pepper Grinder,$7.49,https://www.igashop.com.au/product/g-fresh-black-pepper-grinder-8829
685088,G Fresh Cajun Seasoning,$4.69,https://www.igashop.com.au/product/g-fresh-cajun-seasoning-685088
912702,G Fresh Cayenne Pepper,$3.99,https://www.igashop.com.au/product/g-fresh-cayenne-pepper-912702
912809,G Fresh Chicken Salt Original,$3.99,https://www.igashop.com.au/product/g-fresh-chicken-salt-original-912809
914225,G Fresh Chicken Season,$3.99,https://www.igashop.com.au/product/g-fresh-chicken-season-914225
676584,G Fresh Chilli Crushed Hot,$4.69,https://www.igashop.com.au/product/g-fresh-chilli-crushed-hot-676584
676576,G Fresh Chilli Powder Hot,$3.99,https://www.igashop.com.au/product/g-fresh-chilli-powder-hot-676576
676550,G Fresh Chinese Five Spice,$3.99,https://www.igashop.com.au/product/g-fresh-chinese-five-spice-676550
915035,G Fresh Chives Air Dried,$3.99,https://www.igashop.com.au/product/g-fresh-chives-air-dried-915035
20000000672,G Fresh Cinnamon Ground,$3.99,https://www.igashop.com.au/product/g-fresh-cinnamon-ground-20000000672
676526,G Fresh Cinnamon Quills,$3.99,https://www.igashop.com.au/product/g-fresh-cinnamon-quills-676526
915085,G Fresh Cinnamon Sugar,$3.99,https://www.igashop.com.au/product/g-fresh-cinnamon-sugar-915085
676592,G Fresh Cloves Whole,$3.99,https://www.igashop.com.au/product/g-fresh-cloves-whole-676592
676542,G Fresh Coriander Ground,$3.99,https://www.igashop.com.au/product/g-fresh-coriander-ground-676542
871786,G Fresh Coriander Leaves,$3.99,https://www.igashop.com.au/product/g-fresh-coriander-leaves-871786
908868,G Fresh Coriander Seeds,$3.99,https://www.igashop.com.au/product/g-fresh-coriander-seeds-908868
908923,G Fresh Cracked Black Pepper,$3.99,https://www.igashop.com.au/product/g-fresh-cracked-black-pepper-908923
845921,G Fresh Cumin Ground,$3.99,https://www.igashop.com.au/product/g-fresh-cumin-ground-845921
908931,G Fresh Cumin Seeds,$3.99,https://www.igashop.com.au/product/g-fresh-cumin-seeds-908931
908981,G Fresh Dill Tops Green,$3.99,https://www.igashop.com.au/product/g-fresh-dill-tops-green-908981
908999,G Fresh Fennel Seeds,$3.99,https://www.igashop.com.au/product/g-fresh-fennel-seeds-908999
20000000674,G Fresh Garamassala,$3.99,https://www.igashop.com.au/product/g-fresh-garamassala-20000000674
909068,G Fresh Garlic Powder,$3.99,https://www.igashop.com.au/product/g-fresh-garlic-powder-909068
909115,G Fresh Greek Seasoning,$3.99,https://www.igashop.com.au/product/g-fresh-greek-seasoning-909115
20000000676,G Fresh Grinder Bbq Seasoning,$3.99,https://www.igashop.com.au/product/g-fresh-grinder-bbq-seasoning-20000000676
8627,G Fresh Grinder Pepper,$3.99,https://www.igashop.com.au/product/g-fresh-grinder-pepper-8627
8624,G Fresh Grinder Sea Salt,$7.49,https://www.igashop.com.au/product/g-fresh-grinder-sea-salt-8624
8626,G Fresh Grinder Sea Salt,$3.99,https://www.igashop.com.au/product/g-fresh-grinder-sea-salt-8626
20000006691,G Fresh Herb Medley Seasoning,$3.99,https://www.igashop.com.au/product/g-fresh-herb-medley-seasoning-20000006691
8620,G Fresh Himalayan Salt,$3.99,https://www.igashop.com.au/product/g-fresh-himalayan-salt-8620
909149,G Fresh Italian Herbs,$3.99,https://www.igashop.com.au/product/g-fresh-italian-herbs-909149
870227,G Fresh Lamb Seasoning,$4.00,https://www.igashop.com.au/product/g-fresh-lamb-seasoning-870227
846011,G Fresh Lemon Pepper,$4.69,https://www.igashop.com.au/product/g-fresh-lemon-pepper-846011
909432,G Fresh Lemon Thyme Basil Seasoning,$3.99,https://www.igashop.com.au/product/g-fresh-lemon-thyme-basil-seasoning-909432
916358,G Fresh Mint Leaves,$3.99,https://www.igashop.com.au/product/g-fresh-mint-leaves-916358
917702,G Fresh Mixed Herbs,$3.99,https://www.igashop.com.au/product/g-fresh-mixed-herbs-917702
917948,G Fresh Mixed Spice,$3.99,https://www.igashop.com.au/product/g-fresh-mixed-spice-917948
918415,G Fresh Mustard Ground,$3.99,https://www.igashop.com.au/product/g-fresh-mustard-ground-918415
918740,G Fresh Mustard Seeds Black,$3.99,https://www.igashop.com.au/product/g-fresh-mustard-seeds-black-918740
918839,G Fresh Mustard Seeds Yellow,$3.99,https://www.igashop.com.au/product/g-fresh-mustard-seeds-yellow-918839
918855,G Fresh Nutmeg Ground,$3.99,https://www.igashop.com.au/product/g-fresh-nutmeg-ground-918855
918897,G Fresh Onion Flakes,$3.99,https://www.igashop.com.au/product/g-fresh-onion-flakes-918897
919314,G Fresh Onion Powder,$3.99,https://www.igashop.com.au/product/g-fresh-onion-powder-919314
20000001289,G Fresh Onion Salt,$3.99,https://www.igashop.com.au/product/g-fresh-onion-salt-20000001289
920828,G Fresh Oregano Leaves,$3.99,https://www.igashop.com.au/product/g-fresh-oregano-leaves-920828
920878,G Fresh Paprika Hungarian Red,$3.99,https://www.igashop.com.au/product/g-fresh-paprika-hungarian-red-920878
920894,G Fresh Parsley Flakes,$3.99,https://www.igashop.com.au/product/g-fresh-parsley-flakes-920894
920925,G Fresh Pepper Black Whole,$3.99,https://www.igashop.com.au/product/g-fresh-pepper-black-whole-920925
20000000681,G Fresh Pepper Steak Seasoning,$3.99,https://www.igashop.com.au/product/g-fresh-pepper-steak-seasoning-20000000681
20000001296,G Fresh Popcorn Salt,$3.99,https://www.igashop.com.au/product/g-fresh-popcorn-salt-20000001296
676568,G Fresh Portuguese Seasoning,$3.99,https://www.igashop.com.au/product/g-fresh-portuguese-seasoning-676568
909547,G Fresh Rosemary Leaves,$3.99,https://www.igashop.com.au/product/g-fresh-rosemary-leaves-909547
909563,G Fresh Sage Leaves,$3.99,https://www.igashop.com.au/product/g-fresh-sage-leaves-909563
871134,G Fresh Season Sumac,$3.99,https://www.igashop.com.au/product/g-fresh-season-sumac-871134
909636,G Fresh Sesame Seeds,$3.99,https://www.igashop.com.au/product/g-fresh-sesame-seeds-909636
870536,G Fresh Star Anise Whole,$3.99,https://www.igashop.com.au/product/g-fresh-star-anise-whole-870536
909822,G Fresh Steak Seasoning,$3.99,https://www.igashop.com.au/product/g-fresh-steak-seasoning-909822
909872,G Fresh Tandoori Seasoning,$3.99,https://www.igashop.com.au/product/g-fresh-tandoori-seasoning-909872
