ID,Name,Price,URL
20000004883,Mitani Chicken Salt,$3.80,https://www.igashop.com.au/product/mitani-chicken-salt-20000004883
51433,Moro Delicado Extra Light Taste Olive Oil,$15.00,https://www.igashop.com.au/product/moro-delicado-extra-light-taste-olive-oil-51433
190000002904,Moro Extra Virgin Olive Oil,$23.00,https://www.igashop.com.au/product/moro-extra-virgin-olive-oil-190000002904
190000002907,Moro Extra Virgin Olive Oil,$75.00,https://www.igashop.com.au/product/moro-extra-virgin-olive-oil-190000002907
20000003602,Moro Extra Virgin Olive Oil,$13.50,https://www.igashop.com.au/product/moro-extra-virgin-olive-oil-20000003602
190000002908,Moro Light Taste Olive Oil,$23.00,https://www.igashop.com.au/product/moro-light-taste-olive-oil-190000002908
190000002905,Moro Olive Oil,$75.00,https://www.igashop.com.au/product/moro-olive-oil-190000002905
20000006739,Moro Olive Oil,$23.00,https://www.igashop.com.au/product/moro-olive-oil-20000006739
51425,Moro Olive Oil Tradicional,$13.50,https://www.igashop.com.au/product/moro-olive-oil-tradicional-51425
375942,Moulin Pepper Corn Green,$3.85,https://www.igashop.com.au/product/moulin-pepper-corn-green-375942
769670,Murray River Avocado Oil Organic,$12.00,https://www.igashop.com.au/product/murray-river-avocado-oil-organic-769670
670038,Nandos Perinaise Sauce Mild,$4.30,https://www.igashop.com.au/product/nandos-perinaise-sauce-mild-670038
836207,Obento Japanese Rice Wine Vinegar,$2.60,https://www.igashop.com.au/product/obento-japanese-rice-wine-vinegar-836207
76679,Ocean Spray Fruit Sauce Cranberry Jellied,$3.90,https://www.igashop.com.au/product/ocean-spray-fruit-sauce-cranberry-jellied-76679
662666,Ocean Spray Fruit Sauce Cranberry Whole Berry,$3.90,https://www.igashop.com.au/product/ocean-spray-fruit-sauce-cranberry-whole-berry-662666
48634,Old El Paso Hot Taco Sauce,$4.50,https://www.igashop.com.au/product/old-el-paso-hot-taco-sauce-48634
48618,Old El Paso Medium Taco Sauce,$4.50,https://www.igashop.com.au/product/old-el-paso-medium-taco-sauce-48618
328521,Old El Paso Mexican Burrito Spice Mix Mild,$3.00,https://www.igashop.com.au/product/old-el-paso-mexican-burrito-spice-mix-mild-328521
48278,Old El Paso Mexican Chilli Spice Mix Medium,$3.00,https://www.igashop.com.au/product/old-el-paso-mexican-chilli-spice-mix-medium-48278
71519,Old El Paso Mexican Crispy Chicken Spice Mix,$3.00,https://www.igashop.com.au/product/old-el-paso-mexican-crispy-chicken-spice-mix-71519
50160,Old El Paso Mexican Green Jalapenos,$6.00,https://www.igashop.com.au/product/old-el-paso-mexican-green-jalapenos-50160
603400,Old El Paso Mexican Reduced Salt Taco Spice Mix Mild,$3.00,https://www.igashop.com.au/product/old-el-paso-mexican-reduced-salt-taco-spice-mix-mild-603400
48668,Old El Paso Mild Taco Sauce,$4.50,https://www.igashop.com.au/product/old-el-paso-mild-taco-sauce-48668
813461,Old El Paso Nachos Spice Mix Mild,$3.00,https://www.igashop.com.au/product/old-el-paso-nachos-spice-mix-mild-813461
48684,Old El Paso Original Mexican Taco Spice Mix Mild,$3.00,https://www.igashop.com.au/product/old-el-paso-original-mexican-taco-spice-mix-mild-48684
764222,Olssons Salt Sea Flakes Canister,$7.00,https://www.igashop.com.au/product/olssons-salt-sea-flakes-canister-764222
485307,Pacific Salt Flakes Box,$8.00,https://www.igashop.com.au/product/pacific-salt-flakes-box-485307
190000003145,Pandaroo Rice Paper Dipping Sauce,$3.30,https://www.igashop.com.au/product/pandaroo-rice-paper-dipping-sauce-190000003145
904474,Pantai Shrimp Paste,$2.50,https://www.igashop.com.au/product/pantai-shrimp-paste-904474
190000000974,Paul Newmans Own Dressings Balsamic Vinaigrette,$4.00,https://www.igashop.com.au/product/paul-newmans-own-dressings-balsamic-vinaigrette-190000000974
180000001311,Paul Newmans Own Dressings Classic Vinaigrette,$4.00,https://www.igashop.com.au/product/paul-newmans-own-dressings-classic-vinaigrette-180000001311
190000000977,Paul Newmans Own Dressings Ranch,$4.00,https://www.igashop.com.au/product/paul-newmans-own-dressings-ranch-190000000977
435718,Paul Newmans Own Ranch Salad Dressing,$4.00,https://www.igashop.com.au/product/paul-newmans-own-ranch-salad-dressing-435718
372897,Pearl River Bridge Superior Soy Sauce,$3.30,https://www.igashop.com.au/product/pearl-river-bridge-superior-soy-sauce-372897
20000005345,Picky Picky Peanut Oil,$7.20,https://www.igashop.com.au/product/picky-picky-peanut-oil-20000005345
455344,Praise 99 Fat Free Mayonnaise,$4.00,https://www.igashop.com.au/product/praise-99-fat-free-mayonnaise-455344
396087,Praise 99 Fat Free Squeeze Mayonnaise,$4.50,https://www.igashop.com.au/product/praise-99-fat-free-squeeze-mayonnaise-396087
402118,Praise Aioli Mayonnaise Deli Style Chipotle,$4.50,https://www.igashop.com.au/product/praise-aioli-mayonnaise-deli-style-chipotle-402118
402061,Praise Aioli Mayonnaise Deli Style Classic,$4.50,https://www.igashop.com.au/product/praise-aioli-mayonnaise-deli-style-classic-402061
341422,Praise Balsamic Dressing,$3.00,https://www.igashop.com.au/product/praise-balsamic-dressing-341422
746237,Praise Burger Sauce Aioli,$4.50,https://www.igashop.com.au/product/praise-burger-sauce-aioli-746237
365036,Praise Caesar Dressing,$3.00,https://www.igashop.com.au/product/praise-caesar-dressing-365036
902948,Praise Chilli Jam Mayo,$4.50,https://www.igashop.com.au/product/praise-chilli-jam-mayo-902948
365206,Praise Coleslaw Dressing,$3.00,https://www.igashop.com.au/product/praise-coleslaw-dressing-365206
895811,Praise Creamy Lime Herb Dressing,$3.80,https://www.igashop.com.au/product/praise-creamy-lime-herb-dressing-895811
372643,Praise Creamy Mayonnaise Traditional,$5.00,https://www.igashop.com.au/product/praise-creamy-mayonnaise-traditional-372643
889983,Praise Deli Style Balsamic Roasted Garlic,$3.80,https://www.igashop.com.au/product/praise-deli-style-balsamic-roasted-garlic-889983
889933,Praise Deli Style Creamy Roast Garlic,$3.80,https://www.igashop.com.au/product/praise-deli-style-creamy-roast-garlic-889933
889886,Praise Deli Style Honey Dijon,$3.80,https://www.igashop.com.au/product/praise-deli-style-honey-dijon-889886
365222,Praise Dressings Coleslaw 99 Fat Free,$3.00,https://www.igashop.com.au/product/praise-dressings-coleslaw-99-fat-free-365222
364975,Praise Dressings French Original,$3.00,https://www.igashop.com.au/product/praise-dressings-french-original-364975
365159,Praise Dressings Italian Original,$3.00,https://www.igashop.com.au/product/praise-dressings-italian-original-365159
365086,Praise Dressings Thousand Island,$3.00,https://www.igashop.com.au/product/praise-dressings-thousand-island-365086
62641,Praise Greek Dressings,$3.00,https://www.igashop.com.au/product/praise-greek-dressings-62641
632593,Praise Potato Salad Dressing,$3.00,https://www.igashop.com.au/product/praise-potato-salad-dressing-632593
482498,Praise Ranch Dressing,$3.00,https://www.igashop.com.au/product/praise-ranch-dressing-482498
13833,Praise Real Whole Egg Mayonnaise,$6.00,https://www.igashop.com.au/product/praise-real-whole-egg-mayonnaise-13833
482511,Praise Real Whole Egg Mayonnaise,$4.00,https://www.igashop.com.au/product/praise-real-whole-egg-mayonnaise-482511
52324,Praise Seafood Sauce,$3.50,https://www.igashop.com.au/product/praise-seafood-sauce-52324
52293,Praise Tartare Sauce,$3.50,https://www.igashop.com.au/product/praise-tartare-sauce-52293
372465,Praise Traditional Creamy Mayonnaise,$5.40,https://www.igashop.com.au/product/praise-traditional-creamy-mayonnaise-372465
454461,Praise Traditional Creamy Mayonnaise,$4.00,https://www.igashop.com.au/product/praise-traditional-creamy-mayonnaise-454461
396134,Praise Traditional Mayonnaise Squeeze Bottle,$4.50,https://www.igashop.com.au/product/praise-traditional-mayonnaise-squeeze-bottle-396134
17395,Praise Whole Egg Mayonnaise Whole Egg,$6.30,https://www.igashop.com.au/product/praise-whole-egg-mayonnaise-whole-egg-17395
160000018264,Pro Chef Olive Oil Light Spray,$5.00,https://www.igashop.com.au/product/pro-chef-olive-oil-light-spray-160000018264
856419,Queen Finest Vanilla Bean Pods,$8.00,https://www.igashop.com.au/product/queen-finest-vanilla-bean-pods-856419
4957,Raw C Coconut Oil,$14.89,https://www.igashop.com.au/product/raw-c-coconut-oil-4957
92950,Rosella Fruit Chutney,$4.50,https://www.igashop.com.au/product/rosella-fruit-chutney-92950
877949,Sw Mayonnaise Light,$5.60,https://www.igashop.com.au/product/sw-mayonnaise-light-877949
356605,Sw Mayonnaise Whole Egg,$10.50,https://www.igashop.com.au/product/sw-mayonnaise-whole-egg-356605
752217,Sw Vegan Mayonnaise,$5.50,https://www.igashop.com.au/product/sw-vegan-mayonnaise-752217
338102,Sw Whole Egg Mayonnaise,$6.32,https://www.igashop.com.au/product/sw-whole-egg-mayonnaise-338102
378403,Sw Whole Egg Mayonnaise Squeeze Bottle,$5.55,https://www.igashop.com.au/product/sw-whole-egg-mayonnaise-squeeze-bottle-378403
354360,Sandhurst Baby Capers In Wine Vinegar,$2.80,https://www.igashop.com.au/product/sandhurst-baby-capers-in-wine-vinegar-354360
354093,Sandhurst Chillies Jalapeno Medium Hot,$3.80,https://www.igashop.com.au/product/sandhurst-chillies-jalapeno-medium-hot-354093
92510,Sandhurst Sun Dried Tomatoes,$5.00,https://www.igashop.com.au/product/sandhurst-sun-dried-tomatoes-92510
49290,Saxa All Natural Rock Salt,$4.70,https://www.igashop.com.au/product/saxa-all-natural-rock-salt-49290
344187,Saxa Iodised Sea Salt Grinder,$4.80,https://www.igashop.com.au/product/saxa-iodised-sea-salt-grinder-344187
40767,Saxa Iodised Table Salt Shaker,$4.50,https://www.igashop.com.au/product/saxa-iodised-table-salt-shaker-40767
405190,Saxa Natural Pink Himalayan Salt Grinder,$5.50,https://www.igashop.com.au/product/saxa-natural-pink-himalayan-salt-grinder-405190
934110,Saxa Natural Rock Salt,$2.80,https://www.igashop.com.au/product/saxa-natural-rock-salt-934110
41674,Saxa Pepper Black Picnic Pack,$3.60,https://www.igashop.com.au/product/saxa-pepper-black-picnic-pack-41674
441010,Saxa Pepper Grinder Black Peppercorn,$4.80,https://www.igashop.com.au/product/saxa-pepper-grinder-black-peppercorn-441010
41852,Saxa Pepper White Picnic Pack,$3.60,https://www.igashop.com.au/product/saxa-pepper-white-picnic-pack-41852
160000003095,Saxa Picnic Pack Iodised Table Salt,$2.40,https://www.igashop.com.au/product/saxa-picnic-pack-iodised-table-salt-160000003095
675648,Saxa Pink Himalayan Salt Flakes,$6.60,https://www.igashop.com.au/product/saxa-pink-himalayan-salt-flakes-675648
326430,Saxa Salt Cooking Iodised,$2.20,https://www.igashop.com.au/product/saxa-salt-cooking-iodised-326430
41145,Saxa Table Salt Picnic Pack,$2.40,https://www.igashop.com.au/product/saxa-table-salt-picnic-pack-41145
40822,Saxa Table Salt Plain,$4.50,https://www.igashop.com.au/product/saxa-table-salt-plain-40822
490679,Spring Gully Gherkins Round,$4.50,https://www.igashop.com.au/product/spring-gully-gherkins-round-490679
344242,Spring Gully Gherkins Sweet Spiced,$4.50,https://www.igashop.com.au/product/spring-gully-gherkins-sweet-spiced-344242
999212,Spring Gully Onions Brown,$4.60,https://www.igashop.com.au/product/spring-gully-onions-brown-999212
622284,Spring Gully Pickles Green Tomato,$4.00,https://www.igashop.com.au/product/spring-gully-pickles-green-tomato-622284
680672,Spring Gully Pickles Sweet Mustard,$4.00,https://www.igashop.com.au/product/spring-gully-pickles-sweet-mustard-680672
190000001346,Spring Gully Sour Mustard Pickle,$4.00,https://www.igashop.com.au/product/spring-gully-sour-mustard-pickle-190000001346
265715,Spring Gully White Cocktail Pickled Onions,$2.85,https://www.igashop.com.au/product/spring-gully-white-cocktail-pickled-onions-265715
390201,Spring Gully Worcestershire Sauce,$3.50,https://www.igashop.com.au/product/spring-gully-worcestershire-sauce-390201
372130,Squid Brand Fish Sauce,$2.85,https://www.igashop.com.au/product/squid-brand-fish-sauce-372130
100274,Supafry Solid Frying Oil,$4.50,https://www.igashop.com.au/product/supafry-solid-frying-oil-100274
160000003404,Tabasco Chipotle Sauce,$5.50,https://www.igashop.com.au/product/tabasco-chipotle-sauce-160000003404
160000003409,Tabasco Green Pepper Sauce,$5.50,https://www.igashop.com.au/product/tabasco-green-pepper-sauce-160000003409
160000003407,Tabasco Habanero Sauce,$5.50,https://www.igashop.com.au/product/tabasco-habanero-sauce-160000003407
160000003410,Tabasco Pepper Sauce,$5.50,https://www.igashop.com.au/product/tabasco-pepper-sauce-160000003410
428973,Tabasco Pepper Sauce,$8.40,https://www.igashop.com.au/product/tabasco-pepper-sauce-428973
222204,Tabasco Sriracha,$6.00,https://www.igashop.com.au/product/tabasco-sriracha-222204
20000005977,The Food Company Tahini,$7.40,https://www.igashop.com.au/product/the-food-company-tahini-20000005977
5063,The Market Grocer Caramelised Balsamic Vinegar Dressing,$8.79,https://www.igashop.com.au/product/the-market-grocer-caramelised-balsamic-vinegar-dressing-5063
160000013399,The Market Grocer Caramelised Garlic Lime Dressing,$5.89,https://www.igashop.com.au/product/the-market-grocer-caramelised-garlic-lime-dressing-160000013399
5052,The Market Grocer Ceasars Dressing,$5.89,https://www.igashop.com.au/product/the-market-grocer-ceasars-dressing-5052
160000013398,The Market Grocer French Dressing,$5.89,https://www.igashop.com.au/product/the-market-grocer-french-dressing-160000013398
5056,The Market Grocer Italian Dressing,$5.89,https://www.igashop.com.au/product/the-market-grocer-italian-dressing-5056
5053,The Market Grocer Mango Chilli Coconut Dressing,$5.89,https://www.igashop.com.au/product/the-market-grocer-mango-chilli-coconut-dressing-5053
160000013400,The Market Grocer Tangy Coleslaw Dressing,$6.19,https://www.igashop.com.au/product/the-market-grocer-tangy-coleslaw-dressing-160000013400
5060,The Market Grocer Thai Satay Dressing,$5.89,https://www.igashop.com.au/product/the-market-grocer-thai-satay-dressing-5060
996183,Thomy Mayonnaise,$7.50,https://www.igashop.com.au/product/thomy-mayonnaise-996183
371744,Three Threes Fruit Sauce Apple,$2.90,https://www.igashop.com.au/product/three-threes-fruit-sauce-apple-371744
363856,Three Threes Gherkins Sweet Spiced,$4.00,https://www.igashop.com.au/product/three-threes-gherkins-sweet-spiced-363856
347957,Three Threes Mint Jelly,$2.70,https://www.igashop.com.au/product/three-threes-mint-jelly-347957
345183,Three Threes Olives Stuffed,$4.50,https://www.igashop.com.au/product/three-threes-olives-stuffed-345183
371752,Three Threes Olives Stuffed,$3.00,https://www.igashop.com.au/product/three-threes-olives-stuffed-371752
324404,Three Threes Onions Pickled Old Style,$5.10,https://www.igashop.com.au/product/three-threes-onions-pickled-old-style-324404
420755,Three Threes Pepper Pickled Onions,$4.50,https://www.igashop.com.au/product/three-threes-pepper-pickled-onions-420755
322208,Three Threes Pickled Onions,$4.80,https://www.igashop.com.au/product/three-threes-pickled-onions-322208
324446,Three Threes Pickles Mustard Spreadable,$3.05,https://www.igashop.com.au/product/three-threes-pickles-mustard-spreadable-324446
35322,Three Threes Sweet Mustard Pickles,$2.25,https://www.igashop.com.au/product/three-threes-sweet-mustard-pickles-35322
35330,Three Threes Sweet Mustard Pickles,$3.50,https://www.igashop.com.au/product/three-threes-sweet-mustard-pickles-35330
439089,Trident Chilli Sauce Sweet Chilli,$3.85,https://www.igashop.com.au/product/trident-chilli-sauce-sweet-chilli-439089
680876,Trident Chilli Sauce Sweet Chilli,$5.50,https://www.igashop.com.au/product/trident-chilli-sauce-sweet-chilli-680876
621678,Trident Sweet Chilli With Ginger Sauce,$3.85,https://www.igashop.com.au/product/trident-sweet-chilli-with-ginger-sauce-621678
498326,Valcom Lemongrass,$3.00,https://www.igashop.com.au/product/valcom-lemongrass-498326
20000006842,Ybarra Extra Virgin Olive Oil,$36.00,https://www.igashop.com.au/product/ybarra-extra-virgin-olive-oil-20000006842
378704,Yeos Ingredients Sesame Oil,$5.00,https://www.igashop.com.au/product/yeos-ingredients-sesame-oil-378704
836273,Yeos Sauce Sambal Oelek,$5.45,https://www.igashop.com.au/product/yeos-sauce-sambal-oelek-836273
901463,Zoosh Balsamic Dressing,$3.00,https://www.igashop.com.au/product/zoosh-balsamic-dressing-901463
901455,Zoosh Caesar Dressing,$3.00,https://www.igashop.com.au/product/zoosh-caesar-dressing-901455
901353,Zoosh Coleslaw Dressing,$3.00,https://www.igashop.com.au/product/zoosh-coleslaw-dressing-901353
402582,Zoosh Free Range Egg Garlic Aioli,$4.90,https://www.igashop.com.au/product/zoosh-free-range-egg-garlic-aioli-402582
402566,Zoosh Free Range Egg Mayonnaise,$4.90,https://www.igashop.com.au/product/zoosh-free-range-egg-mayonnaise-402566
901471,Zoosh French Dressing,$3.85,https://www.igashop.com.au/product/zoosh-french-dressing-901471
901696,Zoosh Italian Dressing,$3.00,https://www.igashop.com.au/product/zoosh-italian-dressing-901696
901337,Zoosh Potato Dressing,$3.00,https://www.igashop.com.au/product/zoosh-potato-dressing-901337
901905,Zoosh Tartare Sauce,$4.90,https://www.igashop.com.au/product/zoosh-tartare-sauce-901905
