ID,Name,Price,URL
20000003125,Tcc Coconut Milk Lite,$2.30,https://www.igashop.com.au/product/tcc-coconut-milk-lite-20000003125
274552,Abc Extra Hot Chilli Sauce,$3.40,https://www.igashop.com.au/product/abc-extra-hot-chilli-sauce-274552
341626,Abc Kecap Manis Sweet Soy Sauce Bottle,$3.20,https://www.igashop.com.au/product/abc-kecap-manis-sweet-soy-sauce-bottle-341626
482846,Abc Sweet Soy Sauce,$5.60,https://www.igashop.com.au/product/abc-sweet-soy-sauce-482846
436887,Ayam Coconut Cream Light,$2.90,https://www.igashop.com.au/product/ayam-coconut-cream-light-436887
310992,Ayam Coconut Milk,$2.90,https://www.igashop.com.au/product/ayam-coconut-milk-310992
984911,Ayam Coconut Milk Light,$2.90,https://www.igashop.com.au/product/ayam-coconut-milk-light-984911
436803,Ayam Fish Sauce,$4.00,https://www.igashop.com.au/product/ayam-fish-sauce-436803
683955,Ayam Hoisin Sauce,$4.00,https://www.igashop.com.au/product/ayam-hoisin-sauce-683955
36792,Ayam Laksa Paste,$4.00,https://www.igashop.com.au/product/ayam-laksa-paste-36792
830803,Ayam Malaysian Rendang Curry Paste,$4.00,https://www.igashop.com.au/product/ayam-malaysian-rendang-curry-paste-830803
456837,Ayam Oyster Sauce,$4.00,https://www.igashop.com.au/product/ayam-oyster-sauce-456837
608028,Ayam Paste Thai Green Curry,$4.00,https://www.igashop.com.au/product/ayam-paste-thai-green-curry-608028
607844,Ayam Paste Thai Red Curry,$4.00,https://www.igashop.com.au/product/ayam-paste-thai-red-curry-607844
456803,Ayam Plum Sauce,$4.00,https://www.igashop.com.au/product/ayam-plum-sauce-456803
604896,Ayam Pure Sesame Oil,$6.50,https://www.igashop.com.au/product/ayam-pure-sesame-oil-604896
311184,Ayam Satay Sauce,$3.90,https://www.igashop.com.au/product/ayam-satay-sauce-311184
839988,Ayam Teriyaki Sauce,$4.00,https://www.igashop.com.au/product/ayam-teriyaki-sauce-839988
360243,Bisto Gravy Granules,$9.50,https://www.igashop.com.au/product/bisto-gravy-granules-360243
23359,Black Gold Curry Powder,$2.25,https://www.igashop.com.au/product/black-gold-curry-powder-23359
29606,Black Gold Soy Sauce,$1.90,https://www.igashop.com.au/product/black-gold-soy-sauce-29606
975666,Changs Crunchy Noodles,$1.70,https://www.igashop.com.au/product/changs-crunchy-noodles-975666
78728,Changs Egg Noodles,$3.25,https://www.igashop.com.au/product/changs-egg-noodles-78728
48676,Changs Fried Noodles,$1.70,https://www.igashop.com.au/product/changs-fried-noodles-48676
386579,Changs Hoisin Sauce,$2.75,https://www.igashop.com.au/product/changs-hoisin-sauce-386579
96514,Changs Light Soy Sauce,$3.40,https://www.igashop.com.au/product/changs-light-soy-sauce-96514
451081,Changs Oyster Sauce,$2.00,https://www.igashop.com.au/product/changs-oyster-sauce-451081
428664,Changs Rice Vermicelli,$2.55,https://www.igashop.com.au/product/changs-rice-vermicelli-428664
65377,Changs Sesame Oil,$3.47,https://www.igashop.com.au/product/changs-sesame-oil-65377
401387,Changs Thai Style Rice Noodle,$2.40,https://www.igashop.com.au/product/changs-thai-style-rice-noodle-401387
338615,Clive Of India Authentic Curry Powder,$4.00,https://www.igashop.com.au/product/clive-of-india-authentic-curry-powder-338615
346888,Clive Of India Curry Powder,$2.80,https://www.igashop.com.au/product/clive-of-india-curry-powder-346888
20000006654,Coco Earth Ghee Butter Grass Fed,$6.10,https://www.igashop.com.au/product/coco-earth-ghee-butter-grass-fed-20000006654
812630,Community Co Original Tortilla,$3.45,https://www.igashop.com.au/product/community-co-original-tortilla-812630
437529,Community Co Taco Seasoning,$1.40,https://www.igashop.com.au/product/community-co-taco-seasoning-437529
499500,Double Pheonix Vermicelli Green Bean,$1.00,https://www.igashop.com.au/product/double-pheonix-vermicelli-green-bean-499500
623280,Double Phoenix Prawn Crackers,$2.10,https://www.igashop.com.au/product/double-phoenix-prawn-crackers-623280
151160,Fantastic Fresh Noodles Singapore,$3.00,https://www.igashop.com.au/product/fantastic-fresh-noodles-singapore-151160
16000001738,Fountain Hoi Sin Sauce,$3.50,https://www.igashop.com.au/product/fountain-hoi-sin-sauce-16000001738
615643,Fountain Soy Sauce,$3.50,https://www.igashop.com.au/product/fountain-soy-sauce-615643
839569,Golden Wok Diana Chan Korean Beef Dumpling,$8.50,https://www.igashop.com.au/product/golden-wok-diana-chan-korean-beef-dumpling-839569
839239,Golden Wok Diana Chan Szechuan Peppered Pork Dumpling,$8.50,https://www.igashop.com.au/product/golden-wok-diana-chan-szechuan-peppered-pork-dumpling-839239
835829,Hakubaku Organic Soba,$4.00,https://www.igashop.com.au/product/hakubaku-organic-soba-835829
310196,Hoyts Curry Powder Mild,$2.30,https://www.igashop.com.au/product/hoyts-curry-powder-mild-310196
600355,Huy Fong Sriracha,$7.50,https://www.igashop.com.au/product/huy-fong-sriracha-600355
839360,Jeenys Tamarind Puree,$5.70,https://www.igashop.com.au/product/jeenys-tamarind-puree-839360
390450,Kan Tong Black Bean Stir Fry Cooking Sauce,$3.80,https://www.igashop.com.au/product/kan-tong-black-bean-stir-fry-cooking-sauce-390450
390468,Kan Tong Butter Chicken Cooking Sauce,$3.80,https://www.igashop.com.au/product/kan-tong-butter-chicken-cooking-sauce-390468
442477,Kan Tong Chicken Cashew Nut Meal Base Pouch,$2.50,https://www.igashop.com.au/product/kan-tong-chicken-cashew-nut-meal-base-pouch-442477
442435,Kan Tong Honey Soy Garlic Meal Base Pouch,$2.50,https://www.igashop.com.au/product/kan-tong-honey-soy-garlic-meal-base-pouch-442435
229609,Kan Tong Honey Soy Garlic Stir Fry Sauce,$3.80,https://www.igashop.com.au/product/kan-tong-honey-soy-garlic-stir-fry-sauce-229609
48163,Kan Tong Honey Teriyaki Stir Fry Sauce,$3.80,https://www.igashop.com.au/product/kan-tong-honey-teriyaki-stir-fry-sauce-48163
698560,Kan Tong Inspirations Singapore Style Noodles,$3.00,https://www.igashop.com.au/product/kan-tong-inspirations-singapore-style-noodles-698560
425200,Kan Tong Inspirations Udon Noodles,$3.00,https://www.igashop.com.au/product/kan-tong-inspirations-udon-noodles-425200
390426,Kan Tong Peanut Satay Stir Fry Cooking Sauce,$3.80,https://www.igashop.com.au/product/kan-tong-peanut-satay-stir-fry-cooking-sauce-390426
390382,Kan Tong Pineapple Sweet Sour Stir Fry Cooking Sauce,$3.80,https://www.igashop.com.au/product/kan-tong-pineapple-sweet-sour-stir-fry-cooking-sauce-390382
442508,Kan Tong Satay Chicken Meal Base Pouch,$2.50,https://www.igashop.com.au/product/kan-tong-satay-chicken-meal-base-pouch-442508
390484,Kan Tong Stir Fry Sauce Chinese Barbecue,$3.80,https://www.igashop.com.au/product/kan-tong-stir-fry-sauce-chinese-barbecue-390484
390434,Kan Tong Stir Fry Sauce Honey Sesame Garlic,$3.80,https://www.igashop.com.au/product/kan-tong-stir-fry-sauce-honey-sesame-garlic-390434
390400,Kan Tong Stir Fry Sauce Sweet Sour,$3.80,https://www.igashop.com.au/product/kan-tong-stir-fry-sauce-sweet-sour-390400
390442,Kan Tong Stir Fry Sauce Sweet Soy Garlic,$3.80,https://www.igashop.com.au/product/kan-tong-stir-fry-sauce-sweet-soy-garlic-390442
442249,Kan Tong Teriyaki Chicken Meal Base Pouch,$2.50,https://www.igashop.com.au/product/kan-tong-teriyaki-chicken-meal-base-pouch-442249
442498,Kan Tong Thai Green Curry Meal Base Pouch,$2.50,https://www.igashop.com.au/product/kan-tong-thai-green-curry-meal-base-pouch-442498
9166,Keens Curry Powder,$5.50,https://www.igashop.com.au/product/keens-curry-powder-9166
305044,Kewpie Salad Dressing Roasted Sesame,$5.20,https://www.igashop.com.au/product/kewpie-salad-dressing-roasted-sesame-305044
406939,Kikkoman Honey Soy Marinade,$4.00,https://www.igashop.com.au/product/kikkoman-honey-soy-marinade-406939
19716,Kikkoman Naturally Brewed Soy Sauce Less Salt,$6.70,https://www.igashop.com.au/product/kikkoman-naturally-brewed-soy-sauce-less-salt-19716
37007,Kikkoman Soy Sauce,$6.10,https://www.igashop.com.au/product/kikkoman-soy-sauce-37007
37853,Kikkoman Soy Sauce,$7.90,https://www.igashop.com.au/product/kikkoman-soy-sauce-37853
92125,Kikkoman Soy Sauce Gluten Free Soy,$6.30,https://www.igashop.com.au/product/kikkoman-soy-sauce-gluten-free-soy-92125
36946,Kikkoman Teriyaki Marinade Stir Fry Sauce,$4.00,https://www.igashop.com.au/product/kikkoman-teriyaki-marinade-stir-fry-sauce-36946
412728,Lee Kum Kee Panda Oyster Sauce,$3.65,https://www.igashop.com.au/product/lee-kum-kee-panda-oyster-sauce-412728
836168,Lee Kum Kee Premium Soy Sauce,$3.00,https://www.igashop.com.au/product/lee-kum-kee-premium-soy-sauce-836168
315816,Lee Kum Kee Sauce Chicken And Honey Soy Pouch,$2.70,https://www.igashop.com.au/product/lee-kum-kee-sauce-chicken-and-honey-soy-pouch-315816
497689,Lee Kum Kee Sauce Sweet Sour,$4.35,https://www.igashop.com.au/product/lee-kum-kee-sauce-sweet-sour-497689
881066,Lee Kum Kee Soy Sauce Premium,$4.30,https://www.igashop.com.au/product/lee-kum-kee-soy-sauce-premium-881066
20000002805,Lobo Panko Bread Crumb,$6.30,https://www.igashop.com.au/product/lobo-panko-bread-crumb-20000002805
20000006726,Mae Ploy Paste Green Curry,$1.25,https://www.igashop.com.au/product/mae-ploy-paste-green-curry-20000006726
769769,Maggi Mince Chow Mein Recipe Base,$1.85,https://www.igashop.com.au/product/maggi-mince-chow-mein-recipe-base-769769
252270,Maggi Recipe Base Sachet Infusion Pad Thai Stir Fry,$3.50,https://www.igashop.com.au/product/maggi-recipe-base-sachet-infusion-pad-thai-stir-fry-252270
376383,Maggi Stir Fry Creations Chinese Five Spice Soy Beef,$3.20,https://www.igashop.com.au/product/maggi-stir-fry-creations-chinese-five-spice-soy-beef-376383
376367,Maggi Stir Fry Creations Honey Soy Garlic Chicken,$3.50,https://www.igashop.com.au/product/maggi-stir-fry-creations-honey-soy-garlic-chicken-376367
376406,Maggi Teriyaki Sesame Chicken Stir Fry,$3.50,https://www.igashop.com.au/product/maggi-teriyaki-sesame-chicken-stir-fry-376406
165745,Marathon Dim Sims,$12.00,https://www.igashop.com.au/product/marathon-dim-sims-165745
840913,Marions Kitchen Classic Japanese Teriyaki Sauce,$5.00,https://www.igashop.com.au/product/marions-kitchen-classic-japanese-teriyaki-sauce-840913
844006,Marions Kitchen Pad Thai Cooking Kit,$8.50,https://www.igashop.com.au/product/marions-kitchen-pad-thai-cooking-kit-844006
843987,Marions Kitchen Thai Green Curry Cooking Kit,$8.50,https://www.igashop.com.au/product/marions-kitchen-thai-green-curry-cooking-kit-843987
844462,Marions Kitchen Thai Red Curry Cooking Kit,$8.50,https://www.igashop.com.au/product/marions-kitchen-thai-red-curry-cooking-kit-844462
363610,Masterfoods Chilli Powder Mexican,$4.30,https://www.igashop.com.au/product/masterfoods-chilli-powder-mexican-363610
885094,Masterfoods Moroccan Seasoning,$7.30,https://www.igashop.com.au/product/masterfoods-moroccan-seasoning-885094
683206,Masterfoods Seasoning Thai,$4.30,https://www.igashop.com.au/product/masterfoods-seasoning-thai-683206
675698,Masterfoods Simmer Sauce Butter Chicken,$4.50,https://www.igashop.com.au/product/masterfoods-simmer-sauce-butter-chicken-675698
694558,Masterfoods Stir Fry Recipe Base Creamy Thai Chicken,$2.50,https://www.igashop.com.au/product/masterfoods-stir-fry-recipe-base-creamy-thai-chicken-694558
20000005814,Mission Naan Bread Garlic Herb,$3.20,https://www.igashop.com.au/product/mission-naan-bread-garlic-herb-20000005814
1239,Mission Original Tortillas,$4.50,https://www.igashop.com.au/product/mission-original-tortillas-1239
20000005813,Mission Plain Naan Bread,$3.20,https://www.igashop.com.au/product/mission-plain-naan-bread-20000005813
899530,Mission Street Mini Tacos,$4.40,https://www.igashop.com.au/product/mission-street-mini-tacos-899530
233035,Mission Yellow Corn Tortilla Strips,$4.50,https://www.igashop.com.au/product/mission-yellow-corn-tortilla-strips-233035
907100,Mr Chens Prawn Hargow,$8.50,https://www.igashop.com.au/product/mr-chens-prawn-hargow-907100
20000006746,Nissin Sesame Oil Instant Noodles,$1.80,https://www.igashop.com.au/product/nissin-sesame-oil-instant-noodles-20000006746
20000005764,Nong Shim Instant Noodles Shin Ramyun,$1.95,https://www.igashop.com.au/product/nong-shim-instant-noodles-shin-ramyun-20000005764
836207,Obento Japanese Rice Wine Vinegar,$2.60,https://www.igashop.com.au/product/obento-japanese-rice-wine-vinegar-836207
20000006753,Obento Mirin Seasoning,$4.40,https://www.igashop.com.au/product/obento-mirin-seasoning-20000006753
956772,Obento Noodle Udon,$1.70,https://www.igashop.com.au/product/obento-noodle-udon-956772
190000001555,Obento Sliced Pickled Ginger Amazu Shoga,$1.70,https://www.igashop.com.au/product/obento-sliced-pickled-ginger-amazu-shoga-190000001555
836265,Obento Sushi Mat,$2.15,https://www.igashop.com.au/product/obento-sushi-mat-836265
836257,Obento Yaki Nori For Sushi,$4.00,https://www.igashop.com.au/product/obento-yaki-nori-for-sushi-836257
160000013010,Old El Paso Black Beans,$4.50,https://www.igashop.com.au/product/old-el-paso-black-beans-160000013010
20000006748,Old El Paso Burrito Tortillas Jumbo,$6.50,https://www.igashop.com.au/product/old-el-paso-burrito-tortillas-jumbo-20000006748
357261,Old El Paso Enchilada Kit Mild,$8.50,https://www.igashop.com.au/product/old-el-paso-enchilada-kit-mild-357261
453952,Old El Paso Fajita Kit Mild,$8.50,https://www.igashop.com.au/product/old-el-paso-fajita-kit-mild-453952
945226,Old El Paso Gluten Free Mild 8 Soft Taco Kit,$7.00,https://www.igashop.com.au/product/old-el-paso-gluten-free-mild-8-soft-taco-kit-945226
925886,Old El Paso Gluten Free Tortilla,$6.00,https://www.igashop.com.au/product/old-el-paso-gluten-free-tortilla-925886
479568,Old El Paso Hard N Soft Taco Kit,$7.00,https://www.igashop.com.au/product/old-el-paso-hard-n-soft-taco-kit-479568
48634,Old El Paso Hot Taco Sauce,$4.50,https://www.igashop.com.au/product/old-el-paso-hot-taco-sauce-48634
477045,Old El Paso Medium Salsa Thick Chunky,$5.50,https://www.igashop.com.au/product/old-el-paso-medium-salsa-thick-chunky-477045
48618,Old El Paso Medium Taco Sauce,$4.50,https://www.igashop.com.au/product/old-el-paso-medium-taco-sauce-48618
328521,Old El Paso Mexican Burrito Spice Mix Mild,$3.00,https://www.igashop.com.au/product/old-el-paso-mexican-burrito-spice-mix-mild-328521
20000006141,Old El Paso Mexican Burrito Tortillas,$5.50,https://www.igashop.com.au/product/old-el-paso-mexican-burrito-tortillas-20000006141
20000006749,Old El Paso Mexican Burrito Tortillas,$4.50,https://www.igashop.com.au/product/old-el-paso-mexican-burrito-tortillas-20000006749
48278,Old El Paso Mexican Chilli Spice Mix Medium,$3.00,https://www.igashop.com.au/product/old-el-paso-mexican-chilli-spice-mix-medium-48278
71519,Old El Paso Mexican Crispy Chicken Spice Mix,$3.00,https://www.igashop.com.au/product/old-el-paso-mexican-crispy-chicken-spice-mix-71519
50160,Old El Paso Mexican Green Jalapenos,$6.00,https://www.igashop.com.au/product/old-el-paso-mexican-green-jalapenos-50160
48888,Old El Paso Mexican Mild 12 Taco Kit,$8.50,https://www.igashop.com.au/product/old-el-paso-mexican-mild-12-taco-kit-48888
190000004724,Old El Paso Mexican Mini Tortillas,$5.00,https://www.igashop.com.au/product/old-el-paso-mexican-mini-tortillas-190000004724
603400,Old El Paso Mexican Reduced Salt Taco Spice Mix Mild,$3.00,https://www.igashop.com.au/product/old-el-paso-mexican-reduced-salt-taco-spice-mix-mild-603400
48862,Old El Paso Mexican Wholegrain Tortillas,$4.50,https://www.igashop.com.au/product/old-el-paso-mexican-wholegrain-tortillas-48862
426557,Old El Paso Mild Burrito Kit,$8.50,https://www.igashop.com.au/product/old-el-paso-mild-burrito-kit-426557
612530,Old El Paso Mild Crispy Chicken Soft Taco Kit,$8.50,https://www.igashop.com.au/product/old-el-paso-mild-crispy-chicken-soft-taco-kit-612530
364682,Old El Paso Mild Jumbo 10 Taco Kit,$7.00,https://www.igashop.com.au/product/old-el-paso-mild-jumbo-10-taco-kit-364682
651322,Old El Paso Mild Soft Taco Kit,$8.50,https://www.igashop.com.au/product/old-el-paso-mild-soft-taco-kit-651322
48668,Old El Paso Mild Taco Sauce,$4.50,https://www.igashop.com.au/product/old-el-paso-mild-taco-sauce-48668
813461,Old El Paso Nachos Spice Mix Mild,$3.00,https://www.igashop.com.au/product/old-el-paso-nachos-spice-mix-mild-813461
48684,Old El Paso Original Mexican Taco Spice Mix Mild,$3.00,https://www.igashop.com.au/product/old-el-paso-original-mexican-taco-spice-mix-mild-48684
673073,Old El Paso Refried Beans,$4.50,https://www.igashop.com.au/product/old-el-paso-refried-beans-673073
20000006142,Old El Paso Regular Tortillas,$6.50,https://www.igashop.com.au/product/old-el-paso-regular-tortillas-20000006142
9787,Old El Paso Salsa Thick N Chunky Mild,$5.50,https://www.igashop.com.au/product/old-el-paso-salsa-thick-n-chunky-mild-9787
19978,Old El Paso Stand N Stuff Mild 10 Taco Kit,$7.00,https://www.igashop.com.au/product/old-el-paso-stand-n-stuff-mild-10-taco-kit-19978
673947,Old El Paso Stand N Stuff Mini Tortillas,$6.00,https://www.igashop.com.au/product/old-el-paso-stand-n-stuff-mini-tortillas-673947
94999,Old El Paso Stand N Stuff Tortilla Wholegrain,$6.00,https://www.igashop.com.au/product/old-el-paso-stand-n-stuff-tortilla-wholegrain-94999
396419,Old El Paso Taco Shells Jumbo,$5.50,https://www.igashop.com.au/product/old-el-paso-taco-shells-jumbo-396419
42565,Old El Paso Taco Shells Regular Crunchy,$4.50,https://www.igashop.com.au/product/old-el-paso-taco-shells-regular-crunchy-42565
160000012671,Old El Paso Taco Spice Mix Extra Mild,$3.00,https://www.igashop.com.au/product/old-el-paso-taco-spice-mix-extra-mild-160000012671
813429,Old El Paso Tortilla Pockets,$6.00,https://www.igashop.com.au/product/old-el-paso-tortilla-pockets-813429
20000005939,Ottogi Jin Ramen Spicy Noodles,$5.85,https://www.igashop.com.au/product/ottogi-jin-ramen-spicy-noodles-20000005939
20000006755,Ottogi Noodle Jin Ramen Mild,$5.85,https://www.igashop.com.au/product/ottogi-noodle-jin-ramen-mild-20000006755
190000010485,Palirria Stuffed Vine Leaves With Rice,$5.99,https://www.igashop.com.au/product/palirria-stuffed-vine-leaves-with-rice-190000010485
20000005815,Pandaroo Coconut Cream,$2.00,https://www.igashop.com.au/product/pandaroo-coconut-cream-20000005815
378055,Pandaroo Coconut Milk,$1.65,https://www.igashop.com.au/product/pandaroo-coconut-milk-378055
190000003148,Pandaroo Hoisin Sauce,$4.75,https://www.igashop.com.au/product/pandaroo-hoisin-sauce-190000003148
689799,Pandaroo Ingredients Mushroom Chinese Sliced,$3.50,https://www.igashop.com.au/product/pandaroo-ingredients-mushroom-chinese-sliced-689799
424945,Pandaroo Ingredients Rice Paper Spring Roll,$2.30,https://www.igashop.com.au/product/pandaroo-ingredients-rice-paper-spring-roll-424945
127983,Pandaroo Lite Coconut Cream,$2.00,https://www.igashop.com.au/product/pandaroo-lite-coconut-cream-127983
485242,Pandaroo Noodles Thin Egg,$3.50,https://www.igashop.com.au/product/pandaroo-noodles-thin-egg-485242
190000003147,Pandaroo Oyster Sauce,$4.75,https://www.igashop.com.au/product/pandaroo-oyster-sauce-190000003147
20000002449,Pandaroo Pure Sesame Oil,$4.75,https://www.igashop.com.au/product/pandaroo-pure-sesame-oil-20000002449
190000003145,Pandaroo Rice Paper Dipping Sauce,$3.30,https://www.igashop.com.au/product/pandaroo-rice-paper-dipping-sauce-190000003145
376273,Pandaroo Rice Stick Kongmoon,$3.00,https://www.igashop.com.au/product/pandaroo-rice-stick-kongmoon-376273
20000005359,Pandaroo Sauce Fish,$3.85,https://www.igashop.com.au/product/pandaroo-sauce-fish-20000005359
68854,Pandaroo Yaki Nori For Sushi,$3.90,https://www.igashop.com.au/product/pandaroo-yaki-nori-for-sushi-68854
300167,Passage To India Simmer Sauce Butter Chicken,$6.30,https://www.igashop.com.au/product/passage-to-india-simmer-sauce-butter-chicken-300167
300395,Passage To India Simmer Sauce Curry Korma,$6.30,https://www.igashop.com.au/product/passage-to-india-simmer-sauce-curry-korma-300395
915700,Passage To India Simmer Sauce Extra Mild Butter Chicken,$6.30,https://www.igashop.com.au/product/passage-to-india-simmer-sauce-extra-mild-butter-chicken-915700
300997,Passage To India Simmer Sauce Rogan Josh,$6.30,https://www.igashop.com.au/product/passage-to-india-simmer-sauce-rogan-josh-300997
300646,Passage To India Simmer Sauce Tikka Masala,$6.30,https://www.igashop.com.au/product/passage-to-india-simmer-sauce-tikka-masala-300646
301757,Passage To India Simmer Sauce Vindaloo Hot,$6.30,https://www.igashop.com.au/product/passage-to-india-simmer-sauce-vindaloo-hot-301757
372897,Pearl River Bridge Superior Soy Sauce,$3.30,https://www.igashop.com.au/product/pearl-river-bridge-superior-soy-sauce-372897
20000006153,Sb Japanese Wasabi Tube Paste,$3.30,https://www.igashop.com.au/product/sb-japanese-wasabi-tube-paste-20000006153
190000002249,Sharwoods Extra Creamy Butter Chicken Simmer Sauce,$5.00,https://www.igashop.com.au/product/sharwoods-extra-creamy-butter-chicken-simmer-sauce-190000002249
355463,Sharwoods Ingredients Chutney Mango,$8.00,https://www.igashop.com.au/product/sharwoods-ingredients-chutney-mango-355463
482919,Sharwoods Paste Korma Mild,$6.50,https://www.igashop.com.au/product/sharwoods-paste-korma-mild-482919
483240,Sharwoods Paste Tandoori Medium,$8.10,https://www.igashop.com.au/product/sharwoods-paste-tandoori-medium-483240
483339,Sharwoods Paste Tikka Masala Medium,$6.50,https://www.igashop.com.au/product/sharwoods-paste-tikka-masala-medium-483339
422074,Sharwoods Simmer Sauce For Butter Chicken,$5.00,https://www.igashop.com.au/product/sharwoods-simmer-sauce-for-butter-chicken-422074
422155,Sharwoods Simmer Sauce Korma,$5.00,https://www.igashop.com.au/product/sharwoods-simmer-sauce-korma-422155
422121,Sharwoods Simmer Sauce Rogan Josh,$5.00,https://www.igashop.com.au/product/sharwoods-simmer-sauce-rogan-josh-422121
190000002245,Sharwoods Simmer Sauce Tikka Masala,$5.00,https://www.igashop.com.au/product/sharwoods-simmer-sauce-tikka-masala-190000002245
762,Sharwoods Simmer Sauce Tikka Masala,$5.00,https://www.igashop.com.au/product/sharwoods-simmer-sauce-tikka-masala-762
372130,Squid Brand Fish Sauce,$2.85,https://www.igashop.com.au/product/squid-brand-fish-sauce-372130
742209,Street Kitchen Coconut Chicken Chettinad,$5.90,https://www.igashop.com.au/product/street-kitchen-coconut-chicken-chettinad-742209
915768,Street Kitchen Indian Butter Chicken,$5.90,https://www.igashop.com.au/product/street-kitchen-indian-butter-chicken-915768
915792,Street Kitchen Punjabi Cashew Korma,$5.90,https://www.igashop.com.au/product/street-kitchen-punjabi-cashew-korma-915792
978588,Tcc Coconut Cream,$2.90,https://www.igashop.com.au/product/tcc-coconut-cream-978588
20000006826,Trident Light Coconut Milk,$2.30,https://www.igashop.com.au/product/trident-light-coconut-milk-20000006826
751389,True Foods Bread Naan Garlic,$4.00,https://www.igashop.com.au/product/true-foods-bread-naan-garlic-751389
20000002500,True Foods Garlic Naan Bread,$4.00,https://www.igashop.com.au/product/true-foods-garlic-naan-bread-20000002500
2921,Valcom Authentic Thai Green Curry Paste,$4.30,https://www.igashop.com.au/product/valcom-authentic-thai-green-curry-paste-2921
2997,Valcom Authentic Thai Red Curry Paste,$4.30,https://www.igashop.com.au/product/valcom-authentic-thai-red-curry-paste-2997
497265,Valcom Canned Bamboo Shoots Sliced,$1.40,https://www.igashop.com.au/product/valcom-canned-bamboo-shoots-sliced-497265
498326,Valcom Lemongrass,$3.00,https://www.igashop.com.au/product/valcom-lemongrass-498326
2989,Valcom Panaeng Curry Paste,$4.30,https://www.igashop.com.au/product/valcom-panaeng-curry-paste-2989
880905,Valcom Paste Laksa,$4.30,https://www.igashop.com.au/product/valcom-paste-laksa-880905
2963,Valcom Thai Style Massaman Curry Paste,$4.30,https://www.igashop.com.au/product/valcom-thai-style-massaman-curry-paste-2963
18529,Valcom Yellow Curry Paste,$4.30,https://www.igashop.com.au/product/valcom-yellow-curry-paste-18529
491277,Wokka Noodles Golden Hokkien Shelf Fresh,$2.70,https://www.igashop.com.au/product/wokka-noodles-golden-hokkien-shelf-fresh-491277
345727,Wokka Noodles Thin Egg Style Stir Fry,$2.70,https://www.igashop.com.au/product/wokka-noodles-thin-egg-style-stir-fry-345727
346090,Wokka Shelf Fresh Thin Hokkien Noodles,$2.70,https://www.igashop.com.au/product/wokka-shelf-fresh-thin-hokkien-noodles-346090
378704,Yeos Ingredients Sesame Oil,$5.00,https://www.igashop.com.au/product/yeos-ingredients-sesame-oil-378704
836273,Yeos Sauce Sambal Oelek,$5.45,https://www.igashop.com.au/product/yeos-sauce-sambal-oelek-836273
