ID,Name,Price,URL
53192,Amolin Baby Nappy Rash Cream,$8.00,https://www.igashop.com.au/product/amolin-baby-nappy-rash-cream-53192
764125,Baby Boo Baby Wipes Lightly Scented,$2.00,https://www.igashop.com.au/product/baby-boo-baby-wipes-lightly-scented-764125
764109,Baby Boo Unscented Baby Wipes,$2.00,https://www.igashop.com.au/product/baby-boo-unscented-baby-wipes-764109
951426,Baby U Nappy Sacks,$5.50,https://www.igashop.com.au/product/baby-u-nappy-sacks-951426
160000012788,Babylove Beyond Nappy Pants Size 5,$28.00,https://www.igashop.com.au/product/babylove-beyond-nappy-pants-size-5-160000012788
160000012789,Babylove Beyond Nappy Pants Toddler Size 4,$28.00,https://www.igashop.com.au/product/babylove-beyond-nappy-pants-toddler-size-4-160000012789
902634,Babylove Cosifit Bulk Nappies Crawler,$18.00,https://www.igashop.com.au/product/babylove-cosifit-bulk-nappies-crawler-902634
902508,Babylove Cosifit Bulk Nappies Infant,$18.00,https://www.igashop.com.au/product/babylove-cosifit-bulk-nappies-infant-902508
902273,Babylove Cosifit Bulk Nappies Junior,$18.00,https://www.igashop.com.au/product/babylove-cosifit-bulk-nappies-junior-902273
902480,Babylove Cosifit Nappies Infant,$11.00,https://www.igashop.com.au/product/babylove-cosifit-nappies-infant-902480
160000012797,Babylove Cosifit Nappies Junior Size 6,$11.00,https://www.igashop.com.au/product/babylove-cosifit-nappies-junior-size-6-160000012797
160000012793,Babylove Everyday Baby Wipes,$9.50,https://www.igashop.com.au/product/babylove-everyday-baby-wipes-160000012793
160000012794,Babylove Everyday Baby Wipes,$3.50,https://www.igashop.com.au/product/babylove-everyday-baby-wipes-160000012794
160000012795,Babylove Micellar Water Baby Wipes,$14.50,https://www.igashop.com.au/product/babylove-micellar-water-baby-wipes-160000012795
160000012796,Babylove Micellar Water Baby Wipes,$5.40,https://www.igashop.com.au/product/babylove-micellar-water-baby-wipes-160000012796
483554,Babylove Nappy Pants Jumbo Toddler,$31.00,https://www.igashop.com.au/product/babylove-nappy-pants-jumbo-toddler-483554
475140,Babylove Nappy Pants Jumbo Walker,$31.00,https://www.igashop.com.au/product/babylove-nappy-pants-jumbo-walker-475140
475174,Babylove Nappy Pants Junior,$19.50,https://www.igashop.com.au/product/babylove-nappy-pants-junior-475174
373291,Babylove Nappy Pants Toddler,$20.00,https://www.igashop.com.au/product/babylove-nappy-pants-toddler-373291
373490,Babylove Nappy Pants Walker,$19.50,https://www.igashop.com.au/product/babylove-nappy-pants-walker-373490
477943,Babylove Nappy Pants Wriggler,$20.00,https://www.igashop.com.au/product/babylove-nappy-pants-wriggler-477943
701033,Babylove Sleepy Nights 2 4 Years Overnight Pants,$12.00,https://www.igashop.com.au/product/babylove-sleepy-nights-2-4-years-overnight-pants-701033
336477,Babylove Sleepy Nights 4 7 Years Overnight Pants,$16.00,https://www.igashop.com.au/product/babylove-sleepy-nights-4-7-years-overnight-pants-336477
315248,Babylove Sleepy Nights 8 15 Years,$11.00,https://www.igashop.com.au/product/babylove-sleepy-nights-8-15-years-315248
335743,Babylove Sleepy Nights Overnight Pants,$11.00,https://www.igashop.com.au/product/babylove-sleepy-nights-overnight-pants-335743
966248,Babylove Swim Pants Large,$13.00,https://www.igashop.com.au/product/babylove-swim-pants-large-966248
966222,Babylove Swim Pants Medium,$13.00,https://www.igashop.com.au/product/babylove-swim-pants-medium-966222
966175,Babylove Swim Pants Small,$13.00,https://www.igashop.com.au/product/babylove-swim-pants-small-966175
409225,Bepanthen Baby Nappy Rash Ointment,$12.25,https://www.igashop.com.au/product/bepanthen-baby-nappy-rash-ointment-409225
240312,Bubba Zoo Nappy Bags,$5.30,https://www.igashop.com.au/product/bubba-zoo-nappy-bags-240312
613905,Curash Baby Wipes Fragrance Free,$14.00,https://www.igashop.com.au/product/curash-baby-wipes-fragrance-free-613905
941379,Curash Baby Wipes Fragrance Free,$4.40,https://www.igashop.com.au/product/curash-baby-wipes-fragrance-free-941379
944720,Curash Baby Wipes Simply Water,$6.00,https://www.igashop.com.au/product/curash-baby-wipes-simply-water-944720
892465,Curash Soap Free Baby Wipes,$4.40,https://www.igashop.com.au/product/curash-soap-free-baby-wipes-892465
949275,Curash Water Wipes,$17.60,https://www.igashop.com.au/product/curash-water-wipes-949275
952406,Gaia Natural Baby Wipes,$6.50,https://www.igashop.com.au/product/gaia-natural-baby-wipes-952406
671987,Huggies Baby Wipes Coconut,$5.00,https://www.igashop.com.au/product/huggies-baby-wipes-coconut-671987
86475,Huggies Baby Wipes Cucumber Aloe,$5.00,https://www.igashop.com.au/product/huggies-baby-wipes-cucumber-aloe-86475
61802,Huggies Baby Wipes Fragrance Free,$5.00,https://www.igashop.com.au/product/huggies-baby-wipes-fragrance-free-61802
889996,Huggies Baby Wipes Fragrance Free 80 Wipes Per Pack,$10.70,https://www.igashop.com.au/product/huggies-baby-wipes-fragrance-free-80-wipes-per-pack-889996
938562,Huggies Baby Wipes Fragrance Free Clutch Go,$8.00,https://www.igashop.com.au/product/huggies-baby-wipes-fragrance-free-clutch-go-938562
614192,Huggies Baby Wipes Value Refill Cucumber Aloe,$15.00,https://www.igashop.com.au/product/huggies-baby-wipes-value-refill-cucumber-aloe-614192
613918,Huggies Baby Wipes Value Refill Fragrance Free,$15.00,https://www.igashop.com.au/product/huggies-baby-wipes-value-refill-fragrance-free-613918
170000002413,Huggies Biodegradable Baby Wipes,$6.00,https://www.igashop.com.au/product/huggies-biodegradable-baby-wipes-170000002413
3731,Huggies Crawler Boys,$17.00,https://www.igashop.com.au/product/huggies-crawler-boys-3731
3244,Huggies Crawler Girls,$17.00,https://www.igashop.com.au/product/huggies-crawler-girls-3244
109197,Huggies Drynites Pyjama Pants 2 4Yrs Boy,$13.00,https://www.igashop.com.au/product/huggies-drynites-pyjama-pants-2-4yrs-boy-109197
944607,Huggies Essential Clean Baby Wipes,$4.50,https://www.igashop.com.au/product/huggies-essential-clean-baby-wipes-944607
984741,Huggies Essential Size 1 Newborn,$9.00,https://www.igashop.com.au/product/huggies-essential-size-1-newborn-984741
986345,Huggies Essential Size 2 Infant,$21.20,https://www.igashop.com.au/product/huggies-essential-size-2-infant-986345
986531,Huggies Essential Size 3 Crawler,$24.00,https://www.igashop.com.au/product/huggies-essential-size-3-crawler-986531
986573,Huggies Essential Size 4 Toddler,$24.00,https://www.igashop.com.au/product/huggies-essential-size-4-toddler-986573
986696,Huggies Essential Size 5 Walker,$21.20,https://www.igashop.com.au/product/huggies-essential-size-5-walker-986696
986769,Huggies Essential Size 6 Junior,$21.20,https://www.igashop.com.au/product/huggies-essential-size-6-junior-986769
189715,Huggies Infant Nappies Size 2 4 8Kg,$17.00,https://www.igashop.com.au/product/huggies-infant-nappies-size-2-4-8kg-189715
995378,Huggies Infant Nappies Size 2 4 8Kg,$13.00,https://www.igashop.com.au/product/huggies-infant-nappies-size-2-4-8kg-995378
994770,Huggies Jumbo Infant Nappies Nappies,$39.00,https://www.igashop.com.au/product/huggies-jumbo-infant-nappies-nappies-994770
424351,Huggies Little Swimmers Swimpants Large 14Kg,$17.00,https://www.igashop.com.au/product/huggies-little-swimmers-swimpants-large-14kg-424351
424270,Huggies Little Swimmers Swimpants Medium 7 12Kg,$17.00,https://www.igashop.com.au/product/huggies-little-swimmers-swimpants-medium-7-12kg-424270
160000010816,Huggies Little Swimmers Swimpants Small 7 12Kg,$17.00,https://www.igashop.com.au/product/huggies-little-swimmers-swimpants-small-7-12kg-160000010816
760362,Huggies Nappies Newborn Jumbo,$39.00,https://www.igashop.com.au/product/huggies-nappies-newborn-jumbo-760362
759154,Huggies Nappy Pants Junior Boy,$13.00,https://www.igashop.com.au/product/huggies-nappy-pants-junior-boy-759154
759167,Huggies Nappy Pants Junior Girl,$13.00,https://www.igashop.com.au/product/huggies-nappy-pants-junior-girl-759167
758522,Huggies Nappy Pants Toddler Boy,$13.00,https://www.igashop.com.au/product/huggies-nappy-pants-toddler-boy-758522
758807,Huggies Nappy Pants Toddler Girl,$13.00,https://www.igashop.com.au/product/huggies-nappy-pants-toddler-girl-758807
758831,Huggies Nappy Pants Walker Boy,$13.00,https://www.igashop.com.au/product/huggies-nappy-pants-walker-boy-758831
759015,Huggies Nappy Pants Walker Girl,$13.00,https://www.igashop.com.au/product/huggies-nappy-pants-walker-girl-759015
761114,Huggies Nappy Ultra Newborn,$13.00,https://www.igashop.com.au/product/huggies-nappy-ultra-newborn-761114
758336,Huggies Newborn Nappies For Boys Girls Size 1 Up To 5Kg,$17.00,https://www.igashop.com.au/product/huggies-newborn-nappies-for-boys-girls-size-1-up-to-5kg-758336
651597,Huggies Toddler Boy Jumbo Ultra Dry,$39.00,https://www.igashop.com.au/product/huggies-toddler-boy-jumbo-ultra-dry-651597
651628,Huggies Toddler Girl Jumbo Ultra Dry,$39.00,https://www.igashop.com.au/product/huggies-toddler-girl-jumbo-ultra-dry-651628
899433,Huggies Ultimate Baby Wipes Nourish Care,$6.00,https://www.igashop.com.au/product/huggies-ultimate-baby-wipes-nourish-care-899433
170000002438,Huggies Ultimate Baby Wipes Protect Care,$6.00,https://www.igashop.com.au/product/huggies-ultimate-baby-wipes-protect-care-170000002438
928253,Huggies Ultimate Nappies For Boys Girls Size 4 10 15Kg,$39.00,https://www.igashop.com.au/product/huggies-ultimate-nappies-for-boys-girls-size-4-10-15kg-928253
928208,Huggies Ultimate Nappies Size 3 6 11Kg,$39.00,https://www.igashop.com.au/product/huggies-ultimate-nappies-size-3-6-11kg-928208
928266,Huggies Ultimate Nappies Size 5 13 18Kg,$39.00,https://www.igashop.com.au/product/huggies-ultimate-nappies-size-5-13-18kg-928266
170000002414,Huggies Ultimate Nappy Pants For Boys Girls Size 4 10 15Kg,$39.00,https://www.igashop.com.au/product/huggies-ultimate-nappy-pants-for-boys-girls-size-4-10-15kg-170000002414
170000002423,Huggies Ultimate Nappy Pants For Boys Girls Size 5 14 18 Kg,$39.00,https://www.igashop.com.au/product/huggies-ultimate-nappy-pants-for-boys-girls-size-5-14-18-kg-170000002423
170000002401,Huggies Ultimate Nappy Pants For Boys Girls Size 6 16Kg Over,$39.00,https://www.igashop.com.au/product/huggies-ultimate-nappy-pants-for-boys-girls-size-6-16kg-over-170000002401
939746,Huggies Ultimate Nappy Pants Unisex Size 4 10 15Kg,$25.00,https://www.igashop.com.au/product/huggies-ultimate-nappy-pants-unisex-size-4-10-15kg-939746
592311,Huggies Ultra Dry Nappies Boy Size 3 6 11Kg,$13.00,https://www.igashop.com.au/product/huggies-ultra-dry-nappies-boy-size-3-6-11kg-592311
343534,Huggies Ultra Dry Nappies Boys Size 3 6 11Kg,$39.00,https://www.igashop.com.au/product/huggies-ultra-dry-nappies-boys-size-3-6-11kg-343534
3202,Huggies Ultra Dry Nappies Boys Size 4 10 15Kg,$17.00,https://www.igashop.com.au/product/huggies-ultra-dry-nappies-boys-size-4-10-15kg-3202
592442,Huggies Ultra Dry Nappies Boys Size 4 10 15Kg,$13.00,https://www.igashop.com.au/product/huggies-ultra-dry-nappies-boys-size-4-10-15kg-592442
2719,Huggies Ultra Dry Nappies Boys Size 5 13 18Kg,$17.00,https://www.igashop.com.au/product/huggies-ultra-dry-nappies-boys-size-5-13-18kg-2719
592612,Huggies Ultra Dry Nappies Boys Size 5 13 18Kg,$13.00,https://www.igashop.com.au/product/huggies-ultra-dry-nappies-boys-size-5-13-18kg-592612
651636,Huggies Ultra Dry Nappies Boys Size 5 13 18Kg,$39.00,https://www.igashop.com.au/product/huggies-ultra-dry-nappies-boys-size-5-13-18kg-651636
170000002425,Huggies Ultra Dry Nappies Boys Size 6 16Kg,$39.00,https://www.igashop.com.au/product/huggies-ultra-dry-nappies-boys-size-6-16kg-170000002425
85369,Huggies Ultra Dry Nappies Boys Size 6 16Kg,$17.00,https://www.igashop.com.au/product/huggies-ultra-dry-nappies-boys-size-6-16kg-85369
592719,Huggies Ultra Dry Nappies Boys Size 6 Junior 16Kg,$13.00,https://www.igashop.com.au/product/huggies-ultra-dry-nappies-boys-size-6-junior-16kg-592719
592337,Huggies Ultra Dry Nappies Girl Size 3 6 11Kg,$13.00,https://www.igashop.com.au/product/huggies-ultra-dry-nappies-girl-size-3-6-11kg-592337
3058,Huggies Ultra Dry Nappies Girl Size 4 10 15Kg,$17.00,https://www.igashop.com.au/product/huggies-ultra-dry-nappies-girl-size-4-10-15kg-3058
592654,Huggies Ultra Dry Nappies Girl Size 5 13 18Kg,$13.00,https://www.igashop.com.au/product/huggies-ultra-dry-nappies-girl-size-5-13-18kg-592654
592921,Huggies Ultra Dry Nappies Girl Size 6 16Kg,$13.00,https://www.igashop.com.au/product/huggies-ultra-dry-nappies-girl-size-6-16kg-592921
343526,Huggies Ultra Dry Nappies Girls Size 3 6 11Kg,$39.00,https://www.igashop.com.au/product/huggies-ultra-dry-nappies-girls-size-3-6-11kg-343526
592604,Huggies Ultra Dry Nappies Girls Size 4 10 15Kg,$13.00,https://www.igashop.com.au/product/huggies-ultra-dry-nappies-girls-size-4-10-15kg-592604
2248,Huggies Ultra Dry Nappies Girls Size 5 13 18Kg,$17.00,https://www.igashop.com.au/product/huggies-ultra-dry-nappies-girls-size-5-13-18kg-2248
651652,Huggies Ultra Dry Nappies Girls Size 5 13 18Kg,$39.00,https://www.igashop.com.au/product/huggies-ultra-dry-nappies-girls-size-5-13-18kg-651652
170000002398,Huggies Ultra Dry Nappies Girls Size 6 16Kg,$39.00,https://www.igashop.com.au/product/huggies-ultra-dry-nappies-girls-size-6-16kg-170000002398
85254,Huggies Ultra Dry Nappies Girls Size 6 16Kg,$17.00,https://www.igashop.com.au/product/huggies-ultra-dry-nappies-girls-size-6-16kg-85254
190000002618,Huggies Ultra Dry Nappy Pants Boy Size 3 6 12Kg,$13.00,https://www.igashop.com.au/product/huggies-ultra-dry-nappy-pants-boy-size-3-6-12kg-190000002618
170000002410,Huggies Ultra Dry Nappy Pants Boy Size 5 12 17Kg,$39.00,https://www.igashop.com.au/product/huggies-ultra-dry-nappy-pants-boy-size-5-12-17kg-170000002410
170000002396,Huggies Ultra Dry Nappy Pants Boy Size 6 15Kg,$39.00,https://www.igashop.com.au/product/huggies-ultra-dry-nappy-pants-boy-size-6-15kg-170000002396
170000002417,Huggies Ultra Dry Nappy Pants Girl Size 3 6 12Kg,$13.00,https://www.igashop.com.au/product/huggies-ultra-dry-nappy-pants-girl-size-3-6-12kg-170000002417
170000002441,Huggies Ultra Dry Nappy Pants Girl Size 5 12 17Kg,$39.00,https://www.igashop.com.au/product/huggies-ultra-dry-nappy-pants-girl-size-5-12-17kg-170000002441
170000002409,Huggies Ultra Dry Nappy Pants Girl Size 6 15Kg,$39.00,https://www.igashop.com.au/product/huggies-ultra-dry-nappy-pants-girl-size-6-15kg-170000002409
160000011762,Huggies Ultra Dry Nappy Pants Size 4 Boy,$39.00,https://www.igashop.com.au/product/huggies-ultra-dry-nappy-pants-size-4-boy-160000011762
160000011763,Huggies Ultra Dry Nappy Pants Size 4 Girl,$39.00,https://www.igashop.com.au/product/huggies-ultra-dry-nappy-pants-size-4-girl-160000011763
889894,Huggies Wipes With Coconut 80 Wipes Per Pack,$10.70,https://www.igashop.com.au/product/huggies-wipes-with-coconut-80-wipes-per-pack-889894
478180,Johnsons Baby Skin Care Wipes Refill,$6.50,https://www.igashop.com.au/product/johnsons-baby-skin-care-wipes-refill-478180
395764,Johnsons Baby Wipes Fragrance Free,$6.50,https://www.igashop.com.au/product/johnsons-baby-wipes-fragrance-free-395764
413504,Johnsons Baby Wipes Fragrance Free Refill,$15.00,https://www.igashop.com.au/product/johnsons-baby-wipes-fragrance-free-refill-413504
429115,Johnsons Baby Wipes Skincare Fragrance Free,$15.00,https://www.igashop.com.au/product/johnsons-baby-wipes-skincare-fragrance-free-429115
160000018227,Tom Organic Tooshies Eco Baby Wipes Aloe Vera Chamomile,$5.00,https://www.igashop.com.au/product/tom-organic-tooshies-eco-baby-wipes-aloe-vera-chamomile-160000018227
974961,Tooshies By Tom Nappies With Organic Bamboo Toddlers,$26.00,https://www.igashop.com.au/product/tooshies-by-tom-nappies-with-organic-bamboo-toddlers-974961
986222,Waterwipes Biodegradable Baby Wipes,$8.00,https://www.igashop.com.au/product/waterwipes-biodegradable-baby-wipes-986222
